"Paper Title","Paper Link","Publication Year","Publication Type","Publication Title","Author Names","DOI","PDF Link","Abstract","TL;DR"
"The Development of Early Phonological Networks: An Analysis of Individual Longitudinal Vocabulary Growth","https://scispace.com/paper/the-development-of-early-phonological-networks-an-analysis-i7f1r697d52x","2025","Journal Article","Cognitive Science","Judith Kalinowski
Laura Hansel
Michaela Vystrčilová
Alexander S. Ecker
Nivedita Mani","10.1111/cogs.70109","","Abstract While much work has emphasized the role of the environment in language learning, research equally reports consistent effects of the child's knowledge, in particular, the words known to individual children, in steering further lexical development. Much of this work is based on cross‐sectional data, assuming that the words typically known to children at n months predict the words typically known to children at n +x months. Given acknowledged variability in the number of words known to individual children at different ages, a more conclusive analysis of this issue requires examination of individual differences in the words learned by individual children across development, that is, using longitudinal data. In the current study, using longitudinal vocabulary data from children learning Norwegian, we ask whether the phonological connectivity of a word to words that the child already knows or words in the child's environment predicts the likelihood of the child learning that word across development. The results suggest that the early vocabulary grows predominantly in a rich‐get‐richer manner, where word learning is predicted by the connectivity of a word to already known words. However, word learning is, to a lesser extent, also influenced by the connectivity of a word to words in the child's linguistic environment. Our results highlight the promise of using longitudinal data to better understand the factors that influence vocabulary development. ","This study examines individual longitudinal vocabulary growth in Norwegian children, finding that early vocabulary development is primarily driven by phonological connectivity to already known words, with environmental influences playing a secondary role."
"The Development of Language","https://scispace.com/paper/the-development-of-language-2z9smu32i6","2000","Book","Language","Martyn Barrett","10.4324/9781315784694","","1: A Introduction to the Nature of Language and to the Central Themes and Issues in the Study of Language M. Barrett 2: Prelinguistic Communication V. Reddy 3: Early Speech Perception and Word Learning K. Plunkett, G G. Schafer 4:Phonological Acquisition D. Ingam 5:Early Lexical Development E. Dromi 6:The World of Words: Thoughts on the Development of a Lexicon S.A Kuczaj 7:Early Syntactic Development:A Construction Grammar Approach M. Tomasello, P.J Brooks 8:Some Aspects of Innateness and Complexity in Grammatical Acquisition M. Maratos 9:The Development of Conversational and Discourse Skills B.A Pan, C.E. Snow 10:Bilingual Language Development S.Romaine 11:Sign Language Development J.D Bonvillian 12:Language Development in Atypical Children H. Tager- Flusberg 13:Specific Language Impairment P. Fletcher 14:Towards a Biological Science of Language Development J. Locke.","The authors The World of Words: Thoughts on the Development of a Lexicon S.A Kuczaj 7:Early Syntactic Development:A Construction Grammar Approach M. Tomasello, P.J Brooks 8:Some Aspects of Innateness and Complexity in Grammatical Acquisition M. Maratos 9:The Development of Conversational and Discourse Skills B.E. Snow 10:Bilingual Language Development S.Romaine 11:Sign Language Development J.D Bonvillian 12:Language Development in Atypical Children H. Tager- Fl"
"Drivers of Lexical Processing and Implications for Early Learning","https://scispace.com/paper/drivers-of-lexical-processing-and-implications-for-early-4fwcdppb","2022","Journal Article","Annual review of developmental psychology","Arielle Borovsky","10.1146/annurev-devpsych-120920-042902","","Understanding words in unfolding speech requires the coordination of many skills to support successful and rapid comprehension of word meanings. This multifaceted ability emerges before our first birthday, matures over a protracted period of development, varies widely between individuals, forecasts future learning outcomes, and is influenced by immediate context, prior knowledge, and lifetime experience. This article highlights drivers of early lexical processing abilities while exploring questions regarding how learners begin to acquire, represent, and activate meaning in language. The review additionally explores how lexical processing and representation are connected while reflecting on how network science approaches can support richly detailed insights into this connection in young learners. Future research avenues are considered that focus on addressing how language processing and other cognitive skills are connected.","The authors highlights drivers of early lexical processing abilities while exploring questions regarding how learners begin to acquire, represent, and activate meaning in language, and additionally explores how lexical processes and representation are connected."
"Phonological Awareness, Verbal Working Memory and Rapid Automatic Naming As Indicators of Vocabulary Development in Preschool Children","https://scispace.com/paper/phonological-awareness-verbal-working-memory-and-rapid-j1pum76l3xp2","","","","Ječmenica Nevena R.
Golubović Slavica M.","10.5937/specedreh20-34404","","Introduction. According to the lexical restructuring model, the development of vocabulary initiates the development of phonological representations. Therefore, it can be predicted that children with developed vocabulary will possess very specific phonological representations of words. Aim. The aim of this research was to determine the significance of phonological awareness, verbal working memory, and rapid automatic naming as indicators of the development of expressive and receptive vocabulary in preschool children. Method. The research included 86 children of typical development. For the assessment of phonological awareness, verbal working memory, rapid automatic naming, expressive and receptive vocabulary, the subtests of Clinical Evaluation of Language Fundamentals -Fourth Edition battery were used. Results. The results showed that the model containing age, phonological awareness, verbal working memory, and rapid automatic naming predicted 51% of the achievement variance on expressive vocabulary tasks (F = 7.73, df1 = 2, df2 = 75, p < .001) and 38% of the achievement variance on receptive vocabulary tasks (F = 4.65, df1 = 2, df2 = 75, p < .001). In the final model, only the tasks of phoneme identification, phoneme substitution, and rapid automatic naming (p < .05) stood out as statistically significant indicators of expressive vocabulary. On the other hand, statistically significant indicators of receptive vocabulary included analysis and synthesis of phonemes, verbal working memory, and rapid automatic naming (p < .05). Conclusion. The results showed that age, phonological awareness, verbal working memory, and rapid automatic naming significantly contributed to vocabulary development in children before reading acquisition.","This study examines the relationship between phonological awareness, verbal working memory, and rapid automatic naming with vocabulary development in preschool children, finding significant contributions from these factors to expressive and receptive vocabulary."
"Other 'routes in'? Has the 'fast' in the fast mapping concept led us astray?","https://scispace.com/paper/other-routes-in-has-the-fast-in-the-fast-mapping-concept-led-4di7xy6bh1","2019","Journal Article","Cognitive Neuroscience","Wilma Koutstaal","10.1080/17588928.2019.1593124","","The notion of fast mapping originated in an effort to explain the remarkable adeptness and acceleration with which toddlers learn new words. Yet, by abstracting selected elements of fast mapping aw...","By abstracting selected elements of fast mapping away from the embodied, richly concrete, intermeshed social-interactional experiences of the word-learning child, the authors may be missing opportunities to understand how adults with amnesia also may acquire new semantic knowledge."
"The development of language","https://scispace.com/paper/the-development-of-language-4zv8jucb6n","1985","Book","","Jean Berko Gleason","","","Preface 1 The Development of Language: An Overview and a Preview Jean Berko Gleason, Boston University An Overview of the Course of Language Development The Biological Bases of Language The Structure of Language: Learning the System The Study of Language Development Summary Suggested Projects Suggested Readings Key Words References 2 Communication Development in Infancy Jacqueline Sachs, University of Connecticut The Expression of Communicative Intent Before Speech The Social Context of the Preverbal Infant Summary Suggested Projects Suggested Readings Key Words References 3 Phonological Development: Learning Sounds and Sound Patterns Lise Menn, University of Colorado Carol StoelGammon, University of Washington English Speech Sounds and Sound Patterns Infant Speech Perception Production: The Prelinguistic Period The Beginning of Phonological Development: Protowords Cognitive Approaches to the Acquisition of Phonology Learning to Pronounce Development after Three Years The Acquisition of English Morphophonology Parental Role in Phonological Development Summary Suggested Projects Suggested Readings Key Words References 4 Semantic Development Barbara Alexander Pan and Paola Uccelli, Harvard Graduate School of Education The Relations between Words and Their Referents Theoretical Perspectives on Semantic Development Early Words How Adult Speech Influences Children's Semantic Development Later Semantic Development Factors influencing children's vocabulary development Metalinguistic Development Summary Suggested Projects Suggested Readings Key Words References 5 Putting Words Together: Morphology and Syntax in the Preschool Years Helen Tager Flusberg, Boston University School of Medicine Andrea Zukowski, University of Maryland The Nature of Syntactic Rules Studying Syntactic Development Entering the Complex Linguistic System Measuring Syntactic Growth Two-Word Utterances Developing Grammatical Morphemes Different Sentence Modalities Later Developments in Preschoolers Beyond the Preschool Years Knowledge vs. Processing Summary Suggested Projects Suggested Readings Key Words References 6 Language in Social Contexts: Communicative Competence in the Preschool Years Judith Becker Bryant, University of South Florida Theoretical Approaches to the Study of Communicative Competence Language in Social Contexts The Difficulty of Acquiring Communicative Competence Influences on the Acquisition of Communicative Competence The Significance of Communicative Competence Summary Suggested Projects Suggested Readings Key Words References 7 Theoretical Approaches to Language Development John N. Bohannon III, Butler University John D. Bonvillian, University of Virginia Behavioral Approaches Evaluation of the Behavioral Approaches Linguistic Approaches Evaluation of the Linguistic Approach Interactionist Approaches Summary and New Directions Suggested Projects Suggested Readings Key Words References 8 Individual Differences in Language Development Beverly A. Goldfield, Rhode Island College Catherine E. Snow, Harvard Graduate School of Education The History of Individual Differences in Child Language Research Individual Differences in Early Words Segmenting the Speech Stream Individual Differences in Early Sentences Stability of Individual Differences Sources of Variation Context: The Interaction of Child, Caregiver, and Language Implications of Individual Differences for a Theory of Language Acquisition Summary Suggested Projects Suggested Readings Key Words References 9 Atypical Language Development Nan Bernstein Ratner, University of Maryland at College Park Communicative Development and Severe Hearing Impairment Intellectual Disability and Communicative Development Autism Spectrum Disorder (ASD)/Pervasive Developmental Disorder (PDD) Specific Language Impairment Atypical Speech Development Evaluation of Suspected Speech and Language Disorders in Children Summary Suggested Projects Suggested Readings Key Words References 10 Language Development in the School Years Gigliana Melzi, New York University Richard Ely, Boston University Interactions with Peers Metalinguistic Development in the School Years Literacy Experiences at Home Reading Writing Bilingualism Summary Suggested Projects Suggested Readings Key Words References 11 Language in Adulthood Loraine K. Obler, City University of New York Language in Adulthood The Language of Peer and Social Groups Language at Work Second Language Acquisition in Adulthood Acquisition of Adult Registers Language Development in Advanced Age Adult Language and Brain Damage Summary Suggested Projects Suggested Readings Key Words References Glossary Index","The development of language: An Overview and a Preview Jean Berko Gleason, Boston University An overview of the course of language development The Biological Bases of Language The Structure of Language: Learning the System The Study of Language Development Summary Suggested Projects Suggested Readings Key Words References 2 Communication Development in Infancy Jacqueline Sachs, University of Connecticut The Expression of Communicative Intent Before Speech The Social Context of the Preverbal Infant Summary SuggestED Projects SuggestED ReadingsKey Words References as mentioned in this paper."
"Supra-segmental Details in Early Lexical Representations","https://scispace.com/paper/supra-segmental-details-in-early-lexical-representations-aleo8zi8ol33","","","","Jie  Ren
James  Morgan","10.31234/osf.io/4dbq2","","Recent studies have indicated that toddlers as young as 19 months old already have sophisticated phonological details in their lexical representations. Studies using word recognition tasks have also found that toddlers had graded sensitivities to varying degrees of mispronunciation changes in word onsets and vowels. However, existing studies have primarily investigated sensitivities to segments (vowels and consonants). Less is known about toddlers’ early lexical representations of supra-segmental units such as lexical tones. Unlike segmental units such as vowels and consonants, supra-segmental information is primarily carried across syllables. Phonetically, changes in supra-segmental units are broadly achieved by varying toddlers’ lexical representations of supra-segments. 19-month-old monolingual Mandarin learning toddlers were tested on their sensitivities to varying degrees of familiar word mispronunciations of lexical tones using the intermodal preferential looking paradigm (IPLP). The findings suggested that as toddlers’ sensitivities to mispronunciations increased as a function of the degree of the deviations from the correct forms, replicating previous studies for word-initial consonants and vowels. Therefore, 19-month-olds’ lexical representations appear to contain well-refined architecture in the supra-segmental dimensions.","Research reveals 19-month-old toddlers have refined lexical representations of supra-segmental units, such as lexical tones, with graded sensitivities to mispronunciation changes, similar to segmental units like vowels and consonants, in Mandarin language learning."
"Learning Through Processing: Toward an Integrated Approach to Early Word Learning","https://scispace.com/paper/learning-through-processing-toward-an-integrated-approach-to-26pchs8d","2022","Journal Article","Annual review of linguistics","","10.1146/annurev-linguistics-031220-011146","","Children's linguistic knowledge and the learning mechanisms by which they acquire it grow substantially in infancy and toddlerhood, yet theories of word learning largely fail to incorporate these shifts. Moreover, researchers' often-siloed focus on either familiar word recognition or novel word learning limits the critical consideration of how these two relate. As a step toward a mechanistic theory of language acquisition, we present a framework of ""learning through processing"" and relate it to the prevailing methods used to assess children's early knowledge of words. Incorporating recent empirical work, we posit a specific, testable timeline of qualitative changes in the learning process in this interval. We conclude with several challenges and avenues for building a comprehensive theory of early word learning: better characterization of the input, reconciling results across approaches, and treating lexical knowledge in the nascent grammar with sufficient sophistication to ensure generalizability across languages and development. ","This paper presented a framework of ""learning through processing"" and related it to the prevailing methods used to assess children's early knowledge of words. But their work focused on either familiar word recognition or novel word learning, which limits the critical consideration of how these two relate."
"Fast-mapping in Persian-speaking late-talking toddlers","https://scispace.com/paper/fast-mapping-in-persian-speaking-late-talking-toddlers-2tst6268hb","2021","Journal Article","Early Child Development and Care","Mozhgan Asadi
Talieh Zarifian
Mehdi Dastjerdi Kazemi
Gholamreza Ghaedamini Harouni","10.1080/03004430.2019.1645136","","This mixed two-way experimental, cross-sectional study investigated fast-mapping (FM) of novel nouns and verbs in 63 Persian-speaking toddlers aged 30 months, including 31 late-talking (LT)...","In this article, a mixed two-way experimental, cross-sectional study investigated fast-mapping of novel nouns and verbs in 63 Persian-speaking toddlers aged 30 months, including 31 late-talking toddlers."
"A neurocomputational account of taxonomic responding and fast mapping in early word learning","https://scispace.com/paper/a-neurocomputational-account-of-taxonomic-responding-and-zv29470sue","2010","Journal Article","Psychological Review","Julien Mayor
Kim Plunkett","10.1037/A0018130","","We present a neurocomputational model with self-organizing maps that accounts for the emergence of taxonomic responding and fast mapping in early word learning, as well as a rapid increase in the rate of acquisition of words observed in late infancy. The quality and efficiency of generalization of word-object associations is directly related to the quality of prelexical, categorical representations in the model. We show how synaptogenesis supports coherent generalization of word-object associations and show that later synaptic pruning minimizes metabolic costs without being detrimental to word learning. The role played by joint-attentional activities is identified in the model, both at the level of selecting efficient cross-modal synapses and at the behavioral level, by accelerating and refining overall vocabulary acquisition. The model can account for the qualitative shift in the way infants use words, from an associative to a referential-like use, for the pattern of overextension errors in production and comprehension observed during early childhood and typicality effects observed in lexical development. Interesting by-products of the model include a potential explanation of the shift from prototype to exemplar-based effects reported for adult category formation, an account of mispronunciation effects in early lexical development, and extendability to include accounts of individual differences in lexical development and specific disorders such as Williams syndrome. The model demonstrates how an established constraint on lexical learning, which has often been regarded as domain-specific, can emerge from domain-general learning principles that are simultaneously biologically, psychologically, and socially plausible.","The model demonstrates how an established constraint on lexical learning, which has often been regarded as domain-specific, can emerge from domain-general learning principles that are simultaneously biologically, psychologically, and socially plausible."
"The interaction of phonetic/phonological development and input characteristics in early lexical development: longitudinal and crosslinguistic perspectives","https://scispace.com/paper/the-interaction-of-phonetic-phonological-development-and-3znid9rngp","2018","Journal Article","Canadian Journal of Linguistics-revue Canadienne De Linguistique","Sophie Kern","10.1017/CNJ.2018.21","","The lexicon has often been identified as one of the ‘special’ components of language (e.g., Hauser et al. 2002, Pinker and Jackendoff 2005). According to Wilkins (1972: 111–112), ‘while without grammar very little can be conveyed, without vocabulary nothing can be conveyed’. Therefore, studying lexical development is of major importance. Better understanding of lexical development is also important because of the role the lexicon plays in linguistic development in general. First, early lexical and grammatical developments are strongly correlated: without a critical mass of words, children may not be able to develop later morphosyntactic competence (see Bates and Goodman 2001, for a review). Second, lexical abilities are correlated to later linguistic abilities such as writing and reading. For example, evidence for the importance of vocabulary size in learning to read has been provided by longitudinal studies showing that syntactic and vocabulary performance in kindergarten predicts reading performance (Catts et al. 1999) and reliably discriminates between poor and normal readers (e.g., Catts et al. 1999, Hagtvet 2003, Share and Leikin 2004). Lexical development can be considered as a good basis for the prediction of future problems in reading and writing. The child’s early productive lexicon is quantitatively and qualitatively different from the adult’s lexicon (Fenson et al. 1993). Between one and three years old, a child’s lexicon is limited, and first words can be semantically and phonologically different from the lexical target. There is a consensus that with age, the child’s lexicon increases and words become more accurate at all levels of linguistic precision. Most studies (for counter-argumentation see Ganger and Brent 2004) agree as well that expressive vocabulary has a nonlinear development, with a slow increase in size",""
"From terrible twos to sassy sixes: The development of vocabulary and executive functioning across early childhood.","https://scispace.com/paper/from-terrible-twos-to-sassy-sixes-the-development-of-1yusjxge","2023","Journal Article","Developmental Science","Madeleine Bruce
Jyoti Savla
Martha Ann Bell","10.1111/desc.13396","","Across the early childhood period of development, young children exhibit considerable growth in their executive functioning (EF) and vocabulary abilities. Understanding the developmental trajectory of these seemingly interrelated processes is important as both early vocabulary and EF have been shown to predict critical academic and socio-emotional outcomes later in childhood. Although previous research suggests that EF and vocabulary are correlated in early childhood, much of the existing longitudinal research has focused on unidirectional relations among preschool child samples. The current large-scale study, therefore, sought to examine whether children's vocabulary and EF abilities are bidirectionally related over time across four measurement waves in early childhood (i.e., at ages 2, 3, 4, and 6). At each timepoint, children's vocabulary skills were positively correlated with their concurrent EF abilities. After controlling for child sex and maternal education status, the best-fitting, cross-lagged panel model was a unidirectional model whereby children's early vocabulary scores predicted their later EF performance at each timepoint. Although age 2 EF significantly predicted age 3 vocabulary size, this association was no longer significant after accounting for maternal education status. Our results illustrate that vocabulary size plays an important role in predicting children's later EF performance across various timepoints in early childhood, even after controlling for children's initial EF scores. These findings have important implications for intervention research as fostering early vocabulary acquisition may serve as a possible avenue for improving EF outcomes in young children. RESEARCH HIGHLIGHTS: Children's vocabulary size is positively correlated with their concurrent executive functioning skill at ages 2, 3, 4, and 6 Young children's early vocabulary scores predict their later EF performance across measurement waves, even after controlling for initial EF skill There is stability in children's relative vocabulary size and executive functioning performance over time in early childhood.","In this article , the authors examined whether children's vocabulary and executive functioning abilities are bidirectionally related over time across four measurement waves in early childhood (i.e., at ages 2, 3, 4, and 6)."
