"Paper Title","Paper Link","Publication Year","Publication Type","Publication Title","Author Names","DOI","PDF Link","Abstract","TL;DR"
"Purposive behavior and cognitive mapping: a neural network model","https://scispace.com/paper/purposive-behavior-and-cognitive-mapping-a-neural-network-14d6zf056a","1992","Journal Article","Biological Cybernetics","N. Schmajuk
A. D. Thieme","10.1007/BF00201023","","This study presents a real-time, biologically plausible neural network approach to purposive behavior and cognitive mapping. The system is composed of (a) an action system, consisting of a goal-seeking neural mechanism controlled by a motivational system; and (b) a cognitive system, involving a neural cognitive map. The goal-seeking mechanism displays exploratory behavior until either (a) the goal is found or (b) an adequate prediction of the goal is generated. The cognitive map built by the network is a top logical map, i.e., it represents only the adjacency, but not distances or directions, between places. The network has recurrent and non-recurrent properties that allow the reading of the cognitive map without modifying it. Two types of predictions are introduced: fast-time and real-time predictions. Fast-time predictions are produced in advance of what occurs in real time, when the information stored in the cognitive map is used to predict the remote future. Real-time predictions are generated simultaneously with the occurrence of environmental events, when the information stored in the cognitive map is being updated. Computer simulations show that the network successfully describes latent learning and detour behavior in rats. In addition, simulations demonstrate that the network can be applied to problem-solving paradigms such as the Tower of Hanoi puzzle.","Computer simulations show that the network successfully describes latent learning and detour behavior in rats and can be applied to problem-solving paradigms such as the Tower of Hanoi puzzle."
"Evidence against integration of spatial maps in humans: generality across real and virtual environments.","https://scispace.com/paper/evidence-against-integration-of-spatial-maps-in-humans-37qluqz112","2009","Journal Article","Animal Cognition","Bradley R. Sturz
Kent D. Bodily
Jeffrey S. Katz
Debbie M. Kelly","10.1007/S10071-008-0182-Z","","A real-world open-field search task was implemented with humans as an analogue of Blaisdell and Cook’s (Anim Cogn 8:7–16, 2005) pigeon foraging task and Sturz, Bodily, and Katz’s (Anim Cogn 9:207–217, 2006) human virtual foraging task to 1) determine whether humans were capable of integrating independently learned spatial maps and 2) make explicit comparisons of mechanisms used by humans to navigate real and virtual environments. Participants searched for a hidden goal located in one of 16 bins arranged in a 4 × 4 grid. In Phase 1, the goal was hidden between two landmarks (blue T and red L). In Phase 2, the goal was hidden to the left and in front of a single landmark (blue T). Following training, goal-absent trials were conducted in which the red L from Phase 1 was presented alone. Bin choices during goal-absent trials assessed participants’ strategies: association (from Phase 1), generalization (from Phase 2), or integration (combination of Phase 1 and 2). Results were inconsistent with those obtained with pigeons but were consistent with those obtained with humans in a virtual environment. Specifically, during testing, participants did not integrate independently learned spatial maps but used a generalization strategy followed by a shift in search behavior away from the test landmark. These results were confirmed by a control condition in which a novel landmark was presented during testing. Results are consistent with the bulk of recent findings suggesting the use of alternative navigational strategies to cognitive mapping. Results also add to a growing body of literature suggesting that virtual environment approaches to the study of spatial learning and memory have external validity and that spatial mechanisms used by human participants in navigating virtual environments are similar to those used in navigating real-world environments.","Results add to a growing body of literature suggesting that virtual environment approaches to the study of spatial learning and memory have external validity and that spatial mechanisms used by human participants in navigating virtual environments are similar to those used in navigating real-world environments."
"Multiple Causes of Difficulty in Insight: The Case of the Nine-Dot Problem.","https://scispace.com/paper/multiple-causes-of-difficulty-in-insight-the-case-of-the-341jmqyma6","2004","Journal Article","Journal of Experimental Psychology: Learning, Memory and Cognition","Trina C. Kershaw
Stellan Ohlsson","10.1037/0278-7393.30.1.3","","Theories of insight problems are often tested by formulating hypotheses about the particular difficulties of individual insight problems. Such evaluations often implicitly assume that there is a single difficulty. We argue that the quantitatively small effects of many studies arise because the difficulty of many insight problems is determined by multiple factors, so the removal of 1 factor has limited effect on the solution rate. Difficulties can reside either in problem perception, in prior knowledge, or in the processing of the problem information. We support this multiple factors perspective through 3 experiments on the 9-dot problem (N.R.F. Maier, 1930). Our results lead to a significant reformulation of the classical hypothesis as to why this problem is difficult. The results have general implications for our understanding of insight problem solving and for the interpretation of data from studies that aim to evaluate hypotheses about the sources of difficulty of particular insight problems.","This work argues that the quantitatively small effects of many studies arise because the difficulty of many insight problems is determined by multiple factors, so the removal of 1 factor has limited effect on the solution rate."
"Strategy execution in cognitive skill learning: an item-level test of candidate models","https://scispace.com/paper/strategy-execution-in-cognitive-skill-learning-an-item-level-6i8p8mu47y","2004","Journal Article","Journal of Experimental Psychology: Learning, Memory and Cognition","Timothy C. Rickard","10.1037/0278-7393.30.1.65","","This article investigates the transition to memory-based performance that commonly occurs with practice on tasks that initially require use of a multistep algorithm. In an alphabet arithmetic task, item response times exhibited pronounced step-function decreases after moderate practice that were uniquely predicted by T. C. Rickard's (1997) component power laws model. The results challenge parallel strategy execution models as developed to date and they demonstrate that the shift to retrieval is an item-specific, as opposed to task-general, learning phenomenon. The results also call into question the entire class of smooth speed-up functions as global empirical learning laws. It is shown that overlaying of averaged item fits on averaged data can provide a sensitive test for model sufficiency. Strategy probes agreed with strategy inferences that were based on step-function speed-up patterns, supporting the validity of the probing technique.","This article investigates the transition to memory-based performance that commonly occurs with practice on tasks that initially require use of a multistep algorithm and shows that overlaying of averaged item fits on averaged data can provide a sensitive test for model sufficiency."
"Insight into analogies: Evidence from eye movements","https://scispace.com/paper/insight-into-analogies-evidence-from-eye-movements-3kruqjxh6x","2007","Journal Article","Visual Cognition","Peter C. Gordon
Stephanie Moser","10.1080/13506280600871891","","Eye movements were recorded while participants solved picture analogies in which they had to identify the object in one picture that “went with” an object in another, simultaneously presented picture. The pattern of saccades between objects, but not the time spent looking at objects, was a very sensitive measure of the time course of both relational and object-matching processes. The results show that processing of relations between objects precedes processing of matches between objects for young adults solving simple analogies.","In this article, eye movements were recorded while participants solved picture analogies in which they had to identify the object in one picture that went with an object in another, simultaneously presented picture."
"The temporal dynamics of strategy execution in cognitive skill learning.","https://scispace.com/paper/the-temporal-dynamics-of-strategy-execution-in-cognitive-404egbg9bd","2009","Journal Article","Journal of Experimental Psychology: Learning, Memory and Cognition","Daniel Bajic
Timothy C. Rickard","10.1037/A0013647","","The transition from algorithmic to memory-based performance is a core component of cognitive skill learning. There has been debate about the temporal dynamics of strategy execution, with some models assuming a race (i.e., independent, capacity unconstrained parallel processing) between algorithm and retrieval, and others assuming a choice mechanism. The authors investigated this issue using a new approach that allows the latency of each algorithm step to be measured, in turn providing new insight into (a) whether there is slowing of 1 or more algorithm steps on trials immediately preceding the 1st retrieval trial for an item, as might be expected if there is a competitive strategy execution process of some type other than a race, and (b) whether there is partial algorithm completion on retrieval trials, as would be expected if the 2 strategies are executed in parallel. Results are uniquely consistent with a strategy choice mechanism involving a competition between the retrieval strategy and the 1st step of the algorithm.","This work investigated the temporal dynamics of strategy execution using a new approach that allows the latency of each algorithm step to be measured, providing new insight into whether there is slowing of 1 or more algorithm steps on trials immediately preceding the 1st retrieval trial for an item."
"On the “Demystification” of Insight: A Critique of Neuroimaging Studies of Insight","https://scispace.com/paper/on-the-demystification-of-insight-a-critique-of-neuroimaging-1tqzjnwc5i","2013","Journal Article","Creativity Research Journal","Robert W. Weisberg","10.1080/10400419.2013.752178","","Psychologists studying problem solving have, for over 100 years, been interested in the question of whether there are two different modes of solving problems. One mode—problem solving based on analysis—depends on application of past experience to the problem at hand and proceeds incrementally toward solution. The second mode—problem solving based on insight—involves breaking away from what one knows, typically after one has reached an impasse, and entails solution occurring suddenly, in a leap beyond what one knows. A number of recent studies have used neuroscientific methods (e.g., fMRI; EEG) to demystify insight, i.e., to dispel what is seen as the mystery of insight in problem solving. This research has been summarized by Lehrer (2008), in the context of examination of a real-life example of insightful problem solving: R. Wagner Dodge's creation of an escape fire to avoid near-certain death from a forest fire. This article presents a critical review of neuroscientific studies of insight, which indicate...","A critical review of recent studies of insight in problem-solving can be found in this paper, which indicates that there are two different modes of solving problems: analysis-based and insight-based."
"Navigation outside of the box: what the lab can learn from the field and what the field can learn from the lab.","https://scispace.com/paper/navigation-outside-of-the-box-what-the-lab-can-learn-from-3an6yvo4ao","2014","Journal Article","Movement ecology","Lucia F. Jacobs
Randolf Menzel","10.1186/2051-3933-2-3","","Space is continuous. But the communities of researchers that study the cognitive map in non-humans are strangely divided, with debate over its existence found among behaviorists but not neuroscientists. To reconcile this and other debates within the field of navigation, we return to the concept of the parallel map theory, derived from data on hippocampal function in laboratory rodents. Here the cognitive map is redefined as the integrated map, which is a construction of dual mechanisms, one based on directional cues (bearing map) and the other on positional cues (sketch map). We propose that the dual navigational mechanisms of pigeons, the navigational map and the familiar area map, could be homologous to these mammalian parallel maps; this has implications for both research paradigms. Moreover, this has implications for the lab. To create a bearing map (and hence integrated map) from extended cues requires self-movement over a large enough space to sample and model these cues at a high resolution. Thus a navigator must be able to move freely to map extended cues; only then should the weighted hierarchy of available navigation mechanisms shift in favor of the integrated map. Because of the paucity of extended cues in the lab, the flexible solutions allowed by the integrated map should be rare, despite abundant neurophysiological evidence for the existence of the machinery needed to encode and map extended cues through voluntary movement. Not only do animals need to map extended cues but they must also have sufficient information processing capacity. This may require a specific ontogeny, in which the navigator’s nervous system is exposed to naturally complex spatial contingencies, a circumstance that occurs rarely, if ever, in the lab. For example, free-ranging, flying animals must process more extended cues than walking animals and for this reason alone, the integrated map strategy may be found more reliably in some species. By taking concepts from ethology and the parallel map theory, we propose a path to directly integrating the three great experimental paradigms of navigation: the honeybee, the homing pigeon and the laboratory rodent, towards the goal of a robust, unified theory of animal navigation.","It is proposed that the dual navigational mechanisms of pigeons, the navigational map and the familiar area map, could be homologous to these mammalian parallel maps; this has implications for both research paradigms."
"Insight Problem Solving: A Critical Examination of the Possibility of Formal Theory","https://scispace.com/paper/insight-problem-solving-a-critical-examination-of-the-34fl3a1sag","2012","Journal Article","","William H. Batchelder
Gregory E. Alexander","10.7771/1932-6246.1143","","This paper provides a critical examination of the current state and future possibility of formal cognitive theory for insight problem solving and its associated “aha!” experience. Insight problems are contrasted with move problems, which have been formally defined and studied extensively by cognitive psychologists since the pioneering work of Alan Newell and Herbert Simon. To facilitate our discussion, a number of classical brainteasers are presented along with their solutions and some conclusions derived from observing the behavior of many students trying to solve them. Some of these problems are interesting in their own right, and many of them have not been discussed before in the psychological literature. The main purpose of presenting the brainteasers is to assist in discussing the status of formal cognitive theory for insight problem solving, which is argued to be considerably weaker than that found in other areas of higher cognition such as human memory, decision-making, categorization, and perception. We discuss theoretical barriers that have plagued the development of successful formal theory for insight problem solving. A few suggestions are made that might serve to advance the field.","A critical examination of the current state and future possibility of formal cognitive theory for insight problem solving and its associated “aha!” experience is provided and a number of classical brainteasers are presented."
"Sudden insight: all-or-none processing revealed by speed-accuracy decomposition.","https://scispace.com/paper/sudden-insight-all-or-none-processing-revealed-by-speed-4ne6lf286o","1996","Journal Article","Journal of Experimental Psychology: Learning, Memory and Cognition","Roderick W. Smith
John Kounios","10.1037//0278-7393.22.6.1443","","Issues surrounding the discreteness or continuity of cognitive processes have played a major role in experimental psychology, although there has been relatively little work that directly addresses these topics. Nevertheless, there has been a shift away from discrete models and toward continuous ones. The research reported in this article demonstrates discrete processing of information in an anagram task selected because of its similarity to insight problems, which seem subjectively to produce discrete ""illumination"" during processing. The authors used speed-accuracy decomposition (SAD), a relatively new technique for investigating the time course of information processing. The results of 2 experiments indicate little or no partial information in the anagram tasks, in contrast to previous research with SAD, all of which has revealed partial information. General models of human information processing must therefore be able to account for both patterns.","The research reported in this article demonstrates discrete processing of information in an anagram task selected because of its similarity to insight problems, which seem subjectively to produce discrete ""illumination"" during processing."
"Computational modeling of epiphany learning","https://scispace.com/paper/computational-modeling-of-epiphany-learning-mcog7mthil","2017","Journal Article","Proceedings of the National Academy of Sciences of the United States of America","Wei James Chen
Ian Krajbich","10.1073/PNAS.1618161114","","Models of reinforcement learning (RL) are prevalent in the decision-making literature, but not all behavior seems to conform to the gradual convergence that is a central feature of RL. In some cases learning seems to happen all at once. Limited prior research on these ""epiphanies"" has shown evidence of sudden changes in behavior, but it remains unclear how such epiphanies occur. We propose a sequential-sampling model of epiphany learning (EL) and test it using an eye-tracking experiment. In the experiment, subjects repeatedly play a strategic game that has an optimal strategy. Subjects can learn over time from feedback but are also allowed to commit to a strategy at any time, eliminating all other options and opportunities to learn. We find that the EL model is consistent with the choices, eye movements, and pupillary responses of subjects who commit to the optimal strategy (correct epiphany) but not always of those who commit to a suboptimal strategy or who do not commit at all. Our findings suggest that EL is driven by a latent evidence accumulation process that can be revealed with eye-tracking data.","A sequential-sampling model of epiphany learning (EL) is proposed and it is found that the EL model is consistent with the choices, eye movements, and pupillary responses of subjects who commit to the optimal strategy but not always of those whocommit to a suboptimal strategy or who do not commit at all."
"Insight and creative thinking processes: Routine and special","https://scispace.com/paper/insight-and-creative-thinking-processes-routine-and-special-4r1vi2o26u","2015","Journal Article","Thinking & Reasoning","Kenneth Gilhooly
Linden J. Ball
Laura Macchi","10.1080/13546783.2014.966758","","In recent years there has been an upsurge of research aimed at removing the mystery from insight and creative problem solving The present special issue reflects this expanding field Overall the p","In recent years, there has been an upsurge of research aimed at removing the mystery from insight and creative problem solving as discussed by the authors, and the present special issue reflects this expanding field of research."
"Cues to solution, restructuring patterns, and reports of insight in creative problem solving.","https://scispace.com/paper/cues-to-solution-restructuring-patterns-and-reports-of-3sb7zk9m43","2012","Journal Article","Consciousness and Cognition","Patrick J. Cushen
Jennifer Wiley","10.1016/J.CONCOG.2012.03.013","","","Results show that both providing cues to solution and analyzing problem solving performance on an aggregate level may result in restructuring patterns that appear incremental, but no evidence is found for a relationship between an individual's restructuring pattern and their subjective experience of insight during problem solving."
"A simple test of the vicarious trial-and-error hypothesis of hippocampal function","https://scispace.com/paper/a-simple-test-of-the-vicarious-trial-and-error-hypothesis-of-54cqcwitpx","1995","Journal Article","Proceedings of the National Academy of Sciences of the United States of America","Dan Hu
Abram Amsel","10.1073/PNAS.92.12.5506","","Vicarious trial-and-error (VTE) is a term that Muenzinger and Tolman used to describe the rat's conflict-like behavior before responding to choice Recently, VTE was proposed as a mechanism alternative to the concept of ""cognitive map"" in accounts of hippocampal function That is, many phenomena of impaired learning and memory related to hippocampal interventions may be explained by behavioral first principles: reduced conflicting, incipient, pre-choice tendencies to approach and avoid The nonspatial black-white discrimination learning and VTE behavior of the rat were investigated Hippocampal-lesioned and sham-lesioned animals were trained for 25 days (20 trials per day) starting at 60 days of age Each movement of the head from one discriminative stimulus to the other was counted as a VTE instance Lesioned rats had fewer VTEs than sham controls, and the former learned much more slowly or never learned After learning, VTE frequency declined Male and female rats showed no significant differences in VTE behavior or discrimination learning","The nonspatial black-white discrimination learning and VTE behavior of the rat were investigated and male and female rats showed no significant differences in VTEbehavior or discrimination learning."
"Oculometric signature of switch into awareness? Pupil size predicts sudden insight whereas microsaccades predict problem-solving via analysis.","https://scispace.com/paper/oculometric-signature-of-switch-into-awareness-pupil-size-41bz5ixyf6","2020","Journal Article","NeuroImage","Carola Salvi
Claudio Simoncini
Jordan Grafman
Mark Beeman","10.1016/J.NEUROIMAGE.2020.116933","","","The pupil size change seen when people have an “Aha!” moment represents an indicator of the switch into awareness of unconscious processes humans depend upon for insight, and suggests important involvement of norepinephrine, via the locus coeruleus, in sudden insight."
