"Paper Title","Paper Link","Publication Year","Publication Type","Publication Title","Author Names","DOI","PDF Link","Abstract","TL;DR"
"Approche socio-cognitive de la résolution de problèmes mathématiques : le rôle du contexte didactique dans les représentations de l'activité et les stratégies de résolution","https://scispace.com/paper/approche-socio-cognitive-de-la-resolution-de-problemes-4xh1066s8v","1995","Dissertation","","Hervé Larroze-Marracq","","","Les travaux de psychologie cognitive negligent le plus souvent le contexte social dans lequel est proposee la tâche. Il convient au contraire d'etudier l'activite cognitive en considerant les parametres contextuels comme des facteurs constitutifs des conduites. La these presentee developpe une approche socio-cognitive qui tient compte du systeme didactique : maitre-eleve-savoir et des dimensions socio-communicatives, institutionnelles, socioculturelles de la situation scolaire. Une recherche sur le terrain realisee au niveau du cm2 a permis de specifier des contextes didactiques en resolution de problemes mathematiques, sur la base d'entretiens avec les maitres et d'observations en classe. Le role que jouent ces contextes dans les conceptions des eleves et dans les conduites adoptees en situation experimentale de resolution est analyse a l'aide de comparaisons interclasses des types de reponses et d'une analyse factorielle des correspondances. Les resultats attestent d'un effet important du contexte didactique dans lesquels les eleves travaillent habituellement. Certaines strategies de resolution montrent que les eleves reconduisent la signification de la situation experimentale aux regles du ""contrat didactique"" en œuvre dans la classe et tentent, a travers les reponses ecrites adressees a l'experimentateur, de satisfaire les attentes supposees de leur enseignant. Ces eleves proposent une ""solution de compromis"" qui tient compte d'un traitement prive de la tâche et de la recevabilite de la reponse.","In this article, the authors propose an approche socio-cognitive which tient compte du systeme didactique : maitre-eleve-savoir and des dimensions socio-communicatives, institutionnelles, socioculturelles of the situation scolaire."
"Mathematical problem-solving by high-achieving students: Interaction of mathematical abilities and the role of the mathematical memory","https://scispace.com/paper/mathematical-problem-solving-by-high-achieving-students-4kjmwblq4e","2015","","","Attila Szabo","","","The present study deals with the interaction of mathematical abilities and the role of the mathematical memory in the problem-solving process. To examine those phenomena, the study investigates the behaviour of high-achieving students from secondary school when solving new and challenging problems. Although the mathematical memory accounts for a small part of the problem-solving process, it has a critical role in the choice of problem-solving methods. The study shows that if the initially selected methods do not lead to the desired outcome, the students find it very difficult to modify them. The study also shows that students who use algebraic problem-solving methods perform better than those who use numerical methods.","The study investigates the behaviour of high-achieving students from secondary school when solving new and challenging problems and shows that students who use algebraic problem-solving methods perform better than those who use numerical methods."
"Effects of eye movement on forming and relaxing constraints in insight problem solving","https://scispace.com/paper/effects-of-eye-movement-on-forming-and-relaxing-constraints-2elcewzo3w","2013","Journal Article","Japanese Journal of Psychology","Masahiko Tamura
Kazuhisa Miwa","10.4992/JJPSY.84.103","","To solve an insight problem, a problem solver needs to relax mental constraints that prevent solving the problem, and to shift a search in an incorrect problem space into a search in a correct problem space. In this paper, we investigate how a tracking stimulus that guides problem solvers' eye movements affects the formation and relaxation of constraints in insight problem solving. We conducted two experiments using an insight task and an eye-tracking task in which participants' eye movements were expected to inhibit the fixation constraints in the insight task. Participants engaged in the tracking task before the constraints were formed in Experiment 1 and after the constraints were formed in Experiment 2. In Experiment 1, participants who performed the tracking task were inhibited in forming the constraints more than those in the control condition. In both Experiments 1 and 2, the tracking task affects the participants' hypothesis formation in the insight problem solving processes. In particular, participants who were presented the tracking stimulus found a target rule faster after beginning to relax the constraints than those in the control condition.","In both Experiments 1 and 2, the tracking task affects the participants' hypothesis formation in the insight problem solving processes, and participants who were presented the tracking stimulus found a target rule faster after beginning to relax the constraints than those in the control condition."
"Ah-Ha, I Knew It All Along: Differences in Hindsight Bias Between Insight and Algebra Problems","https://scispace.com/paper/ah-ha-i-knew-it-all-along-differences-in-hindsight-bias-3lkg4eq9cw","2002","","","Ivan K. Ash
Jennifer Wiley","","","Ah-Ha, I Knew It All Along: Differences in Hindsight Bias Between Insight and Algebra Problems Ivan K. Ash (iash1@uic.edu) Jennifer Wiley (jwiley@uic.edu) Department of Psychology The University of Illinois at Chicago 1007 West Harrison Street (M/C 285) Chicago, IL 60607, U.S.A. Abstract The present study investigated the role of restructuring in the solution of insight and incremental problems. Participants were presented with a series of insight and algebra word problems in a hindsight bias paradigm (Fischoff, 1975). Those who solved the insightful problems correctly showed increases in importance ratings on the key problem components. However, no increases in importance ratings were detected for the key problem components of algebra problems. These results are consistent with theories that propose that representational restructuring plays a fundamental role in the insightful problem solving process (Davidson & Sternberg, 1984; Ohlsson, 1992). Restructuring and Insightful Problem Solving A number of researchers have suggested that insight problems may be solved in a qualitatively different manner from incremental or analytic problems (Duncker, 1945, Davidson & Sternberg, 1984, Metcalfe & Wiebe, 1987, Ohlsson, 1992). For example, when Metcalfe and Wiebe (1987) had subjects make feeling of warmth ratings while solving algebra and insight problems, they found that while solving algebra problems, subjects’ warmth ratings steadily increased towards the time of solution; whereas during the solution of insight problems subjects’ warmth ratings remained low and suddenly increased right before they solved the problem. These results suggest the processes for solving insight problems are different from the systematic or analytical processes used for incremental problems. However, this only represents the suddenness of the insightful process and does not shed light on the causes of the solution patterns. It has been suggested that insight problems differ from incremental problems in that the nature of the solvers’ experience causes them to construct a representation of the problem that cannot lead to the correct solution (Duncker, 1945, Davidson & Sternberg, 1984, Ohlsson, 1992). In order to come to the correct solution, solvers must restructure their original conception of the problem. Proposed evidence for restructuring in insight problem solving has come from a wide range of empirical findings. For example, Dominowski and Buyer (2000) found decreases in re-solution time for those who correctly solve insight problems but not for those who were simply shown the answer. Knoblich, Ohlsson, and Raney (2001) analyzed eye movements during the solution of matchstick arithmetic problems and found evidence for impasses followed by increased fixations on components of the problems that were key to solution. Durso, Cornelia, and Dayton (1994) attempted to find an independent measure of restructuring by statistically modeling successful and unsuccessful problem representations after the problem solving session. They found that successful solvers representations centered on concepts key to the nature of the solution, whereas non- solvers representations centered on the principle characters in the story problem, which were not relevant to the solution. These empirical studies suggest an insight problem solving process that involves the restructuring of the mental problem representation. However, these studies fall short of proving the existence of a restructuring process because they fail to directly measure representational change before and after solving across an individual and fail to compare problems that involve incremental solutions to the problems proposed to elicit insightful solutions. What is needed is an independent measure of restructuring in order to test theories that predict an insight process involving restructuring against theories which do not predict restructuring in any problem solving process (such as Weisberg’s nothing special view, 1986). Furthermore, this method must be able to directly test whether more restructuring is involved in insightful than incremental problem solving. The present study uses a hindsight bias paradigm to produce an independent measure of the amount of restructuring involved in solving different types of problems. Hindsight Bias Hindsight bias is the observation that people with outcome knowledge of a situation falsely believe that they would have predicted the correct outcome (Hawkins & Hastie, 1990). Fischoff (1975) originally developed the basic paradigm. He had people read a narrative of a situation with or without receiving the outcome and then had them rate the probability of alternate outcomes as if they had no knowledge of the outcome. The general finding is that people with outcome knowledge unknowingly rate the outcome they were told as more probable than alternatives, as if they “knew it all along.” Individuals who receive outcome knowledge also rate the sentences in the narrative that support the given outcome","Ash et al. as mentioned in this paper investigated the role of restructuring in the solution of insight and algebra word problems and found that those who solved the insightful problems correctly showed increases in importance ratings on the key problem components."
"Intuitive Feelings of Warmth and Confidence in Insight and Noninsight Problem Solving of Magic Tricks.","https://scispace.com/paper/intuitive-feelings-of-warmth-and-confidence-in-insight-and-39rxlj34j7","2016","Journal Article","Frontiers in Psychology","Mikael Ringstad Hedne
Elisabeth Norman
Janet Metcalfe","10.3389/FPSYG.2016.01314","","The focus of the current study is on intuitive feelings of insight during problem solving and the extent to which such feelings are predictive of successful problem solving. We report the results from an experiment (N=51) that applied a procedure where the to-be-solved problems were 32 short (15 s) video recordings of magic tricks. We included metacognitive ratings similar to the ""warmth ratings"" previously used by Metcalfe and colleagues, as well as confidence ratings. At regular intervals during problem solving, participants indicated the perceived closeness to the correct solution. Participants also indicated directly whether each problem was solved by insight or not. We found that problems that people claimed were solved by insight were characterised by higher accuracy and higher confidence than noninsight solutions. There was no difference between the two types of solution in warmth ratings, however. Confidence ratings were more strongly associated with solution accuracy for noninsight than insight trials. Moreover, for insight trials the participants were more likely to repeat their incorrect solutions on a subsequent recognition test. The results have implications for understanding people's metacognitive awareness of the cognitive processes involved in problem solving. They also have general implications for our understanding of how intuition and insight are related.","The results have implications for understanding people's metacognitive awareness of the cognitive processes involved in problem solving and have general implications for the understanding of how intuition and insight are related."
"What can cognitive psychology tell us about the challenges of learning mathematics (and what do we still not know)","https://scispace.com/paper/what-can-cognitive-psychology-tell-us-about-the-challenges-8rx3xke5wr","2020","","","Camilla Gilmore
Lucy Cragg
Victoria Simms","","","What can cognitive psychology tell us about the challenges of learning mathematics (and what do we still not know)?","What can cognitive psychology tell us about the challenges of learning mathematics (and what do the authors still not know)?"
"Denkprozesse beim Lösen mathematischer Deduktionsaufgaben — Bericht über eine exploratorische Untersuchung","https://scispace.com/paper/denkprozesse-beim-losen-mathematischer-deduktionsaufgaben-zk4i6lsnlo","1982","Journal Article","","Bernd Zimmermann","10.1007/BF03338664","","An exploratory study of mathematical problem solving processes was carried out. Think-aloud sessions of students solving problems from incidence geometry were videotaped. A category system was developed to form data from the observations. Correlation-methods and sequence-analysis techniques were used to analyze the data. The hypotheses generated deal with systematic behavior (strategies), problem solving success, modes of representation, problem solving types and mistakes. Some prospects are made concerning future research.","An exploratory study of mathematical problem solving processes was carried out, and hypotheses generated deal with systematic behavior (strategies), problem solving success, modes of representation, problem solving types and mistakes."
"Metacognitive Cues, Working Memory, and Math Anxiety: The Regulated Attention in Mathematical Problem Solving (RAMPS) Framework","https://scispace.com/paper/metacognitive-cues-working-memory-and-math-anxiety-the-1vi7kgjp","2023","Journal Article","Journal of Intelligence","Daniel Scheibe
Christopher A. Was
John Dunlosky
Clarissa A. Thompson","10.3390/jintelligence11060117","","Mathematical problem solving is a process involving metacognitive (e.g., judging progress), cognitive (e.g., working memory), and affective (e.g., math anxiety) factors. Recent research encourages researchers who study math cognition to consider the role that the interaction between metacognition and math anxiety plays in mathematical problem solving. Problem solvers can make many metacognitive judgments during a math problem, ranging from global judgments such as, “Do I care to solve this problem?” to minor cue-based judgments such as, “Is my current strategy successful in making progress toward the correct solution?” Metacognitive monitoring can hinder accurate mathematical problem solving when the monitoring is task-irrelevant; however, task-relevant metacognitive experiences can lead to helpful control decisions in mathematical problem solving such as checking work, considering plausibility of an answer, and considering alternate strategies. Worry and negative thoughts (i.e., math anxiety) can both interfere with the accuracy of metacognitive experiences as cues in mathematical problem solving and lead to avoidance of metacognitive control decisions that could otherwise improve performance. The current paper briefly reviews and incorporates prior literature with current qualitative reports (n = 673) to establish a novel framework of regulated attention in mathematical problem solving (RAMPS).","In this article , a framework of regulated attention in mathematical problem solving (RAMPS) is presented. But, the framework is limited to the case where the monitoring is task-irrelevant; however, task-relevant metacognitive experiences can lead to helpful control decisions, such as checking work, considering plausibility of an answer, and considering alternate strategies."
"Insight problem solving is not that special, but business is not quite 'as usual': typical versus exceptional problem-solving strategies.","https://scispace.com/paper/insight-problem-solving-is-not-that-special-but-business-is-lpl00mg1","2023","Journal Article","Psychological Research-psychologische Forschung","Nirit Salmon-Mordekovich
Mark Leikin","10.1007/s00426-022-01786-5","","The intriguing phenomenon of insight (also known as the ""Aha!"" moment) has provoked a long-standing conflict over its cognitive mechanism. The special-process theory posits insight as a unique, unconscious mechanism. Conversely, the business-as-usual theory conceptualizes insight processing as ordinary and similar to non-insight, i.e., analytic, incremental, and attention demanding. To resolve this conflict, participants completed cognitive tests and solved four types of problems: verbal insight, spatial insight, verbal non-insight, and spatial non-insight. These problems were solved under three conditions: silence (control), inner speech suppression (articulatory suppression), and non-verbal attentional demands (spatial tapping). Interestingly, insight problem solving differed from verbal non-insight, but resembled spatial non-insight problem solving. Solving insight and spatial non-insight problems substantially benefitted from spatial and near verbal analogical thinking and convergent thinking, and little from divergent thinking. Both were unaffected by secondary tasks. Analogical thinking was associated more strongly with the generation of new solution procedures than with the retrieval of known procedures from memory, as in verbal non-insight problem solving. Analogical and convergent thinking seem to be key skills for the creation of new solutions, whether or not they are insight based. The results indicate a typical, analytic solution method consistent with the business-as-usual theory. Yet, there is also evidence for an exceptional solving method that includes rare attributes of the insightful process delineated by the special-process theory. Thus, we endorse an unequally integrated assertion that each theory reflects a different mode of thinking, the common versus the uncommon, by which insightful solutions can be produced. ","In this article , participants completed cognitive tests and solved four types of problems: verbal insight, spatial insight, verbal non-insight, and spatial tapping, under three conditions: silence (control), inner speech suppression (articulatory suppression), and non-verbal attentional demands (spatial tapping)."
"Quantifying the Qualitative: Measuring the Insight Experience","https://scispace.com/paper/quantifying-the-qualitative-measuring-the-insight-experience-4itg5k2t5t","2014","Journal Article","Creativity Research Journal","Matthew S. Jarman","10.1080/10400419.2014.929405","","No scales currently exist that measure variability in the insight experience. Two scales were created to measure two factors hypothesized to be key drivers of the insight experience: insight radicality (i.e., perceived deviation between previous and new problem representations) and restructuring experience (i.e., the subjective experience of the problem representation being restructured). Data were collected online in two studies using a Mechanical Turk sample (N = 212) and a Zoomerang sample (N = 168) that reported on past experiences working to solve a challenging problem at work. Insight radicality and restructuring experience each positively correlated with and accounted for unique variance in (a) the nature of insight experiences (e.g., intensity), (b) insight terminology used to describe them (e.g., “a breakthrough”), and (c) perceived insight impact (e.g., on field/discipline). The 2 scales accounted for unique variance in these variables both individually and above and beyond improved processing f...","In this paper, two scales were created to measure two factors hypothesized to be key drivers of the insight experience: insight radicality (i.e., perceived deviation between previous and new problem representations) and restructuring experience (e.g., the subjective experience of the problem representation being restructured)."
"Modelling Problems from a Cognitive Perspective","https://scispace.com/paper/modelling-problems-from-a-cognitive-perspective-gjhpmcdl5w","2007","Book Chapter","","Rita Borromeo Ferri","10.1533/9780857099419.5.260","","Looking at modelling from a cognitive perspective has largely been neglected in the current discussion regarding modelling. Using the mathematical didactical and cognitive-psychological approach of mathematical thinking styles, this study analyses the modelling performed by teachers and students in context-bounded mathematics lessons. This study is complex, and so are the results. The focus of this paper is on the depiction of reconstructed and so-called individual modelling routes of sixteen-year-old learners working in groups on modelling problems during mathematics lessons. These routes provide an insight into the learners' cognitive procedures during modelling.","The focus of this paper is on the depiction of reconstructed and so-called individual modelling routes of sixteen-year-old learners working in groups on modelling problems during mathematics lessons, which provide an insight into the learners' cognitive procedures during modelling."
"An eye movement study of insight problem solving","https://scispace.com/paper/an-eye-movement-study-of-insight-problem-solving-1j0cko9h8z","2001","Journal Article","Memory & Cognition","Günther Knoblich
Stellan Ohlsson
Gary E. Raney","10.3758/BF03195762","","The representational change theory of insight claims that insight problems cause impasses because they mislead problem solvers into constructing inappropriate initial representations. Insight is attained when the initial representation is changed. In the present study (N = 24), we tested three specific implications of these hypotheses against eye movements recorded while participants solved matchstick arithmetic problems. The results were consistent with the predictions, providing converging evidence with prior findings using solution rates and solution times. Alternative theories of insight can explain individual findings, but only the representational change theory accounts for both the performance data and the eye movement data. The present study also suggests that eye movement recordings provide an important new window into processes of insight problem solving.","The present study suggests that eye movement recordings provide an important new window into processes of insight problem solving, providing converging evidence with prior findings using solution rates and solution times."
"The influence of insight on risky decision making and nucleus accumbens activation","https://scispace.com/paper/the-influence-of-insight-on-risky-decision-making-and-1fiqo2rxj5","2023","Journal Article","Dental science reports","Maxi Becker
Yuhua Yu
Roberto Cabeza","10.1038/s41598-023-44293-2","","Abstract During insightful problem solving, the solution appears unexpectedly and is accompanied by the feeling of an AHA!. Research suggests that this affective component of insight can have consequences beyond the solution itself by motivating future behavior, such as risky (high reward and high uncertainty) decision making. Here, we investigate the behavioral and neural support for the motivational role of AHA in decision making involving monetary choices. The positive affect of the AHA! experience has been linked to internal reward. Reward in turn has been linked to dopaminergic signal transmission in the Nucleus Accumbens (NAcc) and risky decision making. Therefore, we hypothesized that insight activates reward-related brain areas, modulating risky decision making. We tested this hypothesis in two studies. First, in a pre-registered online study (Study 1), we demonstrated the behavioral effect of insight-related increase in risky decision making using a visual Mooney identification paradigm. Participants were more likely to choose the riskier monetary payout when they had previously solved the Mooney image with high compared to low accompanied AHA!. Second, in an fMRI study (Study 2), we measured the effects of insight on NAcc activity using a similar Mooney identification paradigm to the one of Study 1. Greater NAcc activity was found when participants solved the Mooney image with high vs low AHA!. Taken together, our results link insight to enhanced NAcc activity and a preference for high but uncertain rewards, suggesting that insight enhances reward-related brain areas possibly via dopaminergic signal transmission, promoting risky decision making. ","Results link insight to enhanced NAcc activity and a preference for high but uncertain rewards, suggesting that insight enhances reward-related brain areas possibly via dopaminergic signal transmission, promoting risky decision making."
