"Paper Title","Paper Link","Publication Year","Publication Type","Publication Title","Author Names","DOI","PDF Link","Abstract","TL;DR"
"Verbalizable knowledge and skilled task performance: Association, dissociation, and mental models.","https://scispace.com/paper/verbalizable-knowledge-and-skilled-task-performance-3ddntx4wge","1989","Journal Article","Journal of Experimental Psychology: Learning, Memory and Cognition","Penelope Sanderson","10.1037/0278-7393.15.4.729","","Quatre experiences visent a clarifier les conditions d'apparition et les mecanismes des dissociations souvent rencontrees entre les performances a des epreuves et les connaissances verbalisables concernant ces epreuves","Quatre experiences visent a clarifier les conditions d'apparition and les mecanismes des dissociations souvent rencontrees entre les performances a des epreuves and les connaissances verbalisables concernant ces epreuvies as mentioned in this paper."
"On consciousness in syntactic learning and judgment: A reply to Reber, Allen, and Regan","https://scispace.com/paper/on-consciousness-in-syntactic-learning-and-judgment-a-reply-44ykrhuf4s","1985","Journal Article","Journal of Experimental Psychology: General","Don E. Dulany
Richard A. Carlson
Gerald I. Dewey","10.1037/0096-3445.114.1.25","","In this article we examine Reber, Allen, and Regan's (1985) commentary on our analysis of consciousness and abstraction in a case of syntactical learning and judgment (Dulany, Carlson, & Dewey, 1984). We reject their methodological criticism; it is not recall, but assessment at the moment of judgment, that maximizes the validity of reports of rules in consciousness at many moments of judgment. Furthermore, as our computer simulations show, if subjects' reports were merely guessed justifications of unconsciously controlled judgments, the obtained relation of rules to judgments is an event so deviant as to be expected about once in 10 billion occasions. In addition, we discuss a number of broader issues raised by our analysis and their response: judgment after early learning and after automatization, correlated grammars and consciousness, the scope and mental abstractness of rules, conscious and unconscious control, and intuition. Although Reber et al. raise questions that should be examined, we find no reason to revise the interpretation of our experiment. In their commentary, Reber, Allen, and Regan (1985) raise two related methodological issues and greatly broaden the theoretical issue. We welcome the opportunity to reply, rebutting their methodological criticism and placing our analysis in its broader theoretical context. These are methodological issues that anyone investigating consciousness should face, and the broader question of the role of consciousness in the mind should be a central concern of current psychology (Hilgard, 1980; Mandler, 1975; Miller, 1980; Norman 1980). On Methodology","This paper examined Reber, Allen, and Regan's commentary on their analysis of consciousness and abstraction in a case of syntactical learning and judgment, and rebutting their methodological criticism and placing their analysis in its broader theoretical context."
"Implicit learning and tacit knowledge","https://scispace.com/paper/implicit-learning-and-tacit-knowledge-1hgivkxqao","1993","Book","","Arthur S. Reber","","","I examine the phenomenon of implicit learning, the process by which knowledge about the ralegoverned complexities of the stimulus environment is acquired independently of conscious attempts to do so. Our research with the two, seemingly disparate experimental paradigms of synthetic grammar learning and probability learning is reviewed and integrated with other approaches to the general problem of unconscious cognition. The conclusions reached are as follows: (a) Implicit learning produces a tacit knowledge base that is abstract and representative of the structure of the environment; (b) such knowledge is optimally acquired independently of conscious efforts to learn; and (c) it can be used implicitly to solve problems and make accurate decisions about novel stimulus circumstances. Various epistemological issues and related prob1 lems such as intuition, neuroclinical disorders of learning and memory, and the relationship of evolutionary processes to cognitive science are also discussed. Some two decades ago the term implicit learning was first used to characterize how one develops intuitive knowledge about the underlying structure of a complex stimulus environment (Reber, 1965, 1967). In those early writings, I argued that implicit learning is characterized by two critical features: (a) It is an unconscious process and (b) it yields abstract knowledge. Implicit knowledge results from the induction of an abstract representation of the structure that the stimulus environment displays, and this knowledge is acquired in the absence of conscious, reflective strategies to learn. Since then, the evidence in support of this theory has been abundant, and many of the details of the process have been sharpened. This article is an overview of this evidence and an attempt to extend the general concepts to provide some insight into a variety of related processes such as arriving at intuitive judgments, complex decision making, and, in a broad sense, learning about the complex covariations among events that characterize the environment. Put simply, this is an article about learning. It seems curious, given the pattern of psychological investigation of the middle decades of this century, that the topic of learning should be so poorly represented in the contemporary literature in cognitive psychology. The energies of cognitive scientists have been invested largely in the analysis and modeling of existing knowledge rather than in investigations of how it was acquired. For example, in an important recent article on the general topic of unconscious memorial systems, Schacter (1987) never came to grips with the distinction between implicit learning and implicit memory. The latter, the focus of his review, was dealt with historically, characterized, out","Implicit learning as mentioned in this paper is the process by which knowledge about the ralegoverned complexities of the stimulus environment is acquired independently of conscious attempts to do so, and it can be used implicitly to solve problems and make accurate decisions about novel stimulus circumstances."
"Implicit memory: History and current status.","https://scispace.com/paper/implicit-memory-history-and-current-status-166lpiz05r","1987","Journal Article","Journal of Experimental Psychology: Learning, Memory and Cognition","Daniel L. Schacter","10.1037/0278-7393.13.3.501","","Memory for a recent event can be expressed explicitly, as conscious recollection, or implicitly, as a facilitation of test performance without conscious recollection. A growing number of recent studies have been concerned with implicit memory and its relation to explicit memory. This article presents an historical survey of observations concerning implicit memory, reviews the findings of contemporary experimental research, and delineates the strengths and weaknesses of alternative theoretical accounts of implicit memory. It is argued that dissociations between implicit and explicit memory have been documented across numerous tasks and subject populations, represent an important challenge for research and theory, and should be viewed in the context of other dissociations between implicit and explicit expressions of knowledge that have been documented in recent cognitive and neuropsychological research. Psychological studies of memory have traditionally relied on tests such as free recall, cued recall, and recognition. A prominent feature of these tests is that they make explicit reference to, and require conscious recollection of, a specific learning episode. During the past several years, however, increasing attention has been paid to experimental situations in which information that was encoded during a particular episode is subsequently expressed without conscious or deliberate recollection. Instead of being asked to try to remember recently presented information, subjects are simply required to perform a task, such as completing a graphemic fragment of a word, indicating","A survey of implicit memory and its relation to explicit memory can be found in this paper, where the authors present an historical survey of observations concerning implicit memory, reviews the findings of contemporary experimental research, and delineates the strengths and weaknesses of alternative theoretical accounts of implicit memories."
"Probability learning: contingent-event schedules with lags","https://scispace.com/paper/probability-learning-contingent-event-schedules-with-lags-20flq407kv","1972","Journal Article","American Journal of Psychology","Richard B. Millward
Arthur S. Reber","10.2307/1420964","","The importance of memory for the immediately preceding sequence of events has been a recurrent theme in the two-choice prediction experiment. The degree to which subjects attend to preceding events, the manner in which they process the information contained in the event sequence, and the role that the past events play in determining prediction responses are all issues of considerable theoretical importance. There have been three basic ways to investigate the dependency between preceding events and prediction responses. The simplest and most indirect is statistical, as in the analyses of event patterns and recency curves (changes in response proportions as a function of the length","The importance of memory for the immediately preceding sequence of events has been a recurrent theme in the two-choice prediction experiment."
"Learning and Awareness in the Hebb Digits Task","https://scispace.com/paper/learning-and-awareness-in-the-hebb-digits-task-13cz3brny8","1987","Journal Article","Journal of General Psychology","Stuart J. McKelvie","10.1080/00221309.1987.9711057","","Subjects (N = 163) were tested on the Hebb digits task, for which they listened to 24 lists of nine digits read at the rate of about one digit per second and, following each list, attempted to recall the digits in the correct order. They were not informed, however, that the series on Trial 3 recurred on every subsequent third trial. On the basis of a postexperimental questionnaire, subjects were categorized as unaware (n = 21), late aware (n = 29), middle aware (n = 31), and early aware (n = 29) with respect to the point where they reported noticing list repetition. For both aware and unaware subjects, the Hebb repetition effect was replicated in that the recall scores on the repeating series improved over trials relative to those on the novel ones. Moreover, the rate of learning of the critical series was similar in all four groups. These results are inconsistent with Bower and Winzenz's (1969) reallocation hypothesis, in which it is postulated that learning is mediated by recognition of identit...","For instance, this article found that the recall scores on the repeating series improved over trials relative to those on the novel ones, and the rate of learning of the critical series was similar in all four groups."
"Memory as a function of attention, level of processing, and automatization","https://scispace.com/paper/memory-as-a-function-of-attention-level-of-processing-and-2qjwrmim92","1984","Journal Article","Journal of Experimental Psychology: Learning, Memory and Cognition","Arthur D. Fisk
Walter Schneider","10.1037//0278-7393.10.2.181","","The relationships between long-term memory (LTM) modification, attentional allocation, and type of processing are examined. Automatic/controlled processing theory (Schneider & Shiffrin, 1977) predicts that the nature and amount of controlled processing determines LTM storage and that stimuli can be automatically processed with no lasting LTM effect. Subjects performed the following: (a) an intentional learning, (b) a semantic categorization, (c) a graphic categorization, (d) a distracting digit-search while intentionally learning words, and (e) a distracting digit-search while ignoring words. Frequency judgments were more accurate in the semantic and intentional conditions than the graphic condition. Frequency judgments in the digit-search conditions were near chance. Experiment 2 extensively trained subjects to develop automatic categorization. Automatic categorization produced no frequency learning and little recognition. These results also disconfirm the Hasher and Zacks (1979) ""automatic encoding"" proposal regarding the nature of processing.","The relationships between long-term memory (LTM) modification, attentional allocation, and type of processing are examined and results disconfirm the Hasher and Zacks (1979) ""automatic encoding"" proposal regarding the nature of processing."
"Implicit learning: An analysis of the form and structure of a body of tacit knowledge.","https://scispace.com/paper/implicit-learning-an-analysis-of-the-form-and-structure-of-a-1t7vp3jine","1977","Journal Article","Cognition","Arthur S. Reber
Selma Lewis","10.1016/0010-0277(77)90020-8","","","Several important implications about implicit acquisition of a novel complex system emerged, including that the memorial representation of a structured system is acquired through the dual operations of a differentiation-like process based upon relational invariances and a configurational process based on overall structure."
"Implicit learning of artificial grammars","https://scispace.com/paper/implicit-learning-of-artificial-grammars-2b6geynm76","1967","Journal Article","Journal of Verbal Learning and Verbal Behavior","Arthur S. Reber","10.1016/S0022-5371(67)80149-X","","","This paper investigated the process by which Ss respond to the statistical nature of the stimulus array, a process defined as ""implicit learning"" and found that Ss were learning to respond to general grammatical nature of stimuli, rather than learning according to specific coding systems imposed upon the stimuli."
"Analogic and Abstraction Strategies in Synthetic Grammar Learning: A Functionalist Interpretation.","https://scispace.com/paper/analogic-and-abstraction-strategies-in-synthetic-grammar-1eq37v2h0x","1978","Journal Article","Cognition","Arthur S. Reber
Rhianon Allen","10.1016/0010-0277(78)90013-6","","","The relationship between acquisition condition and cognitive strategy is discussed from a functionalist point of view in this article, where both objective response patterns and subjective introspections yielded coordinated data in support of this distinction."
"Attentional requirements of learning: Evidence from performance measures","https://scispace.com/paper/attentional-requirements-of-learning-evidence-from-1v60xlqyru","1987","Journal Article","Cognitive Psychology","Mary Jo Nissen
Peter Bullemer","10.1016/0010-0285(87)90002-8","","","This article investigated whether performance measures would also show a strong dependence on attention and found that patients with Korsakoff's syndrome learned the sequence despite their lack of awareness of the repeating pattern."
"Interactive tasks and the implicit‐explicit distinction","https://scispace.com/paper/interactive-tasks-and-the-implicit-explicit-distinction-1t0sqbrf29","1988","Journal Article","British Journal of Psychology","Dianne C. Berry
Donald E. Broadbent","10.1111/J.2044-8295.1988.TB02286.X","","Two experiments explore the relationship between implicit and explicit processes in the acquisition of complex knowledge. Their purpose is twofold. Firstly, to specify some of the variables that control whether or not performance and explicit knowledge will be associated when people interact with computer-implemented control tasks. Secondly, to clarify the relationships between implicit and explicit modes of learning on the one hand and implicit and explicit types of knowledge on the other. The experiments show that salience of the relationship between decision and action is a crucial factor in relation to both the distinction between implicit and explicit learning and the distinction between implict and explicit knowledge.","This article explored the relationship between implicit and explicit processes in the acquisition of complex knowledge and found that saliency of the relation between decision and action is a crucial factor in relation to both the distinction between explicit and implicit learning and distinction between implict and explicit knowledge."
"Implicit and explicit knowledge in the control of complex systems","https://scispace.com/paper/implicit-and-explicit-knowledge-in-the-control-of-complex-3jvj2mjk5e","1986","Journal Article","British Journal of Psychology","Donald E. Broadbent
Peter H. Fitzgerald
Margaret H. P. Broadbent","10.1111/J.2044-8295.1986.TB01979.X","","These experiments deal with the relation between the ability of a person to carry out efficient action in a situation, and that of the same person to answer questions about the situation. Existing knowledge on the topic has various gaps. In particular it is relatively common to show performance changing without change in verbal knowledge, but relatively rare to show changes in verbal knowledge without change in performance. A second major gap is in defining the kinds of task on which discrepancies may be expected to occur, since in everyday life we do quite frequently expect people to know what they are doing. Accordingly, seven groups of subjects were studied controlling two artificial systems, one concerned with transportation and one with a model of the economy. The discrepancy between verbal knowledge and performance was changed by altering the number or salience of the relationships being learned, and this is at least one factor in making tasks show the discrepancy. Several instances were found of change in verbal question answering opposed to or in the absence of any change of decision performance; thus, the discrepancy is not asymmetric affecting only one measure of learning. This implies that all the variables examined affect processes specific to one or other measure, rather than changing a common database. The results challenge a common view of the discrepancy between performance and verbal accounts, and suggest rather that there are alternative modes of processing in human decision making, each mode having its own advantages.","In this paper, the relation between the ability of a person to carry out efficient action in a situation, and that of the same person to answer questions about the situation was examined, and seven groups of subjects were studied controlling two artificial systems, one concerned with transportation and one with a model of the economy."
"Unconscious acquisition of complex procedural knowledge.","https://scispace.com/paper/unconscious-acquisition-of-complex-procedural-knowledge-2k3iwzakxo","1987","Journal Article","Journal of Experimental Psychology: Learning, Memory and Cognition","Pawel Lewicki
Maria Czyzewska
Hunter G. Hoffman","10.1037/0278-7393.13.4.523","","This research demonstrates a process of acquisition of information about a complex pattern of stimuli and the facilitating influence of this knowledge on subjects' subsequent performance. In two experiments, subjects were exposed for 12 hr to a sequence of frames containing a target, and their task was to search for the target in each frame. The sequence was divided into logical blocks of seven trials each. Locations of the target in the seventh trial of each block were predictable on the basis of the specific sequences of target locations in four out of the previous six trials. Pilot studies and extensive postexperimental interviews indicated that none of the subjects noticed anything even close to the real nature of the manipulation (i.e., the pattern). However, the predicted patterns of latency of their responses to the critical trials indicate that they had, in fact, acquired some intuitive (unconscious) knowledge about how the pattern of prior trials was related to the critical trial. The phenomenon is discussed as a ubiquitous unconscious process involved in the development of both elementary and high-level cognitive skills.","In this paper, the authors demonstrate a process of acquisition of information about a complex pattern of stimuli and the facilitating influence of this knowledge on subjects' subsequent performance, which is referred to as a ubiquitous unconscious process involved in the development of both elementary and high-level cognitive skills."
"Rule-based and exemplar-based classification in artificial grammar learning.","https://scispace.com/paper/rule-based-and-exemplar-based-classification-in-artificial-3ed7om9834","1985","Journal Article","Memory & Cognition","Mary Pat McAndrews
Morris Moscovitch","10.3758/BF03198460","","In this study, we examined the induction of syntactic rules, given the presentation of letter strings generated from a finite-state grammar. Our primary interest was whether application of abstracted syntax or analogy to remembered exemplars could serve as a basis for judgments ofgrammaticality of novel stimuli. The grammatical status of test items and their objectivesimilar­ ity to studied exemplars were manipulated independently to investigate whether rule-based or instance-based information was a more important determinant of classification performance. When group data were examined, the results indicated that both factors were equally important in in­ fluencing grammaticality judgments about novel letter strings. There were, however, large in­ dividual differences in the magnitude of grammatical status effects, with a subgroup of subjects clearly using a classification strategy other than analogy to remembered exemplars. The results offer qualified support for the hypothesis (Reber & Allen, 1978) that rule-based information can be implicitly abstracted given limited experience with richly structured stimulus domains, and these results are inconsistent with a strong version of the instance-based model of categorization. Recent attempts to specify concept formation and cate­ gorization processes have focused on the learning of com­ plex rule structures and ill-defined categories which have no immediately apparent criterial features. Judgments of well-formedness or category membership of items in these complex domains cannot be based on any single easily specified rule or list of defining attributes. In general, ac­ quisition of the objective category or rule relations is in­ vestigated by allowing subjects limited experience with exemplars and assessing classification accuracy on a trans­ fer test using novel stimuli. These experiments form the empirical basis for two broad classes of concept forma­ tion and categorization models which can be distinguished by the information-processing operations assumed to un­","The results offer qualified support for the hypothesis that rule-based information can be implicitly abstracted given limited experience with richly structured stimulus domains, and these results are inconsistent with a strong version of the instance-based model of categorization."
"Insight without awareness: On the interaction of verbalization, instruction and practice in a simulated process control task.","https://scispace.com/paper/insight-without-awareness-on-the-interaction-of-27yrg5bof3","1989","Journal Article","Quarterly Journal of Experimental Psychology","William B. Stanley
Robert C. Mathews
Ray R. Buss
Susan Kotler-Cope","10.1080/14640748908402382","","Four experiments in which subjects learned to control two versions of a complex simulated process control task show that verbalizable knowledge of procedures used to perform these tasks is very limited and is acquired late in learning. Individual learning curves associated with these tasks showed sudden improvements in performance, which were not accompanied by a similar increase in verbalizable knowledge. It was also found that verbal instructions consisting of exemplar memorization, strategies for rule induction, simple heuristics, and experts' instructions were all effective in enhancing novice subjects' performance. A theoretical framework is proposed in which subjects draw on two separate but interacting knowledge structures to perform these tasks. One knowledge structure is based on memory for past experiences (close analogies), and the other is based on one's current mental model of the task. Implicit sets of competing rules that control response selection are derived from both sources of knowledge...","In this article, a theoretical framework is proposed in which subjects draw on two separate but interacting knowledge structures to perform simulated process control tasks, one based on memory for past experiences (close analogies) and the other based on one's current mental model of the task."
"Acquisition of procedural knowledge about a pattern of stimuli that cannot be articulated.","https://scispace.com/paper/acquisition-of-procedural-knowledge-about-a-pattern-of-e5pbp9z7gn","1988","Journal Article","Cognitive Psychology","Pawel Lewicki
Thomas Hill
Elizabeth Bizot","10.1016/0010-0285(88)90023-0","","","It is demonstrated that nonconsciously acquired knowledge can automatically be utilized to facilitate performance, without requiring conscious awareness or control over this knowledge."
