"Paper Title","Paper Link","Publication Year","Publication Type","Publication Title","Author Names","DOI","PDF Link","Abstract","TL;DR"
"Bootstrapping the early lexicon: how do children use old knowledge to create new meanings?","https://scispace.com/paper/bootstrapping-the-early-lexicon-how-do-children-use-old-3w2qvdumqg","2013","Journal Article","Frontiers in Psychology","Emily Mather","10.3389/FPSYG.2013.00096","","Compared to other aspects of language development, such as acquiring grammar, we perhaps take for granted the complexity of building a lexicon. More than 50 years ago the philosopher W.V.O. Quine provided a now famous example of what makes word learning so difficult. In short, Quine (1960) argues that when we hear a new word, how can we ever precisely determine its meaning? This problem has concerned many child language researchers, who all acknowledge that the child requires a means of narrowing down the infinite possible meanings of a word. However, researchers have advocated contrasting theoretical perspectives on how this problem is solved. For many, the child's ability to learn new words requires external input from the speaker—not just the word uttered, but also overt “clues” such as pointing and eye gaze (e.g., Bloom, 2000). Others argue that the child brings their own tools to the task, whether in the form of domain-specific heuristics (e.g., Golinkoff et al., 1994), or domain-general mechanisms (e.g., Samuelson and Smith, 2000).

One simple solution is to use existing vocabulary knowledge to decode the meanings of new words. This strategy is commonly known as mutual exclusivity—the assumption that an object can only have one name (Markman, 1989, 1990). If a child is faced with more than one possible referent of a new word, she will map the word to whichever referent they cannot name. Word learning in this manner is a form of “bootstrapping” in language development, where existing lexical knowledge can be exploited in order to acquire new lexical knowledge. Alternative explanations of this word learning behavior include the novel-name-nameless-category (N3C) principle (Mervis and Bertrand, 1994) and the principle of contrast (Clark, 1987). In spite of extensive research into mutual exclusivity (and related theoretical accounts), many aspects of this phenomenon are not well-understood, such as the underlying cognitive mechanisms and developmental origins.

What mechanism underlies mutual exclusivity?
Prominent explanations of mutual exclusivity suppose that the child discriminates between objects on the basis of whether or not they can name an object. However, in the standard test of mutual exclusivity, the name-unknown objects are almost always more novel than the name-known objects. Hence, there is a fundamental confound between lexical knowledge and object familiarity. Either of these attributes could guide the child toward mapping a novel label with a novel, name-unknown object. There are several reasons to think that object novelty could play a role. First, outside of the laboratory, it might be easier for the child to detect new objects than to systematically retrieve names for the many objects in their surroundings. Second, it is well-established that even very young infants will habituate and preferentially attend to novel stimuli (e.g., Slater et al., 1982, 1983). Finally, there is a small, but growing body of evidence suggesting that object novelty does influence the mutual exclusivity response. Originally, studies by Merriman and colleagues (e.g., Merriman and Bowman, 1989; Merriman and Schuster, 1991), showed that 2-year-olds prefer to select the most novel object in response to a novel label. Children will make this response even when the more novel object is in fact an unfamiliar exemplar of a name-known object category (Merriman and Bowman, 1989). More recently, Horst et al. (2011) and Mather and Plunkett (2012) further demonstrate that toddlers favor the most novel object as a referent, even though other name-unknown objects may be present.

A problem which has beset traditional “constraints and biases” explanations is that they often do not account for the cognitive processes implementing a word-learning strategy. However, a more mechanistic account of mutual exclusivity is possible if we draw upon what we already understand about learning, memory, and attention. Novelty plays a fundamental role in all of these cognitive processes. Thus, clarifying the role of novelty in mutual exclusivity is an important first step toward understanding the underlying cognitive mechanism. However, given the surprisingly small amount of research into the effects of novelty on word learning, some important questions remain unanswered. Here I briefly discuss some of these issues in turn.

Is there a role for object names?
While there is a growing body of evidence for the effects of novelty on word learning, it is not yet clear that object novelty alone can account for the mutual exclusivity response. In Mather and Plunkett (2012), infants' speed of word mapping varied across experiments, according to whether or not a name-known object was present. Infants' mapping of a novel label to a novel object was more rapid when a name-known object was present. One possibility is that the infants' search for a novel referent was prompted more rapidly by the presence of a name-known object. Similarly, other patterns of response suggest that knowledge of object names might impact on the mutual exclusivity response. Halberda (2006) provides evidence that preschoolers and adults engage in a “double-check” of a familiar, name-known object when they hear a new word, even if they are already attending to a novel object. Findings from Halberda (2003) suggest that a similar process might operate for younger word-learners, except that younger infants might struggle with the process of excluding the familiar object as a referent. Thus, while science favors the most parsimonious explanation, it is yet possible that both novelty and object names impact on the mutual exclusivity response.","In spite of extensive research into mutual exclusivity (and related theoretical accounts), many aspects of this phenomenon are not well-understood, such as the underlying cognitive mechanisms and developmental origins."
"Functional reorganization in the developing lexicon: separable and changing influences of lexical and phonological variables on children's fast-mapping.","https://scispace.com/paper/functional-reorganization-in-the-developing-lexicon-2xcmegp44g","2013","Journal Article","Journal of Child Language","Cristina McKean
Carolyn Letts
David Howard","10.1017/S0305000911000444","","Neighbourhood Density (ND) and Phonotactic Probability (PP) influence word learning in children. This influence appears to change over development but the separate developmental trajectories of influence of PP and ND on word learning have not previously been mapped. This study examined the cross-sectional developmental trajectories of influence of PP and ND on fast-mapping in thirty-eight English-speaking children aged 3 ; 01–5 ; 02, in a task varying PP and ND orthogonally. PP and ND exerted separable influences on fast-mapping. Overall, low ND supported better fast-mapping. The influence of PP changed across the developmental trajectory, ‘switching’ from a high to a low PP advantage. A potential explanation for this ‘switch’ is advanced, suggesting that it represents functional reorganization in the developing lexicon, which emerges from changes in the developing lexicon, as phonological knowledge is abstracted from lexical knowledge, over development.","Overall, low ND supported better fast-mapping and a potential explanation for this ‘switch’ is advanced, suggesting that it represents functional reorganization in the developing lexicon, which emerges from changes in the developed lexicon as phonological knowledge is abstracted from lexical knowledge over development."
"Rôle de la mémoire de travail phonologique et de la phonologie sur le développement du lexique chez le jeune enfant","https://scispace.com/paper/role-de-la-memoire-de-travail-phonologique-et-de-la-4c3tafx7h5","2008","Dissertation","","Aline Bertholet","","","Dans la litterature, on releve que le developpement du lexique chez le jeune enfant depend de diverses variables Cependant, les auteurs s'y interessant ne s'entendent pas toujours sur la nature de celles-ci En effet, alors que certains estiment que ce sont les competences en memoire phonologique a court terme (composante de la memoire de travail) qui jouent un role dans l'acquisition du lexique, d'autres revendiquent plutot l'influence de la memoire de l'information sur l'ordre seriel, ou encore l'influence des competences relatives au traitement des sons de la parole (competences phonologiques et metaphonologiques) Par cette recherche, nous desirons clarifier l'influence des ces diverses competences sur l'acquisition du vocabulaire en reception et production chez le jeune enfant Pour ce faire, nous testons les competences de 20 enfants de 4 ½ a 5 ½ ans en lexique receptif et productif d'une part, et en memoire phonologique a court terme, en (meta)phonologie, ainsi qu'en memoire de l'information sur l'ordre seriel d'autre part Notre objectif est de decouvrir quelles competences peuvent etre considerees comme predictrices des competences lexicales receptives et productives chez le jeune enfant Les resultats suggerent que ce sont les competences (meta)phonologiques qui predisent le mieux le niveau lexical des enfants de notre echantillon Hormis une influence non negligeable des competences en memoire de l'information sur l'ordre seriel, nous ne pouvons avancer une importante influence des competences en memoire phonologique a court terme sur le niveau lexical","In this paper, le developpement du lexique chez le jeune enfant depend de diverses variables and the influence of these variables on le lexique's development."
"Early word learning and conceptual development: Everything had a name, and each name gave birth to a new thought: Handbooks of Developmental Psychology","https://scispace.com/paper/early-word-learning-and-conceptual-development-everything-2ne10wl4z5","2002","","","Sandra R. Waxman
Erin M. Leddon","","","Sandra R. Waxman & Erin M. Leddon Northwestern University Synopsis Perhaps more than any other developmental achievement, word-learning stands at the very intersection of language and cognition. Early word-learning represents infants’ entrance into a truly symbolic system and brings with it a means to establish reference. To succeed, infants must identify the relevant linguistic units, identify their corresponding concepts, and establish a mapping between the two. But how do infants begin to map words to concepts, and thus establish their meaning? How do they discover that different types of words (e.g., “dog” (noun), “fluffy” (adjective), “begging” (verb) refer to different aspects of the same scene (e.g, a standard poodle, seated on its hind legs and holding its front paws in the air)? We have proposed that infants begin the task of word-learning with a broad, universal expectation linking novel words to a broad range of commonalities, and that this initial expectation is subsequently fine-tuned on the basis of their experience with the objects and events they encounter and the native language under acquisition. In this chapter, we examine this proposal, in light of recent evidence with infants and young children.","Waxman and Leddon as mentioned in this paper proposed that infants begin the task of word learning with a broad, universal expectation linking novel words to a broad range of commonalities, and that this initial expectation is subsequently fine-tuned on the basis of their experience with the objects and events they encounter and the native language under acquisition."
"The precocious two-year-old: status of the lexicon and links to the grammar.","https://scispace.com/paper/the-precocious-two-year-old-status-of-the-lexicon-and-links-14p835zxz9","2005","Journal Article","Journal of Child Language","Karla K. McGregor
Li Sheng
Bruce L. Smith","10.1017/S0305000905006926","","This is a study of the lexical and grammatical abilities of 16 lexically precocious talkers. These children, aged 2;0 were compared to their age-matched peers, 22 typical talkers aged 2;0, and their expressive vocabulary-matched peers, 22 typical talkers aged 2;6. Individual differences in children's lexical knowledge at 2;0 were stable – evident in parent report, laboratory observation, and an experimental fast-mapping paradigm. In accordance with the continuity hypothesis, the lexically precocious children were also grammatically precocious, having a greater representation of grammatical types and tokens and more advanced combinatorial language than their typical age-matches. Their grammatical development was very similar to that of their older vocabulary-matched peers. Limits on continuity were highly constrained with no true dissociation between the lexicon and the grammar in 33 cases examined. We conclude that, among two-year-olds, grammatical development is more tightly associated with the size of the lexicon than with chronological age.","It is concluded that, among two-year-olds, grammatical development is more tightly associated with the size of the lexicon than with chronological age."
"Lexical and Cognitive Processing in Early Language Delay","https://scispace.com/paper/lexical-and-cognitive-processing-in-early-language-delay-1qui81ign2","2013","","","Erica Michelle Ellis","","","Author(s): Ellis, Erica Michelle | Abstract: Young children who have difficulty learning words compared to their peers are at risk for continued language delays as they grow older. While most late talkers (LT) will move into the normal range of language abilities by school age, approximately 17-26% of LTs will be identified with SLI by 5 years of age (Paul, 1996; Rescorla, 2002, Rescorla a Dale, 2013). Accordingly, one critical question is how to best identify which LTs will have SLI at school age, in order to maximize the opportunity for early and appropriate intervention and support. Longitudinal studies of language outcomes in LTs have had only moderate success at accurately predicting which LTs will be identified as having SLI by 5-6 years of age. Research shows that the individual's lexical and cognitive processing abilities (e.g., speed of processing, memory and implicit learning) play an important role in language development (Fernald a Marchman, 2012; Graf Estes et al., 2007) and in language deficits in children with SLI (e.g., Ellis Weismer et al., 1999; Evans et al., 2009; Leonard et al., 2007; Montgomery, 2000; Montgomery a Evans, 2009; Tomblin et al., 2007). Therefore, using the lexical and cognitive processing deficits characteristic of children with SLI to inform the study of lexical and cognitive processing in infants may prove more successful than traditional static measures of vocabulary alone, in identifying LTs at the greatest risk for SLI. This dissertation utilizes fine-grained eye tracking methods to examine multiple real-time measures of lexical and cognitive processing to begin to identify characteristics of Late Talkers who may be at risk for Specific Language Impairment. Chapter 1 provides the general background and support for the questions addressed in this dissertation. In Chapters 2-5, data from four studies are presented. Specifically, speed and accuracy of processing familiar real words in a group of LT (N = 14) and TYP (N = 14) 18 month old infants is compared (Study 1). In study 2, speed and accuracy of processing of newly learned novel words in a group of LT (N =14) and TYP (N = 14) 18 month old infants is examined. Study 3 further examines infants' abilities to use transitional probabilities to discover word boundaries within a stream of speech is compared in the same group of LT (N = 14) and TYP (N = 14) 18 month old infants. Study 4 examines lexical processing, novel word learning and implicit learning in a larger group of 54, 18-months, using an alternative distributional approach. Finally, Chapter 6 informs both theoretical models and clinical implications of word learning and vocabulary development in LTs and provides insight into the mechanisms that underlie individual differences in language abilities","This dissertation utilizes fine-grained eye tracking methods to examine multiple real-time measures of lexical and cognitive processing to begin to identify characteristics of Late Talkers who may be at risk for Specific Language Impairment."
"Fast Mapping and Slow Mapping in Children's Word Learning","https://scispace.com/paper/fast-mapping-and-slow-mapping-in-children-s-word-learning-1e83hmp6nv","2010","Journal Article","Language Learning and Development","Daniel Swingley","10.1080/15475441.2010.484412","","When young children encounter a word they do not know, their guesses about what the word might mean are often surprisingly accurate. This is true not only with respect to the particular instance th...","The point is not that the experimental situation closely mimics children’s daily lives but rather that children”s interpretations reveal antecedent knowledge either innately specified or gained in development."
"The Role of Statistical Learning and Verbal Short-Term Memory in Impaired and Typical Lexical Development","https://scispace.com/paper/the-role-of-statistical-learning-and-verbal-short-term-2vxr28wr1q","2021","Journal Article","Frontiers in Communication","Ferenc Kemény
Ágnes Lukács","10.3389/FCOMM.2021.700452","","Purpose. Studies on the interface between statistical learning and language are dominated by its role in word segmentation and association with grammar skills, while research on its role in lexical development is scarce. The current study is aimed at exploring whether and how statistical learning and verbal short-term memory are associated with lexical skills in typically developing German-speaker primary school children (Experiment 1) and Hungarian-speaking children with developmental language disorder (DLD, Experiment 2). Methods. We used the language-relevant Peabody Picture Vocabulary Tests to measure individual differences in vocabulary. Statistical learning skills were assessed with the Weather Prediction task, in which participants learn probabilistic cue-outcome associations based on item-based feedback. Verbal short-term memory span was assessed with the Forward digit span task. Results. Hierarchical linear regression modelling was used to test the contribution of different functions to vocabulary size. In TD children, statistical learning skills had an independent contribution to vocabulary size over and above age, receptive grammatical abilities and short-term memory, whereas working memory did not have an independent contribution. The pattern was reverse in SLI: Vocabulary size was predicted by short-term memory skills over and above age, receptive grammar and statistical learning, whereas statistical learning had no independent contribution. Conclusion. Our results suggest that lexical development rely on different underlying memory processes in typical development and in developmental language disorder to different degrees. This qualitative difference is discussed in the light of different stages of lexical development, as well as the contribution of the different human memory systems to vocabulary acquisition.","This article explored whether and how statistical learning and verbal short-term memory are associated with lexical skills in typically developing German-speaker primary school children and Hungarian-speaking children with developmental language disorder."
"Lexical Access in the Second Year: a Study of Monolingual and Bilingual Vocabulary Development.","https://scispace.com/paper/lexical-access-in-the-second-year-a-study-of-monolingual-and-3566q04a28","2017","Journal Article","Bilingualism: Language and Cognition","Stephanie DeAnda
Kristi Hendrickson
Pascal Eric Zesiger
Diane Poulin-Dubois
Margaret Friend","10.1017/S1366728917000220","","It is well established that vocabulary size is related to efficiency in auditory processing, such that children with larger vocabularies recognize words faster than children with smaller vocabularies The present study evaluates whether this relation is specific to the language being assessed, or related to general language or cognitive processes Speed of word processing was measured longitudinally in Spanish- and English-learning monolinguals and bilinguals at 16 and 22 months of age Speed of processing in bilinguals was similar to monolinguals, suggesting that the number of languages to which children are exposed does not influence word recognition Further, cross-language associations in bilinguals suggest that the dominant language supports processing in the non-dominant language These cross-language associations are consistent with general language and cognitive efficiency accounts in which the relation between word processing and knowledge relies on experience within a language as well as on general and cognitive properties of language learning","Cross-language associations in bilinguals suggest that the dominant language supports processing in the non-dominant language, consistent with general language and cognitive efficiency accounts in which the relation between word processing and knowledge relies on experience within a language as well as on general and cognitive properties of language learning."
"Why Word Learning is not Fast","https://scispace.com/paper/why-word-learning-is-not-fast-41qu2bjzum","2012","Journal Article","Frontiers in Psychology","Natalie Munro
Elise Baker
Karla K. McGregor
Karla K. McGregor
Kimberley Docking
Joanne Arciuli","10.3389/FPSYG.2012.00041","","Upon fast mapping, children rarely retain new words even over intervals as short as five minutes. In this study, we asked whether the memory process of encoding or consolidation is the bottleneck to retention. Forty-nine children, mean age 33 months, were exposed to eight 2-or-3-syllable nonce neighbors of words in their existing lexicons. Didactic training consisted of six exposures to each word in the context of its referent, an unfamiliar toy. Productions were elicited four times: immediately following the examiner’s model, and at 1-minute-, 5-minute-, and multiday retention intervals. At the final two intervals, the examiner said the first syllable and provided a beat gesture highlighting target word length in syllables as a cue following any erred production. The children were highly accurate at immediate posttest. Accuracy fell sharply over the 1-minute retention interval and again after an additional 5 minutes. Performance then stabilized such that the 5-minute and multiday posttests yielded comparable performance. Given this time course, we conclude that it was not the post-encoding process of consolidation but the process of encoding itself that presented the primary bottleneck to retention. Patterns of errors and responses to cueing upon error suggested that word forms were particularly vulnerable to partial decay during the time course of encoding.","It was not the post-encoding process of consolidation but the process of encoding itself that presented the primary bottleneck to retention, and patterns of errors and responses to cueing upon error suggested that word forms were particularly vulnerable to partial decay during the time course of encoding."
"It’s All in the Interaction: Early Acquired Words Are Both Frequent and Highly Imageable","https://scispace.com/paper/its-all-in-the-interaction-early-acquired-words-are-both-184w5rl8s8","2024","Journal Article","Open Mind","Joseph R. Coffey
Margarita Zeitlin
Jean Crawford
Jesse Snedeker","10.1162/opmi_a_00130","","Abstract Prior studies have found that children are more likely to learn words that are frequent in the input and highly imageable. Many theories of word learning, however, predict that these variables should interact, particularly early in development: frequency of a form is of little use if you cannot infer its meaning, and a concrete word cannot be acquired if you never hear it. The present study explores this interaction, how it changes over time and its relationship to syntactic category effects in children acquiring American English. We analyzed 1461 monolingual English-speaking children aged 1;4–2;6 from the MB-CDI norming study (Fenson et al., 1994). Word frequency was estimated from the CHILDES database, and imageability was measured using adult ratings. There was a strong over-additive interaction between frequency and imageability, such that children were more likely to learn a word if it was both highly imageable and very frequent. This interaction was larger in younger children than in older children. There were reliable differences between syntactic categories independent of frequency and imageability, which did not interact with age. These findings are consistent with theories in which children’s early words are acquired by mapping frequent word forms onto concrete, perceptually available referents, such that highly frequent items are only acquired if they are also imageable, and vice versa.","Early-acquired words in children are both frequent and highly imageable. There is a strong over-additive interaction between frequency and imageability, such that children are more likely to learn a word if it is both highly imageable and very frequent."
