"Paper Title","Paper Link","Publication Year","Publication Type","Publication Title","Author Names","DOI","PDF Link","Abstract","TL;DR"
"Quantifying and Modelling Transfer Learning in Mice Between Consecutive Training Stages of a Change Detection Task","https://scispace.com/paper/quantifying-and-modelling-transfer-learning-in-mice-between-4r0zd3kvhm","2019","Posted Content","bioRxiv","Marina Garrett
Douglas R. Ollerenshaw
Peter A. Groblewski
Shawn R. Olsen
Stefan Mihalas","10.1101/2019.12.19.883470","","Animals are known to be able to rapidly transfer knowledge between tasks with similar structure. We trained a set of mice on a visual change detection task with multiple stages, starting with direct transitions between gratings, adding an intervening gray screen, and subsequently moving to multiple sets of natural images. We observe that, when progressing to new stages, the performance increases very fast. However, when transitioning to a task of higher complexity, the peak performance decreases. This setup facilitates for the first time an experimental platform to study the transfer learning phenomena in mice using visual stimuli. Based on these results and additional neuroscience insight, we propose a cognitive model to explain the quick adaptation observed in mice. It extends a deep Q learning agent with a multi-tiered architecture and the possibility of performing a representation remapping at every level of the hierarchy to prevent the downstream propagation of representation anomalies. This architecture provides the substrate of an adaptation algorithm based on ideas of optimal transport of probability distributions. It matches well key behavioral aspects observed in mice and the experimental constraint that the mice are initially trained using a single task variant before it transitions to the new training phase. The modelling process helped us to gain biological insights: first, the optimal transport mechanism of the representation remapping indicated that a possible reason for the reduced performance when mice move to a new more complex task could be due to limited representation resources which were optimized for the previous task. Second, the multi-tiered architecture was first an engineering constraint and later a biologic insight confirmed by the literature. A final insight came from the computations required to perform the representation remapping. These computations are interesting because they could help to confirm this transfer learning theory by looking for similar neural correlates during the adaptation process.","A cognitive model is proposed to explain the quick adaptation observed in mice and it extends a deep Q learning agent with a multi-tiered architecture and the possibility of performing a representation remapping at every level of the hierarchy to prevent the downstream propagation of representation anomalies."
"Mechanisms of same–different conceptualization: entropy happens!","https://scispace.com/paper/mechanisms-of-same-different-conceptualization-entropy-7eprzhuw3j","2021","Journal Article","Current opinion in behavioral sciences","Edward A. Wasserman
Michael E. Young
Leyre Castro","10.1016/J.COBEHA.2020.06.001","","Can nonhuman animals learn abstract concepts? This intriguing question has been extensively studied over the past several decades with many different species and experimental methods. Here, we review evidence showing that pigeons can acquire a same–different concept: they readily learn to discriminate between arrays of same and different items as well as robustly transfer their discrimination to novel arrays of items. To do so, pigeons use the degree of visual variability in the collection of items, as measured by entropy. Not only pigeons, but baboons and human adults also use entropy in their discrimination of same from different items. Thus, entropy does seem to lie at the root of this basic abstract concept.","Evidence showing that pigeons can acquire a same–different concept is reviewed: they readily learn to discriminate between arrays of same and different items as well as robustly transfer their discrimination to novel arrays of items."
"Learning Phase Transitions from Regression Uncertainty","https://scispace.com/paper/learning-phase-transitions-from-regression-uncertainty-2yq5w3b2","2022","Posted Content","","","10.48550/arxiv.2203.06455","","For performing regression tasks involved in various physics problems, enhancing the precision, or equivalently reducing the uncertainty of the regression results is undoubtedly one of the central goals. Here, somewhat surprisingly, we find that the unfavorable regression uncertainty in performing regression tasks of inverse statistical problems actually contains ""hidden"" information concerning phase transitions of the system under consideration. By utilizing this ""hidden"" information, we develop a new unsupervised machine learning approach dubbed ""learning from regression uncertainty"" for automated detection of phases of matter, with the core working horse being a neural network performing regression tasks instead of classification tasks as in various related machine learning approaches developed so far. This is achieved by revealing an intrinsic connection between regression uncertainty and response properties of the system under consideration, thus making the results of this machine learning approach directly interpretable. We demonstrate the approach by identifying the critical point of the ferromagnetic Ising model and revealing the existence of the intermediate phase in the six-state and seven-state clock models. Our approach paves the way towards intriguing possibilities for unveiling new physics via machine learning in an interpretable manner. ","In this paper , an unsupervised machine learning approach dubbed ""learning from regression uncertainty"" was developed for automated detection of phases of matter, with the core working horse being a neural network performing regression tasks instead of classification tasks."
"Statistical learning and the critical period: how a continuous learning mechanism can give rise to discontinuous learning.","https://scispace.com/paper/statistical-learning-and-the-critical-period-how-a-1tg8t320z9","2016","Journal Article","Wiley Interdisciplinary Reviews: Cognitive Science","Erik D. Thiessen
Sandrine Girard
Lucy C. Erickson","10.1002/WCS.1394","","Infants and children are generally more successful than adults in learning novel languages, a phenomenon referred to as a critical or sensitive period for language acquisition. One explanation for this critical period is the idea that children have access to a set of language learning processes or mechanisms unavailable to adults. From this perspective, developmental change is explained in terms of a discontinuity of learning processes. We suggest that this is not the only possible explanation for developmental change in language learning outcomes. Instead, we propose that the mechanisms underlying language acquisition (in particular, we highlight statistical learning) are largely continuous across the lifespan. From this perspective, developmental change is explained in terms of experience, differences in the input with age, and maturational changes in the cognitive architecture supporting learning, even while the learning process itself operates continuously across developmental time. WIREs Cogn Sci 2016, 7:276-288. doi: 10.1002/wcs.1394 For further resources related to this article, please visit the WIREs website.","It is proposed that the mechanisms underlying language acquisition (in particular, statistical learning) are largely continuous across the lifespan, even while the learning process itself operates continuously across developmental time."
"Transitions in cognitive development: prospects and limitations of a neural dynamic approach","https://scispace.com/paper/transitions-in-cognitive-development-prospects-and-i0zur0ni9l0w","","","","Han L. J. van der Maas
Maartje E. J. Raijmakers","10.1093/acprof:oso/9780195300598.003.0015","","Abstract This chapter discusses old-fashioned cognitive development from the point of view of two modern approaches, connectionism and nonlinear dynamical systems theory. The main assertion in both connectionist and dynamic systems approaches is that higher cognitive functioning is largely based on nonsymbolic, graded, and dynamic properties, of which these same approaches provide the best account. The chapter argues that the claim concerning nonsymbolic higher order cognition is overstated and explains its position by focusing on sudden transitions in cognitive development.","This chapter critiques the connectionist and dynamic systems approaches to cognitive development, arguing that their emphasis on nonsymbolic, graded cognition is overstated, and instead highlights the significance of sudden transitions in cognitive development."
"Dropping the Other U: An Alternative Approach to U-Shaped Developmental Functions.","https://scispace.com/paper/dropping-the-other-u-an-alternative-approach-to-u-shaped-1aa2f81qwk","2004","Journal Article","Journal of Cognition and Development","Charles J. Brainerd","10.1207/S15327647JCD0501_5","","The aim of this article is to introduce readers to an alternative way of applying U-shaped functions to understand development, especially cognitive development. In classical developmental applications, age is the abscissa; that is, in the fundamental equation B = f(A), some behavioral variable (B) plots as a U-shaped or inverted U-shaped function of chronological age across some age range. Although a U-shaped trend is always a surprising outcome,examples are reasonably thick on the ground—including infant face perception (Cashon & Cohen, 2004), symbolic gestures (Namy, Campbell, & Tomasello, 2004), and motor coordination and language (Gershkoff-Stowe & Thelen, 2004). These nonmonotonic trends are sufficiently numerous that some—notably, Thelen and associates (e.g., Thelen, Schöner, Scheier, & Smith, 2001; Thelen & Smith, 1994)—contend that a theoretical reorientation along dynamical systems lines is in order. There is a second “behavioral U” that figures in adult experimental psychology. It remains largely unknown in developmental work, but we could, I think, employ it to great advantage in research and theory. This article describes the other family of behavioral Us, shows how to apply it in developmental work, and sketches what can be learned from such applications. JOURNAL OF COGNITION AND DEVELOPMENT, 5(1), 81–88 Copyright © 2004, Lawrence Erlbaum Associates, Inc.","Erlbaum et al. as discussed by the authors introduced an alternative way of applying U-shaped functions to understand development, especially cognitive development, and showed how to apply it in developmental work, and sketches what can be learned from such applications."
"Different regulation mechanisms for evolved critical periods in learning","https://scispace.com/paper/different-regulation-mechanisms-for-evolved-critical-periods-3uag0wlti0","2013","Proceedings Article","Congress on Evolutionary Computation","Kai Olav Ellefsen","10.1109/CEC.2013.6557701","","The learning of various skills and behaviors in animals and humans goes through phases known as critical periods, where plasticity is temporarily facilitated. The experiments presented here are designed to shed further light on this phenomenon, by investigating three mechanisms that have been suggested for controlling the timing of critical periods. By evolving neural networks controlled by these mechanisms, we gain an insight into their strengths and weaknesses. We find that the mechanisms based on the developmental stage of an individual can control plasticity under predictable conditions, whereas we need to control plasticity as a function of attention level to adapt successfully to new and uncertain environments.","It is found that the mechanisms based on the developmental stage of an individual can control plasticity under predictable conditions, whereas the authors need to control Plasticity as a function of attention level to adapt successfully to new and uncertain environments."
"Phase Transitions in Transfer Learning for High-Dimensional Perceptrons.","https://scispace.com/paper/phase-transitions-in-transfer-learning-for-high-dimensional-1oju3mve3d","2021","Journal Article","Entropy","Oussama Dhifallah
Yue Lu","10.3390/E23040400","","Transfer learning seeks to improve the generalization performance of a target task by exploiting the knowledge learned from a related source task Central questions include deciding what information one should transfer and when transfer can be beneficial The latter question is related to the so-called negative transfer phenomenon, where the transferred source information actually reduces the generalization performance of the target task This happens when the two tasks are sufficiently dissimilar In this paper, we present a theoretical analysis of transfer learning by studying a pair of related perceptron learning tasks Despite the simplicity of our model, it reproduces several key phenomena observed in practice Specifically, our asymptotic analysis reveals a phase transition from negative transfer to positive transfer as the similarity of the two tasks moves past a well-defined threshold","In this paper, the authors present a theoretical analysis of transfer learning by studying a pair of related perceptron learning tasks and reveal a phase transition from negative transfer to positive transfer as the similarity of the two tasks moves past a well-defined threshold."
"Reflections on the Role of Differentiation Processes in Forming Behavioral Phenotypes: Can These Processes Replace the Concepts of Plastic Phenotype and Reversible Plastic Phenotype?","https://scispace.com/paper/reflections-on-the-role-of-differentiation-processes-in-18cvpa7a2aig","2024","Journal Article","","Pilar Chiappa","10.20944/preprints202411.1047.v1","","Comparative studies of various aspects of human development indicate that it has slowed down during evolution compared to the development of the great apes. From multiple areas of knowledge and at separate times, several authors have related this characteristic to behavioral phenotypic plasticity. Throughout the text, I keep a comparative perspective that emphasizes the crucial role that the selection of juvenile behavior has played in shaping cognitive behavior in various animal species, a critical factor in the evolution of cognitive differentiation. Anchored to the positive correlative evolution between cognitive behavior and modes of development, this perspective leads to an argument in favor of replacing the concept of behavioral plasticity with that of cognitive differentiation. Behind the classical concept of behavioral plasticity, there is a link between the purpose of the behavior and its genotype; likewise, behind this concept, in any cognitive behavior, there are different pre-existing phenotypic possibilities from a single genotype, each one depending on an earlier evolutionary interaction between genotype and environment. In conceptual contrast, the purpose of a behavioral phenotype developed from a process of cognitive and neural differentiation is evolutionarily independent of previous environmental interaction (i.e., it does not have any preexisting purpose). Understanding the neurocognitive aspects of behavioral phenotypes will allow researchers from several evolutionary disciplines to decouple behavioral purpose from genotype during evolutionary processes. ","Comparative studies suggest human development has slowed compared to great apes, linked to behavioral phenotypic plasticity. Cognitive differentiation may replace plasticity, decoupling behavior purpose from genotype, and understanding neurocognitive aspects can facilitate evolutionary process analysis."
"Development of cognition and intelligence","https://scispace.com/paper/development-of-cognition-and-intelligence-38tmlfsboh","2017","Book Chapter","","Florian Schmiedek","10.1016/B978-0-12-804674-6.00019-3","","Lifespan cognitive development is shaped by biological processes of maturation and senescence and their interplay with experience-dependent processes of learning. The development of basic information-processing functions (i.e., the mechanics of cognition) is characterized by normative growth in childhood and adolescence and more or less pronounced declines in adulthood and old age, while knowledge and skill acquisition (i.e., the pragmatics of cognition) keep their potential for improvements across the adult lifespan. The large individual differences in cognitive functioning observable at any age are characterized, on the one hand, by impressive stability across the lifespan, corresponding to large heritability estimates in adulthood. On the other hand, environmental influences can strongly act on cognitive development, independently of, driven by, or interacting with genetic differences. These environmental influences range from effects of home environment, early education, and regular schooling to those of lifestyles during adulthood that characterized by intellectual stimulation, physical activity, and behavior supporting general health.","In this paper, the development of basic information processing functions (i.e., the mechanics of cognition) is characterized by normative growth in childhood and adolescence and more or less pronounced declines in adulthood and old age, while knowledge and skill acquisition keep their potential for improvements across the adult lifespan."
"Can rational models be good accounts of developmental change? The case of language development at two time scales.","https://scispace.com/paper/can-rational-models-be-good-accounts-of-developmental-change-4mjb6siwi1","2012","Book Chapter","Advances in Child Development and Behavior","Colin Reimer Dawson
LouAnn Gerken","10.1016/B978-0-12-397919-3.00004-6","","Rational models of human perception and cognition have allowed researchers new ways to look at learning and the ability to make inferences from data. But how good are such models at accounting for developmental change? In this chapter, we address this question in the domain of language development, focusing on the speed with which developmental change takes place, and classifying different types of language development as either fast or slow. From the pattern of fast and slow development observed, we hypothesize that rational learning processes are generally well suited for handling fast processes over small amounts of input data. In contrast, we suggest that associative learning processes are generally better suited to slow development, in which learners accumulate information about what is typical of their language over time. Finally, although one system may be dominant for a particular component of language learning, we speculate that both systems frequently interact, with the associative system providing a source of emergent hypotheses to be evaluated by the rational system and the rational system serving to highlight which aspects of the learner's input need to be processed in greater depth by the associative system.","This chapter focuses on the speed with which developmental change takes place, and classifies different types of language development as either fast or slow, hypothesize that rational learning processes are generally well suited for handling fast processes over small amounts of input data, and suggest that associative learning process are generally better suited to slow development."
"The Human Challenge in Understanding Animal Cognition","https://scispace.com/paper/the-human-challenge-in-understanding-animal-cognition-498pfpr92o","2020","Book Chapter","","Christophe Boesch","10.1007/978-3-030-31011-0_3","","Animal cognition studies have progressively moved themselves to an impasse due to an overemphasis on controlled experiments on captive animals that are completely detached from species-typical socio-ecologies. If progresses in studies on wild-living animals have provided a wealth of detailed observations on sophisticated cognitive achievements, captive experimental studies have concentrated on the “failure” of nonhuman species to demonstrate so-called uniquely human cognitive skills. In the present chapter, I stress the need to better understand what “cognition” is and to perform valid comparisons on chimpanzees if we want to understand the evolution of human cognitive abilities. Cognition is not just an innate property of a species, but an adaptation of individuals to their living conditions. As such, cognitive studies need ecological validity to explore the adaptations to the environments typical to the studied species. New understanding about brain plasticity and the effect of environmental enrichment in different species, including humans, confirm the importance of environment on the development of cognitive abilities. This invalidates the assumption of most experimental captive studies that one can generalize from such atypical conditions to the whole of the species. Furthermore, observations on wild chimpanzees stress the importance of population differences, thereby illustrating how cognition develops over the lifespan as individuals solve the daily challenges faced in their social and physical environment. Combining the information about brain plasticity, environmental validity, and population differences will permit cognitive studies to progress and finally contribute to our understanding of the evolution of human and human-like cognitive abilities.","The need to better understand what “cognition” is and to perform valid comparisons on chimpanzees is stressed if the authors want to understand the evolution of human cognitive abilities and combine the information about brain plasticity, environmental validity, and population differences to permit cognitive studies to progress."
"Cognitive development from infancy to young adulthood in common marmosets (Callithrix jacchus): Effect of age, sex, and hormones on learning and affective state","https://scispace.com/paper/cognitive-development-from-infancy-to-young-adulthood-in-3fh5wspuz3","2023","Journal Article","Developmental Psychobiology","Hayley Ash
Robinson W. Goy
Abigail Spaulding
Ricki J. Colman
Cody J. Corbett
Toni E. Ziegler","10.1002/dev.22430","","Studies looking at individual variability in cognition have increased in recent years. We followed 43 marmosets (21 males, 22 females) from infancy to young adulthood. At 3‐months old, marmosets were trained to touch a rewarded stimulus. At 9‐, 15‐, and 21‐months old, they were given visual discrimination and cognitive bias tests, and urine samples were collected to examine hormone levels. Marmosets were significantly more successful learners at 15 months than 9 months. Individuals who were more successful learners at 9 months were also more successful at 15 months, with more male learners than expected at 15 months. At 9 months, learning success was associated with higher cortisol levels. At 15 months, males with higher estradiol levels were more successful learners, whereas at 21 months, females with higher estradiol and cortisol levels tended to be less successful learners and more pessimistic. Nine months, therefore, appears to be an important developmental timepoint for acquiring cognitive control, which has developed by 15 months. Steroids may have differential effects on each sex, with complex interactions between gonadal and adrenal hormones having an influence on cognitive function over the lifespan. This longitudinal study offers new insight into cognition, including its development and biological underpinnings.","Nine months appears to be an important developmental timepoint for acquiring cognitive control, which has developed by 15 months, and males with higher estradiol levels were more successful learners, whereas at 21 months, females with higherEstradiol and cortisol levels tended to be less successful learners and more pessimistic."
