"Paper Title","Paper Link","Publication Year","Publication Type","Publication Title","Author Names","DOI","PDF Link","Abstract","TL;DR"
"Representational insight in pigeons: comparing subjects with and without real-life experience","https://scispace.com/paper/representational-insight-in-pigeons-comparing-subjects-with-5c541m0j90","2010","Journal Article","Animal Cognition","Ulrike Aust
Ludwig Huber","10.1007/S10071-009-0258-4","","Understanding the relation between objects and their pictures at a level beyond mere feature discrimination is by no means a trivial cognitive ability, and support of this is still weak in nonhuman species. Here, we report evidence of representational insight in pigeons. Responding to pictures of human body parts was compared in birds that had extensive pre-experience with live humans and in birds that had never seen any human heads. In a two-alternative forced-choice procedure the pigeons were trained to discriminate between pictures of either handless or headless humans and nonhumans. On test, the birds had to choose (i) between body parts they had already seen in training and the parts that had been missing, (ii) between previously seen parts and arbitrary skin patches, and (iii) between previously missing parts and skin patches. Only the pigeons that lacked experience with real heads and were trained with pictures of headless humans failed to show a significant preference for pictures of missing parts (i.e., heads) over arbitrary skin patches. This demonstrates the importance of individual experience with the real 3D-referents of pictures for classification of the latter and is thereby evidence of representational insight.","Evidence of representational insight in pigeons is reported, demonstrating the importance of individual experience with the real 3D-referents of pictures for classification of the latter and is thereby evidence of representingational insight."
"Pigeons Flexibly Time or Count on Cue","https://scispace.com/paper/pigeons-flexibly-time-or-count-on-cue-5dr7d9t3th","2000","Journal Article","Psychological Science","William A. Roberts
Ryan Coughlin
Shelley Roberts","10.1111/1467-9280.00244","","In Experiment 1, pigeons were presented with a sequence of light flashes and cued to peck a key for reward either after a fixed time or after a fixed number of flashes. Curves that showed the rate of key pecking over time within trials indicated that peak rates of response were reached near the fixed time on timing-cued trials and near the fixed number of flashes on counting-cued trials. In Experiment 2, the key cue was shifted from timing to counting or from counting to timing midway through a trial. The peak times reached after the cue change indicated that pigeons kept track of time while cued to count but did not count while cued to time. These findings suggest a basic asymmetry in the dual-mode model of timing and counting.","Findings suggest a basic asymmetry in the dual-mode model of timing and counting in pigeons, which indicates that pigeons kept track of time while cued to count but did not count while cuing to time."
"Pigeons (Columba livia) plan future moves on computerized maze tasks","https://scispace.com/paper/pigeons-columba-livia-plan-future-moves-on-computerized-maze-omgbhrhtl1","2008","Journal Article","Animal Cognition","Hiromitsu Miyata
Kazuo Fujita","10.1007/S10071-008-0141-8","","Planning, the internal process of formulating an organized method about one’s future behavior, should be advantageous for non-human animals as well as for humans. However, little is known about this process in avian species. We examined planning processes in pigeons (Columba livia) using a computerized maze task. In Experiment 1, we found that the pigeons plan their next one step, and in some cases even correctly adjust their actions after change of goal locations, while performing on a plus-shaped maze. We also showed that the pigeons might even plan two steps on familiar, well-practiced mazes. In Experiment 2, we discovered that the subjects plan the direction they would go first before starting to solve a four-arm shuriken (a Japanese traditional throwing knife)-shaped maze. The birds also corrected their previously planned actions after change of goal locations. Our results from these experiments suggest that planning ahead is within the cognitive capacity of a “bird brain”, and that it may be more widespread in the animal kingdom than has been presumed.","The results from these experiments suggest that planning ahead is within the cognitive capacity of a “bird brain”, and that it may be more widespread in the animal kingdom than has been presumed."
"Dissociation of Procedural and Working Memory in Pigeons (Columba livia)","https://scispace.com/paper/dissociation-of-procedural-and-working-memory-in-pigeons-20ix6axehk","2016","Journal Article","International journal of psychological research","Walter T. Herbranson","10.21500/20112084.2326","","A new method was developed to concurrently investigate procedural memory and working memory in pigeons  Pigeons performed a sequence of keypecks across 3 response keys in a serial response task, with periodic choice probes for the location of a recently produced response  Procedural memory was operationally defined as decreasing response times to predictable cues in the sequence  Working memory was reflected by accurate responses to the choice probes  Changing the sequence of required keypecks to a random sequence interfered with procedural memory in the form of slowed response times, but did not prevent pigeons from effectively using working memory to remember specific cue locations  Conversely, changing exposure duration of to a cue location influenced working memory but had no effect on procedural memory  Double dissociations such as this have supported the multiple systems approach to the study of memory in cognitive psychology and neuroscience, and they encourage a similar approach in comparative psychology","A new method was developed to concurrently investigate procedural memory and working memory in pigeons, finding that changing the sequence of required keypecks to a random sequence interfered with procedural memory, but did not prevent pigeons from effectively using working memory to remember specific cue locations."
"Let the pigeon drive the bus: pigeons can plan future routes in a room.","https://scispace.com/paper/let-the-pigeon-drive-the-bus-pigeons-can-plan-future-routes-1d8eg5aa4u","2012","Journal Article","Animal Cognition","Brett M. Gibson
Matthew Wilkinson
Debbie M. Kelly","10.1007/S10071-011-0463-9","","The task of determining an optimal route to several locations is called the traveling salesperson problem (TSP). The TSP has been used recently to examine spatial cognition in humans and non-human animals. It remains unclear whether or not the decision process of animals other than non-human primates utilizes rigid rule-based heuristics, or whether non-human animals are able to flexibly ‘plan’ future routes/behavior based on their knowledge of multiple locations. We presented pigeons in a One-way and Round-Trip group with TSPs that included two or three destinations (feeders) in a laboratory environment. The pigeons departed a start location, traveled to each feeder once before returning to a final destination. Pigeons weighed the proximity of the next location heavily, but appeared to plan ahead multiple steps when the travel costs for inefficient behavior appeared to increase. The results provide clear and strong evidence that animals other than primates are capable of planning sophisticated travel routes.","Pigeons weighed the proximity of the next location heavily, but appeared to plan ahead multiple steps when the travel costs for inefficient behavior appeared to increase, providing clear and strong evidence that animals other than primates are capable of planning sophisticated travel routes."
"Learning to Time (LET) or Scalar Expectancy Theory (SET)? A Critical Test of Two Models of Timing","https://scispace.com/paper/learning-to-time-let-or-scalar-expectancy-theory-set-a-ieclwoj81x","1999","Journal Article","Psychological Science","Armando Machado
Richard Keen","10.1111/1467-9280.00152","","Two theories of timing, scalar expectancy theory (SET) and learning to time (LeT), make substantially different assumptions about what animals learn in temporal tasks. In a test of these assumptions, pigeons learned two discriminations: On Type 1 trials, they learned to choose a red key after a 1-s signal and a green key after a 4-s signal; on Type 2 trials, they learned to choose a blue key after a 4-s signal and a yellow key after a 16-s signal. Then, two psychometric functions were obtained by presenting them with intermediate durations (1 to 4 s and 4 to 16 s). The two functions did not superpose, and most bisection points were not at the geometric mean of the training stimuli (contra SET); for most birds, the function for Type 2 trials was to the left of the function for Type 1 trials (contra LeT). Finally, the birds were exposed to signals ranging from 1 to 16 s and given a choice between novel key combinations (e.g., red vs. blue). The results with the novel key combinations were always closer to L...","In this paper, pigeons learned two discriminations: on Type 1 trials, they learned to choose a red key after a 1-s signal and a green key after 4-s signals; on Type 2 trials, the birds learned to choosing a blue key after an 4s signal, and a yellow key after 16 s signal."
"Transfer of physical understanding in a non-tool-using parrot.","https://scispace.com/paper/transfer-of-physical-understanding-in-a-non-tool-using-3ohhdo5jhi","2016","Journal Article","Animal Cognition","Jayden O. van Horik
Jayden O. van Horik
Nathan J. Emery","10.1007/S10071-016-1031-0","","Physical cognition has generally been assessed in tool-using species that possess a relatively large brain size, such as corvids and apes. Parrots, like corvids and apes, also have large relative brain sizes, yet although parrots rarely use tools in the wild, growing evidence suggests comparable performances on physical cognition tasks. It is, however, unclear whether success on such tasks is facilitated by previous experience and training procedures. We therefore investigated physical comprehension of object relationships in two non-tool-using species of captive neotropical parrots on a new means-end paradigm, the Trap-Gaps task, using unfamiliar materials and modified training procedures that precluded procedural cues. Red-shouldered macaws (Diopsittaca nobilis) and black-headed caiques (Pionites melanocephala) were presented with an initial task that required them to discriminate between pulling food trays through gaps while attending to the respective width of the gaps and size of the trays. Subjects were then presented with a novel, but functionally equivalent, transfer task. Six of eight birds solved the initial task through trial-and-error learning. Four of these six birds solved the transfer task, with one caique demonstrating spontaneous comprehension. These findings suggest that non-tool-using parrots may possess capacities for sophisticated physical cognition by generalising previously learned rules across novel problems.","It is suggested that non-tool-using parrots may possess capacities for sophisticated physical cognition by generalising previously learned rules across novel problems."
"Can Imitation in Pigeons be Explained by Local Enhancement Together with Trial-and-Error Learning?:","https://scispace.com/paper/can-imitation-in-pigeons-be-explained-by-local-enhancement-3v34jj93rj","1997","Journal Article","Psychological Science","Daren H. Kaiser
Thomas R. Zentall
Bennett G. Galef","10.1111/J.1467-9280.1997.TB00461.X","","Zentall Sutton and Sherburne (1996) reported that pigeons observing a conspecific demonstrator either step on or peck at a treadle to obtain food subsequently showed a significant tendency to manipulate the treadle as had their demonstrator Zentall et al suggested this finding showed observer pigeons had learned by imitation to peck at or step on the treadle However, the same result might have been obtained if pigeons had learned to step on the treadle by trial and error, and pigeons exposed to a treadle-pecking demonstrator had come to peck at the treadle as a result of nonimitative social-learning processes such as local enhancement or contagion Here we report the results for two control groups showing that pigeons do not learn to step on or peck at a treadle for food reward unless they observe a relevant demonstrator These results considerably strengthen the original conclusion Future research using the two action method to demonstrate imitative learning should include similar controls","The results for two control groups are reported showing that pigeons do not learn to step on or peck at a treadle for food reward unless they observe a relevant demonstrator."
"Corvids can decide if a future exchange is worth waiting for.","https://scispace.com/paper/corvids-can-decide-if-a-future-exchange-is-worth-waiting-for-42j5dmw82a","2012","Journal Article","Biology Letters","Valérie Dufour
Valérie Dufour
Claudia A. F. Wascher
Anna Braun
Rachael Miller
Thomas Bugnyar","10.1098/RSBL.2011.0726","","Evidence for time-dependent calculations about future rewards is scarce in non-human animals. In non-human primates, only great apes are comparable with humans. Still, some species wait for several minutes to obtain a better reward in delayed exchange tasks. Corvids have been shown to match with non-human primates in some time-related tasks. Here, we investigate a delay of gratification in two corvid species, the carrion crow (Corvus corone) and the common raven (Corvus corax), in an exchange task. Results show that corvids success decreases quickly as delay increases, with a maximal delay of up to 320 s (more than 5 min). The decision to wait rests both on the quality of the prospective reward and the time required to obtain it. Corvids also apply tactics (placing the reward on the ground or caching it) that probably alleviate costs of waiting and distract their attention during waiting. These findings contrast previous results on delayed gratification in birds and indicate that some species may perform comparably to primates.","Investigation of a delay of gratification in two corvid species, the carrion crow and the common raven, in an exchange task indicates that some species may perform comparably to primates and contrast previous results on delayed gratification in birds."
"Not bird-brained: Chickens use prior experience to solve novel timing problems","https://scispace.com/paper/not-bird-brained-chickens-use-prior-experience-to-solve-f9ssr14j","2023","Journal Article","PLOS ONE","Lisa Maree Wiles
Sarah Cowie
Lewis A. Bizo","10.1371/journal.pone.0282667","","Despite differences between bird and human brain anatomy, birds have recently demonstrated capacities thought to be uniquely human, including planning and problem-solving. Many avian demonstrations of ‘complex’ behaviors rely on species-specific behavior (e.g., caching, tool use), or use birds who have evolved largely in similarly undomesticated circumstances (e.g., pigeons). In the present experiment, we asked how a species domesticated thousands of years ago, chickens (Gallus gallus domesticus), used past experience to navigate novel problems in the double-bisection task. The double-bisection task which has been used extensively with pigeons, allowing a comparison of signatures of chicken and pigeon performance on the same task. Our findings revealed chickens, like pigeons, show flexible learning that is sensitive to the broader context in which events occur. Further, as with pigeons, our chickens’ patterns of performance could be divided into two distinct categories which may reflect differences in the specific behaviors in which organisms engage during a timing task. Our findings demonstrate remarkable similarity in how chickens and pigeons use past experience to navigate novel problems. Further, these findings add to a growing body of knowledge suggesting the simplest forms of learning common across species–operant and respondent conditioning–are more flexible than is typically assumed.","In this article , a double-bisection task was used to compare chicken and pigeon performance on the same task, and it was found that chicken showed flexible learning that is sensitive to the broader context in which events occur."
"When pigeons in motion lose sight of their food: behaviour on visible displacement tasks revisited","https://scispace.com/paper/when-pigeons-in-motion-lose-sight-of-their-food-behaviour-on-1gexqczoz1","2007","Journal Article","Canadian Journal of Zoology","C. Krachun
C. Krachun
C.M.S. Plowright
C.M.S. Plowright","10.1139/Z07-042","","In traditional visible displacement tasks, animals view an object as it is moved out of their sight, but either the object moves behind an occluder or an occluder moves in front of it. Here we present a more ecologically realistic visible displacement task for pigeons (Columba livia (Gmelin, 1789)) in which it was the animal that occluded the object, a food dish in this case, by virtue of its own motion. In a branched maze, pigeons had visual access to food, which they would lose from view as they moved through the maze. A within-subject design was used whereby the task was presented first in descending order of difficulty (i.e., decreasing memory load owing to the opening of (i) gaps and (ii) windows in the walls of the maze), and followed 10 months later by an ascending order. When the food was visible at all times through windows and gaps, pigeons would make turns in the maze that would bring them closer to the food (i.e., they chose the shortest route above chance levels). In general, they failed to d...","A more ecologically realistic visible displacement task for pigeons (Columba livia (Gmelin, 1789) in which it was the animal that occluded the object, a food dish in this case, by virtue of its own motion."
"Timing in Pigeons: Effects of the Similarity Between Intertrial Interval and Gap in a Timing Signal.","https://scispace.com/paper/timing-in-pigeons-effects-of-the-similarity-between-mmsjwj8voawl","","","","DH Kaiser
TR Zentall
E Neiman","10.1037//0097-7403.28.4.416","","Previous research suggests that when a fixed interval is interrupted (known as the gap procedure), pigeons tend to reset memory and start timing from 0 after the gap. However, because the ambient conditions of the gap typically have been the same as during the intertrial interval (ITI), ambiguity may have resulted. In the present experiment, the authors found that when ambient conditions during the gap were similar to the ITI, pigeons tended to reset memory, but when ambient conditions during the gap were different from the ITI, pigeons tended to stop timing, retain the duration of the stimulus in memory, and add to that time when the stimulus reappeared. Thus, when the gap was unambiguous, pigeons timed accurately.","Pigeons' timing behavior is influenced by the similarity between intertrial interval and gap conditions, with ambiguous gaps leading to memory reset and unambiguous gaps resulting in accurate timing and retention of stimulus duration."
"An experimental investigation of insight in","https://scispace.com/paper/an-experimental-investigation-of-insight-in-1v1peroevo","1995","","","Common Ravens
Corvus Corax","","","AISTRACT.--I presented four groups of Common Ravens (Corvus corax) with a problem that they had never encountered before. Could they demonstrate the solution to this problem without first practicing or learning the correct sequence of intermediary steps? The problem posed was the reaching of food suspended by a string. The solution required perching above the string and the food, reaching down, pulling up a loop of string, setting the looped-up string onto the perch, stepping onto the string, releasing the string with the bill while simultaneously applying pressure with the foot onto it, then reaching down again to repeat the cycle six to eight times in that precise order before finally securing a piece of dried meat. The results varied enormously between individuals. However, typically a bird approached the string nervously, pecked or briefly yanked on the string, repeated the approach when given another opportunity, extinguished the approach behavior, or suddenly did the entire string-pulling sequence correctly. One of the wild birds performed the entire sequence correctly on his first approach to the string, even though no other bird of that group had shown the behavior. After a bird had acquired the behavior it thereafter performed the behavior correctly without fail. Other behaviors were associated with successful string pull- ing. From their first trial, the four hand-reared individuals dropped the meat attached to string (and perch) if they were shooed from the perch. In contrast, other birds that were handed the food attached to string attempted to fly off with it, and it required five to nine trials before they refused to do so, apparently learning the consequences of this behavior. Other problems related to food presented on the dangling string also were solved without first overtly trying out the alternatives. These problems involved: (1) crossing the string with food with another string that held a rock; (2) using a novel string with food, next to the previously-rewarded ""old"" string; and (3) having food on string next to a rock on string, but with insertion of the string on the perch now displaced laterally. In contrast, the birds performed very poorly at some tasks where simple trial-and-error learning quickly would have resulted in appropriate responses. For example, three birds never once (in 79 trials) pulled the correct string in the crossed-strings experiments that another mustered with no trials. The results are discussed in terms of possible insight and alternative mechanisms, including innate behavior and learning. Received 22 June 1994, accepted 31 August 1994.","The authors presented four groups of Common Ravens (Corvus corax) with a problem that they had never encountered before: reaching of food suspended by a string, which required perching above the string and the food, reaching down, pulling up a loop of string, setting the looped-up string onto the perch, stepping onto the string, releasing the string with the bill while simultaneously applying pressure with the foot onto it, then reaching down again to repeat the cycle six to eight times in that precise order before finally securing a piece of dried meat."
"Memory in the pigeon: Proactive inhibition in a delayed matching task","https://scispace.com/paper/memory-in-the-pigeon-proactive-inhibition-in-a-delayed-3q13doa0bh","1973","Journal Article","Bulletin of the psychonomic society","Thomas R. Zentall
David E. Hogan","10.3758/BF03334212","","Proactive inhibition in a pigeon was studied, using a modified delayed matching-to-sample task. Proactive inhibition was defined as disruption in matching performance produced by the presentation of a stimulus prior to the sample stimulus (relative to control trials without prior stimulus presentation). In Experiment I, with a prior stimulus which was not presented as one of the comparison stimuli, temporary disruption in matching performance was found with a 5-sec delay between sample and comparison stimuli but not with a 0-sec delay. In Experiment II, with a prior stimulus which was later presented as the incorrect comparison stimulus, long-lasting disruption was found with a 5-sec delay, but again not with a 0-sec delay. Experiment III demonstrated a direct relation between the magnitude of proactive inhibition and length of the delay. These results offer some support for an interference theory of forgetting, but also suggest that it may not be the identity of the two stimuli but, rather, the order of the two stimuli which is lost.","It is suggested that interpolated stimulus presentation disrupts the memory trace for the sample stimulus when a novel wavelength or novel shape was interpolated between the sample and comparison stimuli."