"Paper Title","Paper Link","Publication Year","Publication Type","Publication Title","Author Names","DOI","PDF Link","Abstract","TL;DR"
"The Strategy-Specific Nature of Improvement: The Power Law Applies by Strategy Within Task","https://scispace.com/paper/the-strategy-specific-nature-of-improvement-the-power-law-5c1r2j21q9","1998","Journal Article","Psychological Science","Peter F. Delaney
Lynne M. Reder
James J. Staszewski
Frank E. Ritter","10.1111/1467-9280.00001","","If strategy shifts speed up performance, learning curves should show discontinuities where such shifts occur. Relatively smooth curves appear consistently in the literature, however. To explore this incongruity, we examined learning when multiple strategies were used. We plotted power law learning curves for aggregated data from four mental arithmetic experiments and then plotted similar curves separately for each participant and strategy. We then evaluated the fits achieved by each group of curves. In all four experiments, plotting separately by strategy produced significantly better fits to individual participants' data than did plotting a single power function. We conclude that improvement of solution time is better explained by practice on a strategy than by practice on a task, and that careful assessment of trial-by-trial changes in strategy can improve understanding of the effects of practice on learning.","In this article, the authors examined learning when multiple strategies were used, and concluded that improvement of solution time is better explained by practice on a strategy than by practice in a task, and that careful assessment of trial-by-trial changes in strategy can improve understanding of the effects of practice on learning."
"Time Scales, Difficulty/Skill Duality, and the Dynamics of Motor Learning","https://scispace.com/paper/time-scales-difficulty-skill-duality-and-the-dynamics-of-1t34g3qhby","2009","Book Chapter","Advances in Experimental Medicine and Biology","Karl M. Newell
Yeou Teh Liu
Gottfried Mayer-Kress","10.1007/978-0-387-77064-2_24","","In this chapter we elaborate on the dynamical basis for the time scales of change in motor learning. It is known that in both oscillatory and growth/ decay processes the exponential characterizes the time scales of change. A few characteristic or even multiple time scales can arise from continually evolving landscape dynamics due to bifurcations between attractor organization and the transient dynamics toward and away from fixed points. These principles are applied to the determination of the laws of learning and the related duality between the difficulty of the task and the skill of the learner.","In this chapter, the dynamical basis for the time scales of change in motor learning is elaborate and principles are applied to the determination of the laws of learning and the related duality between the difficulty of the task and the skill of the learner."
"Quotidian cognition and the human-nonhuman “divide”: Just more or less of a good thing?","https://scispace.com/paper/quotidian-cognition-and-the-human-nonhuman-divide-just-more-5av454dpmo","2008","Journal Article","Behavioral and Brain Sciences","Drew Rendall
John R. Vokey
Hugh Notman","10.1017/S0140525X08003701","","Abstract We make three points: (1) Overlooked studies of nonhuman communication originally inspired, but no longer support, the blinkered view of mental continuity that Penn et al. critique. (2) Communicative discontinuities between animals and humans might be rooted in social-cognitive discontinuities, reflecting a common lacuna in Penn et al.'s relational reinterpretation mechanism. (3) However, relational reinterpretation need not be a qualitatively new representational process.","Overlooked studies of nonhuman communication originally inspired, but no longer support, the blinkered view of mental continuity that Penn et al. critique, and relational reinterpretation need not be a qualitatively new representational process."
"Gene expression analysis reveals the tipping points during infant brain development for human and chimpanzee.","https://scispace.com/paper/gene-expression-analysis-reveals-the-tipping-points-during-3vjshtrp8r","2020","Journal Article","BMC Genomics","Hui Tang
Ying Tang
Tao Zeng
Luonan Chen","10.1186/S12864-020-6465-8","","Postpartum developmental delay has been proposed as an important phenotype of human evolution which contributes to many human-specific features including the increase in brain size and the advanced human-specific cognitive traits. However, the biological processes and molecular functions underlying early brain development still remain poorly understood, especially in human and primates. In this paper, we comparatively and extensively studied dorsolarteral prefrontal cortex expression data in human and chimpanzee to investigate the critical processes or biological events during early brain development at a molecular level. By using the dynamic network biomarker (DNB) model, we found that there are tipping points around 3 months and 1 month, which are crucial periods in infant human and chimpanzee brain development, respectively. In particular, we shown that the human postnatal development and the corresponding expression changes are delayed 3 times relative to chimpanzee, and we also revealed that many common biological processes are highly involved in those critical periods for both human and chimpanzee, e.g., physiological system development functions, nervous system development, organismal development and tissue morphology. These findings support that the maximal rates of brain growth will be in those two critical periods for respective human and primates. In addition, different from chimpanzee, our analytic results also showed that human can further develop a number of advanced behavior functions around this tipping point (around 3 months), such as the ability of learning and memory. This work not only provides biological insights into primate brain development at a molecular level but also opens a new way to study the criticality of nonlinear biological processes based on the observed omics data.","There are tipping points around 3 months and 1 month, which are crucial periods in infant human and chimpanzee brain development, respectively, and these findings support that the maximal rates of brain growth will be in those two critical periods for respective human and primates."
"Sensitive periods in cognitive development: a mutualistic perspective","https://scispace.com/paper/sensitive-periods-in-cognitive-development-a-mutualistic-562gu695nu","2020","Journal Article","Current opinion in behavioral sciences","Rogier A. Kievit","10.1016/J.COBEHA.2020.10.007","","The theory of mutualism posits that general cognitive ability emerges, at least in part, due to positive reciprocal interaction between distinct cognitive abilities during development. In other words, cognitive abilities at a given developmental time point govern the rate of growth in other cognitive abilities. Moreover, this emerging field of work finds that the strength as well as the nature of these interactions differs during developmental time: In other words, there are sensitive periods when small individual differences may have especially pronounced, long-lasting consequences for cognitive development. Here, I review the literature on mutualistic effects, and show how it can shed new light on sensitive periods. I do so by considering sensitive periods as periods where interactions between (cognitive) domains differ in strength and/or in kind.","The theory of mutualism as discussed by the authors posits that general cognitive ability emerges, at least in part, due to positive reciprocal interaction between distinct cognitive abilities during development, and that cognitive abilities at a given developmental time point govern the rate of growth in other cognitive abilities."
"Intermittent animal behavior: The adjustment-deployment dilemma","https://scispace.com/paper/intermittent-animal-behavior-the-adjustment-deployment-nr0gwup868","2014","Journal Article","Artificial Life","Miguel Aguilera
Manuel G. Bedia
Francisco J. Serón
Xabier E. Barandiaran","10.1162/ARTL_A_00133","","Intermittency is ubiquitous in animal behavior. We depict a coordination problem that is part of the more general structure of intermittent adaptation: the adjustment-deployment dilemma. It captures the intricate compromise between the time spent in adjusting a response and the time used to deploy it: The adjustment process improves fitness with time, but during deployment fitness of the solution decays as environmental conditions change. We provide a formal characterization of the dilemma, and solve it using computational methods. We find that the optimal solution always results in a high intermittency between adjustment and deployment around a non-maximal fitness value. Furthermore we show that this non-maximal fitness value is directly determined by the ratio between the exponential coefficient of the fitness increase during adjustment and that of its decay coefficient during deployment. We compare the model results with experimental data obtained from observation and measurement of intermittent behavior in animals. Among other phenomena, the model is able to predict the uneven distribution of average duration of search and motion phases found among various species such as fishes, birds, and lizards. Despite the complexity of the problem, it can be shown to be solved by relatively simple mechanisms. We find that a model of a single continuous-time recurrent neuron, with the same parametric configuration, is capable of solving the dilemma for a wide set of conditions. We finally hypothesize that many of the different patterns of intermittent behavior found in nature might respond to optimal solutions of complexified versions of the adjustment-deployment dilemma under different constraints.","It is hypothesize that many of the different patterns of intermittent behavior found in nature might respond to optimal solutions of complexified versions of the adjustment-deployment dilemma under different constraints."
"Exploring Human–AI Control Over Dynamic Transitions Between Individual and Collaborative Learning","https://scispace.com/paper/exploring-human-ai-control-over-dynamic-transitions-between-y3nor3v3sp","2020","Book Chapter","European Conference on Technology Enhanced Learning","Vanessa Echeverria
Kenneth Holstein
Jennifer Huang
Jonathan Sewall
Nikol Rummel
Vincent Aleven","10.1007/978-3-030-57717-9_17","","Dynamically transitioning between individual and collaborative learning activities during a class session (i.e., in an un-planned way, as-the-need-arises) has advantages for students, but existing orchestration tools are not designed to support such transitions. This work reports findings from a technology probe study that explored alternative designs for classroom co-orchestration support for dynamically transitioning between individual and collaborative learning, focused on how control over the transitions should be divided or shared among teachers, students, and orchestration system. This study involved 1) a pilot in an authentic classroom scenario with AI support for individual and collaborative learning; and 2) design workshops and interviews with students and teachers. Findings from the study suggest the need for hybrid control between students, teachers, and AI systems over transitions as well as for adaptivity and/or adaptability for different classrooms, teachers, and students’ prior knowledge. This study is the first to explore human–AI control over dynamic transitions between individual and collaborative learning in actual classrooms.","This study is the first to explore human–AI control over dynamic transitions between individual and collaborative learning in actual classrooms and suggests the need for hybrid control between students, teachers, and AI systems over transitions as well as for adaptivity and/or adaptability for different classrooms, Teachers, and students’ prior knowledge."
"Evolutionary transitions in learning and cognition","https://scispace.com/paper/evolutionary-transitions-in-learning-and-cognition-581o7n09g9","2021","Journal Article","Philosophical Transactions of the Royal Society B","Simona Ginsburg
Eva Jablonka
Eva Jablonka","10.1098/RSTB.2019.0766","","We define a cognitive system as a system that can learn, and adopt an evolutionary-transition-oriented framework for analysing different types of neural cognition This enables us to classify types of cognition and point to the continuities and discontinuities among them The framework we use for studying evolutionary transitions in learning capacities focuses on qualitative changes in the integration, storage and use of neurally processed information Although there are always grey areas around evolutionary transitions, we recognize five major neural transitions, the first two of which involve animals at the base of the phylogenetic tree: (i) the evolutionary transition from learning in non-neural animals to learning in the first neural animals; (ii) the transition to animals showing limited, elemental associative learning, entailing neural centralization and primary brain differentiation; (iii) the transition to animals capable of unlimited associative learning, which, on our account, constitutes sentience and entails hierarchical brain organization and dedicated memory and value networks; (iv) the transition to imaginative animals that can plan and learn through selection among virtual events; and (v) the transition to human symbol-based cognition and cultural learning The focus on learning provides a unifying framework for experimental and theoretical studies of cognition in the living world This article is part of the theme issue 'Basal cognition: multicellularity, neurons and the cognitive lens'","In this paper, the authors define a cognitive system as a system that can learn, and adopt an evolutionary-transition-oriented framework for analysing different types of neural cognition, which enables them to classify types of cognition and point to continuities and discontinuities among them."
"Mathematical model bridges disparate timescales of lifelong learning","https://scispace.com/paper/mathematical-model-bridges-disparate-timescales-of-lifelong-i993eyov","2022","Posted Content","","","10.48550/arxiv.2206.03954","","Lifelong learning occurs on timescales ranging from minutes to decades. People can lose themselves in a new skill, practicing for hours until exhausted. And they can pursue mastery over days or decades, perhaps abandoning old skills entirely to seek out new challenges. A full understanding of learning requires an account that integrates these timescales. Here, we present a minimal quantitative model that unifies the nested timescales of learning. Our dynamical model recovers classic accounts of skill acquisition, and describes how learning emerges from moment-to-moment dynamics of motivation, fatigue, and work, while also situated within longer-term dynamics of skill selection, mastery, and abandonment. We apply this model to explore the benefits and pitfalls of a variety of training regimes and to characterize individual differences in motivation and skill development. Our model connects previously disparate timescales -- and the subdisciplines that typically study each timescale in isolation -- to offer a unified account of the timecourse of skill acquisition. ","In this article , the authors present a model that unifies the nested timescales of learning and describes how learning emerges from moment-to-moment dynamics of motivation, fatigue and work, while also situated within longer-term dynamics of skill selection, mastery, and abandonment."
"A Reciprocal Model of Practice and Skill: Navigating Between Dropout and Expertise","https://scispace.com/paper/a-reciprocal-model-of-practice-and-skill-navigating-between-unnwg4p8rx7e","2025","Journal Article","","Pritam Laskar
Raoul P. P. P. Grasman
Maartje E. J. Raijmakers
Brenda R. J. Jansen
Ale Jan Homburg
Han L. J. van der Maas","10.31219/osf.io/gy7kh_v1","","Understanding the reciprocal relationship between practice and skill, or learning success, is essential for designing effective interventions to prevent dropout. Classical learning curves model the effect of practice on skill in the case of enforced learning, where dropout is not an option. However in many learning contexts, such as learning a new hobby or taking an online course, learners can, and often do, drop out. For this case, previous research in educational psychology has suggested a reciprocal relationship between motivation and practice, on the one hand, and achievement and skill, on the other. We provide a formal model of this relationship by integrating classical models of learning and forgetting into a model of the practice-success cycle. We show that in this Reciprocal-Practice-Success (RPS) model of learning, long-term learning outcomes are particularly sensitive to the shape of the learning curve - the risk of dropping out is much higher when the learning curves are sigmoid than when they are concave. Through bifurcation analysis of a simplified formulation of the model, we demonstrate how modifying the minimum practice rate and success sensitivity can mitigate attrition in cases where learning curves are sigmoid. In addition, we explore various mechanisms to shape the learning curve in a concave form, further reducing the risk of dropout. Finally, we present extensions that incorporate spacing effects and temporal discounting to describe learning dynamics in more realistic contexts. ","This study develops a Reciprocal-Practice-Success model to understand the relationship between practice, skill, and dropout in learning contexts, revealing that sigmoid learning curves increase dropout risk and proposes strategies to mitigate attrition through curve modification and spacing effects."
"On the generality and limits of abstraction in rats and humans","https://scispace.com/paper/on-the-generality-and-limits-of-abstraction-in-rats-and-2rpe2ljv5c","2010","Journal Article","Animal Cognition","Gonzalo P. Urcelay
Ralph R. Miller","10.1007/S10071-009-0295-Z","","In this review, we address the question, central to cognition, of whether nonhuman animals such as rats are capable of extracting and extending information from a given learning situation to a new learning situation without generalizing through a physical dimension of the stimuli. This capacity underlies abstraction, which is a hallmark of human cognition and necessary for complex information processing such as language acquisition. We selectively review recent experiments with rats in which systematic changes in information processing of new stimuli are observed after training with different stimuli. These results strongly suggest that this capacity is present in rats. We also review two articles in which clear limitations to this capacity are detected. We conclude that, within specified limits, rats are capable of using prior experience when faced with a learning situation that involves new stimuli. We interpret this ability as a rudimentary form of abstraction. In the face of these provocative results, new theories of learning should be designed to account for these findings.","It is concluded that, within specified limits, rats are capable of using prior experience when faced with a learning situation that involves new stimuli, and is interpreted as a rudimentary form of abstraction."
"The dynamic lift of developmental process","https://scispace.com/paper/the-dynamic-lift-of-developmental-process-4hdc0g7ztv","2007","Journal Article","Developmental Science","Linda B. Smith
Cynthia Breazeal","10.1111/J.1467-7687.2007.00565.X","","What are the essential properties of human intelligence, currently unparalleled in its power relative to other biological forms and relative to artificial forms of intelligence? We suggest that answering this question depends critically on understanding developmental process. This paper considers three principles potentially essential to building human-like intelligence: the heterogeneity of the component processes, the embedding of development in a social world, and developmental processes that change the cognitive system as a function of the history of soft-assemblies of these heterogeneous processes in specific tasks. The paper uses examples from human development and from developmental robotics to show how these processes also may underlie biological intelligence and enable us to generate more advanced forms of artificial intelligence.","Three principles potentially essential to building human-like intelligence are considered: the heterogeneity of the component processes, the embedding of development in a social world, and developmental processes that change the cognitive system as a function of the history of soft-assemblies of these heterogeneous processes in specific tasks."
"Need for speed: Short lifespan selects for increased learning ability","https://scispace.com/paper/need-for-speed-short-lifespan-selects-for-increased-learning-2y7wij1pcr","2019","Journal Article","Scientific Reports","Jannis Liedtke
Lutz Fromhage","10.1038/S41598-019-51652-5","","It is generally assumed that an investment into cognitive abilities and their associated cost is particularly beneficial for long-lived species, as a prolonged lifespan allows to recoup the initial investment. However, ephemeral organisms possess astonishing cognitive abilities too. Invertebrates, for example, are capable of simple associative learning, reversal learning, and planning. How can this discrepancy between theory and evidence be explained? Using a simulation, we show that short lives can actually select for an increase in learning abilities. The rationale behind this is that when learning is needed to exploit otherwise inaccessible resources, one needs to learn fast in order to utilize the resources when constrained by short lifespans. And thus, increased cognitive abilities may evolve, not despite short lifespan, but because of it.","Using a simulation, it is shown that short lives can actually select for an increase in learning abilities, and thus, increased cognitive abilities may evolve, not despite short lifespan, but because of it."
"Nonlinear pedagogy: Learning design for self-organizing neurobiological systems","https://scispace.com/paper/nonlinear-pedagogy-learning-design-for-self-organizing-4qy5xb6szb","2011","","","Jia Yi Chow
Keith Davids
Robert Hristovski
Duarte Araújo
Pedro Passos","","","In this paper, key concepts in ecological psychology and nonlinear dynamics exemplify how learning design can be shaped by ideas of self-organization, meta-stability and self-organized criticality in complex neurobiological systems. Through interactions with specific ecological constraints in learning environments, cognition, decision making and action emerge. An important design strategy is the use of different types of noise to channel the learning process into meta-stable regions of the “learner–learning environment” system to encourage adaptive behaviors. Here learners can be exposed to many functional and creative performance solutions during training. Data from studies in the performance context of sports are used to illustrate how these theoretical ideas can underpin learning design. Based on these insights a nonlinear pedagogy is proposed in which the role of coaches or trainers alters from a more traditional, prescriptive stance to the mode of manipulating key interacting task constraints including information, space and equipment to facilitate learning.","In this paper, a nonlinear pedagogy is proposed in which the role of coaches or trainers alters from a more traditional, prescriptive stance to the mode of manipulating key interacting task constraints including information, space and equipment to facilitate learning."
"Phases of Meaningful Learning","https://scispace.com/paper/phases-of-meaningful-learning-lqlvokxhxg","1990","Journal Article","Review of Educational Research","Thomas J. Shuell","10.3102/00346543060004531","","The research literature is examined for evidence suggesting that in complex, meaningful learning the learner passes through a series of stages or phases during which the learning process and the variables influencing it change systematically. After discussing various conceptual and methodological issues, phase theories in both simpler and more meaningful forms of learning are reviewed. Finally, the initial, intermediate, and terminal phases of learning are discussed. It is suggested that during the initial phase of learning the individual typically acquires isolated facts that are interpreted in terms of preexisting schemata and added to existing knowledge structures. Gradually, the learner begins to assemble these pieces into new schemata that provide him or her with more conceptual power until a level of automaticity is achieved.","In this article, it is suggested that during the initial phase of learning the individual typically acquires isolated facts that are interpreted in terms of preexisting schemata and added to existing knowledge structures."
