"Paper Title","Paper Link","Publication Year","Publication Type","Publication Title","Author Names","DOI","PDF Link","Abstract","TL;DR"
"Event-related potentials during word mapping to object shape predict toddlers’ vocabulary size","https://scispace.com/paper/event-related-potentials-during-word-mapping-to-object-shape-3tyca3o2h8","2015","Journal Article","Frontiers in Psychology","Kristina Borgström
Janne von Koss Torkildsen
Magnus Lindgren","10.3389/FPSYG.2015.00143","","What role does attention to different object properties play in early vocabulary development? This longitudinal study using event-related potentials in combination with behavioral measures investigated 20- and 24-month-olds’ (n = 38; n = 34; overlapping n = 24) ability to use object shape and object part information in word-object mapping. The N400 component was used to measure semantic priming by images containing shape or detail information. At 20 months, the N400 to words primed by object shape varied in topography and amplitude depending on vocabulary size, and these differences predicted productive vocabulary size at 24 months. At 24 months, when most of the children had vocabularies of several hundred words, the relation between vocabulary size and the N400 effect in a shape context was weaker. Detached object parts did not function as word primes regardless of age or vocabulary size, although the part-objects were identified behaviorally. The behavioral measure, however, also showed relatively poor recognition of the part-objects compared to the shape-objects. These three findings provide new support for the link between shape recognition and early vocabulary development.","New support is provided for the link between shape recognition and early vocabulary development and the behavioral measure showed relatively poor recognition of the part-objects compared to the shape-objects."
"Does language change how children think?","https://scispace.com/paper/does-language-change-how-children-think-ehc7lpsv","2022","Book Chapter","","Dr. Ismail Abbas","10.1093/oso/9780192866509.003.0003","","Abstract Whereas Piaget argued that young children often produce egocentric speech, ill-suited to being understood by listeners, Vygotsky argued that such speech reflected children’s growing tendency to deploy language for their own private and eventually silent thought. Language is also used by children not just for private and silent thought but for gathering information via appropriate questions. From around 30 months, children can ask several questions each minute—some questions are simple, factual questions about where things are and what they are called, but other questions are more demanding how and why questions. Having internalized language for private thought, does the particular language that gets internalized impact how children think? Whorf hypothesized such effects of language on thought. Supportive evidence has emerged from the study of number. Children who acquire a language with an open-ended and generative lexicon for number words conceive of number differently from children exposed to a restricted set of three or four number words. ","This article found that children who acquire a language with an open-ended and generative lexicon for number words conceive of number differently from children exposed to a restricted set of three or four number words."
"The Role of Cross-Situational Word Learning in Children'sVocabulary Acquisition: Theory, Behavior, and Mechanisms","https://scispace.com/paper/the-role-of-cross-situational-word-learning-in-children-3r7y6lz7jd","2012","","","Sumarga Suanda","","","Over the first 6 years of life, children are reported
to have amassed a vocabulary of about 14,000 words. What are the
processes that underlie such prolific learning? Based on a wealth
of evidence built up over the past 40 years, one process appears to
be fast mapping, children's ability to draw on a host of
referential cues to infer a word's meaning from a single exposure
to a new word. More recently, a growing body of evidence has
suggested that another process is cross-situational word learning,
word learners' ability to determine word meaning not within a
single encounter but across multiple encounters by tracking the
cross-situational consistency between words and their candidate
referents. Although the notion that children acquire their
vocabulary at least in part through cross-situational learning is
neither novel nor unintuitive, theoretical treatments and empirical
investigations into this learning process are scarce relative to
those of fast mapping. The overarching goal of the research
presented herein is to further investigate the nature of children's
cross-situational learning capacities and to better understand the
role of this type of learning in vocabulary acquisition. Two
behavioral experiments that examine 5- to 7-year-olds'
cross-situational word learning are reported. These experiments
constitute the first empirical investigations of school-aged
children's ability to acquire new word-to-referent mappings when
the only cues to reference are the cross-situational co-occurrence
statistics between words and their referents. These studies also
examine whether some of the behavioral signatures previously
observed in adults' cross-situational learning are also evident in
children's learning. Additionally, a series of computational
simulations that explore the candidate mechanisms underlying
children's cross-situational word learning are reported. Although
the results of these simulations do not provide a conclusive
mechanistic account of children's learning, they do specify some
conditions that readily account for the observed learning patterns
and accurately predict other empirical phenomena. Collectively, the
research presented here contributes to our understanding of the
various processes that make children's impressive word learning
possible.","The authors investigate the nature of children's cross-situational learning capacities and to better understand the role of this type of learning in vocabulary acquisition, using behavioral experiments with 5- to 7-year-olds."
"The Prevalence and the Weakness of an Early Name Mapping Preference.","https://scispace.com/paper/the-prevalence-and-the-weakness-of-an-early-name-mapping-1j6ubnf24z","1998","Journal Article","Journal of Child Language","Julie A. Evey
William E. Merriman","10.1017/S030500099700336X","","An empirical puzzle regarding toddlers' fast mapping motivated the current investigation. Whereas children between 1;10 and 2;1 have shown only a modest rate of mapping novel nouns onto unfamiliar rather than familiar objects, a very high rate has been observed in those between 1;4 and 1;8 (Mervis & Bertrand, 1991). Study 1 examined whether young two-year-olds (N = 40, mean age = 2;1) might map at a higher rate when tested with procedures unique to Mervis & Bertrand's assessment--strong corrective feedback rather than mild positive non-contingent feedback; large sets of test objects rather than pairs; presentation of easier tests first. Only the first variable affected performance in a manner that could solve the puzzle. Unfamiliar kinds were selected at a much higher rate under corrective (0.86) than non-contingent (0.57) feedback. Although nearly every child in the non-contingent group chose correctly on the first trial, many failed to do so thereafter. In Study 2, rather than presenting a test word to the children (N = 16, mean age = 2;2), the experimenter merely asked for 'the one I want'. Unfamiliar kinds were selected much less often than in Study 1, suggesting that at least one lexical principle proposed in the literature underlies the noun mapping preference. Changes over trials in the two studies indicated that the noun mapping preference is quite prevalent, but unless initial choices are strongly reinforced, an increase in the salience of familiar kinds after the first trial lures some children into error. Consistent with this analysis, toddlers in Study 3 (N = 24, mean age = 2:1) who received non-contingent strong acceptance for their noun mapping decisions, selected unfamiliar kinds more often than those who had received non-contingent mild acceptance in Study 1.","Changes over trials in the two studies indicated that the noun mapping preference is quite prevalent, but unless initial choices are strongly reinforced, an increase in the salience of familiar kinds after the first trial lures some children into error."
"Vocabulary and Executive Functioning: A Scoping Review of the Unidirectional and Bidirectional Associations across Early Childhood","https://scispace.com/paper/vocabulary-and-executive-functioning-a-scoping-review-of-the-1tm2ndir","2022","Journal Article","Human Development","Madeleine Bruce
Martha Ann Bell","10.1159/000524964","","Early childhood marks a time where word learning is accompanied by rapid growth in the cognitive processes that underlie self-modulated and goal-directed behavior (i.e., executive functions). Although there is empirical evidence to support the association between executive functioning and vocabulary in childhood, inconsistent findings have been reported regarding the extent to which early executive functioning abilities predict later vocabulary outcomes and vice versa. To clarify the nature of the longitudinal relation between these two processes and to examine what, if any, claims can be made about their interdependence, a critical review of the literature was conducted. Also addressed are the conceptual and/or methodological differences that exist across studies conducted on this topic that may be contributing to some of the discrepancies reported in the longitudinal literature. Finally, this review provides practical and empirically informed future directions to serve as a resource for early childhood researchers advancing this area of study.","Early childhood marks a time where word learning is accompanied by rapid growth in the cognitive processes that underlie self-modulated and goal-directed behavior (i.e., executive functions) as discussed by the authors ."
"Bursty, irregular speech input to preschoolers predicts vocabulary size","https://scispace.com/paper/bursty-irregular-speech-input-to-preschoolers-predicts-3darc9qdgv","2024","Preprint","","Margaret Cychosz
Rachel Romeo
Jan Edwards
Rochelle S. Newman","10.31234/osf.io/6x3d7","","Children learn language by listening to speech from caregivers around them. However, the type and quantity of speech input that children are exposed to changes throughout early childhood in ways that are poorly understood due to the small samples (few participants, limited hours of observation) typically available in developmental psychology. Here we used child-centered audio recorders to unobtrusively measure speech input in the home to 292 children, aged 2-7 years, over 555 distinct days (approximately 8,600 total hours of observation, or 29.62 hours/child). These large timescales allowed us to compare how different dimensions of child-directed speech input (quantity, burstiness) varied throughout early childhood. We then evaluated the relationship between each dimension of input and children's concurrent receptive vocabulary size. We found that the burstiness of speech input (spikes of words) was a stronger correlate with age than the quantity of speech input. Input burstiness was also a stronger predictor than input quantity for children's vocabulary size: children who heard spiky, more intense bouts of input had larger vocabularies. Overall, these results reaffirm the importance of speech input in the home for children's language development, and support exposure-consolidation models of early language development. ","Bursty speech input is a stronger predictor of vocabulary size than quantity of speech input in preschoolers."
"Snapshots of Children's Changing Biases During Language Development: Differential Weighting of Perceptual and Linguistic Factors Predicts Noun Age of Acquisition","https://scispace.com/paper/snapshots-of-children-s-changing-biases-during-language-2kanl743l2","2013","Journal Article","Journal of Cognition and Development","Christopher H. Ramey
Evangelia G. Chrysikou
Jamie Reilly","10.1080/15248372.2012.689386","","Word learning is a lifelong activity constrained by cognitive biases that people possess at particular points in development. Age of acquisition (AoA) is a psycholinguistic variable that may prove useful toward gauging the relative weighting of different phonological, semantic, and morphological factors at different phases of language acquisition and development. Our aim here was to evaluate AoA as a statistical tool for taking “snapshots” of cognitive development. We examined a large corpus of English nouns (n = 1,381) with AoA as the outcome variable in three separate multivariate regressions, encompassing different age ranges (early–middle–late). Predictors included perceptual (e.g., imagery), phonological (e.g., phonological neighborhood density), and lexical (e.g., word length) factors. Different combinations of predictors accounted for significant proportions of the variance for different AoA ranges (i.e., early–middle–late). For example, imageability and frequency are stronger predictors of early r...","This paper examined a large corpus of English nouns (n = 1,381) with AoA as the outcome variable in three separate multivariate regressions, encompassing different age ranges (early-middle-late)."
"Phonology, Semantics, and the Comprehension-Expression Gap in Emerging Lexicons.","https://scispace.com/paper/phonology-semantics-and-the-comprehension-expression-gap-in-2klo99bwpy","2019","Journal Article","Journal of Speech Language and Hearing Research","Stephanie F. Stokes
Elise de Bree
Annemarie Kerkhoff
Mohammad Momenian
Tania S. Zamuner","10.1044/2019_JSLHR-19-00177","","Purpose Children come to understand many words by the end of their 1st year of life, and yet, generally by 12 months, only a few words are said. In this study, we investigated which linguistic fact...","Phonological neighborhood density and WF were independently and significantly associated with whether or not a known word would be in children's spoken lexicons, but semantic neighborhood density was not and individual differences in the impact of WF on the probability that known words would be said."
"Lexical processing of nouns and verbs at 36 months of age predicts concurrent and later vocabulary and school readiness.","https://scispace.com/paper/lexical-processing-of-nouns-and-verbs-at-36-months-of-age-1l82ta2nea","2020","Journal Article","Journal of Cognition and Development","Ashley Koenig
Ashley Koenig
Sudha Arunachalam
Kimberly J. Saudino","10.1080/15248372.2020.1802277","","Children's lexical processing speed at 18 to 25 months of age has been linked to concurrent and later language abilities. In the current study, we extend this finding to children aged 36 months. Children (N = 126) participated in a lexical processing task in which they viewed two static images on noun trials (e.g., an ear of corn and a hat), or two dynamic video clips on verb trials (e.g., a woman stretching and the same woman clapping), and heard an auditory prompt labeling one of them (e.g., ""Where is she stretching?""). They also participated in standard assessments of language and school readiness. The results indicated that lexical processing speed (i.e., how long they required to look to the labeled image or scene) was associated with measures of concurrent receptive vocabulary, as well as receptive vocabulary and school readiness two years later, although the associations are weaker than for younger children.","Children’s lexical processing speed was associated with measures of concurrent receptive vocabulary, as well as receptive vocabulary and school readiness two years later, although the associations are weaker than for younger children."
"Relative Language Exposure, Processing Efficiency and Vocabulary in Spanish-English Bilingual Toddlers.","https://scispace.com/paper/relative-language-exposure-processing-efficiency-and-23kouk64f6","2014","Journal Article","Bilingualism: Language and Cognition","Nereyda Hurtado
Theres Grüter
Virginia A. Marchman
Anne Fernald","10.1017/S136672891300014X","","Research with monolingual children has shown that early efficiency in real-time word recognition predicts later language and cognitive outcomes. In parallel research with young bilingual children, processing ability and vocabulary size are closely related within each language, although not across the two languages. For children in dual-language environments, one source of variation in patterns of language learning is differences in the degree to which they are exposed to each of their languages. In a longitudinal study of Spanish/English bilingual children observed at 30 and 36 months, we asked whether the relative amount of exposure to Spanish vs. English in daily interactions predicts children's relative efficiency in real-time language processing in each language. Moreover, to what extent does early exposure and speed of lexical comprehension predict later expressive and receptive vocabulary outcomes in Spanish vs. English? Results suggest that processing skill and language experience each promote vocabulary development, but also that experience with a particular language provides opportunities for practice in real-time comprehension in that language, sharpening processing skills that are critical for learning.","This article found that the relative amount of exposure to Spanish vs. English in daily interactions predicts children's relative efficiency in real-time language processing in each language, and that early exposure and speed of lexical comprehension predict later expressive and receptive vocabulary outcomes in Spanish and English."
"FAST-TRACK REPORT Speed of word recognition and vocabulary knowledge in infancy predict cognitive and language outcomes in later childhood","https://scispace.com/paper/fast-track-report-speed-of-word-recognition-and-vocabulary-26zajqojoa","2008","","","Virginia A. Marchman
Anne Fernald","","","The nature of predictive relations between early language and later cognitive function is a fundamental question in research on human cognition. In a longitudinal study assessing speed of language processing in infancy, Fernald, Perfors and Marchman (2006) found that reaction time at 25 months was strongly related to lexical and grammatical development over the second year. In this follow-up study, children originally tested as infants were assessed at 8 years on standardized tests of language, cognition, and working memory. Speed of spoken word recognition and vocabulary size at 25 months each accounted for unique variance in linguistic and cognitive skills at 8 years, effects that were attributable to strong relations between both infancy measures and working memory. These findings suggest that processing speed and early language skills are fundamental to intellectual functioning, and that language development is guided by learning and representational principles shared across cognitive and linguistic domains.","Findings suggest that processing speed and early language skills are fundamental to intellectual functioning, and that language development is guided by learning and representational principles shared across cognitive and linguistic domains."
"Fast Mapping in Late-Talking Toddlers.","https://scispace.com/paper/fast-mapping-in-late-talking-toddlers-3mheexqn9s","2013","Journal Article","Applied Psycholinguistics","Susan Ellis Weismer
Courtney E. Venker
Julia L. Evans
Maura Jones Moyle","10.1017/S0142716411000610","","This study investigated fast mapping in late-talking (LT) toddlers and toddlers with normal language (NL) development matched on age, nonverbal cognition, and maternal education. The fast-mapping task included novel object labels and familiar words. The LT group scored significantly lower than the NL group on novel word comprehension and production, as well as familiar word production. For both groups, fast-mapping performance was associated with concurrent language ability and later language outcomes. A post hoc analysis of phonotactic probability (PP) and neighborhood density (ND) suggested that the majority of NL toddlers displayed optimal learning of the nonword with low PP/ND. The LT group did not display the same sensitivity to PP/ND characteristics as the NL group.","For both groups, fast-mapping performance was associated with concurrent language ability and later language outcomes, and a post hoc analysis of phonotactic probability and neighborhood density suggested that the majority of NL toddlers displayed optimal learning of the nonword with low PP/ND."
"Lexico-semantic structure in vocabulary and its links to lexical processing in toddlerhood and language outcomes at age three.","https://scispace.com/paper/lexico-semantic-structure-in-vocabulary-and-its-links-to-qru96479","2022","Journal Article","Developmental Psychology","Arielle Borovsky","10.1037/dev0001291","","Toddlerhood is marked by advances in several lexico-semantic skills, including improvements in the size and structure of the lexicon and increased efficiency in lexical processing. This project seeks to delineate how early changes in vocabulary size and vocabulary structure support lexical processing (Experiment 1), and how these three skills together (vocabulary size, structure, and lexical processing) relate to later language outcomes at age 3 (Experiment 2). Experiment 1 explored how the size and semantic structure of toddlers' vocabulary from 18 to 24 months (N = 61) predicted performance on two lexical processing tasks (semantically related and semantically unrelated trials). Denser semantic connectivity (i.e., global level connectivity between near and far neighbors) positively associated with semantic interference during semantically related lexical processing, whereas denser category structure (i.e., lower-level connectivity between near neighbors) facilitated lexical processing in semantically unrelated trials. In Experiment 2, a subset of the same children (N = 49) returned at age 36 months and completed a comprehensive assessment of their language skills using the Clinical Evaluation of Language Fundamental, Preschool 2 (CELF-P2). Here, earlier measures of lexico-semantic connectivity and lexical processing best predicted age 3 language skill. The findings support accounts that early vocabulary structure and lexical processing skills promote continued growth in language. (PsycInfo Database Record (c) 2022 APA, all rights reserved).","The authors explored how early changes in vocabulary size and vocabulary structure support lexical processing, and how these three skills together (vocabulary size, structure, and lexical processes) relate to later language outcomes at age 3."
"Fast Mapping but Poor Retention by 24-Month-Old Infants","https://scispace.com/paper/fast-mapping-but-poor-retention-by-24-month-old-infants-3pa2sm4j07","2008","Journal Article","Infancy","Jessica S. Horst
Larissa K. Samuelson","10.1080/15250000701795598","","Four experiments explored the processes that bridge between referent selection and word learning. Twenty-four-month-old infants were presented with several novel names during a referent selection task that included both familiar and novel objects and tested for retention after a 5-min delay. The 5-min delay ensured that word learning was based on retrieval from long-term memory. Moreover, the relative familiarity of objects used during the retention test was explicitly controlled. Across experiments, infants were excellent at referent selection, but very poor at retention. Although the highly controlled retention test was clearly challenging, infants were able to demonstrate retention of the first 4 novel names presented in the session when referent selection was augmented with ostensive naming. These results suggest that fast mapping is robust for reference selection but might be more transient than previously reported for lexical retention. The relations between reference selection and retention are discussed in terms of competitive processes on 2 timescales: competition among objects on individual referent selection trials and competition among multiple novel name–object mappings made across an experimental session.","The results suggest that fast mapping is robust for reference selection but might be more transient than previously reported for lexical retention, and competitive processes on 2 timescales: competition among objects on individual referent selection trials and competition among multiple novel name-object mappings made across an experimental session."
