"Paper Title","Paper Link","Publication Year","Publication Type","Publication Title","Author Names","DOI","PDF Link","Abstract","TL;DR"
"Spatial Cognition: From rats-research to multifunctional spatial assistance systems","https://scispace.com/paper/spatial-cognition-from-rats-research-to-multifunctional-7cso3ka00w","2003","Journal Article","Künstliche Intelligenz","Markus Knauff
Christoph Schlieder
Christian Freksa","","","In 1948, the psychologist Edward Tolman described experiments in which rats were trained to follow a path through a complex maze to reach a food box. After the rats performed perfectly (chose the shortest way to reach the goal), the trained path was blocked; the rats had to select another path from a variety of alternatives. Astonishingly, most of the rats found a path that was close to the most direct connection to the food box, whereas not a single rat erroneously tried to follow the original path on which they had been trained. On the basis of these findings, Tolman argued the rats had “acquired not merely a strip-map . . . but, rather, a wider comprehensive map to the effect that the food was located in such and such a direction in the room” (p. 204). Tolman’s paper, entitled “Cognitive maps in rats and men,” marked the starting point of psychological spatial cognition research. Today there is a great body of evidence on how humans (and animals) learn routes, find ways, navigate through familiar and unknown environments, and on the strategies they use when they get lost. Contemporary research on robotics and AI is concerned with similar problems. For example, how must a mobile robot system be designed to improve its efficiency for tasks such as route choice and navigation? Certainly, the robot must acquire an internal representation of the environment – a cognitive map – and apply adequate procedures to plan movements. A related problem exists in the domain of geoinformatics. A geographic information system must be able to efficiently store, process, and retrieve geo-referenced data, i.e. data which is associated with locations defined in a geographic reference system. On the other hand, it should also interact with the user in a comprehensible way, that is, it should take the user’s mental representations of spatial knowledge into account. Applications such as location-based services, geovisualization or semantic information retrieval lead to an especially close interaction between human and machine reasoning. In the last years, a growing number of researchers from AI and robotics have addressed cognitive questions. Psychologists have become sensitive to the computational properties of robot navigation or issues of reasoning with diagrams and qualitative spatial representations. Research in this rapidly evolving interdisciplinary enterprise has a name: Spatial Cognition Research. Spatial Cognition: From Rat-Research to Multifunctional Spatial Assistance Systems","There is a great body of evidence on how humans (and animals) learn routes, find ways, navigate through familiar and unknown environments, and on the strategies they use when they get lost, which marks the starting point of psychological spatial cognition research."
"Latent learning in a straight alley","https://scispace.com/paper/latent-learning-in-a-straight-alley-4hmuq8jnwy","1957","Journal Article","Psychological Reports","Herbert Barry
Frank A. Logan","10.2466/PR0.1957.3.G.88","","One form of latent learning study involves the introduction of reward following an initial series of nonrewarded trials. In a straight alley one may observe the rate at which speed increases following introduction of reward, and compare this change with that by a group shifted to a large reward after initial training with a small reward. Accordingly, 2 groups of 11 rats were run down a 4' straight alley one trial per day. One group received 2 food pellets reward; the other group was detained 30 sec. without food in the goal box. After 57 trials of this first stage, performance of the 2 groups had stabilized. Thereupon the second stage was begun in which all Ss received 12 pellets. The performance of both groups changed significantly during the 22 trials of the second stage, from 2.76 to 3.04 ft./sec. for the 2-pellet group and from 1.32 to 2.72 ft./sec. for the 0pellet group. Performance was reasonably stable by the end of the second stage, and the groups did not differ significantly.","Performance was reasonably stable by the end of the second stage, and the groups did not differ significantly, while the rate at which speed increases following introduction of reward in a straight alley was observed."
"Problem solving in the rat: Piecemeal acquisition of cognitive maps","https://scispace.com/paper/problem-solving-in-the-rat-piecemeal-acquisition-of-42rz2fe8c6","1984","Journal Article","Animal Learning & Behavior","Paul Ellen
B. J. Soteres
Charlene Wages","10.3758/BF03213147","","The purpose of this experiment was to compare the problem-solving performance of rats allowed to explore either one or two tables of Maier’s three-table-problem apparatus on successive days. The feeding experience and test trial were administered on the day after all tables and runways had been explored in this piecemeal fashion. No rat that explored only one table and runway per day was able to solve the problem, whereas 60% of the rats that explored two tables and their interconnecting runways did solve the problem. All rats that explored the entire apparatus on each exploratory day were able to solve the problem. These data support the notion that animals can conceptually link objects experienced successively into cognitive representations which specify the constant relationships existing between those objects. The existence of such an absolute spatial mechanism makes it unnecessary for an organism to depend upon relative spatial mechanisms such as routes or cues.","In this paper, the authors compare the problem-solving performance of rats allowed to explore either one or two tables of Maier's three-table-problem apparatus on successive days."
"The cognitive map must be a separate module","https://scispace.com/paper/the-cognitive-map-must-be-a-separate-module-rxhu498fvo","1982","Journal Article","Behavioral and Brain Sciences","Benjamin Kuipers","10.1017/S0140525X00014023","","We argue that a map is meaningless unless we have a process for using it. Thus, in this paper, we not only offer the world graph as a representation of relationships among situations the animal has encountered and may encounter again, but we also offer algorithms for how the information encoded in the world graph may be used by the animal in determining its behavior. Each node of the graph encodes a recognizable situation in the animal's world, but a given place may well be encoded in a number of different nodes. Nodes not only require algorithms for the recognition of the situation; they store information about drive reduction associated with the encoded situation. We note that the use of graphs as a basis for exploring some search space is well known in artificial intelligence (AI), but we stress the importance of the animal's exploration of its environment for growing the graph, as distinct from the mathematically described potential nodes frequent in AI search spaces. To explore a number of hypotheses about the way information in the world graph is used to guide the animal's movement, we recall a number of classical experiments on maze exploration by animals, and use them to argue for the nonlocal hypothesis (selection of a path does not depend only upon information about the immediate environment of the animal) and the competing nodes hypothesis (more than one drive may enter into the determination of the animal's behavior at any time). An important feature of the model is that it yields exploration and latent learning without the introduction of an exploratory drive. We also note that the performance exhibited by the model appears to be statedependent when the animal operates under high drive levels. The drive-interaction matrix is offered as a subject for future research. We complement the presentation of the world graph model, its drive dynamics, and how these are constrained by experiments on maze behavior, with a brief analysis of maps in the brain. We distinguish egocentric maps which we relate to the many visual systems from allocentric maps. We offer a somewhat unconventional view of short-term and long-term memory. We examine cooperative computation in somatotopically organized networks, relating this to visually guided behavior in the frog, and to the interaction of colliculus and cortex in the control of eye movements. We examine, but do not advocate, the hypothesis that the hippocampus is a cognitive map. We do stress that if it is a cognitive map, it must be seen as a chart of the local neighborhood, rather than the whole atlas; and we note that the cognitive map hypothesis would lead one to expect the region to exhibit activation of place cells before the animal leaves the previous place.",""
"Can Animals Think?","https://scispace.com/paper/can-animals-think-2rn7ozwenj","2023","Book Chapter","","Magnus Enquist
Stefano Ghirlanda
Johan Lind","10.23943/princeton/9780691240770.003.0007","","This chapter considers the evidence of animal learning for more sophisticated mental mechanisms, particularly mechanisms that would qualify as thinking, insight, or mental problem solving. It defines thinking as a recombination of causal information gathered from different experiences that echoes common uses of insight, mental problem solving, and related terms. It also examines predictions drawn from the definition of thinking and challenges in testing such predictions. The chapter explains that predictions concern the extent to which animals can change their behavior upon receiving new information, whether they gather causal information of no immediate value, and whether animals engage in both fast and slow decision making. It cites experiments that have been put forward as evidence for recombination of information beyond chaining. ","The chapter explores the evidence of animal learning for sophisticated mental mechanisms, particularly thinking, insight, and problem solving. It defines thinking as a recombination of causal information and examines predictions drawn from this definition."
"A mechanistic account of transferring structural knowledge across cognitive maps","https://scispace.com/paper/a-mechanistic-account-of-transferring-structural-knowledge-5b1mj0ylv8","2019","Proceedings Article","","Shirley Mark
Rani Moran
Thomas Parr
Steve W. Kennerley
Timothy E.J. Behrens","10.32470/CCN.2019.1324-0","","Animals can transfer knowledge that was learnt previously and infer when this knowledge is relevant. Frequently, the relations between elements in an environment or task follow hidden underlying structure. We suggest that animals represent these underlying structures using abstract basis sets that are generalized over particularities of the current environment, such as its stimuli and size. We show that this type of representation allows inference of important task states, correct behavioural policy and the existence of unobserved routes. We further conducted two experiments in which participants learned three maps during two successive days and asked how the structural knowledge that was acquire during the first day affect participants behaviour during the second day. In line with our model, we show that participants who have a correct structural prior are able to infer the existence of unobserved routes and are able to infer appropriate behavioural policy. Therefore supporting the idea that abstract structural knowledge can be acquired and generalised across different cognitive maps.","It is shown that participants who have a correct structural prior are able to infer the existence of unobserved routes and are ableto infer appropriate behavioural policy, supporting the idea that abstract structural knowledge can be acquired and generalised across different cognitive maps."
"Maps, space, and places","https://scispace.com/paper/maps-space-and-places-k42qm384sq","1982","Journal Article","Behavioral and Brain Sciences","Roger M. Downs","10.1017/S0140525X00013972","","We argue that a map is meaningless unless we have a process for using it. Thus, in this paper, we not only offer the world graph as a representation of relationships among situations the animal has encountered and may encounter again, but we also offer algorithms for how the information encoded in the world graph may be used by the animal in determining its behavior. Each node of the graph encodes a recognizable situation in the animal's world, but a given place may well be encoded in a number of different nodes. Nodes not only require algorithms for the recognition of the situation; they store information about drive reduction associated with the encoded situation. We note that the use of graphs as a basis for exploring some search space is well known in artificial intelligence (AI), but we stress the importance of the animal's exploration of its environment for growing the graph, as distinct from the mathematically described potential nodes frequent in AI search spaces. To explore a number of hypotheses about the way information in the world graph is used to guide the animal's movement, we recall a number of classical experiments on maze exploration by animals, and use them to argue for the nonlocal hypothesis (selection of a path does not depend only upon information about the immediate environment of the animal) and the competing nodes hypothesis (more than one drive may enter into the determination of the animal's behavior at any time). An important feature of the model is that it yields exploration and latent learning without the introduction of an exploratory drive. We also note that the performance exhibited by the model appears to be statedependent when the animal operates under high drive levels. The drive-interaction matrix is offered as a subject for future research. We complement the presentation of the world graph model, its drive dynamics, and how these are constrained by experiments on maze behavior, with a brief analysis of maps in the brain. We distinguish egocentric maps which we relate to the many visual systems from allocentric maps. We offer a somewhat unconventional view of short-term and long-term memory. We examine cooperative computation in somatotopically organized networks, relating this to visually guided behavior in the frog, and to the interaction of colliculus and cortex in the control of eye movements. We examine, but do not advocate, the hypothesis that the hippocampus is a cognitive map. We do stress that if it is a cognitive map, it must be seen as a chart of the local neighborhood, rather than the whole atlas; and we note that the cognitive map hypothesis would lead one to expect the region to exhibit activation of place cells before the animal leaves the previous place.",""