"Paper Title","Paper Link","Publication Year","Publication Type","Publication Title","Author Names","DOI","PDF Link","Abstract","TL;DR"
"A Statistical Model of Developmental Changes in Early Word Learning","https://scispace.com/paper/a-statistical-model-of-developmental-changes-in-early-word-kcvs5s313p","2005","","","Weixia Huang
Chen Yu","","https://scispace.com/pdf/a-statistical-model-of-developmental-changes-in-early-word-kcvs5s313p.pdf","A Statistical Model of Developmental Changes in Early Word Learning Chen Yu (chenyu@indiana.edu) Weixia Huang (whuang@xeroxlabs.com) Department of Psychology and Program in Cognitive Science Indiana University Bloomington, IN 47405 USA Abstract Young language learners are able to map a word onto its ref- erent from an infinite number of possible word-to-world map- pings at early stage and further this learning ability turns to be much more effective at the later stage. What mechanisms underlie behavioral changes during word learning? This pa- per presents a developmental model of statistical associations, suggesting that as far as human minds are equipped with gen- eral associative learning mechanisms, ambiguity in the word- learning situation can be significantly reduced by recruiting cu- mulative lexical knowledge in statistical computations. Conse- quently, this leads to increasingly fast subsequent learning and abrupt behavioral changes, such as the vocabulary spurt and fast mapping. We provide a formal account of this argument by developing a computational model fed with the data col- lected from a series of picture-book reading sessions to sim- ulate word acquisition in natural contexts. The results show that previously learned lexical knowledge can not only nar- row the search space but also bootstrap the subsequent learn- ing process, which greatly improves learning results without the change of the underlying learning mechanism. Hence, this work suggests that using lexical knowledge accumulated in subsequent statistical learning is a scaffold for vocabulary growth in early language acquisition. 1. Introduction From scratch, young children need to solve many complex learning problems in early word acquisition, such as speech segmentation to discover word units, conceptual learning to identify the meanings (prelinguisitic concepts) of words, and then word-to-world mapping to associate words with mean- ings. Gleitman, Cassidy, Nappa, Papafragou, and Trueswell (2005) argued that among these tasks, a considerable part of the bottleneck for young language learners resides in the tools for solving the word-to-world mapping problem – how to map a phonological form to a conceptual representation. A com- mon conjecture is that children map sounds to meanings by seeing an object while hearing an auditory word-form. The most popular mechanism of this word learning process is as- sociationism. Richards and Goldfarb (1986) proposed that children come to know the meaning of a word through re- peatedly associating the verbal label with their experience at the time that the label is used. Smith (2000) argued that word learning is initially a process in which children’s attention is captured by objects or actions that are the most salient in their environment, and then they associate it with some acoustic pattern spoken by an adult. However, the associative approach has been criticized on the grounds that it does not provide a clear explanation about how infants map a word to a potential infinity of referents when the word is heard, which is termed reference uncer- tainty by Quine (1960). Quine presented the following puz- zle to theorists of lexical learning: Imagine that you are a stranger in a strange land with no knowledge of the language or customs. A native says ”Gavagai” while pointing at a rab- Xerox Corp. 800 Philips Road Webster, NY 14580 USA bit in the distance. How can you determine the intended ref- erent? Quine offered this puzzle as an example of the inde- terminacy of translation. Given any word-event pairing, there are, in fact, an infinite number of possible intended meanings – ranging from the rabbit as a whole, to its color, fur, parts, or activity. One explanation termed “cross-situational learn- ing” has been proposed by many theorists, such as Pinker (1989) and Gleitman (1990). The idea is that when a child hears a word, she can hypothesize all the potential meanings for that word from the non-linguistic context of the utterance containing that word. Upon hearing that word in several dif- ferent utterances, each of which is in a different context, she can intersect the corresponding sets to find those meanings which are consistent across the different occurrences of that word. Presumably, hearing words in enough different situa- tions would enable the child to rule out all incorrect hypothe- ses and uniquely determine word meanings. In light of this and with recent empirical evidence demonstrating that chil- dren and even infants, possess powerful statistical learning capacities (Saffran, Newport, & Aslin, 1996), Yu and Bal- lard (2004a) (see also Yu, Ballard, & Aslin, in press) devel- oped a computational model of how young language learners perform statistical computations on cross-situational observa- tions, which is reviewed in Section 3. Based on our previous work, this paper attempts to apply the statistical learning mechanism to interpret developmen- tal changes in word learning. Specifically, we investigate whether the associative learning mechanism can account for discontinuities in behaviors during the second year of life, such as the vocabulary spurt and fast mapping (see Section 2). These phenomena has attracted much attention in the field of cognitive development since they are difficult to ex- plain in terms of simple and transparent causes, and pose theoretical challenges that require sophisticated and highly- constrained learning principles. Nonetheless, complementary studies in connectionist modeling (e.g. Elman et al., 1996; see a good review in Regier, 2003) suggest that abrupt internal changes may not be needed to produce discontinuous external changes in behaviors. These works show that some factors, such as limited memory at the starting point of learning (El- man et al., 1996), nonlinearity of neural networks (Plunkett, Sinha, Miller, & Strandsby, 1992), and gradual emergence of attention to some aspects of the world (Regier et al., 2001), may contribute to nonlinear behaviors of human learning. In light of this, the present paper suggests another possible ex- planation of discontinuous behaviors in early word learning – the performance of the same learning mechanism can signif- icantly improve by storing lexical knowledge previously ex- posed and then recruiting it in subsequent learning. This idea may seem obvious and it is certainly consistent with many formal theories of learning. However, the main contribution of this paper is to propose and implement such a learning","Yu et al. as mentioned in this paper presented a developmental model of statistical associations, suggesting that ambiguity in the word learning situation can be significantly reduced by recruiting a cumulative lexical knowledge in statistical computations."
"Different Classes of Words Are Learned in Different Ways","https://scispace.com/paper/different-classes-of-words-are-learned-in-different-ways-4n0ppyc1xr","2009","","","Shohei Hidaka","","https://scispace.com/pdf/different-classes-of-words-are-learned-in-different-ways-4n0ppyc1xr.pdf","Different Classes of Words Are Learned in Different Ways Shohei Hidaka (shhidaka@indiana.edu) Department of Psychology and Brain Sciences 1101 E. Tenth Street, Bloomington, IN 47405-7007 USA Abstract What determines vocabulary growth patterns? The research presented here examines the growth pattern of words listed in the McArthur-Bates Communicative Development Inventory using a computational model. Our model characterizes vocabulary growth curves based on the sampling of learning relevant events and a threshold (the number of such events needed) for acquisition of the word. Using this general class of models, fits of vocabulary growth curves suggests a transition from one in which acquisition is primarily limited by the threshold for acquisition to one in which acquisition is primarily limited by sampling speed. Further analyses suggest that these parameters of the learning model link to meaningful psychological factors: specifically the acquisition of threshold limited (and earlier learned) words are correlated with frequency whereas sampling-speed-limited words are correlated with imageability of the word in the input. Keywords: Vocabulary Growth; Age of Acquisition; Statistical Analysis. What predicts vocabulary growth patterns? In the first years of life, children begin to comprehend and produce words. Between 8 and 16 months of age, children’s receptive vocabularies nearly double in size every two months (Dale & Fenson, 1996). From 12 to 24 months, their expressive vocabularies follow a similar path of productive growth. It has been estimated that between 18-months and 18-years of age children acquire approximately ten new words per day, or one new word every hour and a half the child is awake (Bloom, 2000). The words a child learns in this time period include nouns, verbs, determiners, preposition, however, nouns are acquired at a faster rate than other word classes. What processes underlie this efficient learning pattern? Traditionally the growth pattern was described in terms of a sudden acceleration proposed to occur when children are 18-month-old or their number of acquired words reaches 50 words. This idea of a vocabulary spurt suggests a unitary change the sudden realization that things have names (Reznick & Goldfield, 1992), the onset of categorization abilities (Gopnik &Meltzoff, 1987), or the acquisition of word learning constraints (Mervis & Bertrand, 1994). More recent accounts conceptualize the process in terms of a single or set of self-accelerating processes (van Geert, 1998). This view recognizes the fact that the age of acquisition (AoA) of any word will depend on a variety of factors: frequency, word length, phonological similarity, semantic similarity, lexical density, familiarity, imageability, and etc. Moreover, these variables tend to be correlated to each other. For example, more frequent words tend to be more familiar in general and to appear in more diverse contexts. All this makes the prediction of the age of acquisition of any single word complicated indeed. Also patterns of acquisition are subject to show considerable individual differences, which makes sense in many factors that are characteristic of individual experiences matter (see Bates, Dale, & Thal, 1995). One way to get a handle on all this is to consider vocabulary growth from a population perspective – populations of words with various properties in the learning environment and populations of children learning those words. This is the approach taken here. We examine the growth patterns of the proportion of children in large normative studies reported to “know” a word as an index of the properties of words and learners that make for earlier and later acquisition. Our approach is based on the following ideas: (1) many complexly related psychological variables relevant to age of acquisition (2) generalization of growth patterns from individual children to population level patterns and vice versa requires an integration of these relevant factors via a learning process to outcome (AoA). Considering only the correlation between relevant factors in the input (e.g., frequency, diversity, concreteness) and output (AoA) is not enough to describe a coherent picture of word learning. Thus, the larger goal of this work is to specify the triplet, not a dyad, the relation among the properties of words, the learning process, and AoA. Here we present initial results that build on recent findings by Goodman et al. (2008) of nonlinear effects of frequency on AoA, a result which clearly suggests the complexity of the processes that determine the AoA of any word. It’s Complicated There is general agreement that no simple psychological variable can account for the entire range of vocabulary growth. Although several studies show the some part of vocabulary growth seems strongly related to the input frequency of the words, the effect of frequency on vocabulary growth itself is also not simple. Goodman et al. (2008) analyzed the frequency effect on vocabulary growth in different classes of words and found that the AoA of words in the MCDI have a complicated correlational structure to frequency of words. Across the entire corpus of early learned words, there is a very small correlation between AoA and the frequency of the word in child directed speech. However, their analyses also suggest that","Hidaka et al. as discussed by the authors examined the growth pattern of words listed in the McArthur-Bates Communicative Development Inventory using a computational model and found that the acquisition of threshold limited (and earlier learned) words is correlated with frequency whereas sampling-speed limited words are correlated with imageability of the word in the input."
"Exploring Word Learning in a High-Density Longitudinal Corpus","https://scispace.com/paper/exploring-word-learning-in-a-high-density-longitudinal-24q83xdtai","2009","","","Brandon Roy
Michael C. Frank
Deb Roy","","https://scispace.com/pdf/exploring-word-learning-in-a-high-density-longitudinal-24q83xdtai.pdf","Exploring Word Learning in a High-Density Longitudinal Corpus Brandon C. Roy (bcroy@media.mit.edu) Michael C. Frank (mcfrank@mit.edu) The Media Laboratory Massachusetts Institute of Technology Department of Brain and Cognitive Sciences Massachusetts Institute of Technology Deb Roy (dkroy@media.mit.edu) The Media Laboratory Massachusetts Institute of Technology Abstract What is the role of the linguistic environment in children’s early word learning? Here we provide a preliminary analy- sis of one child’s linguistic development, using a portion of the high-density longitudinal data collected for the Human Speechome Project. We focus particularly on the develop- ment of the child’s productive vocabulary from the age of 9 to 24 months and the relationship between the child’s language development and the caregivers’ speech. We find significant correlations between input frequencies and age of acquisition for individual words. In addition, caregivers’ utterance length, type-token ratio, and proportion of single-word utterances all show significant temporal relationships with the child’s devel- opment, suggesting that caregivers “tune” their utterances to the linguistic ability of the child. Keywords: Language acquisition; word learning; corpus data Language Development and the Environment What is the role of the linguistic environment in a child’s ac- quisition of language? In attempts to understand the nature of the mechanisms underlying language acquisition, input- uptake correlations have the potential to provide deep insight. If particular aspects of children’s input are predictive of their later language development, such findings could powerfully illuminate the nature of children’s language learning strate- gies and mechanisms and the relationship of linguistic knowl- edge and experience. Systematic studies of child-directed speech (CDS) dating back to the late 1960’s have established that CDS has special characteristics including shorter utterance lengths, exagger- ated prosody, high redundancy, and referential content tied to immediate context (Snow & Ferguson, 1977). Initial in- vestigations of the facilitative role of CDS focused primarily on development of syntax. Early findings were contradictory, however, and the overall picture remains mixed (Newport et al., 1977; Furrow et al., 1979; Pine, 1995). More recent stud- ies of the role of the environment on lexical development proved to be clearer. For example, studies have shown that the total amount of CDS predicts children’s vocabulary size and rate of growth (Huttenlocher et al., 1991; Hart & Risley, 1995) and the frequency of specific words within CDS pre- dicts the age of acquisition of those words (Huttenlocher et al., 1991; Goodman et al., 2008). Despite the quantity of work in this area, however, our overall understanding of the role of the environment in lan- guage development remains limited by the lack of appropriate observational data. Historically, most longitudinal studies of language development have relied on observations from just two or a few points in time, leading to difficulties in construct- ing a complete picture of the continuous developmental pro- cess. Driven by new technologies, the methodological land- scape is now changing. Higher density longitudinal studies are emerging that provide valuable new perspectives on long- standing questions. For example, by analyzing 90-120 minute audio recordings of children’s home environments every two weeks from 9-15 months of age, Brent & Siskind (2001) shed new light on the role of words spoken in isolation by show- ing that their presence in CDS predicted age of acquisition of those words. More recently, Lieven et al. (in press) recorded 28-30 hours of audio over a 6-week period in the homes of four toddlers yielding 100,000+ word corpora of CDS and speech by children from each home. These data were used to trace the relationship between a child’s utterances over time in support of a constructivist theory of grammar development. Motivated by the goal of obtaining a more complete and naturalistic longitudinal record of child development—and establishing new tools and methods for replicating such ef- forts in the future—the Human Speechome Project (HSP) was launched with the aim of recording the first two to three years of one child’s development at home in rich detail (Roy et al., 2006). This paper provides an overview of the HSP project and corpus, and the human-machine collaborative process for audio analysis. We then present an initial anal- ysis on a subset of the audio portion of this corpus focusing on CDS and lexical development. The Human Speechome Project The goal of HSP is to study early language development through analysis of audio and video recordings of the first two to three years of one child’s life. The home of the fam- ily of one of the authors (DR) with a newborn was outfitted with fourteen microphones and eleven omnidirectional cam- eras. Audio was recorded from ceiling mounted boundary layer microphones at 16 bit resolution with a sampling rate of 48 KHz. Due to the unique acoustic properties of boundary layer microphones, most speech throughout the house includ- ing very quiet speech was captured with sufficient clarity to enable reliable transcription. Video was also recorded to cap- ture non-linguistic context using high resolution fisheye lens video cameras that provide a bird’s-eye view of people, ob- jects, and activity throughout the home. Recordings were made from birth to the child’s third birth- day with the highest density of recordings focused on the first","Roy et al. as discussed by the authors found significant correlations between input frequencies and age of acquisition for individual words, and caregivers' utterance length, type-token ratio, and proportion of single-word utterances all show significant temporal relationships with the child's devel- opment, suggesting that caregivers tune their utterances to the linguistic ability of the child."
"Patterns of Interaction in the Lexical Growth in Two Languages of Bilingual Infants and Toddlers","https://scispace.com/paper/patterns-of-interaction-in-the-lexical-growth-in-two-550fbf2mii","1994","Journal Article","Language Learning","Barbara Zurer Pearson
Sylvia C. Fernández","10.1111/J.1467-1770.1994.TB00633.X","https://scispace.com/pdf/patterns-of-interaction-in-the-lexical-growth-in-two-550fbf2mii.pdf","We investigated the extent to which bilingual children follow the same patterns and timetable of lexical development as monolinguals. For a group of 20 simultaneous bilingual (English-Spanish) infants, ages 10 to 30 months, we looked at the patterns of growth in one language in relation to growth in the other and also with respect to growth in both languages combined. The MacArthur Communicative Development Inventories (CDI), standardized parent report forms in Spanish and English, provided measures of lexical growth in two languages at varying intervals within the age range. We plotted the two single-language measures, as well as Total and Total Conceptual language measures, across time, referenced on a second γ-axis to the percent of the child's language environment that each language represented. For a subset of the children, we calculated the percentages of general nominals, social words, and verbs for each language to allow the characterization of the children's learning strategies as “referential” or “expressive” (Nelson, 1973). The rate and pace of development were similar to patterns observed in monolinguals. In addition, the vocabulary spurt was seen to occur in about the same percentage of children as has been observed in groups of monolingual children. The bilinguals differed from one another with respect to the relative independence of one language from the other, including the use of different learning strategies in the two languages by the same child.","This article investigated the extent to which bilingual children follow the same patterns and timetable of lexical development as monolinguals, and found that the rate and pace of development were similar to patterns observed in monolinguistic children."
"Early lexical development: the contribution of parental labelling and infants' categorization abilities.","https://scispace.com/paper/early-lexical-development-the-contribution-of-parental-19gtg8iv1g","1995","Journal Article","Journal of Child Language","Diane Poulin-Dubois
Susan A. Graham
Lorrie K. Sippola","10.1017/S0305000900009818","","In the present longitudinal study, we examined changes in parental labelling and infants' categorization skills as potential predictors of vocabulary composition, the age of the naming explosion, and the acquisition of subordinate labels. Sixteen French- and English-speaking parent-child dyads were videotaped during a 20-minute free-play session every month beginning when the child was 1;0 and ending at 2;0. The children received object-manipulation tasks every three months and their vocabulary growth was recorded. Parental labelling practices were assessed monthly using a picture-book reading task. Both parental labelling and children's categorization skills predicted the content of children's lexicon, with children with more names in their vocabulary having better categorization skills. Furthermore, the naming explosion was found to coincide with improvement of categorization skills. These findings suggest that the influence of each factor varies as a function of the stage and aspect of lexical development considered.","It is suggested that the influence of each factor varies as a function of the stage and aspect of lexical development considered, with children with more names in their vocabulary having better categorization skills."
"Early lexical development: A corpus-based study of three languages","https://scispace.com/paper/early-lexical-development-a-corpus-based-study-of-three-3j45teuibt","2008","","","Shuxia Liu
Xiaowei Zhao
Ping Li","","https://blclab.org/wp-content/uploads/2013/02/pp291_liu.pdf","In this study, we present a crosslinguistic analysis of early lexical development in English, Mandarin and Cantonese based on large-scale child-adult interaction transcripts in the CHILDES database. We examined patterns of lexical composition for several lexical categories (nouns, verbs, and adjectives) in children and their caregivers’ vocabularies across eight different age groups from 13 to 60 months. A series of statistical methods were applied to analyze the developmental trajectories of lexical diversity of children’s speech. Our study overcomes several major methodological limitations of previous studies, and provides a clear and detailed picture of the similarities and differences in lexical development patterns: (1) in all three languages, children’s early language development shows increasing diversity as a function of time, and the child lexicon becomes more similar to that of their parents over time; and (2) language-specific differences in the linguistic input have strong influence on children’s language output, which is reflected in the varying percentages of nouns, verbs, and adjectives in the child’s productive lexicon at different developmental stages.","The authors examined patterns of lexical composition for several lexical categories (nouns, verbs, and adjectives) in children and their caregivers' vocabularies across eight different age groups from 13 to 60 months."
