"Paper Title","Paper Link","Publication Year","Publication Type","Publication Title","Author Names","DOI","PDF Link","Abstract","Relevant Excerpt"
"The Pace of Vocabulary Growth Helps Predict Later Vocabulary Skill","https://scispace.com/paper/the-pace-of-vocabulary-growth-helps-predict-later-vocabulary-1a3lmqpej0","2012","Journal Article","Child Development","Meredith L. Rowe
Stephen W. Raudenbush
Susan Goldin-Meadow","10.1111/J.1467-8624.2011.01710.X","https://scispace.com/pdf/the-pace-of-vocabulary-growth-helps-predict-later-vocabulary-1a3lmqpej0.pdf","Children vary widely in the rate at which they acquire words—some start slow and speed up, others start fast and continue at a steady pace. Do early developmental variations of this sort help predict vocabulary skill just prior to kindergarten entry? This longitudinal study starts by examining important predictors (socioeconomic status [SES], parent input, child gesture) of vocabulary growth between 14 and 46 months (n = 62) and then uses growth estimates to predict children’s vocabulary at 54 months. Velocity and acceleration in vocabulary development at 30 months predicted later vocabulary, particularly for children from low-SES backgrounds. Understanding the pace of early vocabulary growth thus improves our ability to predict school readiness and may help identify children at risk for starting behind.","level and was achieved when coders agreed on 95% of transcription decisions. Procedure: The children were again visited in the home prior to kindergarten entry (age 54 months) and were given a receptive vocabulary assessment as described in the next section. Measures:
 Vocabulary skill prior to kindergarten entry. At 54 months, children were administered the PPVT-III  at home. The PPVT is a widely used measure of receptive vocabulary. In this task, children hear a word and are asked to point to the picture (of four options) that matches the word they heard. We were able to obtain PPVT scores for 55 of the 62 children at age 54 months. Thus, the regression analysis predicting PPVT is based on a sample of 55 children, as we chose not to impute data for our outcome measure. There were no differences between the children with PPVT scores (n = 55) and the children without PPVT scores (n = 7) on SES, parent input, or child gesture measures. The mean standardized score for the sample was 112 (SD = 18.3). Measures:
 Vocabulary growth during early childhood. Children's vocabulary growth across the nine sessions from 14 to 46 months was measured as their cumulative word types over time. Automated analyses of the transcripts yielded data on the number of different word types (i.e., number of different intelligible word roots) produced by each child at each session. Several decisions were made as to what constituted a word type. Morphologically inflected variants of words (e.g., run, running) were considered a single type. Words produced in imitation of the mother were included in the corpus of child word types, as were words that the parent or child produced while reading. The number of cumulative word types produced at each age served as our measure of vocabulary growth. That is, if a child said a specific word at age 14 months (i.e., cat), the child was given credit for producing cat from that point on, whether the word was produced again or not. This method of measuring vocabulary growth has been used previously in longitudinal analyses  and provides less noisy estimates of growth over time. As in most longitudinal studies, families occasionally missed a data collection period. The sample of 62 families visited over nine time points resulted in 558 possible visits of which only eight were missing. Thus, less than 2% of the visits were missed. Because we measured cumulative vocabulary, we imputed values of the ''new word types added'' for the missing sessions using regression equations from the full sample at the missing age, with age and agesquared as predictors. The imputed value for the missing session was then added to the child's previous cumulative word types to generate the new cumulative word type value for that child. We did not impute values if the missing data point was the final session(s) for that child. In those cases, we left the data as missing and only used the child's data up until that point in the growth models. Measures:
 Overall, only 1.4% of the vocabulary growth data were imputed."
"The birth of a word","https://scispace.com/paper/the-birth-of-a-word-1wo0jv8mbw","2013","Dissertation","","Deb Roy
Brandon Roy","","https://scispace.com/pdf/the-birth-of-a-word-1wo0jv8mbw.pdf","A hallmark of a child's first two years of life is their entry into language, from first productive word use around 12 months of age to the emergence of combinatorial speech in their second year. What is the nature of early language development and how is it shaped by everyday experience? 
This work builds from the ground up to study early word learning, characterizing vocabulary growth and its relation to the child's environment. Our study is guided"" by the idea that the natural activities and social structures of daily life provide helpful learning constraints. We study this through analysis of the largest-ever corpus of one child's everyday experience at home. Through the Human Speechome Project, the home of a family with a young child was outfitted with a custom audio-video recording system, capturing more than 200,000 hours of audio and video of daily life from birth to age three. The annotated subset of this data spans the child's 9-24 month age range and contains more than 8 million words of transcribed speech, constituting a detailed record of both the child's input and linguistic development. 
Such a comprehensive, naturalistic dataset presents new research opportunities but also requires new analysis approaches—questions must be operationalized to leverage the full scale of the data. We begin with the task of speech 'transcription, then identify ""word births""—the child's first use of each word in his vocabulary. Vocabulary growth accelerates and then shows a surprising deceleration that coincides with an increase in combinatorial speech. The vocabulary growth timeline provides a means to 888eB8 the environmental contributions to word learning, beginning with aspects of caregiver input speech. But language is tied to everyday activity, and we investigate how spatial and activity contexts relate to word learning. Activity contexts, such as ""mealtime"", are identified manually and with probabilistic methods that can scale to large datasets. These new nonlinguistic variables are predictive of when words are learned and are complementary to more traditionally studied linguistic measures. Characterizing word learning and assessing natural input variables can lead to new insights on fundamental learning mechanisms. (Copies available exclusively from MIT Libraries, libraries.mit.edu/docs - [email protected])","Corpus, as in other case studies based on transcript data, assessing receptive vocabulary is particularly challenging. Our emphasis is the child's productive word use, using similar criteria to (Dromi, 1987) when transcribing words in child speech. Chapter 3: Efficient Transcription of the Speechome Corpus:
 We coin the term ""word birth"" to refer to the first (consistent) production of a word by the child; the sequence of word births describes both the child's productive vocabulary as well as the timeline of growth. The notion of a word birth also suggests that words are not simply acquired, but rather have a gestation period prior to their first use. Characterizing a word's gestation period is the subject of subsequent chapters. But first, detecting true word births in the sea of transcript data presents a significant challenge in its own right. Simply choosing the subset of transcripts attributed to the child and identifying the first use of each word leads to many spurious word births, since automatic speaker ID is imperfect and even human generated transcripts and speaker annotations are error prone. For example, a single adult utterance mislabeled as child speech (perhaps due to the child crying while the adult is speaking) could falsely attribute multiple words to the child's productive lexicon if using this method. Instead, we present a series of statistical inference approaches to identify likely first word productions. These all incorporate, in some fashion, the false positive rate of the speaker ID in modeling child token counts. The best method models observations as arising from pre-and post-word birth regimes. Yet despite the efficacy of this approach, it is still crucial to our later analyses to have a high quality word birth timeline. Toward this end, a word birth annotation tool was developed in Java and several annotators checked (and revised) word births by hand. Chapter 3: Efficient Transcription of the Speechome Corpus:
 The resultant vocabulary growth rate curve had a striking ""shark's fin"" shape -a period of accelerating growth up to 18 months of age, followed by a precipitous drop in the number new word births per month. Although there has been much discussion of vocabulary growth accelerating (e.g. , there is less discussion of decreasing growth rates.  presents a similar growth rate curve and argues for a change in learning strategy;  sees a different growth trajectory in her subject, while  point out that averaging different growth functions may obscure non-monotonic behavior. How shall we interpret the vocabulary growth curve? This chapter closes by exploring two ideas. We explore and ultimately reject a null model in which the observed curve results from an interaction between a steady or increasing ""true"" vocabulary and the decreased chance of observing any particular word as vocabulary size increases. The second exploration seems more promising, revealing that the number of new word combinations shows a marked increase just as vocabulary growth slows down. Combined with other results on the child's average utterance length over time , this points toward a change in production style and complexity. The dynamics of vocabulary growth are complex and part of a larger developmental story, but how do basic external factors contribute to learning a word? Chapter 3: Efficient Transcription of the Speechome Corpus:
 Chapter 5: Environmental Contributions to Word Learning"
"Differences in Two Sisters' Acquisition of First Verbs.","https://scispace.com/paper/differences-in-two-sisters-acquisition-of-first-verbs-4b4ax88nbn","1993","","","Susan R. Braunwald","","https://scispace.com/pdf/differences-in-two-sisters-acquisition-of-first-verbs-4b4ax88nbn.pdf","","summarizes the design of the systematic data analyses based on coding portions of the diary data with SALT 1. SALT analyses.: These analyses provide a comparable but delimited sample from the diaries of J's and L's early use of verbs. SALT analyses.:
 The use of the SALT word root lists was modified to make them more sensitive to the development of meaning: 1) Homonyms were counted as separate words (i.e. turn in ""my turn"" and in ""turn on""), 2) variants of the same word with different meanings were counted as separate words (i.e. no to cDnvey denial and no-no to indicate forbidden objects or actions) and 3) variants in the form of a word with the same meaning were counted as a single word (i.e. SALT analyses.:
 dada and daddy for father). SALT analyses.:
 If  rules are followed MLU is a measure of the child's general level of language acquisition. Given the criterion for entering data into the diaries, MLU is not a measure of ordinary language use. MLU was calculated from 50 or more diary entries and represents a best performance or the zenith of the girls' language production. RESULTS:
 As Tables  illustrate, the SALT analyses reveal asynchronous pattern of verb acquisition for J and an asynchronous pattern for L. RESULTS:
 Table  The form, meaning and relational function of J's verbs emerged simultaneously between 19 to 20 months of age. Her first 50 verb utterances contained 23 verbs. RESULTS:
 Eighty-three percent (19/23) of these verbs were also new to her lexicon, and there were no errors in word order. Her first SVO sentences occurred within 4 days of her first word combinations with verbs. RESULTS:
 In contrast, the integration of the form, meaning and function of verbs for occurred as part of a gradual and incremental process of change in her language production. Her first 50 utterances with verbs contained 3 verb-like lexemes, cry at 16.8, bark at 16.18 and go at 16.19. L did not seem to know the referential meaning or grammatical function of these verbs at this time. RESULTS:
 There is an almost 3 month decalage between L's first production of the verblike lexeme, cry and the production of her first SVO sentence at 19.2. Verbs constituted 19% of her total cumulative lexicon prior to the production of her first SVO sentence, and word order was problematic for her. RESULTS:
 In sum, the data on L illustrate an initially asynchronous pattern of verb acquisition in which form > referential meaning > combinatorial function in her expressive language. DISCUSSION:
 The results of this study predict that there will be individual difference in children's acquisition of verbs that co-vary with their chronological age and their general approach to language ac.,uisition. The SALT analyses confirm that there were individual differences between the girls in their initial acquisition of verbs. DISCUSSION:
 The similarity in the quantitative SALT descriptions of their performance at 24 months fails to indicate that there were still important qualitative differences between J and L in the Important similarity in spite of large difference between J and L in the size of their vocabulaies. Time Three:
 2.1 Last 50 utterances with a verb prior to 24 months."
"Learning Strategies in Two Danish Children's Language Development.","https://scispace.com/paper/learning-strategies-in-two-danish-children-s-language-1us16owudr","1985","","","Kim Plunkett","","https://scispace.com/pdf/learning-strategies-in-two-danish-children-s-language-1us16owudr.pdf","A longitudinal investigation of two Danish children's linguistic and cognitive development during their second year is described. A summary of their Mean Length of Utterances (MLU), Vocabulary Scores and performance on the Uzgiris-Hunt infancy assessment scales is presented. The results reveal a pattern of individual differences that can be accommodated within a framework that identifies the use of analytic and holistic strategies as complementary approaches to the process of language learning. The consequences of this theoretical framework for the interpretation of MLU and Vocabulary Scores are discussed.","coenitive/referen-x4allanalytic mode of language functioning selectv, vocabulary items that can be supported adequately by stage 6 (transition). Of course, any final conclusion regarding this hypothesis awaits a more detailed analysis of the two children's word usage. Comparison of Language and Cognitive Measures.:
 One final aspect of the language data for our two children warrants further discussion, namely the regression in vocabulary scores after the initial spurt of accelerated growth. The regressions seem to pro- longed (21 months for Anne and 11 months for Jens) to.'be explained away as random pertubations in the data. Furthermore, MLU measures for both children show substantial increases during these periods of reeression. Comparison of Language and Cognitive Measures.:
 It is not unreasonable to suppose that these two developments, increase in MLU and reduction in vocabulary, might be related. The discovery that objects, events and relations can be named makes possible the linguiltic expression of semantic relations holding between entities and events in the environment. Thus, McShane (1070 has noted that vocabulary explosions are often closely associated with the emergence of two-word utterances. This would account for the eeneral positive correlation between vocabulary scores and MIX. We might cen-ceive the reductions in vocabulary scores as a result of the sharing of cognitive resources between the two processes of vocabulary growth and syntactic development, i.e. MLU advances at the expense of vocabulary growth. A limited vocabulary of salient words may be selected by the child as the foundation for exploring the combinatorial possibilities of its linguistic system. Comparison of Language and Cognitive Measures.:
 It is interesting to note that a strategy of this kind during a period of restricted vocabulary usage would give rise to the kind of distributional phenomena described by the pivot-open grammarians writing during the sixties (Braine. Comparison of Language and Cognitive Measures.:
 1.901. These grammars were written mostly for children in the initial period of the so-called two-word stage. The period of restricted vocabulary usage for our own two children also coincides with their early attempts to combine individual morphemes. CONCLUSION:
 It is a current trend kn child language research to account for individual differences in language acquisition in terms of the application of different strategies to the learning process. CONCLUSION:
 In the present account, I have attempted to use the distinction between analytic and holistic processing strategies to explain a variety of similarities and differences between the two children investigated. The postulation of these two strategies is, of course. a hypothetical business: We have no independent evidence that identifies the children as having a preferred strategy. CONCLUSION:
 We have seen how this theoretical framework forces us to question the surface validity of some of the objective measures used in language development research. CONCLUSION:
 For example, the interpretation of a child's MLU is seen to be dependent upon the particular language processing strategy the child is using. Nevertheless, the MLU profile itself can yield clues as to the strategy being applied. In this con - text, regressions can be especially informative (cf."
"The concurrent and predictive validity of the IGDI-ECI for toddlers with communication delays","https://scispace.com/paper/the-concurrent-and-predictive-validity-of-the-igdi-eci-for-4qj6hb1l3r","2012","","","Mollie Friedman","","https://scispace.com/pdf/the-concurrent-and-predictive-validity-of-the-igdi-eci-for-4qj6hb1l3r.pdf","","deceleration rate (γ 20 = -0.00128; p<.001) for gesture use over time in children with and without IFSPs. Figure depicts predicted growth based on the current analysis and based upon the data from . Results:
 Vocalization Development. To characterize vocalization development over time, we began by fitting a linear growth model with random error terms. See Table  for a list of parameters and Figure  for individual growth trajectories. The equation for the growth model is as follows: Results:
 Data indicated that children are predicted to use 3.5 vocalizations per minute at 36 months (p<.001). The linear growth term for TIME was not significant (γ 10 =0.011; p=0.7) in this model. Results:
 Next, an acceleration term (TIME 2 ) was added to determine whether or not there was a curvilinear growth pattern in vocalization development. Previous studies describe an increasing then decreasing rate of vocalizations after the onset of single words, so an acceleration term was added into the model . Results:
 In this model, γ 00 , or the mean rate of vocalizations per minute at 36 months was 3.39 (p<.001). Results:
 There was significant between subjects variability on the rate of vocalizations at 36 months (u 0 =2.48; χ2=114.5; p<.001). The coefficient for the acceleration term (γ 20 ) was significant (p=.034) and revealed a slightly negative decrease in rate vocalization use over time at a rate of -0.003 vocalizations per minute per month. There was significant between subject variability on the slope (u 1 =.013; p<.001), but not on the acceleration rate, so β 2j was left as a fixed effect.  also reported a decrease in vocalization rates a function of time. Results:
 The mean intercept for rate of vocalizations for the IFSP cohort was 2.47 per minute at 36 months. The predicted slope for TIME in this sample was -0.13 vocalizations per minute per month (p<.001) and the deceleration rate was -0.0064 (p<.001). Figure  depicts predicted growth in vocalizations based on the current analysis compared to . Results:
 Single Word Use. We began to model single word use over time by running an unconditional model with TIME as a level 1 predictor. See Table  for a list of model parameters and Figure  for a graph displaying individual child growth trajectories. The equation is as follows:"
"Model Fit and Interpretation of Non-Linear Latent Growth Curve Models","https://scispace.com/paper/model-fit-and-interpretation-of-non-linear-latent-growth-2mj5uixwoa","2007","","","Greg William Welch","","https://scispace.com/pdf/model-fit-and-interpretation-of-non-linear-latent-growth-2mj5uixwoa.pdf","This dissertation investigated the use of various techniques in modeling non-linear change in the context of latent growth modeling. A simulation study was conducted utilizing four between subjects factors: sample size (50, 75, 100, 150, 200, 300 and 500), slope variance (.15, .45 and .75), factor correlation (.15, .45 and .75) and growth curve (exponential, logarithmic and logistic). There was also a single within subjects factor: fit technique (quadratic, unspecified and spline). The outcomes of interest were the ÷2 model fit statistic and the following goodness-of-fit indices: CFI, GFI, AGFI, SRMR and RMSEA. Results indicated the unspecified technique provided the best statistical estimates of model fit while the quadratic technique provided the worst. This result was consistent across all of the between subject factor conditions. The spline technique performed very similarly to the quadratic technique. These results suggest applied researchers should pay very close attention when utilizing polynomial techniques and should also strongly consider the unspecified technique as either the model of choice or as a comparison to results obtained for another model.","each of the independent and dependent variables along with the procedure of the simulation study. INDEPENDENT VARIABLES: There were 5 independent variables manipulated in the simulation study: sample size, trajectory pattern, slope variance, covariance between factor disturbances and nonlinear technique. Sample Size:
 The 7 levels of sample size used were: 50, 75, 100, 150, 200, 300, and 500. This covers the spectrum of sample sizes commonly seen in individual growth modeling via Sample Size:
 LGM. Statistical estimates for samples larger than 500 were not expected to change significantly, leaving little reason for the investigation of larger sample sizes. In general, minimum sample size requirements in SEM are determined by the ratio of subjects to parameters estimated.  has indicated this ratio to be at least 5:1, preferably 10:1, in order for statistical estimates to be accurate and meaningful. All of the models utilized in this study were simple LGMs without predictor variables, which, as seen in Table , resulted in between 14 and 19 parameter estimates. At the smallest sample sizes, n=50 and n=75, the ratio of subjects to parameters was generally lower than the suggested 5:1, providing an evaluation of minimal sample size requirements in non-linear Sample Size:
 LGMs. Regardless of the non-linear technique implemented to fit the data, minimal sample size requirements were met in the remainder of the sample conditions. Sample Size:
 Factor Loadings 15 14 13 , , λ λ λ Trajectory Pattern:
 Various trajectories are found in longitudinal research designed to identify differences in individual growth. This dissertation focused on trajectories consistent with the exponential, logarithmic and logistic functions. Trajectories displaying a pattern of change consistent with either of these functions are generally observed in applied settings . Logarithmic growth, where an attribute initially develops at a rapid pace but then levels off, essentially represents the ''learning curve'' found in many educational settings where knowledge of a concept is initially obtained rather quickly but then levels off as time goes on. Logistic growth, where an attribute takes some time to develop but then develops at a rapid pace before leveling off, is most often observed in developmental research on young children. Specifically, logistic growth is often seen in the vocabulary development of young children. Young children typically take a year or so to speak an initial word but once the initial word is spoken, additional words are acquired at an increasingly rapid pace until a certain age when acquisition of new words begins to slow considerably. Although not as common in the social and behavioral sciences, the exponential curve, in which growth of an attribute develops slowly but increases rapidly at later time points, was investigated due to the possibility of it also being observed in the applied realm. These curves were created by applying exponential, logarithmic and logistic mathematical functions to the values representing each time point (i.e., 1, 2, 3, 4, 5). Trajectory Pattern:
 After obtaining the transformed values, the curves were put on the same scale by applying a transformation that fixed the values of time points 1 and 5 at 0 and 10, respectively. Table  displays the resulting means at each time point."
