"Paper Title","Paper Link","Publication Year","Publication Type","Publication Title","Author Names","DOI","PDF Link","Abstract","Relevant Excerpt"
"Methodological issues when studying the relationship between reading and solving mathematical tasks","https://scispace.com/paper/methodological-issues-when-studying-the-relationship-between-4o5f345y8o","2012","","","Magnus Österholm
Ewa Bergqvist","","https://scispace.com/pdf/methodological-issues-when-studying-the-relationship-between-4o5f345y8o.pdf","In this paper we examine four statistical methods used for characterizing mathematical test items regarding their demands of reading ability. These methods rely on data of students' performance on ...","need to connect this type of analysis to theories or models regarding the relationship between different abilities when solving mathematical tasks. Furthermore, the overlap between abilities can have different causes and to examine properties of this overlap could add new knowledge about the relationships between the abilities. Conclusions and discussion:
 Except the common effect of two abilities described by the overlap between them, there is also the potential interaction between variables to take into ac-count. In particular, an interaction exists when the demand of reading ability for a task is not independent of mathematical ability. Such interactions can be studied directly in some of the methods examined in this paper, in particular when using a regression analysis or the matrix method. However, since our analysis has shown some deficiencies in these methods there is a need for methodological development regarding the study of the interaction between reading ability and mathematical ability in relation to the solving of mathematics tasks. Furthermore, there are empirical results about the reading of longer texts showing an interaction between text complexity and student ability in relation to reading comprehension . This type of interaction could therefore be of interest to examine also for the reading of test items. Conclusions and discussion:
 Some of the deficiencies regarding reliability and validity might not have any large practical effect if the focus is on the characterization of the group of tasks with highest demand of reading ability, rather than on single tasks. This potential robustness of methods is perhaps observed when some similar results are noted by both  and  despite noted lack of reliability in the method used by Bergqvist and lack of validity in the method used by Roe and Taube. However, it seems more suitable to use the method with better reliability and validity, the principal component analysis, also since this method is somewhat simpler than the other methods because it does not rely on any explicit measures of abilities, which can be complex to create. Conclusions and discussion:
 Focus in this paper is on studies in research area 3 (as labeled in the background), regarding statistical analyses of effects of different abilities on students' performance when solving mathematical tasks. In the background we also criticize several studies in research areas 1 and 2, regarding studies about effects of linguistic properties of mathematical tasks and about the process of reading and solving mathematical tasks. However, we see it as essential to combine foci from different research areas in order to better understand the connections between reading and solving mathematical tasks. Conclusions and discussion:
 In future quantitative studies we will use the results from a characterization of mathematics tasks regarding their demands of reading ability together with other types of characterizations of the same tasks, in order to combine the foci in research areas 1 and 3. For example, we have started to examine if there are any special linguistic properties of tasks having a high demand of reading ability ). Conclusions and discussion:
 We will also include more qualitative types of studies in our future attempts to deepen our understanding of the relationships between reading and solving mathematical tasks. For example, we intend to include both a student perspective, regarding their view of tasks with different demands of reading ability and what strategies are used when solving these tasks, and also a teacher perspective, regarding their view of, and in teaching use of, tasks with different demands of reading ability. These types of studies are meant to combine the foci in research areas 2 and 3. Conclusions and discussion:
 Finally, our ambitions are also to continuously relate results from empirical studies to the development of theories and models about the relationships between reading and solving mathematical tasks."
"Second Graders' Reading Behaviors: A Study of Variety, Complexity, and Change.","https://scispace.com/paper/second-graders-reading-behaviors-a-study-of-variety-488iuo31ve","2006","","","Elizabeth L. Kaye","","https://scispace.com/pdf/second-graders-reading-behaviors-a-study-of-variety-488iuo31ve.pdf","This qualitative inquiry examined second graders’ literacy learning by observing acts of processing on continuous text. Specifically, this study explored the variety, complexity, and change in second graders’ on-the-run reading behaviors at three points in time across an academic year. Systematic observation and the analysis of more than 2,500 text reading behaviors from running records of 21 proficient readers revealed more than 100 unique behaviors in six major categories (substitution, overt solving, repetition, omission, insertion, and other). Substitutions occurred most frequently and reflected students’ attention to multiple sources of information concurrently. Second graders demonstrated more than 60 different ways to overtly solve words, usually working with large, sub-word level units. They never appealed for help without initiating attempts to work out difficulty and never articulated words phoneme-by-phoneme. Findings revealed general patterns of change and constancy across time as well as a variety of idiosyncratic behaviors particular to individual children. Discussion highlights readers’ flexible control of a broad range of literacy processing behaviors and their vast repertoire of ways to problem solve new and","literacy learning. Although this study examined on-the-run behaviors of individuals, data were aggregated for reporting. However, homogenized descriptions of an ""average child"" can neither accurately describe an individual's progress nor inform the teaching of an individual student. Individuality:
 An example of students' solving behaviors illustrates the way aggregated data mask individual differences. The third most prevalent multi-step solving behavior for the year was an action in which students made four or more consecutive attempts at a word (e.g., pair, pairlem, pairle, pairliement for parliament). More than half of the occurrences of this behavior can be attributed to two students, and those two students exhibited the behavior only in September. In fact, half of the children in the study never exhibited this behavior. Individuality:
 Children demonstrated 109 unique reading behaviors, many of which were idiosyncratic to particular children at a single point in time. These diverse and Systematic observation reveals useful descriptions of children's progressions in literacy learning; however, it also presents challenges. Although generalizations about trends over time may appear, the description that emerges may obscure the complex and varied paths individuals take in their literacy learning. DISCUSSION:
 The purpose of this study was to describe the variety, complexity, and change in reading behaviors of proficient second-grade students across the year, with a specific emphasis on the visible information in print. One question guided the study: What reading behaviors do second-grade students exhibit on continuous text? A complex picture emerged as observational data were gathered over time.  spoke of lessons to be learned from qualitative inquiry. In this case, the lessons are about readers' flexible control of processing behaviors and their extensive repertoire of ways to problem solve words. Each of these areas is discussed relative to the present study and the literature in the field. Proficient Readers Flexibly Control a Range of Processing Behaviors:
 The present research examined second graders' literacy learning by observing reading behaviors, or acts of processing, on continuous text. Reading is a continual decision-making process across phrases, sentences, and passages ; therefore, readers can exercise the full range of acts required in reading only when working on continuous text. A theory of literacy processing suggests that children actively assemble a variety of systems to tackle challenges as they read. Assembling working systems  requires flexible, moment-by-moment mobilization and reorganization of different systems to deal with different problems. Thus, children must develop a repertoire of ways of processing text, integrating information from various knowledge sources to solve words, phrases, and messages. Processing behaviors:
 Studies of 5-year-old  and 6-year-old readers  revealed some of the early decision-making actions of beginning readers. The present study extended the inquiry by examining reading behaviors of proficient second graders over an academic year. These readers displayed a varied repertoire of responses that indicate they are assembling working systems and making rapid decisions to effectively process text. The behaviors that signal their efficient processing are listed in Table . Large amounts:
 Instructional-level text provides opportunities for successful of correct reading, smooth integration of processing behaviors, and reading rapid problem solving. Substitutions:
 Errors reflect attention to multiple information sources close to the text (semantic, syntactic, visual, and phonological). Approximately one-fourth are spontaneously corrected. Substitutions:
 Helpful Short repetitions (one to three words) are used to confirm repetitions reading or correct errors. Repetitions following errors usually result in self-corrections."
"Basic calculation proficiency and mathematics achievement in elementary school children.","https://scispace.com/paper/basic-calculation-proficiency-and-mathematics-achievement-in-5c6uxqixcj","2011","Journal Article","Journal of Educational Psychology","Richard Cowan
Chris Donlan
Donna-Lynn Shepherd
Rachel Cole-Fletcher
Matthew Saxton
Jane Hurry","10.1037/A0024556","https://scispace.com/pdf/basic-calculation-proficiency-and-mathematics-achievement-in-5c6uxqixcj.pdf","The relation between skill in simple addition and subtraction and more general math achievement in elementary school is well established but not understood. Both the intrinsic importance of skill in simple calculation for math and the influence of conceptual knowledge and cognitive factors (working memory, processing speed, oral language) on simple calculation and math are plausible. The authors investigated the development of basic calculation fluency and its relations to math achievement and other factors by tracking a group of 259 United Kingdom English children from second to third grade. In both grades the group did not retrieve the solutions to most problems, but their math achievement was typical. Improvement in basic calculation proficiency was partially predicted by conceptual knowledge and cognitive factors. These factors only partially mediated the relation between basic calculation and math achievement. The relation between reading and math was wholly mediated by number measures and cognitive factors.","Authors: Richard Cowan (Corresponding Author),Donna-Lynn Shepherd,Rachel Cole-Fletcher,Matthew Saxton,Jane Hurry,Human Development Keywords: mathematical achievement, simple addition, working memory, reading, young children"
"Working Memory and Learning A 3-Year Longitudinal Study of Children Growing Up In a Multilingual Environment","https://scispace.com/paper/working-memory-and-learning-a-3-year-longitudinal-study-of-4m4a8wxa5x","2009","","","Pascale Engel de Abreu","","https://scispace.com/pdf/working-memory-and-learning-a-3-year-longitudinal-study-of-4m4a8wxa5x.pdf","","manifested unique and robust links with language comprehension, reading, and spelling in second grade and weaker associations with mathematical abilities that were shared with fluid intelligence. Importantly, the processing element of the WM tasks (i.e. reversing sequences of digits and counting) Conclusion:
 did not match the domain of most aptitude test (i.e. reading, spelling, and language comprehension) rejecting the possibility that the observed relationships were due to task specific similarities. There was no evidence for any specific links between verbal STM and either literacy or mathematical ability. Conclusion:
 The findings reinforce previous evidence indicating that the capacity to store verbal material for brief periods of time is a crucial factor in supporting developing language abilities (for review, see . Furthermore, the findings fit well with the position that the central executive might play an important role in the monitoring and processing of information during complex and demanding activities present in many classroom situations . Conclusion:
 Although the presented evidence provides valuable insights into the cognitive underpinnings of learning in young children, it is important to bear in mind that the analyses were based on correlational, cross-sectional data; it is therefore improper to draw strong conclusions regarding the causal relationship between WM, STM, and learning or to identify the dynamic nature of the processes under study. These issues will be addressed more directly in the following chapter 6, exploring cross-lagged relations between the constructs of interest. C H A P T E R S I X R Results III -Longitudinal analyses:
 The main objective of the present chapter was to explore the influences of individual differences in WM and verbal STM on subsequent individual differences in learning. C H A P T E R S I X R Results III -Longitudinal analyses:
 The time periods from kindergarten to first grade, from first grade to second grade, and from kindergarten to second grade were assessed. The chapter consists of five different sections: The first part of the analysis will centre on the general contributions of verbal STM and WM to learning, whereas in a second part more specific links will be explored after controlling for possible associated causes. In a third part potential causal influences of learning on basic cognitive abilities are investigated, and a last set of analyses will focus on the relations of STM and WM with two specific domains of learning -French vocabulary and reading comprehension. The main findings of the analyses are discussed in a final fifth section. Influences of individual differences in WM and STM on subsequent individual differences in learning:
 The following analyses followed the same approach as adopted in the previous chapter 5. In an initial step CFA models were performed, exploring the influences of verbal STM and WM on learning when considered in isolation. Next, SR models were fitted to the data investigating the specific contributions of STM and WM to learning. The statistical procedures were identical to the ones described in chapter 5; Influences of individual differences in WM and STM on subsequent individual differences in learning:
 the following sections will therefore only focus on the results (for a detailed description of the statistical procedures see chapter 5)."
"A 3-Year Longitudinal Study of Children Growing Up In a Multilingual Environment","https://scispace.com/paper/a-3-year-longitudinal-study-of-children-growing-up-in-a-13qxpo9l6q","2009","","","Pascale Marguerite
Josiane Engel","","https://scispace.com/pdf/a-3-year-longitudinal-study-of-children-growing-up-in-a-13qxpo9l6q.pdf","","manifested unique and robust links with language comprehension, reading, and spelling in second grade and weaker associations with mathematical abilities that were shared with fluid intelligence. Importantly, the processing element of the WM tasks (i.e. reversing sequences of digits and counting) Conclusion:
 did not match the domain of most aptitude test (i.e. reading, spelling, and language comprehension) rejecting the possibility that the observed relationships were due to task specific similarities. There was no evidence for any specific links between verbal STM and either literacy or mathematical ability. Conclusion:
 The findings reinforce previous evidence indicating that the capacity to store verbal material for brief periods of time is a crucial factor in supporting developing language abilities (for review, see . Furthermore, the findings fit well with the position that the central executive might play an important role in the monitoring and processing of information during complex and demanding activities present in many classroom situations . Conclusion:
 Although the presented evidence provides valuable insights into the cognitive underpinnings of learning in young children, it is important to bear in mind that the analyses were based on correlational, cross-sectional data; it is therefore improper to draw strong conclusions regarding the causal relationship between WM, STM, and learning or to identify the dynamic nature of the processes under study. These issues will be addressed more directly in the following chapter 6, exploring cross-lagged relations between the constructs of interest. C H A P T E R S I X R Results III -Longitudinal analyses:
 The main objective of the present chapter was to explore the influences of individual differences in WM and verbal STM on subsequent individual differences in learning. C H A P T E R S I X R Results III -Longitudinal analyses:
 The time periods from kindergarten to first grade, from first grade to second grade, and from kindergarten to second grade were assessed. The chapter consists of five different sections: The first part of the analysis will centre on the general contributions of verbal STM and WM to learning, whereas in a second part more specific links will be explored after controlling for possible associated causes. In a third part potential causal influences of learning on basic cognitive abilities are investigated, and a last set of analyses will focus on the relations of STM and WM with two specific domains of learning -French vocabulary and reading comprehension. The main findings of the analyses are discussed in a final fifth section. Influences of individual differences in WM and STM on subsequent individual differences in learning:
 The following analyses followed the same approach as adopted in the previous chapter 5. In an initial step CFA models were performed, exploring the influences of verbal STM and WM on learning when considered in isolation. Next, SR models were fitted to the data investigating the specific contributions of STM and WM to learning. The statistical procedures were identical to the ones described in chapter 5; Influences of individual differences in WM and STM on subsequent individual differences in learning:
 the following sections will therefore only focus on the results (for a detailed description of the statistical procedures see chapter 5)."
"The impact of metacognitive strategies and self-regulating processes of solving math word problems","https://scispace.com/paper/the-impact-of-metacognitive-strategies-and-self-regulating-2iwdo6898b","2017","Journal Article","International Electronic Journal of Elementary Education","Eda Vula
Rrezarta Avdyli
Valbona Berisha
Blerim Saqipi
Shpetim Elezi","10.26822/IEJEE.2017131886","https://scispace.com/pdf/the-impact-of-metacognitive-strategies-and-self-regulating-2iwdo6898b.pdf","This empirical study investigates the impact of metacognitive strategies and self-regulating processes in learners’ achievement on solving math word problems. It specifically analyzes the impact of the linguistic factor and the number of steps and arithmetical operations that learners need to apply during the process of solving math word problems. Two hundred sixty-three learners, of three classes of third graders (N=130) and four classes of fifth graders (N=133) of the elementary cycle from two urban schools of Kosovo, participated in the study. Almost half of the total number of the third and fifth-graders were exposed to metacognitive instruction. The rest of the learners were included in control classes in which they performed tasks without having been given any specific guidance, based exclusively on traditional methods and respective textbooks. All the learners were tested in math word problems twice, before the intervention and after it. Research findings have shown that metacognitive strategies and self-regulating processes that learners use to control their actions, to reason, and to reflect, are one of the main resources that influence their success in solving a math word problem. Although the difference between the pre-test and the post-test results was statistically significant solely with the fifth-grade experimental classes, yet an improved performance was observed in third-grade experimental learners’ classes compared to control classes. Theoretical and practical implications of the research are discussed in the end of the study.","operation problems require only one operation in order to be solved, two operation problems include a question that requires the application of computing operations on a variable; therefore, the more steps are required, the more mental resources are demanded in order to perform the task . Literature review:
 Since the whole process of comprehending words, the sequence of operations, as well as the final result of a sentence that describes a mathematical problem is extremely overloaded, the best way to understand how learners reason when facing such a problem is to take into account their reflections. In order to do this, an intervention strategy that would measure the process of self-regulation is required. Self-regulation is an ""active"" structural process which enables achievement of learners' goals, monitoring, and understanding of knowledge; it is an ability to control and guide learners towards the fulfillment of learning goals . Due to this, learners need to set goals, to select strategies that will help them reach their goal, to apply the selected strategies, and to continuously monitor their own progress. Literature review:
 Self-regulation of learning consists of three main components: cognition, metacognition, and motivation. Cognition includes the abilities necessary for codifying, for memorizing, and for retrieving information. Metacognition includes the abilities, which enable learners to understand and monitor their own cognitive processes. Motivation involves the beliefs and attitudes that influence the usage and the development of cognitive and metacognitive abilities. Each of the three components is essential, but not sufficient for selfregulation  and for efficient solving of problems. Although self-regulating processes are the basis for learning in general, selfregulation can be more directly related to early mathematics and the natural requirements of mathematical operations , and consequently with learners' achievements in solving problems in early childhood. Literature review:
 Reading comprehension is essential in solving math word problems. Achievement of comprehension of written texts or sentences is one of the main pillars of the development of reading skills throughout school years. However, the mere fact that children can read does not mean that they also understand what they have read. Therefore, deciphering graphemes into phonemes does not make children skillful readers. A child attains such a skill only through extensive reading, initially reading accompanied by an adult, further on independent loud reading, and finally meaningful silent reading. If the complex nature of language itself, and additionally, the issue of converting linguistic signs (words, sentences, etc.)  into mathematical symbols, or arithmetical operations is considered, then it has to be taken into account that frequently the issue of solving math word problems is more than just a ""mathematical or arithmetical"" issue. It is rather the issue of the very nature of language and of the words used . Literature review:
 The present study investigates reading comprehension as a possibility for enhancing solving math word problems. The principal focus of the research is the examination of texts that describe mathematical problems through an analysis, which assesses whether the linguistic information is consistent or inconsistent. Analysis of text complexity that influences the scale of solving mathematical problems is also important for the present study. Consequently, the impact of comprehension of linguistic information in solving mathematical problems, regardless whether application of one or more operations is required is investigated. The research hypotheses of the present study derive from these particular goals."
