"Paper Title","Paper Link","Publication Year","Publication Type","Publication Title","Author Names","DOI","PDF Link","Abstract","Relevant Excerpt"
"Individual Differences as Predictors of Learning and Engagement","https://scispace.com/paper/individual-differences-as-predictors-of-learning-and-46ap6ecv2l","2010","","","Sidney K. D'Mello
Claire Williams
Patrick Hays
Andrew Olney","","https://scispace.com/pdf/individual-differences-as-predictors-of-learning-and-46ap6ecv2l.pdf","Individual Differences as Predictors of Learning and Engagement Sidney D’Mello (sdmello@memphis.edu) Claire Williams (mcwllams@memphis.edu) Patrick Hays (dphays@memphis.edu) Andrew Olney (aolney@memphis.edu) Institute for Intelligent Systems, University of Memphis Memphis, TN 38152 USA data on how individual differences influence engagement and learning within the context of intelligent learning environments such as Intelligent Tutoring Systems (ITSs). Understanding how individual differences impact learning sessions with ITSs is important, because ITSs are emerging as effective alternatives to deliver individualized instruction to large numbers of students (Corbett, Anderson, Graesser, Koedinger, & VanLehn, 1999; Graesser, Person, & Magliano, 1995; Koedinger & Corbett, 2006). It is generally acknowledged that all students do not benefit equally from learning sessions with ITSs (VanLehn et al., 2007). Some learners show dramatic improvements in learning gains from pre to post tests, while tutoring has a negligible impact on others. Some learners actively attend the session by carefully listening to the tutor, taking initiative by asking questions, and providing verbose responses to the tutor’s questions (Graesser et al., 1995). However, other non-critical learners, socially attend the session, and are comfortable being passive information receivers rather than active problem solvers. Who are these learners? Can they be discriminated from standard individual difference measures? What are the individual differences that are predictive of engagement and learning gains? These are the questions that motivated the present study. The present study investigated whether trait measures of individual differences in (a) motivation, engagement, and burnout, (b) cognitive abilities, and (c) task related measures, could predict state measures consisting of engagement levels and learning gains in a one-on-one tutoring session with an ITS. Our focus on trait measures of motivation, engagement, and burnout is motivated by numerous studies that have related these measures to engagement and learning (Bartels & Magun-Jackson, 2009; Pekrun, Elliot, & Maier, 2006). For example, learners with mastery-approach motivation orientations are expected to be absorbed in the learning process (i.e., more engaged) and process the material deeply, presumably resulting in higher learning gains (Elliot & McGregor, 2001). In contrast, learners with performance-approach characteristics process the material at relatively shallow levels and do not demonstrate impressive learning gains. Similarly, some research has linked trait measures of engagement and burnout to performance outcomes (Schaufeli, Martinez, Pinto, Salanova, & Bakker, 2002). Abstract We investigated the possibility of predicting students’ engagement and learning gains during a tutoring session from trait measures of motivation, engagement, burnout, cognitive ability, prior knowledge, and task related measures. Participants completed a multiple choice pretest, a learning session, a posttest, and a battery of individual differences tests and questionnaires. Multiple regression and exploratory factor analyses indicated that the individual differences measures yielded medium sized effects at predicting learning gains as well as engagement levels that were self-reported during the tutorial session. In general, self-reported interest in the task and confidence in learning from a computer tutor coupled with working memory capacity and attentional abilities were the major predictors of both engagement and learning. Keywords: learning, engagement, individual differences, cognitive abilities, motivation, burnout, ITS Introduction There is no one-size-fits-all approach when it comes to promoting student engagement and learning. Engagement and learning are affected by a number of factors such as, the learning environment (classroom, human tutor, high stakes learning), the task (acquiring shallow facts versus obtaining a deeper conceptual understanding), and characteristics of the learners themselves (e.g., visual versus verbal learners, performance versus mastery-oriented learners) (Ackerman, Sternberg, & Glaser, 1989; Jonassen & Grabowski, 1993; Schmeck & Geisler-Brenstein, 1989). Therefore, understanding how a particular student will be engaged in and benefit from a learning session requires an analysis of how the learning environment, the task, and the characteristics of the learner (i.e. individual differences) interact and influence learning outcomes. For a given learning activity (e.g., learning conceptual physics from a human tutor), the context and the task are fixed, however the individuals involved in the activity vary. Hence, it is important to discriminate learners that actively engage and benefit from a learning session from others who passively attend the session and do not demonstrate dramatic improvements in their knowledge levels. Consequently, individual differences research has been a long standing and valuable tradition in the fields of psychology and education (Ackerman et al., 1989; Jonassen & Grabowski, 1993). Although research efforts along this front have yielded some important insights, there is little","Authors: Sidney D ' Mello,Claire Williams,Patrick Hays,Andrew Olney Keywords: learning, engagement, individual differences, cognitive abilities, motivation, burnout, ITS"
"Challenges Facing Contemporary Associative Approaches to Acquired Behavior","https://scispace.com/paper/challenges-facing-contemporary-associative-approaches-to-4tugywymcm","2006","Journal Article","Comparative Cognition & Behavior Reviews","Ralph R. Miller","10.3819/CCBR.2008.10005","https://scispace.compdf/challenges-facing-contemporary-associative-approaches-to-4tugywymcm.pdf","Despite the considerable success of contemporary associative models of learning in stimulating new behavioral research and modest success in providing direction to both neuroscience and psychotherapy, these models are confronted with at least three challenges. The first challenge is to the assumption that animals encode only one or a few summary statistics to capture what has been experienced over many training trials. This assumption is contrary to overwhelming evidence that the brain retains episodic information. The second challenge is that the learning-performance distinction has been largely ignored. Most models erroneously assume that behavior is a nearly perfect reflection of what has been encoded. The third challenge is to account for interactions between stimuli that have been presented separately (e.g., stimulus interference) as well as between stimuli that have been presented together (e.g., stimulus competition).","associative theories: Moreover, what is stored according to such contingency models does not include the temporal information that is inherent in episodic-like memories. The latter version, with each specific trial encoded, is more compatible with the observation of episodic memories. Contingency theories as an alternative to associative theories:
 However, both versions encounter a number of problems, among them being unable to address trial order effects because frequencies of trial types are encoded without any information about the order of the different trials. Contingency theories as an alternative to associative theories:
 Not only do these contingency models, like traditional associative models, fail to account for waning recency effects and waxing primacy, but they do not even anticipate the recency effects that are ordinarily observed with short retention intervals and no change in context prior to testing, something that traditional associative models such as  correctly anticipate. Contingency theories as an alternative to associative theories:
 The richer version of contingency theory with its retention of memories of individual trials, complemented with added information concerning the time at which trials occurred, is a direction that future researchers might profitably pursue (see  for a detailed discussion of potential modifications). The Learning-Performance Distinction:
 Ever since , researchers have had some awareness of the learning-performance distinction. The Learning-Performance Distinction:
 The primary variable upon which Tolman focused concerning the transformation of stored knowledge into behavior was motivation. Today we all acknowledge that motivation is essential for the expression of what has been learned. The Learning-Performance Distinction:
 But associative theories in the animal learning tradition rarely go beyond motivation in differentiating encoded knowledge from behavior. Indeed, they usually only acknowledge rather than formalize the role of motivation, but that is still more attention than they give to other so-called performance variables. The Learning-Performance Distinction:
 Unlike associative theories framed to explain human performance, there is ordinarily little concern for retrieval processes or response generation rules. Learning is an intervening variable; all we ever see is a change in behavior as a consequence of prior experience. The Learning-Performance Distinction:
 Consistent with the misguided name learning theory and inconsistent with the actual goal of explaining acquired behavior, most modern associative theories in the animal tradition emphasize the learning (i.e., acquisition) process per se and are virtually silent concerning the transformation of acquired information into behavior. The Learning-Performance Distinction:
 For example,  simply say that responding is monotonically related to associative strength. This undermines the assertion that the Rescorla-Wagner model is quantitative in more than anticipating rank order of behaviors resulting from different treatments. The Learning-Performance Distinction:
 That is, the model is quantitative only up to the point of computing associative strength, which is an intervening variable that cannot be directly measured. The Learning-Performance Distinction:
 Some other associative models such as  go a bit further in discussing the expression of behavior, but in explaining differences in behavior even these models clearly place a far greater emphasis on acquisition processes than on expression processes that are uniquely active at test. The Learning-Performance Distinction:
 They assume that what is observed in behavior is a reliable reflection of what the subject has encoded. The failure to do more than predict rank-order differences in behavior is a major weakness of most contemporary association models in the animal tradition."
"Observational Word Learning: Beyond Propose-But-Verify and Associative Bean Counting.","https://scispace.com/paper/observational-word-learning-beyond-propose-but-verify-and-3zj5s4hrz9","2016","Journal Article","Journal of Memory and Language","Tanja C. Roembke
Bob McMurray","10.1016/J.JML.2015.09.005","","","supplement): This may indicate that these differences in co-occurrence (LC competitor versus RO) were too subtle to result in observable differences in association strength. However, for the HC competitors, there was clear evidence for the simultaneous consideration of multiple hypotheses. Discussion:
 It should also be noted that the difference in looks to HC over RO/ LC competitors was driven by eye movements generated late in the trial. This suggests that participants may have had difficulty fully suppressing the HC competitor. In addition, this indicates that a consistent context throughout learning (i.e. the presence of the HC competitor) may impede performace; however, this will become clearer when comparing Experiment 1 and 2 (see below). Discussion:
 Our autocorrelation analyses addressed our second question. They replicated previous work showing an influence of prior responding on current trial accuracy . However, more importantly, we found that adding a gradual component to the statistical model accounted for variance in accuracy over and beyond performance on the previous learning instance with that word. This thus indicates that participants do not simply retain hypotheses in an all-or-nothing fashion -they are also sensitive to the gradual accumulation of co-occurrence statistics. This was found even considering only trials in which participants responded incorrectly on their last encounter with a word. This also provides converging evidence for the question of multiple hypotheses (Question 1) -even when participants did not respond correctly on a prior encounter (they had the wrong hypothesis under a propose-but-verify account), they were still accumulating information relevant to the correct mappings. Thus, learning appears to be shaped both by last-encounter performance as well as overall exposure. Moreover, the fact that the effect of last-encounter performance improves with more learning suggests that the effect of lastencounter performance -argued to be the hallmark of a propose-but-verify strategy -may be a product of learning, not a mechanism of it (echoing the description of classic fast-mapping offered by . Discussion:
 The combined influence of both gradual learning and last-encounter performance is quite clear when examining individual subject data. Figure  shows the trial-by-trial accuracy for three participants for each word. Here we see that some words seem to start correct and stay that way (e.g., pacho for S1, goba for S10), seemingly confirming a propose-but-verify strategy. However, other words show a much more sporadic pattern (e.g., goba, for S1, zati for S5) and a substantial number of words show continued oscillation even out to repetition 30 or 40. Yet other words show a fairly robust run of accurate responding (suggesting a correct proposal) that is then lost for a time (e.g., mefa for S10 around repetitions 12-20; pacho for S5 from blocks 1-6). Thus, while the individual learning profiles appear to fit a range of descriptions, there appears to be a strong gradual or probabilistic component to learning."
"No evidence for cross-contextual consistency in spatial learning and behavioural flexibility in a passerine","https://scispace.com/paper/no-evidence-for-cross-contextual-consistency-in-spatial-2j58b52xb2","2020","Posted Content","bioRxiv","Camille A. Troisi
Amy C. Cooke
Gabrielle L. Davidson
Iván de la Hera
Michael S. Reichert
John L. Quinn","10.1101/2020.09.04.282566","https://scispace.com/pdf/no-evidence-for-cross-contextual-consistency-in-spatial-2j58b52xb2.pdf","Although the evolution of cognitive differences among species has long been of interest in ecology, whether natural selection acts on cognitive processes within populations has only begun to receive similar attention. One of the key challenges is to understand how consistently cognitive traits within any one domain are expressed over time and across different contexts, as this has direct implications for the way in which selection might act on this variation. Animal studies typically measure a cognitive domain using only one task in one context, and assume that this captures the likely expression of that domain in different contexts. This deficit is not surprising because, from an ecologist9s perspective, cognitive tasks are notoriously laborious to employ, and for design reasons most tasks can only be deployed in a specific context. Thus our knowledge of whether individual differences in cognitive abilities are consistent across contexts is limited. Using a wild population of great tits (Parus major) we characterised consistency of two cognitive abilities, each in two different contexts: 1) spatial learning at two different spatial scales, and 2) behavioural flexibility as both performance in a detour reaching task and reversal learning in a spatial task. We found no evidence of a correlation between the two spatial learning speeds, or between the two measures of behavioural flexibility. This suggests that cognitive performance is highly plastic and sensitive to differences across tasks, or that variants of these well-known tasks may tap into different combinations of both cognitive and non-cognitive mechanisms, or that they simply do not adequately measure each putative cognitive domain. Our results highlight the challenges of developing standardised cognitive assays to explain natural behaviour and to understand the selective consequences of that variation.","Pinning down the meaningful measures of individual differences in cognitive mechanisms remains a major challenge. Conclusions: Nevertheless, studies that aim to validate tasks, as we aimed to do here, are a step forward in understanding causes and consequences of individual variation in cognition. Figures:
 Figure  Relationship between A) performance on small-scale and large-scale spatial learning tasks, B) performance on detour reach and reversal learning tasks. The line is a fitted linear regression line and the shaded grey area is the 95% confidence interval. Figures:
 On average, birds assigned to the control condition made 22.11 (SE = 6.49) choices before learning the large-scale spatial learning task (N=9), and 22.44 (SE = 6.69) choices before learning the smallscale spatial learning task (N=9). There was no evidence of a correlation between the two measures (z = -1.82; tau = -0.59; p = 0.068, n=7). Figures:
 On average, birds assigned to the control condition made 18.37 (SE = 5.62) choices before reverse learning (N=8), and made 3.90 (SE = 0.74) correct choices in the detour reach task (N=10). There was no evidence of a correlation between the detour reach and reversal learning (z = -0.15; tau = -0.05; p = 0.878, n=7)."
"Individual differences in the effectiveness of text cohesion for science text comprehension","https://scispace.com/paper/individual-differences-in-the-effectiveness-of-text-cohesion-435n94n9bg","2014","Journal Article","Learning and Individual Differences","Sophie Hall
Jaskaran Basran
Kevin B. Paterson
Rebecca Kowalski Kowalski
Ruth Filik
John Maltby","10.1016/J.LINDIF.2013.10.014","","","Keywords: text cohesion, science learning, individual differences, general intelligence, selfefficacy"
"Decreased Key Pecking in Response to Reward Uncertainty Followed by Surprising Delay Extension in Pigeons","https://scispace.com/paper/decreased-key-pecking-in-response-to-reward-uncertainty-d9gqig8u8a","2021","Journal Article","International Journal of Comparative Psychology","Neslihan Wittek
Kevin Wittek
Onur Güntürkün
Patrick Anselme","10.46867/IJCP.2021.34.00.02","https://scispace.com/pdf/decreased-key-pecking-in-response-to-reward-uncertainty-d9gqig8u8a.pdf","Author(s): Wittek, Neslihan; Wittek, Kevin; Gunturkun, Onur; Anselme, Patrick | Abstract: The Pavlovian autoshaping paradigm has often been used to assess the behavioral effects of reward omission on behavior. We trained pigeons to receive a food reward (unconditioned stimulus or UCS) following illumination of a response key (conditioned stimulus or CS). In Experiment 1, one group of pigeons was trained with two 100% predictive CS-UCS associations (reward certainty) and another group with two 25% predictive CS-UCS associations (reward uncertainty) for 12 sessions. In both groups, the two CS durations were 8 s. Then, in each group, the duration of one CS remained unchanged and that of the other CS was suddenly extended from 8 to 24 s for 6 sessions. In Experiment 2, some experienced individuals (from Experiment 1) and naive individuals formed two groups trained with a 24-s CS throughout for 18 sessions. Our results show that pigeons (a) pecked less at the uncertain than the certain CS, (b) decreased and then increased CS-pecking after extending CS duration, especially in the certainty condition, (c) were unresponsive to the 24-s CS in the absence of previous experience, and (d) decreased their response rate close to the end of a trial irrespective of the reinforcement condition, CS duration, and amount of training. These results are discussed in relation to several theoretical frameworks.","preference when presented simultaneously. The dynamics of responding within a trial was also examined in both groups. As the pigeons responded similarly to both initial-link stimuli (blue and brown), the stimuli were statistically merged and treated as if they were a single stimulus. Training Phase: Reward Uncertainty:
 Figure  represents the mean number of pecks in Groups Certainty and Uncertainty over the course of 12 acquisition sessions. We found significant overall effects of group, F(1, 14) = 5.07, p = 0.041, ηp 2 = 0.26, and of session, F(11, 154) = 20.97, p < 0.001, ηp 2 = 0.60, as well as a Group × Session interaction, F(11, 154) = 3.23, p = 0.028, ηp 2 = 0.19. A post-hoc pairwise comparison showed that the performance was similar in both groups on Session 1, pcorr = 0.421, and the pigeons learned the task in both groups. However, the effect of training on performance occurred faster in the certain pigeons (Sessions 1 vs. 2: pcorr = 0.024) than in the uncertain pigeons (Sessions 1 vs. 10: pcorr = 0.018). Responses in both groups showed significant differences on Sessions 2, 3, 4, 5, 6, 7, and 8, pcorrs ≤ 0.032, with the performance of the uncertain pigeons being consistently lower than that of the certain pigeons. Training Phase: Reward Uncertainty:
 A second-by-second analysis was used to study the within-trial dynamics of responses. Figure  depicts the pattern of responses for Sessions 2 (early), 7 (middle), and 12 (late), a pattern that was similar for all sessions -including the sessions not shown. For each of these three sessions, an overall bin effect was observed, Fs(7, 98) ≥ 19.55, ps < 0.001, ηp 2 ≥ 0.58. Consistent with the results reported in Figure , we found an overall effect of group, Fs(1, 14) ≥ 5.13, ps ≤ 0.040, ηp 2 ≥ 0.27, and also a Group × Bin interaction, Fs(7, 98) ≥ 2.85, ps ≤ 0.010, ηp 2 ≥ 0.17, on Sessions 2 and 7, but not on Session 12 (F < 1). A post-hoc comparison revealed that the certain and the uncertain pigeons differed significantly for each bin on Session 2, pcorrs ≤ 0.028, and for Bins 1, 5, 6, 7 on Session 7, pcorrs ≤ 0.042."
"Latent variable mixture models in research on learning and individual differences","https://scispace.com/paper/latent-variable-mixture-models-in-research-on-learning-and-118vw20in9","2018","Journal Article","Learning and Individual Differences","Jake McMullen
Marian Hickendorff","10.1016/J.LINDIF.2018.05.008","","","Title: Learning and Individual Differences Authors: Jake Mcmullen (Corresponding Author),Marian Hickendorff,A R T I C L E I N F O"
