"Paper Title","Paper Link","Publication Year","Publication Type","Publication Title","Author Names","DOI","PDF Link","Abstract","Relevant Excerpt"
"The predictive validity of oral reading fluency measures on the Louisiana Educational Assessment Program for third and fourth grade students","https://scispace.com/paper/the-predictive-validity-of-oral-reading-fluency-measures-on-x1b0iwok0q","2014","","","Tracy Elkins Bennett","","https://scispace.com/pdf/the-predictive-validity-of-oral-reading-fluency-measures-on-x1b0iwok0q.pdf","Good, Kaminski, Simmons and Kamenui (2001) declared a national awareness of the benefits of early reading success and the negative consequences of early reading failure. One method discussed for prevention of reading failure was the implementation of screening programs employed to measure reading skills, predict success of future reading success, and inform instruction that would hopefully eliminate reading failure. In the current study, the primary research question was to investigate the Dynamic Indicators of Basic Early Literacy Skills (DIBELS) Oral Reading Fluency (DIBELS ORF) benchmark and screening program and its predictive abilities on reading comprehension achievement measured by the integrated Louisiana Educational Assessment Program English Language Arts (/'LEAP ELA) scores for third-grade students. The secondary research question was to examine whether the AIMSweb Reading-Curriculum Based Measurement (R-CBM) oral reading fluency benchmark and progress monitoring system could predict reading comprehension achievement on the Louisiana Educational Assessment Program English Language Arts (LEAP ELA) scores for fourth-grade students. Finally, determining accuracy of risk status determined by oral reading fluency screening programs, DIBELS ORF and AIMSweb R-CBM, and their relation to reading comprehension achievement, according to /'LEAP ELA and LEAP ELA, was an additional purpose of the study. A non-experimental, causal comparative study was conducted to examine oral reading fluency scores and reading comprehension scores in the school year 2011-2012. The data were obtained from thirdand fourth-grade students who attended five elementary schools within one rural Louisiana district. The findings revealed the strongest correlation and prediction between oral reading fluency and reading comprehension existed when oral reading fluency was measured by DIBELS ORF, administered in Grade 3, and reading comprehension was measured by /LEAP ELA Standard 1: Reading, comprehending, and responding, also administered in Grade 3. However, significant correlations and evidence of predictive validity were also verified when oral reading fluency was measured using DIBELS ORF and Reading Standard 7 in third grade. Additionally, when AIMSweb R-CBM and reading comprehension measures LEAP ELA Reading Standards 1, 6 and 7 were employed to examine relationship in Grade 4, significant correlations and predictions were found. Furthermore, findings revealed that the scores from the oral reading fluency measures and the scores from the reading comprehension measures were dependent on one another. Research revealed the importance of the Reading First (RF) initiative developed to improve American reading programs (U.S. Department of Education, 2012). One of the reading programs developed under RF was DIBELS. This study confirmed that oral reading fluency screening programs, like DIBELS ORF and AIMSweb R-CBM, were significantly related to reading comprehension measured in standardized assessments. APPROVAL FOR SCHOLARLY DISSEMINATION The author grants to the Prescott Memorial Library of Louisiana Tech University the right to reproduce, by appropriate methods, upon request, any or all portions of this Dissertation. It was understood that “proper request” consists of the agreement, on the part of the requesting party, that said reproduction was for his personal use and that subsequent reproduction will not occur without written approval of the author of this Dissertation. Further, any portions of the Dissertation used in books, papers, and other works must be appropriately referenced to this Dissertation. Finally, the author of this Dissertation reserves the right to publish freely, in the literature, at any time, any or all portions of this Dissertation. Author ~IY}uacA Date","focus less on sub-skills like word-identification and focus more on sub-skills requiring resources and experiences like comprehension. However, researchers found that if each reading sub-skill required individual attention throughout one's reading journey, then reading performance would suffer . Theory of Automaticity Defined:
 Practicing reading sub-skills promotes automaticity in reading . A fluent reader should be able to focus attention on semantics as the brain automatically decodes letters and sounds into words. As readers begin to make connections between words and semantics, automaticity of meaning takes place. Once a reader is considered fluent in reading, there are no longer dividing lines between sub skills of reading. All readers invariably enter through stages of attention being placed on various sub-skills until practice upon practice allows for automaticity of each sub-skill and eventually automatic integration of all reading processes. Examples of Automaticity:
 An example of automaticity in early readers is when a young child has learned his letters and letter sounds and can give less attention to letter recognition and more attention to semantics . The reader's brain capacity will have more room for deciphering meaning from new words now that letters and sounds are known. Also, as readers reread passages, they recognize the number of errors decreasing and their reading rates are faster . Oral reading practice is used to improve reading fluency and signs of automaticity may develop for the reader. Because readers want to sound good as they read, they will orally reread passages over and over to hear themselves read fluently. Examples of Automaticity:
 In order for successful reading to occur, automatic processing must take place . Much like practice of reading sub-skills, basketball players handle the ball in a variety of ways consisting of many sub-skills. These sub-skills include dribbling, passing, and catching, and these sub-skills must be practiced over and over to become automatic. Some of these skills must be automatic for successful ballhandling. Ball players cannot devote attention to each skill and play the game as it was designed to be played. Reading requires the same kind of automatic transactions within the reader in order to be a successful reader. Automaticity and Comprehension:
 LaBerge and  defined comprehension as the ""organization of these word meanings receiving attention one-by-one and later becoming automatic and recognized as a coherent whole"" (p. 319). Readers bring their individual experiences to the task when they assign meaning to words and sentences and this act makes comprehension a complex operation. This act of adding one's own association is also what helps readers successfully apply what they have read into their memory. apply the text meaning to their present understanding, and (d) infer where needed to make sense of the text, the reader would be labeled a fluent reader from orally reading a passage. Also, when readers recognized words in a timely manner, it showed that the readers could successfully and automatically glide through the reading process applying selective attention only to new, occasional text material. Automaticity and Fluency Used to Predict Achievement:
 Without automatic attention to comprehension while reading, readers in early elementary grades may have been at risk for reading failure ."
"An fMRI study of fluent and nonfluent beginning readers","https://scispace.com/paper/an-fmri-study-of-fluent-and-nonfluent-beginning-readers-1bbxiu87av","2015","","","Jennifer Joyce Long","","https://scispace.com/pdf/an-fmri-study-of-fluent-and-nonfluent-beginning-readers-1bbxiu87av.pdf","Although reading fluency has been identified as an important component of skilled reading, few studies have examined the underlying neural processes. The purpose of the current study was to compare the neural systems for reading in fluent and nonfluent beginning readers. The Goldberg and Costa (1981) theory of hemisphere differences provided a theoretical framework for conceptualizing the development of reading fluency. This theory proposes that the right hemisphere processes novel stimuli and assembles new descriptive systems while the left hemisphere utilizes fully formed and well-routinized codes, and that a right-to-left shift in hemisphere superiority occurs during skill development. Children between 6 and 7 years of age participated in an fMRI experiment. Low and high fluency groups were based on level of fluency in grapheme-phoneme mapping. fMRI reading tasks were modeled on curriculum based measurement tests of reading fluency. Three different tasks involved letter-phoneme, word-spoken word, or picture-spoken word matching. In high fluency as compared to low fluency beginning readers, there was greater activation in the left parietotemporal area during letter and word reading tasks, an area involved in phonological processing, grapheme-phoneme mapping, and word decoding. Also, in the high fluency as compared to the low fluency group, there was greater activation in the left inferior frontal area during the word reading task, another area involved in phonological processing. Within the framework of the Goldberg and Costa theory, the greater left hemisphere involvement in the high fluency group may reflect the utilization of more routinized descriptive codes for phonological processing skills. There was greater activation in high fluency as compared to low fluency beginning readers in bilateral occipitotemporal areas during","fluency and comprehension has been debated ). Historically, it has been proposed that fluency contributes to comprehension . A more current view proposed by some researchers is that fluency and comprehension have a reciprocal relationship with fluency contributing to and resulting from comprehension . Reading Fluency:
 Although, fluency has often been viewed in terms of oral reading, definitions of fluency need to apply to silent reading as well since most reading is silent . Reading Fluency:
 Reading fluency is a complex, multifaceted construct and there is currently no consensus on its definition . It has been defined from a number of different approaches . There is disagreement as to whether fluency is a dependent variable that represents the quality of reading or, whether it is an independent variable that affects the quality of reading . There now appears to be agreement on the key elements of fluency: accuracy in decoding, automaticity in word recognition, and appropriate use of prosody . Different definitions of fluency place varying emphasis on these three components .  offer a definition of reading fluency which attempts to integrate previous knowledge and definitions: ""Fluency combines accuracy, automaticity, and oral reading prosody, which, taken together, facilitate the reader's construction of meaning. It is demonstrated during oral reading through ease of word recognition, appropriate pacing, phrasing and intonation. It is a factor in both oral and silent reading that can limit or support comprehension"" (p. 240). Reading Fluency:
 Fluency can also be viewed in terms of the levels at which one is fluent .  describe fluency as occurring at the levels of ""letter, letter pattern, word, sentence, and passage"" (p. 218). They also stress that fluency should not be seen as the outcome of learned reading skill but viewed from a developmental perspective. Fluency develops in initial skills such as letter recognition and phoneme awareness and progresses to higher-level skills such as word recognition and text comprehension. Some have argued that fluency should be seen as part of reading development instead of as a proxy for it .  describe fluency as developing from multiple underlying processes including perceptual, phonological, orthographic, morphological, semantic, and syntactic processes. Consequently, problems with fluency can result from impairment in one or more of these processes. Another approach to fluency views it as the outcome of the effectiveness of biological and cognitive systems involved in reading . Automaticity:
 The terms fluency and automaticity are often used interchangeably but automaticity is a separate construct that is one essential element of reading fluency. Similar to fluency, there is no agreement on the definition of automaticity . The term implies that a behaviour is ""automatic"", meaning that it is effortless, autonomous, fast, outside of conscious control, and uses few processing resources . The most consistent observation of increased automaticity is a speed-up in performance that occurs with practice . Many have conceptualized automaticity in terms of the properties that are necessary or sufficient to define it . The problems with this approach are that it simply describes behaviour and there is a high level of inconsistency between researchers regarding the properties that define automaticity . A different approach is to conceptualize automaticity in terms of its underlying processes . The advantage of this approach is that it can explain and predict behaviour ."
"Des évaluations simples, rapides et abordables: Améliorer l'apprentissage dans les pays en développement","https://scispace.com/paper/des-evaluations-simples-rapides-et-abordables-ameliorer-l-4ktk3fywvo","2015","","","Daniel A. Wagner","","https://scispace.com/pdf/des-evaluations-simples-rapides-et-abordables-ameliorer-l-4ktk3fywvo.pdf","Cet ouvrage, initialement publié en anglais par l'Institut international de planification de l'éducation de l'UNESCO (IIPE-UNESCO) et le Partenariat mondial pour l'éducation (PME), rejoint les préoccupations de plusieurs États et gouvernements de la Francophonie, qui font face au défi de la qualité de l'éducation. Á l'heure du bilan des Objectifs du Millénaire pour le développement et de ceux de l'Éducation pour tous – qui s'achéveront en 2015 – et malgré les remarquables progrès effectués, depuis le Forum de Dakar en 2000, la scolarisation primaire universelle et la qualité de l'éducation dispensée demeurent des préoccupations majeures. Disciplines Curriculum and Instruction | Education | Educational Administration and Supervision | Educational Assessment, Evaluation, and Research | Educational Methods | International and Comparative Education Comments This is the French-translated and updated version of the book Smaller, Quicker, Cheaper: Improving Learning Assessments in Developing Countries. This book is available at ScholarlyCommons: https://repository.upenn.edu/literacyorg_chapters/3 Pour améliorer l’apprentissage, il est fondamental d’utiliser efficacement les évaluations des acquis scolaires. Mais cette notion d’utilisation efficace ne fait pas uniquement référence aux paramètres techniques ou aux méthodes statistiques. Les évaluations de l’apprentissage en usage actuellement – qu’il s’agisse d’évaluations à grande échelle, d’enquêtes auprès des ménages ou d’évaluations hybrides (simples, rapides et abordables, «  smaller, quicker, cheaper  » ou SQC)  – ont diverses finalités et applications. Le présent ouvrage donne une vue d’ensemble des évaluations de l’apprentissage et de leur importance pour la constitution d’une base de données empiriques ; il propose quelques idées nouvelles pour les rendre plus efficaces, en particulier pour les enfants les plus en difficulté. Selon l’auteur, les évaluations hybrides de l’apprentissage peuvent renforcer la responsabilité éducative, favoriser une plus grande transparence et susciter un plus grand engagement des parties prenantes soucieuses d’améliorer l’apprentissage. Les pays ont, par ailleurs, besoin d’une politique à long terme pour choisir les évaluations les plus pertinentes, en privilégiant notamment les populations pauvres et marginalisées. Les initiatives actuelles pour élargir l’administration des évaluations des acquis scolaires dans les pays en développement sont déterminantes pour permettre des améliorations de l’éducation réelles et durables.","des questions, production de questions, structure du récit et résumé 156 . En utilisant ces stratégies et techniques, les enfants peuvent comprendre et mémoriser plus facilement le sens de ce qu'ils lisent. L'automaticité de la lecture:
 La plupart des théories sur l'acquisition de la lecture établissent une distinction entre les processus liés au décodage mot écrit/son et les processus liés au déchiffrage du sens du texte (compréhension)  (Wagner, 1993). 155. Voir Chall (1967, 1996) L'automaticité résulte principalement d'une longue pratique de la lecture, souvent sur plusieurs années, et n'est donc ni immédiate ni rapide . Elle peut toutefois découler de l'application de règles et stratégies simples de décodage. En anglais, les jeunes lecteurs capables de reconnaître des modèles phonologiques, comme d-og, l-og, f-og, arrivent facilement à prononcer des mots peu familiers comme c-og, voire des mots qui n'ont pas de sens comme m-og. Les évaluations qui mesurent la rapidité avec laquelle les lecteurs débutants sont capables d'identifi er les sons des lettres, les mots charnières et les mots dépourvus de sens mesurent, par conséquent, la capacité de décodage automatique. En général, les mesures de la maîtrise relative et de l'automaticité du décodage chez les lecteurs débutants sont de bons facteurs prédictifs d'un apprentissage rapide de la lecture  . Durant de nombreuses décennies, enseignants et autres acteurs ont débattu de la nature et de l'acquisition de la lecture dans une seconde langue, à l'instar des discussions sur le bilinguisme. Ces débats vont de la « confusion linguistique » qu'entraîne l'apprentissage pendant l'enfance, lorsque les enfants parlent plus d'une langue à la maison, à une controverse similaire concernant le stade, plus ou moins précoce, auquel l'apprentissage de la lecture dans une seconde langue devrait intervenir dans les programmes scolaires. Les politiques liées au choix des langues, dans les pays où ces questions peuvent provoquer de vives controverses, ajoutent à la tension. Même si ces débats dépassent le champ de la présente étude, les évaluations de la lecture dans la première langue (L1) et dans la seconde langue (L2) ont une place importante dans la présente discussion, dans la mesure où beaucoup d'enfants dans les PMA sont confrontés à cette réalité multilingue, bien plus fréquemment que dans la plupart des pays de l'OCDE 162 ."
"Developing Automaticity in Children with Learning Disabilities: A Functional Perspective Part Two: Programme Methods and Materials","https://scispace.com/paper/developing-automaticity-in-children-with-learning-2lw2iaie4m","2017","Book Chapter","","Charles Potter","10.5772/INTECHOPEN.72052","https://scispace.com/pdf/developing-automaticity-in-children-with-learning-2lw2iaie4m.pdf","This chapter is the second of two chapters in this book to describe an instructional programme based on Luria's theories, which can be used to develop basic skills and automaticity in reading, writing, and spelling. The first chapter focused on the programme's theory, and then described how assessment is used to develop an individual programme relating to both basic skill and fluency needs in reading, writing, and spelling. The process was illustrated with one detailed case study. The results of this case study (Child 1) are presented in the current chapter, together with the results of 13 children exposed to similar fluency-based interventions. The results of six children exposed to one or more systematic variations in programme implementation are then discussed. Case contrast analysis is used to highlight three variables affecting successful programme implementation, namely: consistent and regular exposure to phonological and phonic instruction to provide a foundation of basic skills on which the fluency interventions in the programme can be built; consistent implementation of methods designed to improve both reading fluency, and writing and spelling fluency, to produce the greatest likelihood of positive effects; and consistent support from parents in programme implementation to produce the greatest likelihood of positive effects.","Title: Developing Automaticity in Children with Learning Disabilities: A Functional Perspective Part Two: Programme Methods and Materials Authors: Charles Potter Keywords: reading difficulties, dyslexia, reading fluency, writing and spelling fluency, automaticity, rate of work, analytical phonics, large print, repeated reading, visual tracking, sequential spelling"
