"Paper Title","Paper Link","Publication Year","Publication Type","Publication Title","Author Names","DOI","PDF Link","Abstract","Relevant Excerpt"
"Intuition and insight: two concepts that illuminate the tacit in science education","https://scispace.com/paper/intuition-and-insight-two-concepts-that-illuminate-the-tacit-4rrfbxzoox","2015","Journal Article","Studies in Science Education","Richard Brock","10.1080/03057267.2015.1049843","https://scispace.com/pdf/intuition-and-insight-two-concepts-that-illuminate-the-tacit-4rrfbxzoox.pdf","Tacit knowledge, that is knowledge not expressible in words, may play a role in learning science, yet it is difficult to study directly. Intuition and insight, two processes that link the tacit and the explicit, are proposed as a route to investigating tacit knowledge. Intuitions are defined as tacit hunches or feelings that influence thought with little conscious effort. This paper examines conceptualisations of intuition as embodied cognition, and as abstracted rules before examining reports of intuition in the work of scientists and in science education. Insight is described as an explicit awareness of novel relations between concepts that arrives with little conscious control. Insight is related to rapid conceptual change and the development of conceptual connections. Reports of insight in the work of scientists and in the science classroom are discussed. The manner in which insight and intuition may promote and hinder learning is considered and conditions that affect the use of both processes are sug...","some degree depend to the density of observation of conceptual change. The use of a microgenetic research method, which has a high density of observations relative to the phenomenon being investigated , may help to provide a clearer picture of the rate of conceptual change. Insight in science education research: insight as sudden conceptual change:
 However, though conceptual change may generally be incremental, there is some evidence that sudden changes occur. Indeed,  does not rule out abrupt restructuring, instead it is argued that it 'does not appear to be the usual road to conceptual change. ) also make the case that 'a flash of insight, is the exception rather than the rule.' Learning may turn out to be a mix of many processes, of gradual accretion of knowledge and of 'false starts, relapses to intuitive conceptions and, occasionally, highly motivating and personally significant experiences of insight-when everything suddenly ''clicks together""' . Sudden moments of conceptual restructuring have been neglected in the research to date, perhaps due to their comparative infrequency, and the high density of observation required to capture them. Moments of insight, though rare, may none-the-less be highly significant moments in a learner's experience and repay the significant difficulties of investigating their properties more closely. Insight in science education research: insight as sudden conceptual change:
 It is possible to find some reports of rapid conceptual change in the science education literature. One kind of rapid conceptual change involves an alteration in the conceptualisation of a problem. Insight has been linked to a change in problem representation .  describe how a group of students solving a problem became stuck in a particular frame (a particular representation of the problem) for 15 minutes before being able to shift their interpretation sufficiently to solve the problem. In  example of the spring problem, discussed in detail below, the process of breaking away from a particular conceptualisation is argued to be a significant skill: 'In order to generate an analogy… the subject must break away from the original problem context' . An example of a rapid reconceptualisation of a problem is seen in . Natalie, a student studying the phases of the moon, has an insight following another student's elaboration of which part of the illuminated moon is visible: 'Natalie: Ah! One moment, (takes Rose's hand away from the representation) the moon doesn't really get larger and smaller, it's simply what we see. We see only the illuminated part' .  describes this as an ""Aha"" moment, a moment of meaningful insight, and argues it follows a representational innovation: the addition of a straight line to a diagram enables the student to understand that the moon does not alter in size, only in illumination. A shift in perception of the diagram has caused a sudden leap in understanding, as is reported in problem restructuring of insight problems . Another reported moment of insight again involves a change in understanding of a representation. In an unpublished Master's thesis,  describes the case of students studying velocity time graphs by using data loggers and their subsequent whiteboard presentations to their peers."
"Neural Correlates of Learning from Induced Insight: A Case for Reward-Based Episodic Encoding.","https://scispace.com/paper/neural-correlates-of-learning-from-induced-insight-a-case-1ex8imqur9","2016","Journal Article","Frontiers in Psychology","Jasmin M. Kizilirmak
Hannes Thuerich
Kristian Folta-Schoofs
Bjoern H. Schott
Bjoern H. Schott
Alan Richardson-Klavehn","10.3389/FPSYG.2016.01693","https://scispace.com/pdf/neural-correlates-of-learning-from-induced-insight-a-case-1ex8imqur9.pdf","Experiencing insight when solving problems can improve memory formation for both the problem and its solution. The underlying neural processes involved in this kind of learning are, however, thus far insufficiently understood. Here, we conceptualized insight as the sudden understanding of a novel relationship between known stimuli that fits into existing knowledge and is accompanied by a positive emotional response. Hence, insight is thought to comprise associative novelty, schema congruency, and intrinsic reward, all of which are separately known to enhance memory performance. We examined the neural correlates of learning from induced insight with functional magnetic resonance imaging (fMRI) using our own version of the Compound-Remote-Associates-Task (CRAT) in which each item consists of three clue words and a solution word. (Pseudo-)Solution words were presented after a brief period of problem-solving attempts to induce either sudden comprehension (CRA items) or continued incomprehension (control items) at a specific time point. By comparing processing of the solution words of CRA with control items, we found induced insight to elicit activation of the rostral anterior cingulate cortex / medial prefrontal cortex (rACC/mPFC) and left hippocampus. This pattern of results lends support to the role of schema congruency (rACC/mPFC) and associative novelty (hippocampus) in the processing of induced insight. We propose that (1) the mPFC not only responds to schema-congruent information, but also to the detection of novel schemata, and (2) that the hippocampus responds to a form of associative novelty that is not just a novel constellation of familiar items, but rather comprises a novel meaningful relationship between the items—which was the only difference between our insight and no insight conditions. To investigate episodic long-term memory encoding, we compared CRA items whose solution word was recognized 24h after encoding to those with forgotten solutions. We found activation in the left striatum and parts of the left amygdala, pointing to a potential role of brain reward circuitry in the encoding of the solution words. We propose that learning from induced insight mainly relies on the amygdala evaluating the internal value (as an affective evaluation) of the suddenly comprehended information, and striatum-dependent reward-based learning.","study. Such a psychophysiological measure would be of particular interest when comparing ""aha!"" and ""non-aha!"" items, and future research should be aimed at differentiating objective and subjective insight manipulations also at the level of psychophysiology. CONCLUSION:
 The findings of the current study suggest that encoding of solutions to verbal riddles is more successful when the solution is comprehended suddenly (CRA = induced insight) as compared to continued incomprehension (control). We further found that induced insight was associated with higher activation of several frontal, temporal, and parietal brain regions of which we would like to point out the hippocampus and mPFC. The hippocampus has been known to be involved in associative novelty, however, never in the sense of detecting a novel meaningful combination of known items (insight condition) as compared to just a novel combination of known items (control condition). Thus, the hippocampus may play a special role during insight processing, by detecting novel meaningful relationships. The mPFC on the other hand has been associated with detecting schemaconsistency and may be associated with the detection that a novel meaningful relationship is consistent with existing knowledge. Regarding the neural correlates of successful encoding of CRA items, our current findings suggest that (1) the positive emotional response toward sudden comprehension (insight) as reflected by higher activation of the amygdala and (2) intrinsic reward as reflected by higher activations of the striatum play key roles in learning from insight. Our findings suggest that encoding insightrelated information is different from the encoding of non-insight related information, because it seems to rely on reward learning, which is not typical for information that is not associated with external rewards. We would therefore propose that insight, that is, sudden comprehension of a solution, may itself be rewarding, thereby facilitating LTM encoding of insight-related information."
"Acute Exercise and Creativity: Embodied Cognition Approaches","https://scispace.com/paper/acute-exercise-and-creativity-embodied-cognition-approaches-407pfm7nlx","2019","","","Emily M. Frith","","https://scispace.com/pdf/acute-exercise-and-creativity-embodied-cognition-approaches-407pfm7nlx.pdf","..................................................................................................................................ii DEDICATION........................................................................................................................iii LIST OF ABBREVIATIONS AND SYMBOLS...........................................................................iv ACKNOWLEDGMENTS...............................................................................................................v LIST OF TABLES.......................................................................................................................viii LIST OF FIGURES........................................................................................................................ix CHAPTER I: TOWARDS A BOXED PANOPLY MODEL OF CREATIVE COGNITION: PLAUSIBLE MECHANISMS AND FUTURE RESEARCH IDEAS...........................................1 CHAPTER II: SYSTEMATIC REVIEW OF THE PROPOSED ASSOCIATIONS BETWEEN PHYSICAL EXERCISE AND CREATIVE THINKING.............................................................42 CHAPTER III: THE KINESTHETICS OF CREATIVITY: POTENTIAL PATHWAYS INFLUENCED BY EXERCISE....................................................................................................68 CHAPTER IV: A REVIEW OF EXPERIMENTAL RESEARCH ON EMBODIED CREATIVITY: REVISITING THE MIND-BODY CONNECTION...........................................95 CHAPTER V: EXPERIMENTAL STUDIES............................................................................134 I. EXPERIMENT V.I: EXPERIMENTAL EFFECTS OF ACUTE EXERCISE AND MUSIC LISTENING ON COGNITIVE CREATIVITY............................................................................................................134 II. EXPERIMENT V.II: IS ENGAGEMENT IN PHYSICAL ACTIVITY AND CREATIVE ACTIVITY MUTUALLY EXCLUSIVE? AN EVALUATION OF","in SPSS (v. 25. A repeated measures ANOVA (RM-ANOVA) was used to evaluate creativity performance differences across the three experimental differences. Three separate RM-ANOVAs were computed, one for each insight category. Statistical Analyses:
 Statistical significance was set at an a-priori alpha of 0.05. Results:
 Participant demographic characteristics are displayed in Table  (N=20). On average, participants were 21 years-old, with the majority of participants being male (60%), right-hand dominant (80%), and non-Hispanic Caucasian (75%). Results:
 Results from the three RM-ANOVA's conducted to examine differences between the three experimental conditions (CO, EBI, EDI) and three domains of insight performance (verbal, mathematical, and spatial) are shown in Table . Of the three analytic models that were conducted to examine the proposed temporal effects of acute exercise on creativity, all models demonstrate no statistically significant temporal effects. That is, average insight creativity scores were similar across the three exercise manipulations: verbal insight (F(2,18)=.689, p=.51), mathematical insight (F(2,18)=.033, p=.97), and spatial insight F(2,18)=1.0, p=.38 performance. Results:
 Taken together, seated rest, exercising before solving insight creativity problems, and exercising during solving insight tasks do not appear to effectuate meaningful differences on insight performance within the same individuals. Further analyses indicated that the proportion of correct versus incorrect responses were not different across conditions, with all p-values >.05. Results:
 There were also no statistically significant differences in task difficulty across experimental conditions (data not shown; all p-values >.05). Discussion:
 Previous insight creativity research highlights the importance of efficient memory search and retrieval, prefrontal cortex activity, and coordinated executive functions for successful problem-solving performance  . Creative insight is but one of the many subprocesses of the creative mind  . A moment of insight is commonly described as a shift from the unknown to the sudden arrival at the solution that is perceived to be true, with a correspondingly powerful, ""Aha"" moment or ""Eureka"" experience  . Creative insight is not as ubiquitously researched as divergent creative thinking, particularly because Aha experiences are quite difficult to pinpoint  , and thus, evaluate in a laboratory session. However, the purpose of this experiment was not to isolate individual perceptions of Aha moments, but rather to evaluate participants' ability to accurately solve a variety of insight tasks. Both long-term and acute exercise protocols, as well as exercise during and immediately prior to verbal  , mathematical  , and spatial  cognitive tasks have been shown to facilitate cognitive performance. Discussion:
 Therefore, the primary aim of this study was to be the first to compare the efficacy of seated rest, or treadmill walking either before, or during insight problem-solving, on the number of correct verbal, mathematical, and spatial insight task solutions."
"Transitive inference after minimal training in rhesus macaques (Macaca mulatta).","https://scispace.com/paper/transitive-inference-after-minimal-training-in-rhesus-34yqewuz8m","2020","Posted Content","Journal of experimental psychology. Animal learning and cognition","Greg Jensen
Fabian Munoz
Anna Meaney
Herbert S. Terrace
Vincent P. Ferrera","10.31234/OSF.IO/EP92D","https://scispace.com/pdf/transitive-inference-after-minimal-training-in-rhesus-34yqewuz8m.pdf","Rhesus macaques, when trained for several hundred trials on adjacent items in an ordered list (e.g., A > B, B > C, C > D), are able to make accurate transitive inferences (TI) about previously untrained pairs (e.g., A > C, B > D). How that learning unfolds during training, however, is not well understood. We sought to measure the relationship between the amount of TI training and the resulting response accuracy in 4 rhesus macaques using seven-item lists. The training conditions included the absolute minimal case of presenting each of the six adjacent pairs only once prior to testing. We also tested transfer to nonadjacent pairs with 24 and 114 training trials. Because performance during and after small amounts of training is expected to be near chance levels, we developed a descriptive statistical model to estimate potentially subtle learning effects in the presence of much larger random response variability and systematic bias. These results suggest that subjects learned serial order in an incremental fashion. Thus, rather than performing transitive inference by a logical process, serial learning in rhesus macaques proceeds in a manner more akin to a statistical inference, with an initial uncertainty about list position that gradually becomes more accurate as evidence accumulates. (PsycInfo Database Record (c) 2021 APA, all rights reserved).","became progressively more dominant as training progressed, until subject performance at trial 114 was overwhelmingly better described by RL-Elo. In every case, RL-Elo did a better job of describing performance during the testing block, regardless of amount of training. Implications for Learning in General:
 Subjects generally benefitted from training, a result that is not in itself surprising. However, several features of their performance are noteworthy. The extent of training corresponded to between four-and fivefold increases in the number of trials, but the gains observed in overall response accuracy (as captured by β ∅ ) grew in an approximately linear fashion as a function of training. This pattern is consistent with an ""accumulation of evidence"" account of improving performance, as the rate at which new observations can contribute to the estimate of a mean is at most a factor of √ n, given n observations. Since each subject displayed a different slope, we can infer that subjects differed in the information content they were able to extract from a single trial. Dramatic individual differences were observed, and this has implications for experimental methodology. Most studies using animal models make use of extensive training, often consisting of thousands or tens of thousands of trials. Under an ""evidence accumulation"" framework, this is expected to drive subjects toward ceiling performance, which may serve to conceal individual differences that may have been more evident early in learning. This approach likely also suffers from diminishing returns. If subjects reliably show evidence of learning after mere dozens of trials, the time spent collecting thousands of trials of data might be better served by training subjects on multiple lists per day. When trying to understand the underlying learning process, having many examples of learning (e.g. multiple lists, each trained separately) generally yields more statistical power than having many trials in a single context (e.g. training a single list until asymptotic performance is reached). Implications for Learning in General:
 Although the majority of studies of learning processes in non-human subjects focus on asymptotic behavior after extensive training, an undercurrent of results continues to suggest that subjects display detectable evidence of learning even from the earliest trials of training, provided one has sufficient evidence to separate the signal from the noise. These results are in no way limited to serial learning studies. Even at the height of associative learning theory's popularity,  argued persuasively that there was unambiguous evidence for single-trial learning. Pigeons foraging for rewards under concurrent operant schedules are sensitive to differential rewards after only one or two reward deliveries . Even goldfish learning to anticipate the timing of an uncomfortable shock display a peak in conditioned responding during the very earliest trials of training, long before ""conditioning"" is commonly thought to have had a chance to materialize . Single-trial learning effects have also been detected in the learning supported by the limbic system , and cerebellum . The possibility that subjects can measurably extract information from single experiences places important constraints on the learning models we should consider plausible, as well as on the varieties of neural circuitry that could implement such learning in the brain ."
"Detecting learning moment-by-moment","https://scispace.com/paper/detecting-learning-moment-by-moment-1hwzn3mtnz","2011","Proceedings Article","Artificial Intelligence in Education","Ryan S. Baker
Adam B. Goldstein
Neil T. Heffernan","10.3233/JAI-2011-015","https://scispace.com/pdf/detecting-learning-moment-by-moment-1hwzn3mtnz.pdf","Intelligent tutors have become increasingly accurate at detecting whether a student knows a skill, or knowledge component (KC), at a given time However, current student models do not tell us exactly at which point a KC is learned In this paper, we present a machine-learned model that assesses the probability that a student learned a KC at a specific problem step (instead of at the next or previous problem step) We use this model to analyze which KCs are learned gradually, and which are learned in ""eureka"" moments We also discuss potential ways that this model could be used to improve the effectiveness of cognitive mastery learning","n-1 ) -0.0605 Constant term + 0.0957 RESULTS:
 One interesting aspect of this model (and the original labels) is that the overall chance of learning a KC on any single step is relatively low within the two tutors. However, there are specific circumstances where learning is higher. Within both systems, many of these circumstances correlate to time spent, and the student's degree of persistence in attempting to respond. In addition, in both systems, there is a positive correlation associated with an incorrect answer, potentially suggesting that students learn by making errors and then considering why the answer was incorrect. In particular, within the Cognitive Tutor, larger numbers of past errors appear to predict more current learning than larger numbers of past help requests. This result appears at a surface level to be in contrast to the findings from , but is potentially explained by the difference between learning from requesting help once -the grain-size studied in  -and learning from requesting the same help sequence many times across problems. It may be that learning from errors  is facilitated by making more errors, but that learning from help does not benefit from reading the same help multiple times. Another possible explanation for this difference is that the help studied in  was much briefer than the multi-step problem-solving hints used in the Cognitive Tutor and ASSISTments studied here. STUDYING THE SPIKINESS OF STUDENT LEARNING:
 A key way that the model presented here can be scientifically useful is through its predictions, as components in other analyses. Machine-learned models of gaming the system, off-task behavior, and contextual slip have proven useful as components in many other analyses (cf. . Models of the moment of student learning may turn out to be equally useful. STUDYING THE SPIKINESS OF STUDENT LEARNING:
 One research area that models of the moment of student learning may shed light on is the differences between gradual learning (such as strengthening of a memory association) and learning given to ""eureka"" moments, where a KC is understood suddenly (cf. . Predictions of momentary learning for a specific student and KC can be plotted, and graphs which are ""spiky"" (e.g. which have sudden peaks of learning) can be distinguished from flatter graphs, which indicate more gradual learning. Examples of students' experiencing gradual learning and eureka learning are shown in Figure . The degree to which learning involves a eureka moment can be quantified through a measure of ""spikiness"", defined as the maximum value of P(J) for a student/KC pair, divided by the average value of P(J) for that same student/KC pair. This measure of spikiness is bounded between 1 (minimum spikiness) and positive infinity (maximum spikiness). Below we will detail the analysis of spikiness in the data from both the Cognitive Tutor and ASSISTments, first at the KC level and then at the student level. As a quick note, it is worth mentioning that the graph on the left in Figure  shows two spikes, rather than just one spike. This pattern was fairly common in both data sets. Investigating this phenomenon is out of the scope of the current paper, but understanding why some spiky graphs have two spikes, and others have just one, will be an interesting and potentially fruitful area for future investigation."
