"Paper Title","Paper Link","Publication Year","Publication Type","Publication Title","Author Names","DOI","PDF Link","Abstract","Relevant Excerpt"
"Beyond the blank slate: routes to learning new coordination patterns depend on the intrinsic dynamics of the learner—experimental evidence and theoretical model","https://scispace.com/paper/beyond-the-blank-slate-routes-to-learning-new-coordination-5460ftjlbr","2012","Journal Article","Frontiers in Human Neuroscience","Viviane Kostrubiec
Pier-Giorgio Zanone
Armin Fuchs
J. A. Scott Kelso","10.3389/FNHUM.2012.00222","https://scispace.com/pdf/beyond-the-blank-slate-routes-to-learning-new-coordination-5460ftjlbr.pdf","Using an approach that combines experimental studies of bimanual movements to visual stimuli and theoretical modeling, the present paper develops a dynamical account of sensorimotor learning, that is, how new skills are acquired and old ones modified. A significant aspect of our approach is the focus on the individual learner as the basic unit of analysis, in particular the quantification of predispositions and capabilities that the individual learner brings to the learning environment. Such predispositions constitute the learner’s behavioral repertoire, captured here theoretically as a dynamical landscape (‘intrinsic dynamics’). The learning process is demonstrated to not only lead to a relatively permanent improvement of performance in the required task —the usual outcome— but also to alter the individual’s entire repertoire. Changes in the dynamical landscape due to learning are shown to result from two basic mechanisms or “routes”: bifurcation and shift. Which mechanism is selected depends both on the initial individual repertoire before new learning begins and the task to be learned. Both bifurcation and shift mechanisms are accommodated by a dynamical model, a relatively straightforward development of the well-established HKB model of movement coordination. Model simulations show that although environmental or task demands may be met equally well using either mechanism, the bifurcation route results in greater stabilization of the to-be-learned behavior. Thus stability not (or not only) error is demonstrated to be the basis of selection, both of a new pattern of behavior and the path (smooth shift versus abrupt qualitative change) that learning takes. In line with these results, recent neurophysiological evidence indicates that stability is a relevant feature around which brain activity is organized while an individual performs a coordination task. Finally, we explore the consequences of the dynamical approach to learning for theories of biological change.","ways. When the initial state of observers and the usefulness of perceptual variables are taken into account, learning can be understood as a predictable path through a perceptual space . Here again, individual predispositions open a window into general rules for behavioral change. DISCUSSION:
 Learning has long been associated with higher cognitive functions such as memory and attention. However, memory and attention have been studied separately and are, to date, associated with learning in no explicit fashion. Here, these cognitive functions may be coherently put back into relation by virtue of the fundamental dynamical notion of stability. Our findings indicate that the key argument is whether there is gain in stability with learning or not. In the case of the bifurcation route only is there any gain in stability, accompanied with a drop in attentional cost and the persistence of learned patterns in memory. In contrast, with the shift route, there is no gain in stability, no drop in attentional cost and no permanent storage in memory. DISCUSSION:
 The foregoing conclusions are significantly backed up by theoretical modeling. In computer simulations, the creation of a novel attractor required by the learning task is captured by the Fourier development of the model skeleton, suggesting that the novel attractor arises through the very same bifurcation mechanism that governs change within the initially stable spontaneous patterns (viz. intrinsic dynamics). Such a skeleton creates the possibility of generating a series of maximally distant, symmetrically distributed attractors, each characterized by lower and lower stability. These internal constraints on the location, order and relative stability of the created attractors affect the effect of the von Mises distributions that formalize the shift route to learning. A key lesson is that learning emerges from a generic, internal rule (i.e., bifurcation) pertaining to the skeleton that is finely tuned as a function of its initial state, particular to each individual. Thus, for the first time to our knowledge, general and individual features of learning, as well as the learner's spontaneous and acquired capabilities are reconciled within a single model. DISCUSSION:
 This model also reconciles two, apparently opposite descriptions of how learning is supposed to progress: learning by a gradual accumulation of tiny barely discernible steps is captured here by the shift route, whereas learning by abrupt changes, reminiscent of learning by insight  corresponds to the bifurcation route. Continuous improvement points to the commonality of processes governing behavioral change of all living forms, whereas abrupt changes focus attention on individual specificities allowing qualitative transformations. DISCUSSION:
 The specificity of the bifurcation route is to generate qualitative change in an initially bistable behavioral repertoire by adding new stable patterns. Bifurcation may thus be conceived as a dynamical mechanism for novelty. The selection of novel coordination patterns stabilized at specific values of relative phase is an instance of selection via instability an dm a ybe seen as a primordial mechanism without which further adaptive change may not be possible. Why is it so? By enriching the behavioral repertoire at maximally distant values of relative phase, the bifurcation mechanism establishes the best conditions for the shift mechanism to operate. When environmentally required and preexisting patterns are close enough, their influences cooperate and learning by shift is favored. When the required and preexisting patterns are far apart, they enter into competition with each other, which leads to instabilities, hence to novel pattern creation."
"Predatory Sequence Learning for Synthetic Characters","https://scispace.com/paper/predatory-sequence-learning-for-synthetic-characters-1ljv0qjhd5","2003","Dissertation","","Matthew Roberts Berlin","","https://scispace.com/pdf/predatory-sequence-learning-for-synthetic-characters-1ljv0qjhd5.pdf","The process of mammalian predatory sequence development offers a number of insights relevant to the goal of designing synthetic characters that can quickly and easily learn complicated and interesting behavior. We propose a number of principles for designing such learning systems, inspired by a targeted review of animal developmental phenomena, with particular emphasis on the development of predatory behavior in certain felid and canid species. We describe the implementation of a few of these principles as an extension to a popular algorithm for learning in autonomous systems called hierarchical Q-learning. In this new approach, the agent starts out with only one skill, and then new skills are added one at a time to its available repertoire as time passes. The agent is motivated to experiment thoroughly with each new skill as it is introduced. Simulation results are presented which empirically demonstrate the advantages of this new algorithm for the speed and effectiveness of the learning process. Thesis Supervisor: Bruce M. Blumberg Title: Associate Professor of Media Arts and Sciences","that that property is causal to their success. The justification for all of these lessons ultimately lies in the advantages that they offer for machine learning. These advantages will be explored further throughout the rest of this thesis, both theoretically and in some cases experimentally. Lessons for Designing Learning Systems:
 It should also be noted that these lessons could have been arrived at through an analysis of synthetic learning systems directly, without ever having looked at animal behavior. However, I firmly believe that my focus on animal development greatly facilitated the formulation of these lessons. Furthermore, animal development provides a rich framework for understanding and contextualizing these lessons, as well as for reasoning about how to implement them synthetically. Hopefully, it will also make it easier to extrapolate from them to powerful new design principles in the future. Animals are remarkably capable learners, and by identifying more fully the characteristics of their success, we can arrive at a better understanding of our own goals as designers. Lessons for Designing Learning Systems:
 We proceed by examining each of these lessons in greater detail, highlighting observations from animal development that support these design principles and discussing their applicability to computational learning systems. Not how to learn, but what to learn and when.:
 The question of what to learn and when is often just as important as the question of how to learn, but it has received much less attention in computational learning research. Timing is everything in animal learning. Animal learning throughout development is not a continuous process, but rather highly discrete, consisting of overlapping episodes of highly specialized learning. Animals learn very different things at different points in their development. They are adept at learning when the environment is ready to teach, as if they were ""looking for"" the requisite information when it is most likely to be available and easiest to acquire. As an example, many different species learn about their allies while in the nest, under the protective custody of their mothers, and subsequently learn about their enemies when they leave or begin to venture out of the nest. In a similar vein, rats learn to be choosy about their food when they start finding it for themselves, and not while they are suckling, when their only available food source is their mother's milk . Not how to learn, but what to learn and when.:
 The developing animal brain seems to be a system of numerous learning specialists that turn on and off at remarkably appropriate moments during the creature's life. The underlying phenomenon behind this system of specialists is the fairly well-known idea of the sensitive period. Sensitive periods were originally termed ""critical periods,"" and the original concept was of a critical period for certain types of learning, characterized by a sudden onset, a sudden offset, and by the irreversibility of learning. Each of these three characteristics has been the subject of significant debate, leading to the more recent, less committed idea of a ""sensitive period"": a period of augmented sensitivity to a particular type of experience, with a potentially gradual onset and offset, and with consequences that can sometimes be changed as a result of experience later in life. The onset and offset of a sensitive period do not have to be controlled by the same mechanism. For example, the onset of a particular sensitive period might be timed by an internal clock, whereas the offset might be based on experience . While the details may be controversial, the core idea is not generally contested: animals are often particularly sensitive to certain types of experience during specific periods in their development."
"As especificidades humanas e a aprendizagem: relações entre cognição, afeto e cultura","https://scispace.com/paper/as-especificidades-humanas-e-a-aprendizagem-relacoes-entre-37kls2mih1","2011","Journal Article","Psicologia Usp","Maria Isabel da Silva Leme","10.1590/S0103-65642011005000028","https://scispace.com/pdf/as-especificidades-humanas-e-a-aprendizagem-relacoes-entre-37kls2mih1.pdf","O artigo tem por objetivo discutir questoes que periodicamente provocam polemica na Psicologia da Aprendizagem, que sao as relacoes entre cognicao, cultura e afeto e as especificidades humanas nesses processos. Assim, a aprendizagem e discutida em termos de processos partilhados com outras especies, como a associacao e a recursividade, e outros que sao especificamente humanos, como a abstracao e a metacognicao. Sao examinadas algumas hipoteses sobre como a mente humana pode ter evoluido em direcao a essas diferencas. Na conclusao, e explicitado o posicionamento sobre as relacoes entre cognicao, cultura e afeto, em dois niveis de funcionamento psicologico e da influencia decisiva da cultura e seu principal instrumento, a linguagem, na promocao das especificidades humanas.","Keywords: ds: ds: Learning, Cognition, Affect, Culture Introduction:
 Important issues related to learning, like which psychological processes are exclusively human and the relation between cognition and affect face recurring controversy .It is likely that this debate happens, at least in part, due to problems of definition of the phenomenon being discussed. As De Waal and Ferrari (2010) point out as an example, imitation, has been progressively defined as a mental process subordinate to other superior processes, like understanding the objective of the action to be imitated. In this sense, these authors see beyond much inaccuracy in the definition of cognitive capacities, problems in its measurement, which, in our point of view, is closely related to the discussion about the relation between affect and cognition. Introduction:
 Aspects considered by researchers as distinctively human vary from language to habits of cooking food, including the ability to mentally travel in time, theory of mind, imitation and others . As it will be opportunely analyzed regarding the relation between cognition and affect, one can discern antagonistic positions between researchers besides little concern with a precise definition of the processes being investigated. However, what is ascertained in both discussions is that these analysis are based on different theoretical conceptions about psychological functioning, as well as what regards to the issue of psychological continuity between species, as postulated by Darwin . Therefore, in many conceptions about human specificity, one observes the absence of concern with underlying mental operations that allow for its materialization. In a similar way, many authors of these proposals are not concerned with the implications of postulating total discontinuity between humans and other species. The objective of this article is precisely to discuss these positions, valuing the involved mental operations and consequently, the issue of continuity between species. Introduction:
 Thus, it will initially be clarified, how and from what point of view important processes for these human specificities are defined, starting from learning and proceeding to the relation between cognition, affect and culture. It is important to point out that the main concern of this article is not to identify a psychological characteristic that is distinctively human, but, rather, to go beyond this and analyze its implications, that is, the issue of continuity between species and the role of culture concerning mental processes, pointing issues that need to be clarified in these explanations. Learning, cognition and its evolution:
 Learning, defined as a lasting process of change and produced by experience, has a strong adaptive nature in virtue of an advantage conferred to organisms that modify themselves in response to what is experienced in the environment. As an adaptive process, learning occurs in most species and has a potential for modification through experience transmitted to the next generations. This potential for modification due to what is experienced may promote variability between individuals and populations . However, what is least remembered -except by theorists like the behaviorists -is that learning may also promote similarity between species. This is due to the fact that similarity does not only come from shared ancestry, but also from common selective pressures; as is argued in phylogenetic studies. These studies further state that the learning processes tend to be of a most stable and general nature, as is seen in association, which is present in all bilateral species. Research data from biologists show that natural selection acted more frequently in other processes associated to learning, such as: sensorial, motor and motivational, allowing for the evolution of new behavioral capacities ."
"La particularidades humanas y el aprendizaje: las relaciones entre la cognición, afecto y cultura","https://scispace.com/paper/la-particularidades-humanas-y-el-aprendizaje-las-relaciones-2t0n8a1m46","2011","Journal Article","Psicologia Usp","Maria Isabel da Silva Leme","10.1590/S0103-65642011005000028","https://scispace.com/pdf/la-particularidades-humanas-y-el-aprendizaje-las-relaciones-2t0n8a1m46.pdf","O artigo tem por objetivo discutir questoes que periodicamente provocam polemica na Psicologia da Aprendizagem, que sao as relacoes entre cognicao, cultura e afeto e as especificidades humanas nesses processos. Assim, a aprendizagem e discutida em termos de processos partilhados com outras especies, como a associacao e a recursividade, e outros que sao especificamente humanos, como a abstracao e a metacognicao. Sao examinadas algumas hipoteses sobre como a mente humana pode ter evoluido em direcao a essas diferencas. Na conclusao, e explicitado o posicionamento sobre as relacoes entre cognicao, cultura e afeto, em dois niveis de funcionamento psicologico e da influencia decisiva da cultura e seu principal instrumento, a linguagem, na promocao das especificidades humanas.","Keywords: ds: ds: Learning, Cognition, Affect, Culture Introduction:
 Important issues related to learning, like which psychological processes are exclusively human and the relation between cognition and affect face recurring controversy .It is likely that this debate happens, at least in part, due to problems of definition of the phenomenon being discussed. As De Waal and Ferrari (2010) point out as an example, imitation, has been progressively defined as a mental process subordinate to other superior processes, like understanding the objective of the action to be imitated. In this sense, these authors see beyond much inaccuracy in the definition of cognitive capacities, problems in its measurement, which, in our point of view, is closely related to the discussion about the relation between affect and cognition. Introduction:
 Aspects considered by researchers as distinctively human vary from language to habits of cooking food, including the ability to mentally travel in time, theory of mind, imitation and others . As it will be opportunely analyzed regarding the relation between cognition and affect, one can discern antagonistic positions between researchers besides little concern with a precise definition of the processes being investigated. However, what is ascertained in both discussions is that these analysis are based on different theoretical conceptions about psychological functioning, as well as what regards to the issue of psychological continuity between species, as postulated by Darwin . Therefore, in many conceptions about human specificity, one observes the absence of concern with underlying mental operations that allow for its materialization. In a similar way, many authors of these proposals are not concerned with the implications of postulating total discontinuity between humans and other species. The objective of this article is precisely to discuss these positions, valuing the involved mental operations and consequently, the issue of continuity between species. Introduction:
 Thus, it will initially be clarified, how and from what point of view important processes for these human specificities are defined, starting from learning and proceeding to the relation between cognition, affect and culture. It is important to point out that the main concern of this article is not to identify a psychological characteristic that is distinctively human, but, rather, to go beyond this and analyze its implications, that is, the issue of continuity between species and the role of culture concerning mental processes, pointing issues that need to be clarified in these explanations. Learning, cognition and its evolution:
 Learning, defined as a lasting process of change and produced by experience, has a strong adaptive nature in virtue of an advantage conferred to organisms that modify themselves in response to what is experienced in the environment. As an adaptive process, learning occurs in most species and has a potential for modification through experience transmitted to the next generations. This potential for modification due to what is experienced may promote variability between individuals and populations . However, what is least remembered -except by theorists like the behaviorists -is that learning may also promote similarity between species. This is due to the fact that similarity does not only come from shared ancestry, but also from common selective pressures; as is argued in phylogenetic studies. These studies further state that the learning processes tend to be of a most stable and general nature, as is seen in association, which is present in all bilateral species. Research data from biologists show that natural selection acted more frequently in other processes associated to learning, such as: sensorial, motor and motivational, allowing for the evolution of new behavioral capacities ."
