"Paper Title","Paper Link","Publication Year","Publication Type","Publication Title","Author Names","DOI","PDF Link","Abstract","Relevant Excerpt"
"Transfer in Implicit Learning","https://scispace.com/paper/transfer-in-implicit-learning-4qeqomzhkq","2018","Journal Article","KnE Life Sciences","A Agafonov
A Kryukova
Y Shilov","10.18502/KLS.V4I8.3259","https://scispace.com/pdf/transfer-in-implicit-learning-4qeqomzhkq.pdf","The article describes the research, the aim of which is to discover the effect of transfer of the implicit knowledge of artificial grammar to solving of sensory-motor tasks. The article considers the role of implicit knowledge in actual cognitive activity. Forty volunteers took part in the experiment. Participants of the experiment wereimplicitly taught the rule of artificial grammar. At the control phase, the assignment consisted of solving the sensory-motor problem – to react to the appearance of the green or yellow circle by pressing a certain key. In the experimental group, the grammatical line always appeared before the green-colored circle was presented, and the ungrammatical line appeared before the yellow-colored circle. In the control group the color of the circle didn’t depend on the grammaticality of the line. As a result, we established the considerable reduction in the reaction time in the experimental group. Thus, the transfer of the implicitly learned knowledge of artificial grammar leads to enhancement of efficiency of sensory-motor activity. The implicit rule of artificialgrammar has acquired role of prime-stimulation. 
Keywords: implicit knowledge, implicit learning, artificial grammar learning, sensorymotor activity, transfer effect, priming","that because of the simplicity of the task they started thinking about the nature of relationship between the stimuli by the end of the control phase. Discussion: In other words, the participants started analyzing the information consciously, which, apparently, complicated its implicit use. Discussion:
 Thus, we detected a certain effect of transfer of the implicitly learned the rule of artificial grammar to solving of sensory-motor tasks. Within the framework of our research the said effect is expressed in a quicker reaction to the stimuli, related to the grammaticality of the lines, namely: the participants demonstrated a significantly shorter time of relevant reactions under presentation of target stimuli, in case green circles are preceded by grammar lines and yellow circles -by non-grammar lines. Discussion:
 The result of implicit solving of the task of classification of the lines is transferred to performance of the sensory-motor task. The transfer effect is best manifested in the second one-third of the control phase in the EG. Discussion:
 The observed effect is akin to the effect of semantic transfer, discovered by N.S. Discussion:
 Kudelkina and T.A. Sviridova. They suggested that in their experiment as the result of implicit analysis of the series of inception presentations the meaning of the conscious context of the tasks ('solvable/unsolvable'), in which the stimulus was presented, is transferred to the neutral unconscious stimulus. Consequently, the stimulus which was a priori semantically neutral, acquired the properties of a prime . Discussion:
 The transfer we discovered may also be regarded as a specific positive primingeffect in the sense that after implicit analysis of the series of presentations of the first one-third of the control phase in the EG the grammar lines became primes for the green-colored circles, the non-grammar lines became primes for the yellow-colored circles, contributing to speeding up of reaction. Discussion:
 The logic of emergence of the priming-effect may be described in the following manner. At first the participants implicitly take in the regularity of the related presentation of the stimuli. Then the unconscious realization of the fact, that it is a grammar line that is being demonstrated, actualizes the expectation of the green circle. Discussion:
 In its turn, this expectation suggests the existence of motor readiness to react in the corresponding way, that is, to press the key '←"". Appearance of a non-grammar line actualizes the expectation of the yellow circle and of the relevant motor set. Conclusions:
 The results obtained in the course of the conducted research in whole confirm the original hypothesis. We found the effect of transfer of the implicit knowledge of the rule of artificial grammar to the sensory-motor activity which is another type of cognitive activity, other than test classification in case of standard use of the experimental technique of 'artificial grammar learning'. In the experiment the effect manifested itself via reduction of the time of reaction to chromatic stimuli of two types, related to the grammaticality of the lines. The effect was preceded by the series of presentations. Conclusions:
 In the said series each grammatically correct line preceded the appearance of target stimuli of one type and each non-grammar line preceded the appearance of target stimuli of another type. The obtained results allow supposing that at first the participants needed to implicitly establish the type of lines and take in the regularity in accordance with which the type of the line is related to a certain target stimulus. This contributed to the enhancement of efficiency of performance of the sensory-motor task."
"Incidental, explicit, and implicit language learning during meaning-based exposure: Their effectiveness and relationship to individual cognitive abilities","https://scispace.com/paper/incidental-explicit-and-implicit-language-learning-during-3qytnisnig","2012","Dissertation","","Philippa Bell","","https://scispace.com/pdf/incidental-explicit-and-implicit-language-learning-during-3qytnisnig.pdf","Isolated grammar tasks develop different types of learning: incidental (pick up grammar), explicit (conscious learning) and implicit (unconscious learning). Cognitive abilities affecting the accuracy of these types of learning have been discussed (Robinson, 1997a). We know much less about learning during meaningful tasks, common in second language classrooms, during which language is used to understand or communicate information. This study employed tasks of this type to further knowledge of the: a.) incidental acquisition of form, b.) possibility of simultaneous explicit and implicit learning, c.) quantitative differences between explicit and implicit accuracy, d.) role of learner cognitive abilities on quantity and type of learning, and e.) effects of classification of type of learning on the results.
Eighty-one Anglophone adults completed two crosswords and two reading passages presented using a semi-artificial language (Rebuschat, 2008), which ensured experimental control, and between-participant equal vocabulary knowledge. After, participants completed a surprise, timed grammaticality judgement test to measure learning. Type of learning (explicit and/or implicit) was assessed using three awareness measures (confidence ratings, source attributions, and verbal reports). Participants’ working memory, inductive ability, processing speed, and verbal reasoning were measured. 
The results demonstrated participants incidentally acquired some of the language. The majority of participants (n = 63) learnt the language explicitly and implicitly, and explicit learning was slightly more accurate. Cognitive abilities were unrelated to incidental acquisition, and the accuracy of explicit and implicit learning. However, inductive ability predicted the quantity of language processed explicitly positively and implicitly negatively. 
The findings further knowledge of the effectiveness of incidental, explicit, and implicit learning during language use. They demonstrate for the first time that adults learn language form using explicit and implicit processing simultaneously when focused on meaning. The small differences in accuracy of explicit and implicit learning suggest that when learning form is a by-product of understanding, implicitly-learnt information may be as accurate as explicitly-learnt information. Furthermore, as cognitive abilities did not affect the accuracy of incidental, explicit, and implicit learning, learning form whilst using may not disadvantage certain learners. However, as ability to induce patterns affects how information is processed, learners may benefit from practising pattern induction.","them to work out the system (or to believe they had worked out the system). The inclusion of a delayed posttest could provide important information on the retention of learning, which coupled with longer exposure, would more accurately reflect how second languages are learnt. Limitations:
 A final limitation that I would like to raise relates to the test of learning. In the present study, a timed grammaticality judgement test (GJT) was used to measure learning. A GJT was used as it permits a wide range of syntactic patterns to be tested in a short period of time. In addition, a comprehension-based as opposed to production-based test was needed as the participants had not practised producing the language (DeKeyser & Sokalski, 1996). However, it has been argued that GJTs favour the use of explicit knowledge over implicit knowledge and that the rejection of ungrammatical items may be associated with explicit knowledge (R. . This is clearly problematic if the test is supposed to be measuring both explicit learning and implicit learning and, as such, a time limit was included in the present study as it has been argued that timed GJTs allow implicit knowledge to be used . Furthermore,  argued that responses on GJTs do not require the use of explicit structural knowledge (knowledge of the language system), but explicit judgement knowledge (knowledge that the item in the GJT is the same or different from items in the training phase). In other words, consciously rejecting an item on the GJT does not mean the knowledge used to reject the item has to be explicit. In my opinion, the use of a GJT was warranted in the present study, but it is important to interpret the results with this information in mind. Contributions and Future Directions:
 In this final section, I will present the contributions of this study in order to clarify our present state of knowledge and look towards future research directions. Contributions and Future Directions:
 In terms of incidental acquisition, this study demonstrated that whilst language is being used for comprehension to achieve a meaningful target outcome, adult participants were able to incidentally acquire some information concerning language syntax. Despite clear evidence that incidental acquisition occurs when learners interact with language for non-language related goals (e.g. content-based classrooms), this is the first study to document its occurrence with adults for an individual linguistic feature based on short, intense exposure requiring a nonlinguistic, meaningful outcome. It is now important to document this type of incidental acquisition with a natural language, with different linguistic features, and with different quantities of exposure that are distributed over time as opposed to massed as in the present study. Understanding these issues can provide information on how effective incidental acquisition can be, and whether its effectiveness depends on individual linguistic features. It can also shed light on the necessary/optimum quantity of input for the acquisition of grammatical features."
"The Emergence of Explicit Knowledge in a Serial Reaction Time Task: The Role of Experienced Fluency and Strength of Representation.","https://scispace.com/paper/the-emergence-of-explicit-knowledge-in-a-serial-reaction-pkwkgugl50","2017","Journal Article","Frontiers in Psychology","Sarah Esser
Hilde Haider","10.3389/FPSYG.2017.00502","https://scispace.com/pdf/the-emergence-of-explicit-knowledge-in-a-serial-reaction-pkwkgugl50.pdf","The Serial Reaction Time Task (SRTT) is an important paradigm to study the properties of unconscious learning processes. One specifically interesting and still controversially discussed topic are the conditions under which unconsciously acquired knowledge becomes conscious knowledge. The different assumptions about the underlying mechanisms can contrastively be separated into two accounts: single system views in which the strengthening of associative weights throughout training gradually turns implicit knowledge into explicit knowledge, and dual system views in which implicit knowledge itself does not become conscious. Rather, it requires a second process which detects changes in performance and is able to acquire conscious knowledge. In a series of three experiments, we manipulated the arrangement of sequential and deviant trials. In an SRTT training, participants either received mini-blocks of sequential trials followed by mini-blocks of deviant trials (22 trials each) or they received sequential and deviant trials mixed randomly. Importantly the number of correct and deviant transitions was the same for both conditions. Experiment 1 showed that both conditions acquired a comparable amount of implicit knowledge, expressed in different test tasks. Experiment 2 further demonstrated that both conditions differed in their subjectively experienced fluency of the task, with more fluency experienced when trained with mini-blocks. Lastly, Experiment 3 revealed that the participants trained with longer mini-blocks of sequential and deviant material developed more explicit knowledge. Results are discussed regarding their compatibility with different assumptions about the emergence of explicit knowledge in an implicit learning situation, especially with respect to the role of metacognitive judgements and more specifically the Unexpected-Event Hypothesis.","Role of Experienced Fluency and Strength of Representation Authors: Sarah Esser (Corresponding Author),Hilde Haider,Haider Esser Keywords: implicit learning, conscious awareness, fluency, associative strength, serial reaction time task, unexpected events INTRODUCTION:
 Implicit learning refers to our ability to adapt to more or less complex statistical structures in the environment without possessing conscious access to the content of the acquired knowledge, often even lacking any conscious knowledge that something has been learned at all. An accessible example is the knowledge about grammatical rules which develops early and is hard to verbalize even for adults . But implicit learning processes are also important for sequences of movements (e.g., typing on a keyboard;  or stimuli (e.g., visual, spatial, or auditive; , as well as for social interactions . INTRODUCTION:
 There are two very prominent paradigms for studying these so-called implicit learning processes: One is the Artificial Grammar Learning Task (AGLT;  and the other one is the Serial Reaction Time Task (SRTT; . In an AGL task participants are confronted with letter strings that are constructed from artificial probabilistic grammar rules. In a following test task participants are usually asked to classify test strings as following or not following this rule. In a SRTT participants react to a series of different target stimuli by choosing a corresponding response. Unbeknownst to the participant the stimuli and/or the responses follow a certain probabilistic or deterministic sequence. Test tasks can, mostly depending on the definition of consciousness, range from recognition , over free generation , process dissociation , and subjective measures  to verbal report . In both paradigms, the SRTT and the AGLT, participants are usually unaware of the fact that their task followed a certain rule or sequence, while their performance shows that, in fact, they have acquired some knowledge about these [see e.g., , for a discussion about the adequacy of the different measures for (un-)conscious knowledge]. INTRODUCTION:
 In implicit learning research, a lot of effort is dedicated to the question about the complexity, the flexibility and the structure of the knowledge we extract from predictable structures (see e.g., , for an overview). Here, our goal is to focus not on implicit learning processes per se, but on the question: Why and how do some participants acquire conscious knowledge about the unconsciously learned sequences? The paradigms used in implicit learning research can constitute very useful tools for addressing exactly this important topic."
"First- and third-person approaches in implicit learning research","https://scispace.com/paper/first-and-third-person-approaches-in-implicit-learning-2cxxpodzuu","2006","Journal Article","Consciousness and Cognition","Vinciane Gaillard
Muriel Vandenberghe
Arnaud Destrebecqz
Axel Cleeremans","10.1016/J.CONCOG.2006.08.001","http://journalpsyche.org/articles/0xc008.pdf","","that I should conclude that a subject is conscious of some information if she can describe it to me, the reverse does not necessarily hold. Thus, poor performance on a questionnaire or verbal report task does not necessarily imply that I am unaware of some information. First-and third-person methods in implicit learning research:
 These issues come out most pointedly in the domain of implicit learning. Implicit learning-broadly construed, learning without awareness-is a complex, multifaceted phenomenon that defies easy definition . Learning is implicit when we acquire new information without intending to do so, and in such a way that the resulting knowledge is difficult to express. In this, implicit learning thus contrasts strongly with explicit learning (e.g., as when learning how to solve a problem or learning a concept), which is typically hypothesis-driven and fully conscious. Implicit learning contrasts with implicit memory in that it typically involves sensitivity to relationships between events rather than sensitivity to single events, and with subliminal priming in that it typically involves supra-liminal stimuli. Implicit learning research has essentially been focused on two experimental paradigms: Artificial grammar learning and sequence learning. Additional paradigms include dynamic system control, probability learning, hidden covariation detection, acquisition of invariant characteristics, or visual search. In Reber's seminal study of artificial grammar learning, subjects were asked to memorize meaningless letter strings generated by a finite-state grammar. After memorization, subjects are asked to classify novel strings as grammatical or not. In this and many subsequent experiments, subjects can classify strings better than chance despite remaining unable to describe the rules of the grammar. This dissociation between classification and verbal report is the finding that prompted Reber to describe learning as implicit. Subjects indeed appeared sensitive to and could apply knowledge that they remained unable to describe and had had no intention to learn. First-and third-person methods in implicit learning research:
 Today, another paradigm-sequence learning-has become dominant. Subjects are asked to react to each element of a sequentially structured visual sequence of events in the context of a serial reaction time task. On each trial, a stimulus appears at one of several locations on a computer screen and subjects are asked to press as fast as possible on a corresponding key.  first demonstrated that subjects progressively learned about the sequential structure of the stimulus sequence in spite of showing little evidence of being aware that the material contained structure. First-and third-person methods in implicit learning research:
 Numerous subsequent studies have indicated that subjects can learn about complex sequential relationships despite remaining unable to deploy this knowledge in direct tasks."
