"Paper Title","Paper Link","Publication Year","Publication Type","Publication Title","Author Names","DOI","PDF Link","Abstract","TL;DR"
"A Look into Vocabulary Spurt in a Typically Developing Child and a Child with a Developmental Language Disorder","https://scispace.com/paper/a-look-into-vocabulary-spurt-in-a-typically-developing-child-30kxxs9u6n","2014","","","Abiot Yenealem Derbie","","","Vocabulary spurt is a swift increase of lexicon in the process of language acquisition of children‟s. The goal of the present research, thus, was to test the replicability and refutability of the claim in both typically and atypically developing children‟s. For this, one typically developing child and one child with developmental language disorder from Child Language Data Exchange System/CHILDES (MacWhinney, 2000) were taken. The data was longitudinal. Computerized Language Analysis (CLAN) v.30 for Windows was employed to analyze the non-elicited spontaneous speech of the typically developing child and the child with developmental language disorder. Number of lexicon across age (in months) was calculated. Based on observed regression line of number of lexicon produced, the present study unveils the existence of VS in typically developing child, while the presence of VS in the child with developmental language disorder is refuted.","In this article, the authors used Computerized Language Analysis (CLAN) v.30 for Windows to analyze the spontaneous speech of the typically developing child and the child with developmental language disorder."
"Abstractness emerges progressively over the second year of life","https://scispace.com/paper/abstractness-emerges-progressively-over-the-second-year-of-2kfig2l6","2022","Journal Article","Dental science reports","Francesca Bellagamba
Anna M. Borghi
Claudia Mazzuca
Giulia Pecora
Fabiana Ferrara
Alan Fogel","10.1038/s41598-022-25426-5","https://scispace.com/pdf/abstractness-emerges-progressively-over-the-second-year-of-2kfig2l6.pdf","Abstract Abstract words, terms not referring to here and now, are acquired slowly in infancy. They are difficult to acquire as they are more detached from sensory modalities than concrete words. Recent theories propose that, because of their complexity, other people are pivotal for abstract concepts’ acquisition and use. Eight children (4 girls) and their mothers were observed longitudinally and extensively from 12 to 24 months of age. Video recordings of mother-infant free play with toys were done every two weeks in a laboratory setting with families in the USA. Children progressively use a range of words referring to abstract concepts, with a major shift from 12 to 15 months and again from 22 to 24 months, but the qualitative data testify an incremental growth of abstract concepts. We identified a progression in the acquisition of words denoting abstract concepts in relation to the overall productive vocabulary, suggesting that having more abstract terms in one’s vocabulary promotes faster language acquisition. ","This paper found that children progressively use a range of words referring to abstract concepts, with a major shift from 12 to 15 months and again from 22 to 24 months, but the qualitative data testify an incremental growth of abstract concepts."
"Acquiring the First Words by Persian Toddlers: A Longitudinal Study Using the MacAuthor-Bates Inventory","https://scispace.com/paper/acquiring-the-first-words-by-persian-toddlers-a-longitudinal-2u9fpve9gw","2023","Journal Article","Journal of Modern Rehabilitation","Asma Ebtedaei
Fatemeh Paknazar
Raheb Ghorbani
Masoomeh Salmani","10.18502/jmr.v17i4.13885","","Introduction: A robust vocabulary improves all areas of communication. Vocabulary is critical to a child’s success to think and learn about the world. Expanding a child’s knowledge of words provides unlimited access to new information. This study describes the early development of comprehension and production vocabularies in a group of Persian-speaking toddlers. 
Materials and Methods: The mothers of 33 typical, Persian-speaking toddlers during 6 months (from 12-14 months to 19-21 months) completed the Persian McArthur-Bates communicative development inventories 7 times per month. The collected data were analyzed via the SPSS software, version 21, through non-parametric tests. 
Results: The results indicated that the only significant increase for both vocabularies was between 15 and 16 months (P comprehension=0.045 and P production=0.027). The development of phrase comprehension showed significant increases during six months (P<0.001). Further analysis of production vocabulary growth demonstrated the word spurt in each child (in different months and with different word levels). According to the figures, the composition of vocabulary production was different during the selected 6 months. Nouns were the largest group during the 50-, 100-, and 200-word stages; however, verbs presented a faster rate of development. Both genders showed significant changes during follow-ups (P<0.001) and there were no significant differences between the vocabularies of different genders (P>0.05). 
Conclusion: Persian-speaking children follow commonalities of lexical development reported for different languages; however, few differences could be traced between these children and their peers from other languages.","Persian toddlers acquire their first words using a similar timeline as other languages, with a word spurt occurring between 15-16 months and a phrase comprehension spurt occurring at 6 months."
"Exploring Word Learning in a High-Density Longitudinal Corpus","https://scispace.com/paper/exploring-word-learning-in-a-high-density-longitudinal-24q83xdtai","2009","","","Brandon Roy
Michael C. Frank
Deb Roy","","https://scispace.com/pdf/exploring-word-learning-in-a-high-density-longitudinal-24q83xdtai.pdf","Exploring Word Learning in a High-Density Longitudinal Corpus Brandon C. Roy (bcroy@media.mit.edu) Michael C. Frank (mcfrank@mit.edu) The Media Laboratory Massachusetts Institute of Technology Department of Brain and Cognitive Sciences Massachusetts Institute of Technology Deb Roy (dkroy@media.mit.edu) The Media Laboratory Massachusetts Institute of Technology Abstract What is the role of the linguistic environment in children’s early word learning? Here we provide a preliminary analy- sis of one child’s linguistic development, using a portion of the high-density longitudinal data collected for the Human Speechome Project. We focus particularly on the develop- ment of the child’s productive vocabulary from the age of 9 to 24 months and the relationship between the child’s language development and the caregivers’ speech. We find significant correlations between input frequencies and age of acquisition for individual words. In addition, caregivers’ utterance length, type-token ratio, and proportion of single-word utterances all show significant temporal relationships with the child’s devel- opment, suggesting that caregivers “tune” their utterances to the linguistic ability of the child. Keywords: Language acquisition; word learning; corpus data Language Development and the Environment What is the role of the linguistic environment in a child’s ac- quisition of language? In attempts to understand the nature of the mechanisms underlying language acquisition, input- uptake correlations have the potential to provide deep insight. If particular aspects of children’s input are predictive of their later language development, such findings could powerfully illuminate the nature of children’s language learning strate- gies and mechanisms and the relationship of linguistic knowl- edge and experience. Systematic studies of child-directed speech (CDS) dating back to the late 1960’s have established that CDS has special characteristics including shorter utterance lengths, exagger- ated prosody, high redundancy, and referential content tied to immediate context (Snow & Ferguson, 1977). Initial in- vestigations of the facilitative role of CDS focused primarily on development of syntax. Early findings were contradictory, however, and the overall picture remains mixed (Newport et al., 1977; Furrow et al., 1979; Pine, 1995). More recent stud- ies of the role of the environment on lexical development proved to be clearer. For example, studies have shown that the total amount of CDS predicts children’s vocabulary size and rate of growth (Huttenlocher et al., 1991; Hart & Risley, 1995) and the frequency of specific words within CDS pre- dicts the age of acquisition of those words (Huttenlocher et al., 1991; Goodman et al., 2008). Despite the quantity of work in this area, however, our overall understanding of the role of the environment in lan- guage development remains limited by the lack of appropriate observational data. Historically, most longitudinal studies of language development have relied on observations from just two or a few points in time, leading to difficulties in construct- ing a complete picture of the continuous developmental pro- cess. Driven by new technologies, the methodological land- scape is now changing. Higher density longitudinal studies are emerging that provide valuable new perspectives on long- standing questions. For example, by analyzing 90-120 minute audio recordings of children’s home environments every two weeks from 9-15 months of age, Brent & Siskind (2001) shed new light on the role of words spoken in isolation by show- ing that their presence in CDS predicted age of acquisition of those words. More recently, Lieven et al. (in press) recorded 28-30 hours of audio over a 6-week period in the homes of four toddlers yielding 100,000+ word corpora of CDS and speech by children from each home. These data were used to trace the relationship between a child’s utterances over time in support of a constructivist theory of grammar development. Motivated by the goal of obtaining a more complete and naturalistic longitudinal record of child development—and establishing new tools and methods for replicating such ef- forts in the future—the Human Speechome Project (HSP) was launched with the aim of recording the first two to three years of one child’s development at home in rich detail (Roy et al., 2006). This paper provides an overview of the HSP project and corpus, and the human-machine collaborative process for audio analysis. We then present an initial anal- ysis on a subset of the audio portion of this corpus focusing on CDS and lexical development. The Human Speechome Project The goal of HSP is to study early language development through analysis of audio and video recordings of the first two to three years of one child’s life. The home of the fam- ily of one of the authors (DR) with a newborn was outfitted with fourteen microphones and eleven omnidirectional cam- eras. Audio was recorded from ceiling mounted boundary layer microphones at 16 bit resolution with a sampling rate of 48 KHz. Due to the unique acoustic properties of boundary layer microphones, most speech throughout the house includ- ing very quiet speech was captured with sufficient clarity to enable reliable transcription. Video was also recorded to cap- ture non-linguistic context using high resolution fisheye lens video cameras that provide a bird’s-eye view of people, ob- jects, and activity throughout the home. Recordings were made from birth to the child’s third birth- day with the highest density of recordings focused on the first","Roy et al. as discussed by the authors found significant correlations between input frequencies and age of acquisition for individual words, and caregivers' utterance length, type-token ratio, and proportion of single-word utterances all show significant temporal relationships with the child's devel- opment, suggesting that caregivers tune their utterances to the linguistic ability of the child."
"The Course of Children's Naming Errors in Early Word Learning","https://scispace.com/paper/the-course-of-children-s-naming-errors-in-early-word-36pi1zc3g0","2001","Journal Article","Journal of Cognition and Development","Lisa Gershkoff-Stowe","10.1207/S15327647JCD0202_2","","Young children sometimes use 1 word in the place of another when attempting to name an object. Previous research has suggested several reasons why children may call an object by another name, including faulty hypothesis testing concerning the meaning of words, limitations in vocabulary size, and difficulties in retrieving the desired word from lexical memory. This study examined children's object naming in a longitudinal design. Ten children were tested at regular intervals from 16 to 24 months of age. Two tasks were presented: a picture book task used to elicit naming errors of known objects and a novel object task used to elicit word extensions to unknown referents. The results indicate that children are particularly prone to substitute 1 word for another during a narrow band of time, when they have between 50 and 150 words in their productive vocabularies. Moreover, the specific nature of the word substitutions suggests that they derive from common processes involving the activation and retrieval of wo...","The authors found that children are particularly prone to substitute 1 word for another during a narrow band of time, when they have between 50 and 150 words in their productive vocabularies."
"Connecting Environmental and Genetic Explanations for Nonlinear Language Development in Infancy and Toddlerhood","https://scispace.com/paper/connecting-environmental-and-genetic-explanations-for-30dsmxgw01","2024","Journal Article","Biological Psychiatry","Federica Bulgarelli","10.1016/j.biopsych.2024.03.001","","Language development is not linear, regardless of the lens through which it is examined. Across both comprehension (i.e., receptive vocabulary) and production (i.e., expressive vocabulary, grammar), development is characterized by slow and gradual progress followed by sudden spurts. For example, comprehension is thought to improve drastically around 14 months of age; while infants exhibit knowledge of a few words prior to this time, their word recognition quickly improves after this point (1). Expressive vocabulary knowledge is also slow at first; typically developing infants go from knowing just a few words to knowing at least 50, but typically more than 100, between 18 and 24 months of age (2). ","Language development in infancy and toddlerhood exhibits nonlinear patterns, characterized by slow progress followed by sudden spurts in comprehension and production, influenced by both environmental and genetic factors."
"Rapid Word Learning in 13- and 18-Month-Olds.","https://scispace.com/paper/rapid-word-learning-in-13-and-18-month-olds-1qsvqous1b","1994","Journal Article","Developmental Psychology","Amanda L. Woodward
Ellen M. Markman
Colleen M. Fitzsimmons","10.1037/0012-1649.30.4.553","","A number of theorists have argued that the productive naming explosion results from advances in abilities that underlie language learning (e.g., the realization that words are symbols, changes in conceptual structure, or the onset of word learning constraints). If any of these accounts are accurate, there should be parallel developments in comprehension. To explore this issue, 4 studies assessed whether pre- and postnaming explosion children differ in their ability to learn a new word after limited exposure. Thirteen- and 18-month-olds heard a new object label just 9 times in a 5-min training session and then their comprehension was assessed in a multiple-choice procedure. Under favorable testing conditions, both 18- and 13-month-olds showed comprehension of the new word, even after a 24-hr delay","This paper found that pre-and post-naming explosion children differ in their ability to learn a new word after limited exposure, with 13-and 18-month-olds hearing a new object label just 9 times in a 5min training session and then their comprehension was assessed in a multiple-choice procedure."
"Distribution of words across the first years of life: A longitudinal analysis of everyday language input to three English‐learning infants","https://scispace.com/paper/distribution-of-words-across-the-first-years-of-life-a-2l2va1mebgab","2024","Journal Article","Infancy","Erica H. Wojcik
Sarah J. Goulding","10.1111/infa.12622","","Abstract Many in‐lab studies have demonstrated that the distribution of word learning moments affects the strength and quality of word representations. How are words distributed in speech to children in their daily lives, and how is distribution related to other input characteristics? The present study analyzes transcripts of language input to English‐learning infants from three longitudinal, naturalistic corpora captured between 6 and 39 months of age. To describe how word frequency varies across time, we calculated dispersion scores for all word types for each child. Dispersion quantifies the deviation of observed frequencies in each recording session from expected (uniform across sessions) word frequency, providing a measure of how evenly word utterances were spread across sessions. Dispersion is strongly correlated with frequency and moderately correlated with concreteness across all corpora, such that high frequency and low concreteness words are more evenly dispersed. Correlations with measures of age of acquisition (AoA) varied across corpora, and dispersion did not reliably predict AoA above and beyond frequency and concreteness. The contradiction between the current results and results from in‐lab experiments is discussed. This study provides a foundation to explore how word learning unfolds across time and contexts in the real world. ","This longitudinal study analyzes language input to three English-learning infants (6-39 months) and finds that word frequency is strongly correlated with dispersion, with high-frequency and low-concreteness words being more evenly distributed across time."
"Dynamic Models of Learning That Characterize Parent-Child Exchanges Predict Vocabulary Growth.","https://scispace.com/paper/dynamic-models-of-learning-that-characterize-parent-child-11kl7f2yf7","2016","Journal Article","Journal of education and training studies","David R. Ober
John A. Beekman","10.11114/JETS.V4I4.1215","https://scispace.com/pdf/dynamic-models-of-learning-that-characterize-parent-child-11kl7f2yf7.pdf","Cumulative vocabulary models for infants and toddlers were developed from models of learning that predict trajectories associated with low, average, and high vocabulary growth rates (14 to 46 months). It was hypothesized that models derived from rates of learning mirror the type of exchanges provided to infants and toddlers by parents and caregivers. Slow and rapid growth models assume that rates of acquiring new vocabulary are proportional to (a) the child's current vocabulary and (b) the difference between maximum achievable vocabulary and the child's current vocabulary. These models produce (a) exponential growth and (b) bounded exponential growth, respectively. The third model (interactive engagement) results from the interaction of the two previous models and describes vocabulary growth trajectories with a logistic function. It describes the three empirical growth trajectories for average, slow, and rapid growth in the 14 to 46 month study, and for percentile growth rate trajectories of infants and toddlers between 16 and 30 months in a second study. A substantive outcome to the interactive engagement model is that it provided physically meaningful predictions when it was extended forward in time to 60 months and backward in time to 10 months. Although meaningful predictions of achievement can be made based on polynomial growth models (quadratic, and cubic) that fit empirical data, physically meaningful growth trajectories are obtained for logistic-model predictions beyond the empirical data. Excellent agreement between empirical data and model predictions provide evidence that additional birth through age three exchanges by parents and caregivers will narrow socioeconomic status gaps.","In this article, a cumulative vocabulary model for infants and toddlers was developed from models of learning that predict trajectories associated with low, average, and high vocabulary growth rates (14 to 46 months)."
"Development of adjective frequencies across semantic classes : A growth curve analysis of child speech and child-directed speech","https://scispace.com/paper/development-of-adjective-frequencies-across-semantic-classes-5bifmte72i","2014","Journal Article","","Elena Tribushinina
Huub van den Bergh
Dorit Ravid
Ayhan Aksu-Koç
Marianne Kilani-Schoch
Katharina Korecky-Kröll
Iris Leibovitch-Cohen
Sabine Laaha
Bracha Nir
Wolfgang U. Dressler
Steven Gillis","10.1075/LIA.5.2.02TRI","","This paper is a longitudinal investigation of adjective use by children aged 1;8−2;8, speaking Dutch, German, French, Hebrew, and Turkish, and by their caregivers. Each adjective token in transcripts of spontaneous speech was coded for semantic class. The development of adjective use in each semantic class was analysed by means of a multilevel logistic regression. The results show that toddlers and their parents use adjectives more often as the child grows older. However, this holds only for semantic classes denoting concrete concepts, such as physical properties, colour, and size. Adjectives denoting more abstract properties are barely used by children and parents throughout the first year of adjective acquisition. The correlations between adjective frequencies in child speech and child-directed speech are very strong at the beginning, but decrease with time as the child develops independent adjective use. The composition of early adjective lexicons is very similar in the five languages under study.","In this article, a longitudinal investigation of adjective use by children aged 1;8−2;8, speaking Dutch, German, French, Hebrew, and Turkish, and by their caregivers was conducted."
"Diary vs. representative checklist assessment of productive vocabulary","https://scispace.com/paper/diary-vs-representative-checklist-assessment-of-productive-47nqtdjqg7","1994","Journal Article","Journal of Child Language","J. Steven Reznick
Beverly A. Goldfield","10.1017/S0305000900009351","https://www.cambridge.org/core/services/aop-cambridge-core/content/view/S0305000900009351","Twenty-four infants were followed longitudinally from 1.2 to 1.10. Parents maintained diaries of the child's spoken words and at two-month intervals completed a representative checklist of words produced. There was good agreement across the two instruments and robust month-to-month correlations for both. However, the overall pattern of results suggests that the diary method is more effective during the early emergence of language and the representative checklist method is more effective late in the second year when vocabulary size becomes relatively large. Accurate longitudinal assessment of vocabulary may require a combination of the diary and checklist approaches.","The overall pattern of results suggests that the diary method is more effective during the early emergence of language and the representative checklist method isMore effective late in the second year when vocabulary size becomes relatively large."
"Spanish-speaking caregivers’ use of referential labels with toddlers is a better predictor of later vocabulary than their use of referential gestures","https://scispace.com/paper/spanish-speaking-caregivers-use-of-referential-labels-with-23194dc3","2022","Journal Article","Developmental Science","Janet Y. Bang
Manuel Bohn
Joel Ramirez
Virginia A. Marchman
Anne Fernald","10.1111/desc.13354","https://doi.org/10.1111/desc.13354","Variation in how frequently caregivers engage with their children is associated with variation in children’s later language outcomes. One explanation for this link is that caregivers use both verbal behaviors, such as labels, and non-verbal behaviors, such as gestures, to help children establish reference to objects or events in the world. However, few studies have directly explored whether language outcomes are more strongly associated with referential behaviors that are expressed verbally, such as labels, or non-verbally, such as gestures, or whether both are equally predictive. Here, we observed caregivers from 42 Spanish-speaking families in the US engage with their 18-month-old children during 5-min lab-based, play sessions. Children’s language processing speed and vocabulary size were assessed when children were 25 months. Bayesian model comparisons assessed the extent to which the frequencies of caregivers’ referential labels, referential gestures, or labels and gestures together, were more strongly associated with children’s language outcomes than a model with caregiver total words, or overall talkativeness. The best-fitting models showed that children who heard more referential labels at 18 months were faster in language processing and had larger vocabularies at 25 months. Models including gestures, or labels and gestures together, showed weaker fits to the data. Caregivers’ total words predicted children’s language processing speed, but predicted vocabulary size less well. These results suggest that the frequency with which caregivers of 18-month-old children use referential labels, more so than referential gestures, is a critical feature of caregiver verbal engagement that contributes to language processing development and vocabulary growth.","The authors found that the frequency with which caregivers use referential labels, more so than non-verbal gestures, is a critical feature of caregiver verbal engagement that contributes to language processing development and vocabulary growth."
