"Paper Title","Paper Link","Publication Year","Publication Type","Publication Title","Author Names","DOI","PDF Link","Abstract","Relevant Excerpt"
"Darwin's mistake: Explaining the discontinuity between human and nonhuman minds","https://scispace.com/paper/darwin-s-mistake-explaining-the-discontinuity-between-human-4fre7cnfit","2008","Journal Article","Behavioral and Brain Sciences","Derek C. Penn
Keith J. Holyoak
Daniel J. Povinelli","10.1017/S0140525X08003543","https://scispace.com/pdf/darwin-s-mistake-explaining-the-discontinuity-between-human-4fre7cnfit.pdf","Over the last quarter century, the dominant tendency in comparative cognitive psychology has been to emphasize the similarities between human and nonhuman minds and to downplay the differences as ""one of degree and not of kind"" (Darwin 1871). In the present target article, we argue that Darwin was mistaken: the profound biological continuity between human and nonhuman animals masks an equally profound discontinuity between human and nonhuman minds. To wit, there is a significant discontinuity in the degree to which human and nonhuman animals are able to approximate the higher-order, systematic, relational capabilities of a physical symbol system (PSS) (Newell 1980). We show that this symbolic-relational discontinuity pervades nearly every domain of cognition and runs much deeper than even the spectacular scaffolding provided by language or culture alone can explain. We propose a representational-level specification as to where human and nonhuman animals' abilities to approximate a PSS are similar and where they differ. We conclude by suggesting that recent symbolic- connectionist models of cognition shed new light on the mechanisms that underlie the gap between human and nonhuman minds.","claiming a major functional discontinuity between humans and other species rests on a hybrid formal model LISA (Learning and Inference with Schemas and Analogies) now overtaken by new models of cognitive growth and new empirical studies within an embodied systems stance. A C K N O W L E D G M E N T S:
 That there is discontinuity as well as continuity in the (nonlinear) evolution of cognitive systems is hardly news. In the case of contemporary humans, it is also self-evident that a runaway culture of cognition has led to an exponential growth in knowledge way outside the time frame of classical Darwinian evolution. Externalised as in the third world of books , these knowledge-gaining systems are the product of a society of minds, public, open to scrutiny, repair, refutation, and (collective) redevelopment. These demand in turn extended periods of top-down instruction to secure for individuals what Piaget once dubbed the status of an ""epistemic agent"" capable of participation in the rational world of the sciences. Within this domain there is no possibility by definition of a nonhuman entry. And if this is the central thesis of Penn et al., then we have no disagreement with them. A C K N O W L E D G M E N T S:
 However, despite the near impossible challenge of separating human cultural products from individual competences , the authors seem bent on assessing the ""evolutionary"" and cognitive status of the individual. Motivated by an adult end-state PSS (physical symbol system) -type model, they seek to explain discontinuity in terms of the individual's possession of a ""supermodule."" Installed in a space between more primitive nonhuman forms of cognition (and even human natural language), such a module is used to claim a special biological uniqueness for humans (but not Neanderthals), allegedly with a representational capability that forever separates us even from our closest simian relatives. A C K N O W L E D G M E N T S:
 One difficulty in following this thesis is that when espousing their case for human structural superiority, the authors veer between task criteria which are adult end-state, context free, and formal, such as ""systematicity,"" omnidirectionality, and ""analogy"" considered in isolation from content -and those which are embedded in ""world knowledge"" -such as functional analogy, theory of mind (ToM), and higher-order structural apprehension of perceived relations of similarity and difference. These heterogeneous domains are bridged with words such as ""cognising,"" ""abstraction,"" and ""re-representation,"" giving rise to the impression these all share the property of an in-the-head compliance between formal structures and individual agents."
"The evolution of comparative cognition: Is the snark still a boojum?","https://scispace.com/paper/the-evolution-of-comparative-cognition-is-the-snark-still-a-1gkd98hjpe","2009","Journal Article","Behavioural Processes","Sara J. Shettleworth","10.1016/J.BEPROC.2008.09.001","https://sites.ualberta.ca/~elegge/Alrg_Docs/Shettleworth_2009.pdf","","songbirds and many more nonhuman primates. One might continue this survey and extend it to textbooks, many of which reflect the historical development of the field with titles mentioning ""animal learning and cognition"" and organizations with the chapters on cognition at the end. What is comparative cognition?:
 But it seems to me that if done without too many historical blinders, an inclusive survey of current work in comparative cognition reveals that the field encompasses three major sets of mechanisms for the acquisition, processing, and representation of information about the environment. Basic cognitive processes cut across all kinds of content; these are the ones that were the main focus in the 1970s. They include perception, attention, memory, associative leaning, category and concept learning. In addition, following the taxonomy proposed by , is research on two sets of possibly specialized processes of acquisition, representation, and behavioral control, or cognitive modules, defined largely in terms of their functions, i.e. what aspects of the world they are about, namely physical cognition and social cognition. Some aspects of physical cognition like time, space, and number have been studied for quite a long time within experimental animal psychology, whereas others like tool using and causal learning have emerged or re-emerged into prominence recently. Social cognition includes social knowledge, the kind of thing so beautifully studied in the field by , i.e. what animals know about their social networks and how they come to know it. It also includes theory of mind, imitation and other forms of social learning, and the representational and other processes involved in communication. What is comparative cognition?:
 So part of what has changed since the 1970s is that the study of cognitive processes in animals now encompasses a much broader set of problems. They are also being studied by researchers from a much wider variety of backgrounds. Behavioral ecologists, field biologists, developmental psychologists, and others are all contributing, and in some integrative research the lines between them are nearly invisible. But more important are the major conceptual and theoretical issues being addressed. The next part of the article briefly reviews some key issues common to different aspects of cognition by taking one topic within each of the three major areas to exemplify some of the important new developments and challenges."
"Immune cognition, social justice and asthma: structured stress and the developing immune system","https://scispace.com/paper/immune-cognition-social-justice-and-asthma-structured-stress-4gi26q381x","2001","","","Rodrick Wallace
Mindy Thompson Fullilove
Deborah Wallace","","https://scispace.com/pdf/immune-cognition-social-justice-and-asthma-structured-stress-4gi26q381x.pdf","We explore the implications of IR Cohen's work on immune
cognition for understanding rising rates of asthma morbidity
and mortality in the US. Immune cognition is conjoined with
central nervous system cognition, and with the cognitive
function of the embedding sociocultural networks by which
individuals are acculturated and through which they work with others to meet challenges of threat and opportunity.
Using a mathematical model, we find that externally-
imposed patterns of 'structured stress' can, through their
effect on a child's socioculture, become synergistic with
the development of immune cognition, triggering the persistence of an atopic Th2 phenotype, a necessary precursor to asthma and other immune disease. Reversal of the rising tide of asthma and related chronic diseases in the US thus seems unlikely without a 21st Century version of the earlier Great Urban Reforms which ended the scourge of infectious diseases.","condensations: I[K] defines the splitting criterion between high and low probability pairs of training and response paths for a specified average distortion D, and is analogous to the parametized information source uncertainty upon which we imposed renormalization symmetry to obtain phase transition. Generalized cognitive condensations:
 We thus interpret the sudden changes in the measured average distortion D ≡ p(y)d(y, ŷ) which determines 'mean square error' between training pattern and output pattern, e.g. the ending of a learning plateau, as representing onset of a phase transition in I[K] at some critical K C , consonant with our earlier developments. Generalized cognitive condensations:
 Note that I[K] constitutes an interaction between the cognitive system and the impinging sensory activity, so that its properties may be quite different from those of the cognitive condensation itself. Generalized cognitive condensations:
 From this viewpoint learning plateaus are an inherently 'natural' phase transition behavior of pattern recognition systems. While one may perhaps, in the sense of , find more efficient gradient learning algorithms, our development suggests learning plateaus will be both ubiquitous and highly characteristic of a cognitive system. Indeed, it seems likely that proper analysis of learning plateaus will give deep insight into the structures underlying that system. This is not a new thought: Mathematical learning models of varying complexity have been under constant development since the late 1940's [62], and learning plateau behavior has always been a focus of such studies. Generalized cognitive condensations:
 The particular contribution of our perspective to this debate is that the distinct coevolutionary condensation of immune, CNS, and local sociocultural network cognition which distinguishes human biology must respond as a composite in a coherent, unitary and coupled manner to sensory input. Thus the 'learning curves' of the immune system, the CNS and the embedding sociocultural network are inevitably coupled and must reflect each other. Such reflection or interaction will, of necessity, be complicated. Generalized cognitive condensations:
 Our analysis, however, has a particular implication. Learned cultural behavior -sociocultural cognition -is, from our viewpoint, a nested hierarchy of phase transition learning plateaus which carries within it the history of an individual's embedding socioculture. Through the cognitive condensation which distinguishes human biology, that punctuated history becomes part of individual cognitive and immune function. Simply removing 'constraints' which have deformed individual and collective past is unlikely to have the desired impact: one never, really, forgets how to ride a bicycle, and a social group, in the absence of affirmative redress, will not 'forget' the punctuated adaptations 'learned' from experiences of slavery or holocaust. Indeed, at the individual level, sufficiently traumatic events may become encoded within the CNS and immune systems to express themselves as Post Traumatic Stress Disorder."
"THEORETICAL NOTES Pattern and Process in the Evolution of Learning","https://scispace.com/paper/theoretical-notes-pattern-and-process-in-the-evolution-of-4ouk9mjp3a","2002","","","Mauricio R. Papini","","https://scispace.com/pdf/theoretical-notes-pattern-and-process-in-the-evolution-of-4ouk9mjp3a.pdf","A century after E. L. Thorndike’s (1898) dissertation on the comparative psychology of learning, the field seems ready for a reassessment of its metatheoretical foundations. The stability of learning phenotypes across species is shown to be similar to that of other biological characters, both genotypic (e.g., Hox genes) and phenotypic (e.g., vertebrate brain structure). Moreover, an analysis of some current lines of comparative research indicates that researchers use similar strategies when approaching problems from either an ecological view (emphasizing adaptive significance) or a general-process view (emphasizing commonality across species). An integration of learning and evolution requires the development of criteria for recognizing and studying the divergence, homology, and homoplasy of learning mechanisms, much as it is done in other branches of biological research. The study of learning has been influenced in recent decades by an adaptationist view in which learned behavior is part of the organism’s biological equipment that allows for an adaptive fit to its environment. This ecological view is a central aspect of several approaches to the study of learning, including the constraints-onlearning approach, prompted by discoveries in taste-aversion learning, avoidance training, and autoshaping during the late 1960s; the more contemporary behavior systems approach, seeking explanations of learned behavior as resulting from preorganized systems evolved by natural selection; and the application of optimal foraging theory to learning, according to which natural selection shapes decision rules so that behavior maximizes resource value, minimizes behavioral costs, or both, within certain constraints (see Domjan, 1998). These lines of research follow from a view of learning mechanisms as adaptations shaped by natural selection to achieve outcomes that represent the best solutions to specific environmental problems, within certain constraints. According to this view, the species to be compared in terms of learning tasks must be chosen “on the basis of adaptation and","are unique to mammals. However, cell populations with similar embryological origin exist in other vertebrates, although organized in a different manner. It is presently unclear whether the architectural level is functionally important or just a neutral by-product of different developmental trajectories. Divergence, Homology, and Homoplasy:
 The foregoing review provides an appropriate framework in which to evaluate the generality of learning processes. In the context provided by these extremely stable traits, the possibility that at least some learning mechanisms could be homologous among widely divergent animal lineages, as postulated by the general-process view of learning, seems biologically plausible and meaningful. This is particularly obvious if the word mechanism refers to synaptic properties or molecular processes responsible for neural plasticity. Furthermore, the most meaningful comparisons for very stable characters (e.g., Hox genes, cytochrome c, endothermy, telencephalic morphology, etc.) are actually those involving distantly related species. A striking feature of the biological characters reviewed in this section is that they do not correlate with ecological conditions or even modes of life. Paraphrasing Cuvier and Darwin, it would appear that the ""conditions of existence"" must accommodate to these characters rather than vice versa, as a simple adaptationist viewpoint would appear to suggest. Obviously, conserved traits must also meet adaptive criteria, or natural selection would rapidly eliminate the genes responsible for the trait. But the adaptive significance of a particular trait need not be obvious at the taxonomic level of a species. This point was made clearly by  who, after reviewing arthropod neural development, arrived at the following conclusion: Divergence, Homology, and Homoplasy:
 The picture that emerges from comparative studies of lamina [a ganglion receiving visual input] in insects and crayfish is one of remarkable uniformity from animals whose life-styles and evolutionary lineages should set them far apart. Not only are they probably separated by over 500 million years of independent evolution, but insects also are fast moving aerial animals, whereas crayfish are comparatively sluggish, aquatic, and often nocturnal. Even so, we find the same set of neurons making up a lamina cartridge, with the same physiological responses. (p. 253) Comparative Learning: Three Examples and Some Conclusions:
 Although I have emphasized stable aspects of evolution in the previous sections, evolution does involve a complex interaction of pattern and process, and it is possible, at least in principle, to assess the contribution of both aspects to the evolution of any biological trait, including learning. Such an assessment demands not only careful analysis of learning processes but also attention to underlying mechanisms, comparative neurological issues, and phyloge-netic hypotheses. From the several currently active areas of comparative research, three were selected as examples: Phylogenetic analysis of cellular properties of learning in molluscs (illustrating evolutionary reversal), spatial learning and hippocampal size in food-storing birds (illustrating parallel evolution), and surprising nonreward in appetitive learning in vertebrates (illustrating divergent evolution). This selection is not intended as an exhaustive review of these areas but rather is meant to provide examples that demonstrate the extent of the integration of evolutionary concepts into the experimental study of learning."
"Piecewise power laws in individual learning curves","https://scispace.com/paper/piecewise-power-laws-in-individual-learning-curves-432ugb7nla","2015","Journal Article","Psychonomic Bulletin & Review","Yoni Donner
Joseph L. Hardy","10.3758/S13423-015-0811-X","https://scispace.com/pdf/piecewise-power-laws-in-individual-learning-curves-432ugb7nla.pdf","The notion that human learning follows a smooth power law (PL) of diminishing gains is well-established in psychology This characteristic is observed when multiple curves are averaged, potentially masking more complex dynamics underpinning the curves of individual learners Here, we analyzed 25,280 individual learning curves, each comprising 500 measurements of cognitive performance taken from four cognitive tasks A piecewise PL (PPL) model explained the individual learning curves significantly better than a single PL, controlling for model complexity The PPL model allows for multiple PLs connected at different points in the learning process We also explored the transition dynamics between PL curve component pieces Performance in later pieces typically surpassed that in earlier pieces, after a brief drop in performance at the transition point The transition rate was negatively associated with age, even after controlling for overall performance Our results suggest at least two processes at work in individual learning curves: locally, a gradual, smooth improvement, with diminishing gains within a specific strategy, which is modeled well as a PL; and globally, a discrete sequence of strategy shifts, in which each strategy is better in the long term than the ones preceding it The piecewise extension of the classic PL of practice has implications for both individual skill acquisition and theories of learning","the scope of the present study. However, since the average transition curves were similar for all quartiles of the total duration in a window of five exercises before and after the transition, spacing was not a major factor in the transition behavior we report here. Discontinuities may reflect a change in performance due:
 The PPL of practice extends learning theory and suggests specific directions for future investigation, as we outline below. Practically, considering learning progress both locally, within smooth PL trajectories, and globally, within sequences of discrete improvements, could improve skill acquisition through data-driven planning of training. Future discoveries about transitions could further accelerate learning by triggering transitions at specific times. For example, if theory or data suggest that certain advanced strategies depend on the preexisting mastery of simpler strategies, learners could track progress on each PL and transition at appropriate points, thus avoiding both superfluous practice on earlier strategies and premature attempts to acquire later ones. The acquisition of Table  Demographics and performance: Effects of performance, improvement, and demographic variables on the number of transitions, in a linear regression expert performance follows similar principles , further supporting our results. Discontinuities may reflect a change in performance due:
 In this study, we have shown that individual human learning curves in natural learning settings follow a PPL sequence in which subsequent PLs tend to surpass earlier ones, usually after a temporary drop in performance. Many open questions remain, including: What are the factors causing transitions between PLs? What is the relationship between the temporal spacing of training sessions and the learning curve? Why are transitions usually accompanied by a temporary drop in performance? And what regularities in global PL sequences exist within and across tasks? We hope that future work will answer these questions and further improve our understanding of individual human learning curves."
"Stages of Abstraction and Exemplar Memorization in Pigeon Category Learning","https://scispace.com/paper/stages-of-abstraction-and-exemplar-memorization-in-pigeon-3gopvan0ol","2006","Journal Article","Psychological Science","Robert G. Cook
J. David Smith","10.1111/J.1467-9280.2006.01833.X","https://scispace.com/pdf/stages-of-abstraction-and-exemplar-memorization-in-pigeon-3gopvan0ol.pdf","It has been proposed that human category learning consists of an early abstraction-based stage followed by a later exemplar-memorization stage. To investigate whether similar processing stages extend to category learning in a nonverbal species, we applied a prototype-exception paradigm to investigating pigeon category learning. Five birds and 8 humans learned six-dimensional perceptual categories constructed to include prototypes, typical items, and exceptions. We evaluated the birds' and humans' categorization strategies at different points during learning. Early on in both species, prototype performance improved rapidly as exception performance remained below chance, indicating an initial mastery of the categories' general structure. Later on, exception performance improved selectively and dramatically, indicating exception-item resolution and exemplar memorization. Abstraction- and exemplar-based formal models reinforced these interpretations. The results suggest a psychological transition in pigeon ca...","divergence is striking and contributes to the general and comparative categorization literature in several ways. First, it suggests that either these general processes are evolutionarily old or similar solutions to category learning have evolved independently in these distinct phylogenetic lineages. GENERAL DISCUSSION:
 Second, it shows the value of looking at the time course of acquisition in categorization studies. Much categorization research focuses only on asymptotic performance after learning is completed. This approach does not show the first principles or To make these configurations, the six attentional parameters were systematically varied from 0 to 1.0 in .05 steps (with the constraint that the six parameters sum to 1.0). Then, for each attentional profile, a random bias and sensitivity parameter were selected (from the ranges of 0-1.0 and 0-20.0, respectively), and the prototype and exception performance for that configuration of the model was calculated. GENERAL DISCUSSION:
 initial assumptions of category learning-extensive training paves these over. Moreover, looking only at terminal performance may unduly emphasize exemplar processes, because, as we have shown here, these will likely be strongest at the end of learning. Thus, analyzing the stages of category learning and the succession of strategies will be productive in comparative studies for the same reason it is productive in human studies. GENERAL DISCUSSION:
 Third, our results show the value of a mixed theoretical perspective that permits behavior to be determined by different categorization systems operating at different times. This perspective has enriched the human literature by moving it beyond forcing one process to explain all categorization behavior. In the comparative literature, too, some researchers have preferred a linear feature model allied to our abstraction model , whereas others have preferred a configural model allied to our exemplar model . In our view, both perspectives will figure prominently in explaining fully animals' categorization behavior. Here we explored for the first time the changing balance of these processes across stages of learning. One could also explore the changing balance across category structures. For instance, categories that have few members or weak withincategory similarity would probably shift animals toward exemplar processing, just as they shift humans ."
