"Paper Title","Paper Link","Publication Year","Publication Type","Publication Title","Author Names","DOI","PDF Link","Abstract","Relevant Excerpt"
"The Effect of Mood and Individual Differences on Implicit Learning","https://scispace.com/paper/the-effect-of-mood-and-individual-differences-on-implicit-4tmgx6gg1p","2007","","","Sentman
M Kathryn","","https://scispace.com/pdf/the-effect-of-mood-and-individual-differences-on-implicit-4tmgx6gg1p.pdf","This study investigated the relationship between mood, cognitive style, and implicit learning. Ninety-four participants were induced with a positive, neutral, or negative mood. We predicted that a positive mood would enhance implicit learning, while a negative mood would depress it. Additionally, we expected that participants with a more intuitive cognitive style would perform better on implicit learning. Implicit learning was measured using the Artificial Grammar (AG) and Serial Reaction Time (SRT) tasks. Our results suggest surprising differences between the tasks; positive mood and intuitive cognitive style seem to help the SRT, while negative mood and analytical cognitive style seem to help the AG. We postulate that this might result from differences in modality, strategy use, or awareness of the pattern. The Effect of Mood 3 The Effect ofMood and Individual Differences on Implicit Learning It might be surprising to learn that, at this very moment, you are consciously aware of only a small fraction of the information your mind is processing. The mind controls two distinct but intimately intertwined systems: The explicit system and the implicit system (Hogarth, 2001; Pacini & Epstein, 1999). The explicit system accounts for deliberate actions that are available to conscious awareness; it operates consciously and is relatively slow, analytical, and relatively uninfluenced by emotions (Pacini & Epstein, 1999). Reading, studying, and willfully attending to something are all examples of actions which are controlled by the explicit system. However, given the limited amount of attentional resources available to a person, it is not possible to pay attention to everything which could possibly be important in the environment (Hogarth, 2001). While busy concentrating attention on certain information via the explicit system, the mind is also unconsciously learning associations and processing information from the environment. Processes such as these are part of the implicit system; it is preconscious, operates quickly or automatically, holistically, and is highly associated with the effects of emotion (Pacini & Epstein, 1999). The implicit system operates at a level below conscious awareness and is less dependent on attentional resources (Hogarth, 2001). The implicit system is capable ofprocessing vast and complex sets of information-so vast and complex, that one could not even attempt to attend to all of it consciously (Cleeremans & Jimenez, 1998). Despite being unavailable to consciousness, this implicit information can influence actions. For example, implicit learning might influence social information processing. When in a social situation, individuals may make implicit associations that might lead to hasty judgments of character or stereotyping (Park & Banaji, 2000; Seger, 1994). The Effect of Mood 4 Evidence for the existence of these two distinct systems stems from neuroscientific research. For example, some studies have indicated that patients with Korsakoff's syndrome and anterograde amnesia still maintain the unconscious processes ofthe implicit system, whereas explicit functions are drastically reduced (Nissen & Bullemer, 1987; Roediger, 1990). This evidence indicates that implicit and explicit systems for gaining and processing information are distinct, as the explicit system can be damaged while the implicit system remains intact. Because the environment is so incredibly rich in information, the individual cannot attend to all of it. Thus, in order to take in as much of that information as possible, individuals are able to learn implicitly, through experience rather than meticulous explicit study. Much of the information that is used in everyday life has not been explicitly taught; rather, it has been gained over time through experience. An expert tennis player, for instance, learns to react to subtle cues in the opponent's movements. The tennis player probably cannot explicate precisely what cues she is reacting to, but her behavior on the court is deeply influenced nonetheless. This is the phenomenon of implicit learning, or the gaining of knowledge at a level below consciousness (Cleeremans & McClelland, 1991; Roediger, 1990). Because so much of one's behavior is influenced by implicit processes such as implicit learning, it is important to understand what affects it, positively and negatively. Two possible factors which could influence implicit learning are cognitive style and mood. Cognitive style has been demonstrated to influence many aspects of cognition, such as problem solving strategy (Epstein, 1994; Pacini & Epstein, 1999). Its relationship to implicit learning, however, has thus far been overlooked. Likewise, mood has been shown to influence many aspects of cognition, including idea generation, creativity, and information processing (e.g., Isen, 1987, 1999; Vosburg, 1998a, 1998b). However, mood's influence on implicit learning","white, 6.4% black, 5.3% Asian, and 1.1% Hispanic. Participants were randomly assigned to a mood condition and counterbalanced task order; there were roughly equal numbers of participants in each mood condition. Participants:
 The Effect ofMood 13 Materials Implicit learning measures. Two implicit learning measures were chosen for their widespread and robust use in similar research: The Artificial Grammar task (AG) and the Serial Reaction Time task (SRT). The AG included two phases, the learning phase and the testing phase. In the learning phase, participants memorized a series of20 exemplary letter strings generated by a finite-state grammar. Each letter string appeared on the computer screen for 3s, after which the participant was prompted to reproduce the string by typing it on the keyboard. If participants reproduced the letter string correctly, they were so informed and a new letter string was presented. Ifparticipants made an error, they were asked to try to reproduce the same letter string again. All 20 exemplars were presented twice for a total of40 learning trials. In the testing phase, participants were informed that the letter strings they had memorized were formed according to a complex set ofrules and that the following trials would test their knowledge of those rules. Participants were presented with 50 letter strings, one at a time, and responded either ""yes"" (by pressing the Y key) or ""no"" (by pressing the N key) according to their immediate judgment ofwhether the letter string conformed to the rules ofthe grammar. The testing stimuli consisted of25 grammatical letter strings (7 ofwhich will be from the original set) and 25 non-grammatical letter strings, which were formed by introducing one or more violations into otherwise grammatical letter strings. The entire set was presented twice so that 100 judgments were made by each participant. Past research (e.g., Manza, Zizak, & Reber, 1998)   shows that participants generally scored significantly above chance in correctly classifying letter strings, yet they were unable to explicate the grammar rules. Learning is determined by how many letter strings were correctly classified as following the grammar. The finite state grammar and sample letter strings used in this study can been seen in Appendix A. Participants:
 In the SRT, participants saw a stimulus appear at one ofseveral locations on a computer screen and were asked to press the button corresponding to each box when the stimulus appeared there. Unknown to the participants, the sequence of successive stimuli followed a complex repeating sequence. Participants fIrst completed a practice block, followed by six training blocks, each consisting of 120 trials. Past research (e.g., Cleeremans & Jimenez, 1998) indicates that participants' reaction times decreased significantly for patterned sequences but not for random ones, suggesting that participants unconsciously recognized the pattern and used it to their advantage. Participants, however, were consciously unaware ofthe pattern, even when they were asked to consciously look for it . Participants:
 At one point in the task, the pattern switches radically, resulting in a sudden jump in participants' reaction time. This jump in reaction time suggests that participants are no longer able to rely on their implicitly-learned information about the pattern. This task is scored by assessing the gain in reaction time when the pattern switches. The probabilistic pattern used in this study can be seen in Appendix B."
"Instructional Focus Does Not Effect Implicit Pattern Learning","https://scispace.com/paper/instructional-focus-does-not-effect-implicit-pattern-43errq7qt9","2003","","","Ivan K. Ash
Timothy J. Nokes","","https://scispace.com/pdf/instructional-focus-does-not-effect-implicit-pattern-43errq7qt9.pdf","Participants performed a dual-component training procedure that combined a serial reaction time task and an artificial grammar learning task under two instructional conditions. Participants given memory-focused instructions performed at the same level as participants given motor-focused instructions on the serial reaction time test and grammar sorting task. Both groups performed better than a control (no training) group. Results suggest that only a minimal amount of attentional focus on aspects of the stimuli relevant to the pattern is needed to acquire implicit pattern knowledge.","a finite-state grammar. This grammar involved a set of rules by which a sequence of letter strings was constructed. After memorizing a number of letter strings in sets of three, participants were informed that the strings were constructed using a set of grammar rules. Introduction:
 Subjects were given an unexpected test in which they were presented strings constructed using the grammar and random strings, and asked to indicate whether the string was constructed following the same rules as the studied list or not. It was found that subjects could identify the grammatical strings at better than chance levels even though most were unable to verbalize any of their decision criteria or accurately state the grammar rules. This study suggested that there could be a distinction between the learning mechanisms involved in explicit tasks and implicit tasks, which involves learning complex concepts without explicit knowledge of the rules.  original experiment has led to a growth in the study of implicit learning. In a recent review,  suggested three criteria by which to judge whether a learning task should be considered as implicit. The first criterion is that the knowledge that is gained in the task is not fully conscious to the learner. In other words, participants are unable to provide a full or accurate account of what they have learned and do not realize that they have learned anything. The second criterion is that the learned information or relationships are more complex than simple frequency counts or associations. This does not imply that implicit learning cannot take place in those types of tasks, just that in order to separate implicit learning from very rudimentary automatic explicit learning, more complex stimuli must be used. The final criterion is that the knowledge acquired in implicit learning does not come from conscious processes such as hypothesis testing, but is acquired incidentally by just processing the material. This is to say that just because in retrospect subjects may say that they noticed patterns in the material does not mean that implicit learning did not occur. The more important aspect is the process by which this knowledge came about.  serial reaction time experiments are another classic example of an implicit learning paradigm. In these experiments subjects were asked to tap a series of four keys in response to the spatial position of an asterisk on a visual display. The order of the positions was either random or a complex repeating sequence. It was found that subjects who practiced in the sequenced condition had faster reaction times in responding to a spatial position than those in the random condition. These results showed that even though subjects were unaware of the sequential nature of the task they were still able to ""learn"" the sequence. This learning was reflected in the shorter reaction times.  offered further evidence that this task involved a different type of learning than traditional explicit learning tasks. In this experiment they gave the serial reaction time task to a sample of Korsakaff Syndrome patients who had severely impaired declarative memory. These patients showed the same performance on the sequenced series task as the non-patient group. The fact that these patients showed faster reaction times on sequenced tasks after practice, even though many were unable to remember the practice session itself, shows that awareness is not necessary for learning in these types of tasks. The main conclusion from the implicit learning research is that people seem be able to detect abstract patterns in material without having to explicitly, consciously search for such patterns."
"Investigating the Role of Instructional Focus in Incidental Pattern Learning","https://scispace.com/paper/investigating-the-role-of-instructional-focus-in-incidental-4kztaniwu9","2009","Journal Article","Journal of General Psychology","Timothy J. Nokes
Ivan K. Ash","10.1080/00221300903352125","https://scispace.com/pdf/investigating-the-role-of-instructional-focus-in-incidental-4kztaniwu9.pdf","The authors used a novel dual-component training procedure that combined a serial reaction time task and an artificial grammar learning task to investigate the role of instructional focus in incidental pattern learning. In Experiment 1, participants either memorized letter strings as a primary task and reacted to the stimuli locations as a secondary task or vice versa. In Experiment 2, participants were given the same dual-component stimuli but performed only one of the two training tasks. Instructional focus affected the amount of learning and the likelihood of acquiring explicit knowledge of the underlying pattern. However, the effect of instructional focus varied for the different types of stimuli. These results are discussed in terms of the role of focused attention in incidental learning.","majority of the learning trials. Unfortunately, the nature of the artificial grammar-learning paradigm does not enable a complementary measure of on-line learning performance. Therefore, we have no similar manipulation check of the effects of instructional focus on grammar acquisition during the learning phase. Discussion:
 The behavioral differences observed during the learning phase did not translate into differential performance during the testing phase. On the grammar classification task, both training groups showed evidence of grammar acquisition above the no-training control group (see Figure ). However, instructional focus did not lead to differences in grammar classification performance between the training groups. This result is somewhat surprising when compared to what we know about the effects of instructional focus on explicit learning. For example, research on TAP has shown that instructing participants to focus on the aspects of the learning stimuli that are important for a later test clearly improves performance on the assessment tasks (e.g., . Although our instructions were designed to focus participants' attention on the relevant aspects of the learning stimuli (letter strings or spatial location), this manipulation did not have any clear effect on participants' subsequent test performance. Discussion:
 The behavioral differences of the learning phase also did not translate into differences in SRT test performance (see Figure ). Once again both training groups showed evidence of location pattern learning above the no-training control group. However, no differences were detected between instructional focus groups. One possible explanation for the lack of difference between the two groups is that they both reached the same final performance level during learning. That is, although the two groups may have processed the material in different ways (as evidenced by the different learning rates), both groups achieved the same final performance and therefore showed equal learning on the test. This interpretation suggests that it is not how the stimuli are processed that matters but instead the total amount of processing. Discussion:
 These results provide evidence that the participants were able to learn multiple patterns from the dual-component stimuli. This finding is consistent with the prior work on the incidental learning of multiple patterns  and shows that participants in the current study could learn two qualitatively distinct patterns concurrently. However, because we did not employ post-hoc probes of awareness, it is not clear to what degree the acquired knowledge was implicit, explicit, or a combination of both. This issue is further examined in Experiment 2, where we use posttest questionnaires to assess the possibility of participants' acquisition of explicit (verbalizable) pattern knowledge. Discussion:
 In contrast to previous work showing that dual-task training procedures interfere with incidental learning (e.g., , the current results show significant learning gains for both learning conditions. There are two important differences between the current approach and the previous dual-task studies that can account for this result. First, instead of using an ambiguous location sequence, we used hybrid sequences, the properties of which have been shown to facilitate incidental learning even under conditions of distraction . Second, the distracter tasks used in previous studies were typically explicit memory tasks that created a cognitive load for participants. In contrast, our secondary tasks, reacting to screen locations or reading through letter strings, were not memory tasks and probably did not create such a memory load, and therefore they did not substantially reduce attentional processing to the relevant aspects of the stimuli."
"Elucidating an implicit learning network in healthy adults during artificial grammar tasks","https://scispace.com/paper/elucidating-an-implicit-learning-network-in-healthy-adults-15sccssksv","2021","","","Kaila E Cote","","https://scispace.com/pdf/elucidating-an-implicit-learning-network-in-healthy-adults-15sccssksv.pdf","","judgements about the grammaticality of an utterance and perform above chance . What is unique about this type of learning, and implicit learning in general, is that it happens automatically and unconsciously, without specific instructions to learn the grammar or rules. CHAPTER I: INTRODUCTION:
 The ability to implicitly learn is utilized in memory intervention for patients with amnesia in the form of errorless learning. In a meta-analysis by , errorless learning, which utilizes minimization of errors to access the implicit learning system through repetition of correct targets, produced a large effect size of 0.87 across 11 studies. A more recent study by  also found success for errorless learning and minimized reliance on explicit memory in patients with post-traumatic amnesia. However, there are no known language interventions that employ implicit learning strategies and only one experimental study that has used implicit learning treatment with individuals with aphasia.  implemented an implicit sentence comprehension treatment utilizing errorless learning strategies with five adults with agrammatic aphasia. The training took place over five sessions, with each session lasting around 20 minutes.  found no significant increases in passive sentence comprehension, and three participants showed decreased comprehension scores from baseline. However, the short duration of treatment and difficulty of the task should be noted as they may have prevented treatment gains. Additionally, other studies show that individuals with non-fluent aphasia can perform above chance on serial reaction time tasks involving nonlinguistic stimuli, and therefore learn implicitly . Moreover,  found that seven individuals with agrammatic aphasia were able to learn an artificial grammar with 91% accuracy during a learning phase, but the average test performance was only 51% when ungrammatical stimuli were introduced, which was not significantly above chance. The ability to implicitly learn has not been examined in other forms of aphasia and has only been minimally tested using artificial grammar tasks to measure implicit learning, thus warranting more research. CHAPTER I: INTRODUCTION:
 In addition to using implicit learning to promote intervention success, the automaticity involved in implicit learning may also assist in generalization of intervention. Generalization requires information to be extracted from stimuli, encoded in memory, and consolidated for automatic retrieval and use. As generalization is the ultimate goal of speech and language intervention, the focus of this study is on the automaticity underlying implicit learning, and specifically statistical learning. One way to better understand implicit learning is by examining the neural correlates of this type of learning and the connections between regions involved in the implicit learning network. Currently, a meta-analysis that clarifies which brain regions are involved in implicit learning does not exist, although two recent meta-analyses have been published examining language learning in adults  and non-linguistic sequence learning in adults . While  examined artificial grammar learning in adults, their main goal was to look at language learning in general, CHAPTER I: INTRODUCTION:
 and not specifically implicit language learning. Additionally, their literature search ended in 2015 and more implicit learning studies have been published since the end of their search. This thesis aims to extend the findings of  by identifying the brain regions involved in implicit learning in healthy adults to serve as a reference for future research."
