"Paper Title","Paper Link","Publication Year","Publication Type","Publication Title","Author Names","DOI","PDF Link","Abstract","TL;DR"
"Early lexical acquisition: rate, content, and the vocabulary spurt.","https://scispace.com/paper/early-lexical-acquisition-rate-content-and-the-vocabulary-5flexx5291","1990","Journal Article","Journal of Child Language","Beverly A. Goldfield
J. Steven Reznick","10.1017/S0305000900013167","https://www.cambridge.org/core/services/aop-cambridge-core/content/view/S0305000900013167","The transition from slow to rapid word-learning was examined in a longitudinal study of 18 children. Beginning at age 1.2, mothers kept a diary of children's words. Diary entries were discussed during phone calls to the home every 2 1/2 weeks. A chronological record of nouns and other word classes was coded from the diary records. Thirteen children evidenced a prolonged period of up to three months during which rate of acquisition markedly increased. Almost three-quarters of the words learned during this period were nouns. Five children evidenced more gradual word-learning, and acquired a balance of nouns and other word classes. These results suggest that the terms 'vocabulary spurt' and 'naming explosion' best describe children who focus their early linguistic efforts on a single strategy: learning names for things. Other children may attempt to encode a broad range of experience with a more varied lexicon, a strategy that results in more gradual lexical growth.","The results suggest that the terms 'vocabulary spurt' and 'naming explosion' best describe children who focus their early linguistic efforts on a single strategy: learning names for things."
"Individual Differences in Lexical Processing at 18 Months Predict Vocabulary Growth in Typically Developing and Late-Talking Toddlers.","https://scispace.com/paper/individual-differences-in-lexical-processing-at-18-months-2yt6dh5m01","2012","Journal Article","Child Development","Anne Fernald
Virginia A. Marchman","10.1111/J.1467-8624.2011.01692.X","https://scispace.com/pdf/individual-differences-in-lexical-processing-at-18-months-2yt6dh5m01.pdf","Using online measures of familiar word recognition in the looking-while-listening procedure, this prospective longitudinal study revealed robust links between processing efficiency and vocabulary growth from 18 to 30 months in children classified as typically developing (n = 46) and as ""late talkers"" (n = 36) at 18 months. Those late talkers who were more efficient in word recognition at 18 months were also more likely to ""bloom,"" showing more accelerated vocabulary growth over the following year, compared with late talkers less efficient in early speech processing. Such findings support the emerging view that early differences in processing efficiency evident in infancy have cascading consequences for later learning and may be continuous with individual differences in language proficiency observed in older children and adults.","Findings support the emerging view that early differences in processing efficiency evident in infancy have cascading consequences for later learning and may be continuous with individual differences in language proficiency observed in older children and adults."
"The development of early phonological networks: An analysis of individual longitudinal vocabulary growth","https://scispace.com/paper/the-development-of-early-phonological-networks-an-analysis-3o6xqtsl1u","2024","Preprint","","Judith Kalinowski
Laura Hansel
Michaela Vystrčilová
Alexander S. Ecker
Nivedita Mani","10.31234/osf.io/xd5j3","https://scispace.compdf/the-development-of-early-phonological-networks-an-analysis-3o6xqtsl1u.pdf","While much work has emphasized the role of the environment in language learning, research equally reports consistent effects of the child’s knowledge, in particular, the words known to individual children, in steering further lexical development. Much of this work is based on cross-sectional data, assuming that the words typically known to children at n months predict the words typically known to children at n+x months. Given acknowledged variability in the number of words known to individual children at different ages, a more conclusive analysis of this issue requires examination of individual differences in the words learned by individual children across development, i.e., using longitudinal data. In the current study, using longitudinal vocabulary data from children learning Norwegian, we ask whether the phonological connectivity of a word to words that the child already knows or words in the child’s environment predicts the likelihood of the child learning that word across development. We compare three different measures of phonological connectivity that have been used in the literature to-date. The results suggest that the early vocabulary grows predominantly in a rich-get-richer manner, where word learning is predicted by the connectivity of a word to already known words. However, word learning is, to a lesser extent, also influenced by the connectivity of a word to words in the child’s linguistic environment. Our results highlight the promise of using longitudinal data to better understand the factors that influence vocabulary development and the insights to be gained from analyzing different measures of the same construct. ","The development of early phonological networks is predominantly driven by the connectivity of a word to already known words."
"Rapid Word Learning in Trilingual Children: One Spurt or Three?","https://scispace.com/paper/rapid-word-learning-in-trilingual-children-one-spurt-or-nl931wb54b","2016","","","Aaron Albin
Lisa Gershkoff-Stowe","","https://scispace.comwww.lingref.com/cpp/gasla/13/paper3272.pdf","Longitudinal studies that chart the nature and use of children's earliest words consistently note a common pattern of development. Children start out slowly adding one word at a time but then show a sudden acceleration in the rate of learning towards the end of the second year (Bates et al., 1994; Bates, Bretherton, & Snyder, 1988; Bloom, 1973; Dromi, 1987; Gershkoff-Stowe & Smith, 1997; Mervis & Bertrand, 1994). To illustrate, a child with a typical trajectory might produce approximately 10 words at 12 months, 50 words at 18 months, and 500 words at 24 months (Fenson et al., 1994). This translates to a rate of 0.83 words/month from 0-12 months, 6.67 words/month from 12-18 months, and 75 words per month from 18-24 months. In this hypothetical example, the acceleration in rate is exponential, since the change from 0.83 to 6.67 is an 800% increase, and the change from 6.67 to 75 is a 1125% increase. This 'explosion' in the size of a child's productive lexicon is commonly referred to as the vocabulary spurt. Why the vocabulary spurt occurs, and what metric should be used to identify it, are issues that have been extensively debated in the literature. Indeed, whether the phenomenon exists at all is still a matter of controversy. One problem is that not all children experience a spurt. For example, Goldfield & Reznick (1990) used maternal diaries to track the lexical development of 18 children, beginning when they were 14 months of age until each child reached the 75-word mark. They found considerable variation in individual growth curves, with some children showing a steady, linear increase in new word acquisitions and others exhibiting the sharp increase characteristic of the spurt. A second problem is that a lexical spurt may not be limited to a particular developmental period. For instance, in a recent study, Dandurand & Shultz (2011) used densely-recorded observations to detect statistically significant shifts in linearity in the vocabulary data of 20 children. Parents kept daily records of their children's vocabulary acquisitions beginning at 15 months of age until each child reached the 90-word mark. Using a technique based on Functional Data Analysis, Dandurand & Shultz found that most children experienced multiple spurts at different ages and of varying degrees of intensity. Finally, a third problem associated with studying the vocabulary spurt concerns the methods researchers use to detect nonlinearities in children's word learning. Bloom (2000) has argued that changes in vocabulary growth reflect a gradual continuous increase in the number of words acquired rather than an abrupt change in rate. Furthermore, the criteria used for detecting a vocabulary spurt, according to Bloom, lack objectivity and precision. For example, many researchers require children to attain some arbitrary number of words (e.g., 10 new object words in a 3-week period) rather than to assess the rate of change itself. A similar argument has been made by Ganger & Brent (2004) who questioned whether a 'spurt' refers to a nonlinearity in the overall size of the child's lexicon or in the rate of word learning.","This article found that most children experienced multiple spurt at different ages and of varying degrees of intensity, with some children showing a steady, linear increase in new word acquisitions and others exhibiting the sharp increase characteristic of the spurt."
"Testing Theories of the Vocabulary Spurt with Monolingual and Bilingual Infants","https://scispace.com/paper/testing-theories-of-the-vocabulary-spurt-with-monolingual-tq5sccyq8z","2023","Preprint","","Miranda Gómez Díaz
Laia Fibla
Rachel Ka Ying Tsui
Krista Byers‐Heinlein","10.31234/osf.io/dhpm3","https://scispace.compdf/testing-theories-of-the-vocabulary-spurt-with-monolingual-tq5sccyq8z.pdf","Sometime before their second birthday, many children have a period of rapid expressive vocabulary growth called the vocabulary spurt. Theories of the underlying mechanisms differ: accumulator models emphasize the accumulation of experience with words over time to yield a spurt-like pattern, while cognitive models attribute the spurt to cognitive changes. To test these theories, English–French monolingual and bilingual children with different exposure to each language were studied. Dense, longitudinal data was analyzed from 45 infants aged 16-30 months, whose expressive vocabulary was measured on a total of 617 occasions in English and/or French. Single-language (English and/or French), concept (number of concepts lexicalized across both languages), and word (sum of both languages) vocabulary scores were computed. Infants’ exposure to each language and their exposure balance were measured using a language exposure questionnaire. Logistic curves were fitted to each infant’s data to estimate the timing (midpoint) and steepness (slope) of the vocabulary spurt in single-language, concept, and word vocabularies. 76% of infants showed a spurt in at least one vocabulary type, and bilinguals were less likely to show one in their non-dominant than their dominant language. For single-language vocabulary, infants with more exposure to a language had earlier spurts. For combined vocabularies (concept and word), monolinguals and unbalanced bilinguals had earlier and steeper spurts than balanced bilinguals. Results better support the predictions of accumulator models than cognitive theories, and show that infants follow different vocabulary acquisition trajectories based on their language background. ","The vocabulary spurt is primarily driven by the accumulation of experience with words, and bilingual infants show a delay in the spurt in their non-dominant language."
"What Toddlers Talk About","https://scispace.com/paper/what-toddlers-talk-about-1zisgtdzlj","2004","Journal Article","Language","Betty Hart","10.1177/0142723704044634","","The size of the noun vocabulary children learn is influenced by what the children talk about with their caregivers when they are toddlers. For quartiles based on root noun vocabulary size, longitudinal data for 40 children (13n36 months old) were analysed using the MacArthur Communicative Development Inventory (CDI) to standardize the vocabulary of topics examined and a 100-utterance sample each month to equate the children for rate of talking. Analysis showed similar trends across the quartiles in the topic categories the children talked about, major increases in use of nouns different from those on the CDI, and diversity (different nouns per noun used) increasing as vocabulary increased. Richness differed across the quartiles, and the richness in nouns of the children’s utterances was associated not with diversity but with the richness in nouns of their parents’ utterances. An important aspect of the size of the noun vocabulary children learn may be the extent to which the children are matching not only...","This article found that the size of the noun vocabulary children learn is influenced by what the children talk about with their caregivers when they are toddlers, and the richness in nouns of the children's utterances was associated not with diversity but with the richness of their parents' utterances."
"The Development of Early Phonological Networks: An Analysis of Individual Longitudinal Vocabulary Growth","https://scispace.com/paper/the-development-of-early-phonological-networks-an-analysis-i7f1r697d52x","2025","Journal Article","Cognitive Science","Judith Kalinowski
Laura Hansel
Michaela Vystrčilová
Alexander S. Ecker
Nivedita Mani","10.1111/cogs.70109","","Abstract While much work has emphasized the role of the environment in language learning, research equally reports consistent effects of the child's knowledge, in particular, the words known to individual children, in steering further lexical development. Much of this work is based on cross‐sectional data, assuming that the words typically known to children at n months predict the words typically known to children at n +x months. Given acknowledged variability in the number of words known to individual children at different ages, a more conclusive analysis of this issue requires examination of individual differences in the words learned by individual children across development, that is, using longitudinal data. In the current study, using longitudinal vocabulary data from children learning Norwegian, we ask whether the phonological connectivity of a word to words that the child already knows or words in the child's environment predicts the likelihood of the child learning that word across development. The results suggest that the early vocabulary grows predominantly in a rich‐get‐richer manner, where word learning is predicted by the connectivity of a word to already known words. However, word learning is, to a lesser extent, also influenced by the connectivity of a word to words in the child's linguistic environment. Our results highlight the promise of using longitudinal data to better understand the factors that influence vocabulary development. ","This study examines individual longitudinal vocabulary growth in Norwegian children, finding that early vocabulary development is primarily driven by phonological connectivity to already known words, with environmental influences playing a secondary role."
"The Child’s Language System during the Vocabulary Explosion: Individual and Common Trends","https://scispace.com/paper/the-childs-language-system-during-the-vocabulary-explosion-4hsd9u8ewad9","2025","Journal Article","Ученые записки Казанского государственного университета","M. V. Eliseeva
K. A. Tossa","10.26907/2541-7738.2024.5.154-165","https://scispace.compdf/the-childs-language-system-during-the-vocabulary-explosion-4hsd9u8ewad9.pdf","A longitudinal diary study on the formation of two young girls’ individual language systems was carried out. In both cases, the general language ability was tracked by considering its key components, including the phonetic, lexical, morphological, and syntactic ones, as well as imitation skills and early metalinguistic awareness. The relation between these components (autonomy or mutual influence) was examined. The MacArthur–Bates Communicative Development Inventories (CDI) were used as an auxiliary tool. The findings of the two case studies were compared with the published results of a systemic analysis based on the extensive MacArthur–Bates-CDI database on various components of general language ability. The comparisons revealed shared and individual language acquisition patterns in the early stages of speech ontogenesis. The obtained data are consistent with those reported in previous research: in the early stage of language acquisition, the speech of the girls was marked by an interaction between the phonetic (articulation of complex three- or four-syllable words), lexical (vocabulary growth), and morphological (learning grammatical categories) components, while the syntactic component progressed relatively autonomously; and then, during the later stage, morphological skills served more as a supportive mechanism that facilitated the construction of grammatically accurate syntactic structures. ","A longitudinal study on two young girls' language development reveals shared and individual patterns, with phonetic, lexical, and morphological components interacting in early stages, and morphological skills supporting syntactic development in later stages."
"Testing theories of the vocabulary spurt with monolingual and bilingual infants.","https://scispace.com/paper/testing-theories-of-the-vocabulary-spurt-with-monolingual-39usdbq9c3","2024","Journal Article","Developmental Psychology","Miranda Gómez Díaz
NULL AUTHOR_ID
Rachel Ka Ying Tsui
NULL AUTHOR_ID","10.1037/dev0001777","","Sometime before their second birthday, many children have a period of rapid expressive vocabulary growth called the vocabulary spurt. Theories of the underlying mechanisms differ: Accumulator models emphasize the accumulation of experience with words over time to yield a spurtlike pattern, while cognitive models attribute the spurt to cognitive changes. To test these theories, English-French monolingual and bilingual children with different exposure to each language were studied. Dense, longitudinal data were analyzed from 45 infants aged 16-30 months, whose expressive vocabulary was measured on a total of 617 occasions in English and/or French. Single-language (English and/or French), concept (number of concepts lexicalized across both languages), and word (sum of both languages) vocabulary scores were computed. Infants' exposure to each language and their exposure balance were measured using a language exposure questionnaire. Logistic curves were fitted to each infant's data to estimate the timing (midpoint) and steepness (slope) of the vocabulary spurt in single-language, concept, and word vocabularies. Seventy-six percent of infants showed a spurt in at least one vocabulary type, and bilinguals were less likely to show one in their nondominant than their dominant language. For single-language vocabulary, infants with more exposure to a language had earlier spurts. For combined vocabularies (concept and word), monolinguals and unbalanced bilinguals had earlier and steeper spurts than balanced bilinguals. Results better support the predictions of accumulator models than cognitive theories and show that infants follow different vocabulary acquisition trajectories based on their language background. (PsycInfo Database Record (c) 2024 APA, all rights reserved). ","This study examines the vocabulary spurt in monolingual and bilingual infants, finding that accumulator models better explain the phenomenon, with exposure to language and language balance influencing the timing and steepness of vocabulary growth."
"Word-Spurt: A Milestone in Early Language Development——A Longitudinal Study on Five Mandarin-Speaking Children","https://scispace.com/paper/word-spurt-a-milestone-in-early-language-development-a-qjr8u1hpv4rh","","","","Zeng Tao
Duan Niuniu","10.16719/j.cnki.1671-6981.2014.03.004","","本文通过对五名汉语儿童的长期跟踪调查,旨在从词汇增长、句法出现和语义发展三方面发掘词汇飞跃时期儿童的语言特征.结果显示:儿童在18个月左右词汇迅猛增长,出现词汇飞跃现象;标志句法出现的词语组合和词汇飞跃在时间上紧密相连;词汇飞跃期儿童语义发展显著,体现为过度延伸词的逐渐减少及下位层次词的逐渐增加.词汇飞跃是汉语儿童早期语言发展的里程碑,表明其在词汇、句法和语义多个语言层面的飞跃.",""
"Examining Dutch children's vocabularies across infancy and toddlerhood: Demographic effects are age-specific and task-specific.","https://scispace.com/paper/examining-dutch-children-s-vocabularies-across-infancy-and-2t23ku1glz","2024","Journal Article","Journal of Child Language","Anika van der Klis
Caroline Junge
Frans Adriaans
René Kager","10.1017/s0305000924000199","","Limited studies have examined demographic differences in children's vocabulary in longitudinal samples, while there are questions regarding the duration, direction, and magnitude of these effects across development. In this longitudinal study, we included over 400 Dutch children. Caregivers filled out N-CDIs when children were 9-11 months (measuring word comprehension, word production, and gestures) and around 2-5 years of age (measuring word production). At 2-5 years, we also administered a receptive vocabulary task in the lab. We examined demographic effects on vocabulary size across infancy and toddlerhood. We found a disadvantage for males in infants' gestures and toddlers' vocabulary production. We found a negative effect of maternal education on infants' caregiver-reported vocabulary, but a positive effect on toddlers' lab-administered receptive vocabulary. Lastly, we found a negative effect of multilingualism - but only for the lab-administered task. Examining predictors in large, longitudinal samples ensures their robustness and generalisability across development.","Demographic effects on Dutch children's vocabularies across infancy and toddlerhood are age-specific and task-specific."
"From ‘mommy’ to ‘like’: tackling the emergence of abstractness during the second year of life using an ecological approach","https://scispace.com/paper/from-mommy-to-like-tackling-the-emergence-of-abstractness-1fux49rxkv","2021","Posted Content","","Bellagamba F
Anna M. Borghi
Claudia Mazzuca
Pecora G
Ferrara F
Fogel A","10.31234/OSF.IO/V9JMK","","The first abstract words, terms not referring to here and now, are acquired slowly in infancy. They are difficult to acquire as they are more detached from sensory modalities than concrete words. Recent theories propose that, because of their complexity, other people are pivotal for abstract concepts’ acquisition and use. Eight children (4 girls) and their mothers were observed longitudinally and extensively from 11 to 24 months of age, using a multiple case study method. We documented real time age of acquisition of abstract vocabulary in an interactive mother-child situation. Children progressively use more abstract concepts, with a major shift from 12-15 months and again from 22-24 months, but the qualitative data testify an incremental growth of abstract concepts. We also identified a progression in the acquisition of abstract concepts in relation to the overall productive vocabulary, suggesting that having more abstract terms in one’s vocabulary promotes faster language acquisition.","In this article, the authors documented real-time age of acquisition of abstract vocabulary in an interactive mother-child situation and found that children progressively use more abstract concepts with a major shift from 12-15 months and again from 22-24 months, but the qualitative data testify an incremental growth of abstract concepts."
"Análisis de la explosión del vocabulario en infantes hispano hablantes","https://scispace.com/paper/analisis-de-la-explosion-del-vocabulario-en-infantes-hispano-1q0zzy23yn","2015","Journal Article","Revista de Psicología y Ciencias del Comportamiento de la Unidad Académica de Ciencias Jurídicas y Sociales","Eduardo Hernández Padilla
Elda Alicia Alva Canto","10.29365/RPCC.20150529-35","https://scispace.com/pdf/analisis-de-la-explosion-del-vocabulario-en-infantes-hispano-1q0zzy23yn.pdf","The vocabulary spurt produced by eight infants was registered weekly during a 16-months period and analyzed. The verbal utterances of the infants were observed and recorded during everyday activities in natural surroundings. The results confirm the occurrence of vocabulary spurts in all the subjects. The children were divided into two groups, those of high production and those of low production. The differences in patterns of response were noted from the age of 27/28 months and suggest different word learning strategies in the two groups. The results support the apparent universality of the vocabulary spurt.","In this article, the vocabulary spurt produced by eight infants was registered weekly during a 16-month period and analyzed, and the results confirmed the occurrence of vocabulary spurts in all the subjects."
