"Paper Title","Paper Link","Publication Year","Publication Type","Publication Title","Author Names","DOI","PDF Link","Abstract","Relevant Excerpt"
"New look 3. Unconscious cognition reclaimed.","https://scispace.com/paper/new-look-3-unconscious-cognition-reclaimed-122p289iew","1992","Journal Article","American Psychologist","Anthony G. Greenwald","10.1037/0003-066X.47.6.766","https://scispace.com/pdf/new-look-3-unconscious-cognition-reclaimed-122p289iew.pdf","Recent research has established several empirical results that are widely agreed to merit description in terms of unconscious cognition. These findings come from experiments that use indirect tests for immediate or long-term residues of barely perceptible-but-unattended, or attended-but-forgotten events. Importantly, these well-established phenomena--insofar as they occur without initially involving focal attention--are limited to relatively minor cognitive feats. Unconscious cognition is now solidly established in empirical research, but it appears to be intellectually much simpler than the sophisticated agency portrayed in psychoanalytic theory. The strengthened position of unconscious cognitive phenomena can be related to their fit with the developing neural network (connectionist) theoretical framework in psychology.","are subliminal mere exposure and negative priming effects. These replicable findings indicate that attentionless unconscious cognition produces memory traces at the level of object or word representations. However, tests for establishment of more complex memory traces have generally not found them. Unconscious Learning:
 In a series of experiments started during the 1960s, Reber  (e.g., 1967, 1989; Reber & Allen, 1978) developed an ar-tiJicial grammar procedure in which subjects study 20 or more strings, each containing a half-dozen or so consonants, produced by a set of rules (a finite-state grammar) that is complex enough to be virtually impossible for subjects to discover. Nevertheless, after the study phase, subjects typically show significant, although considerably less than perfect, ability to discriminate novel strings generated by the grammar from novel nongrammatical strings. Similar results have been obtained by others (e.g., . Unconscious Learning:
 A conceptually related method is the pattern learning experiment . In an illustrative version of this procedure, a target stimulus for which the subject is searching may occur in any of four quadrants of a computer display on each trial. Rather than being entirely random, however, the target's location on a subset of trials is determined by its location over a sequence of preceding trials. The rules that govern target location are too complex to allow discovery by subjects but, nevertheless, subjects typically show gradual improvements in performance, indicated by decreasing latencies in locating the target quadrant in displays that contain many distractors. In some other versions of the pattern learning procedure (e.g., Kushner, Cleeremans, & Reber, 199 l), the subject's task is to predict the identity of the target on the next trial; with this task, gradual increases in prediction accuracy occur. Unconscious Learning:
 Most researchers using procedures similar to the artificial grammar and pattern learning experiments have used easily perceived, attended stimuli. When subjects' nonverbal performances indicate learning that they cannot articulate verbally-referred to by  as ""implicit learning"" and by  as ""nonconscious acquisition of covariation""-that learning can be regarded as unconscious (in the verbally unreportable, not the attentionless, sense). However, that interpretation is controversial. Several researchers (e.g., Brooks & Vokey, 199 1; Dulany, Carlson,  & Dewey, 1984, 1985; Perruchet, Gallego, & Savy, 1990;  Perruchet & Pacteau, 1990) have suggested that some (not all) artificial grammar or pattern learning findings are explainable by assuming that subjects acquire partial conscious knowledge about the experimental patterns. This skeptical position is supported by finding that subjects in some artificial grammar and pattern learning experiments can report fragmentary stimulus patterns that, even though falling well short of the complexity of the rules used to generate the stimuli, could consciously mediate the observed modest levels of rule-consistent oerformance. At the same time, subjects' ability to articulate partial rules on demand does not oblige concluding that those rules actually governed their observed (nonverbal) performance. It remains plausible that performance improvements in some pattern learning tasks are mediated by unconscious (i.e., verbally unreportable) knowledge."
"Implicit learning: Below the subjective threshold","https://scispace.com/paper/implicit-learning-below-the-subjective-threshold-3tygu1c537","1997","Journal Article","Psychonomic Bulletin & Review","Zoltan Dienes
Dianne C. Berry","10.3758/BF03210769","https://scispace.com/pdf/implicit-learning-below-the-subjective-threshold-3tygu1c537.pdf","In this review, we consider three possible criteria by which knowledge might be regarded as implicit or inaccessible: It might be implicit only in the sense that it is difficult to articulate freely, or it might be implicit according to either an objective threshold or a subjective threshold. We evaluate evidence for these criteria in relation to artificial grammar learning, the control of complex systems, and sequence learning, respectively. We argue that the convincing evidence is not yet in, but construing the implicit nature of implicit learning in terms of a subjective threshold is most likely to prove fruitful for future research. Furthermore, the subjective threshold criterion may demarcate qualitatively different types of knowledge. We argue that (1) implicit, rather than explicit, knowledge is often relatively inflexible in transfer to different domains, (2) implicit, rather than explicit, learning occurs when attention is focused on specific items and not underlying rules, and (3) implicit learning and the resulting knowledge are often relatively robust.","Dienes and Altmann (in press) found that, when subjects transferred their knowledge to a different domain, they were classifying substantially above chance even when they believed that they were literally guessing, and their confidence was not related to their accuracy. ARTIFICIAL GRAMMAR LEARNING:
 In summary, when trained by simply observing or memorizing exemplars, subjects have low, even if sometimes statistically significant, levels of metaknowledge about their knowledge of the artificial grammar. The knowledge appears to be below a subjective threshold. Features of Implicit Learning:
 Transfer across domains.  asked subjects to memorize strings of letters generated by a finite-state grammar. The more strings that subjects had previously studied, the easier they found it to memorize new strings generated by the grammar. There was also a benefit when the new strings were constructed from a different letter set, but the same grammar. That is, subjects could apply their knowledge of the grammar to a completely different letter set, leading Reber to claim that the knowledge was abstract and not perceptually bound. Subsequent work by , , , , and ) exposed subjects to strings constructed from one letter set and later tested subjects' ability to classify strings constructed from another letter set. As well as showing transfer performance significantly above chance, these studies have all demonstrated a transfer decrement-that is, an advantage ofsame-domain performance over transfer performance.  extended these findings to transfer between different modalities. In each of four experiments, involving transfer between letters and music or between graphic symbols and nonsense syllables, significant transfer occurred across domains. Furthermore, subjects performed better when tested in the same domain in which they had been trained than when tested in the different domain."
"Intact implicit learning in autism spectrum conditions","https://scispace.com/paper/intact-implicit-learning-in-autism-spectrum-conditions-4dhxl08603","2010","Journal Article","Quarterly Journal of Experimental Psychology","Jamie Brown
Balazs Aczel
Luis Jiménez
Scott Barry Kaufman
Kate Plaisted Grant","10.1080/17470210903536910","https://scispace.com/pdf/intact-implicit-learning-in-autism-spectrum-conditions-4dhxl08603.pdf","Individuals with autism spectrum condition (ASC) have diagnostic impairments in skills that are associated with an implicit acquisition; however, it is not clear whether ASC individuals show specific implicit learning deficits. We compared ASC and typically developing (TD) individuals matched for IQ on five learning tasks: four implicit learning tasks—contextual cueing, serial reaction time, artificial grammar learning, and probabilistic classification learning tasks—that used procedures expressly designed to minimize the use of explicit strategies, and one comparison explicit learning task, paired associates learning. We found implicit learning to be intact in ASC. Beyond no evidence of differences, there was evidence of statistical equivalence between the groups on all the implicit learning tasks. This was not a consequence of compensation by explicit learning ability or IQ. Furthermore, there was no evidence to relate implicit learning to ASC symptomatology. We conclude that implicit mechanisms are preserved in ASC and propose that it is disruption by other atypical processes that impact negatively on the development of skills associated with an implicit acquisition.","the participant with feedback about their accuracy. Sequence learning was assessed by comparing participants' RT between trials that were generated according to the frequent sequence (i.e., probable trials) and those that were generated by the alternative sequence (i.e., improbable trials). Tasks and procedure:
 Artificial grammar learning (AGL) task. During a learning phase, participants were told that they would be presented with a series of nonsense letter strings, which they should memorize because after each letter string disappeared they would need to reproduce it using the keyboard. Each string was presented for four seconds. When reproducing the strings, upon typing an incorrect letter, participants were instructed: ""Incorrect. Please try again."" Participants were then presented with the string for another four seconds before trying again to reproduce it. In total, 20 different strings were presented during this learning phase; each was presented twice, once in one of two blocks, which were separated by a short interval. Crucially, all the learning strings conformed to an artificial, semantic-free, finite-state grammar (see Figure ). To elaborate, grammatical strings are created by following the direction of the arrow, and a letter is added to the string whenever a node is passed (e.g., PTTTVPS or TSXXTTVV). These learning strings were replicated exactly from the stimuli reported in A. S.  and A. S. . Thus, letter strings were between 3 -8 letters long, and strings were selected so that all the variations of the grammar, the three loops, and all possible beginnings and endings were displayed (see A. S. . Tasks and procedure:
 Instructions up to the end of the learning phase described a memory experiment; the grammaticality of the strings was unknown to the participants. Upon beginning the test phase, participants were told that those strings had followed rules. Participants were further instructed that they would now see letter strings, some of which followed the rules and some of which did not, and that they would have to judge, according to their first feeling, whether they followed the rules. Test strings were presented one at a time, for a maximum of 6 seconds, and participants indicated yes if they felt a string followed the rules by pressing ""Y"" or no if they felt it did not by pressing ""N"". Test stimuli consisted of 25 grammatical letter strings (7 of which were old strings from the learning set, and the remaining were novel grammatical strings) and 25 nongrammatical letter strings, which were formed by introducing one or more violations into otherwise grammatical letter strings (see A. S. . Overall, grammar learning was assessed by comparing classification performance against chance performance. Probabilistic classification learning (PCL) task.:
 We used a version of the PCL task developed by Acze ´l (2006) and . During a learning phase, participants were told that they would be selling ice cream in an ice cream shop and that ""customers"" would come in to buy vanilla or chocolate ice cream cones (Figure )."
"A matter of time: Implicit acquisition of recursive sequence structures","https://scispace.com/paper/a-matter-of-time-implicit-acquisition-of-recursive-sequence-4sahwol4jc","2009","Proceedings Article","Conference Cognitive Science","Julia Udden
Susana Araújo
Christian Forkstam
Martin Ingvar
Peter Hagoort
Karl Magnus Petersson","","https://scispace.com/pdf/a-matter-of-time-implicit-acquisition-of-recursive-sequence-4sahwol4jc.pdf","A Matter of Time: Implicit Acquisition of Recursive Sequence Structures Julia Udden a,b,c (Julia.Udden@ki.se) Susana Araujo c,d (smaraujo@ualg.pt) Christian Forkstam a,b,c (Christian.Forkstam@ki.se) Martin Ingvar b (Martin.Ingvar@ki.se) Peter Hagoort a,c (Peter.Hagoort@mpi.nl) Karl Magnus Petersson a,b,c,d (Karl-Magnus.Petersson@mpi.nl) a Max Planck Institute for Psycholinguistics, Nijmegen, the Netherlands b Cognitive Neurophysiology Research Group, Stockholm Brain Institute Karolinska Institutet, Stockholm, Sweden c Donders Institute for Brain, Cognition and Behaviour: Centre for Cognitive Neuroimaging Radboud University Nijmegen, the Netherlands d Cognitive Neuroscience Research Group, Universidade do Algarve, Faro, Portugal classification session. In the acquisition phase, participants are typically engaged in a short term memory task using an acquisition sample of sequences generated from a formal grammar. Subsequently, subjects are informed that the symbol sequences were generated according to a complex system of rules and asked to classify novel items as grammatical or not, typically with the instruction to base their classification decisions on their immediate intuitive impression (i.e., guessing based on ''gut feeling''). It is a robust finding on regular grammars that subjects perform well above chance and more so after several days of learning (Folia et al., 2008; Forkstam, Elwer, Ingvar & Petersson, 2008). Taking the perspective that some aspects of the faculty of language are shared with nonhuman animals (faculty of language in a broad sense; FLB) and that other aspects are specific to human language (faculty of language in a narrow sense; FLN), the quest for FLN in AGL has centered around the theoretical construct of the Chomsky hierarchy – a complexity hierarchy for formal grammars, which are divided into regular (finite state; T3), context-free (phrase- structure; T2), context-sensitive (T1), and general phrase- structure grammars (Turing-Tue; T0), and its embodiment in the recursion-only hypothesis for FLN outlined in a seminal paper by Hauser, Chomsky and Fitch (2002). For example, in a sentence such as: Abstract A dominant hypothesis in empirical research on the evolution of language is the following: the fundamental difference between animal and human communication systems is captured by the distinction between regular and more complex non-regular grammars. Studies reporting successful artificial grammar learning of nested recursive structures and imaging studies of the same have methodological shortcomings since they typically allow explicit problem solving strategies and this has been shown to account for the learning effect in subsequent behavioral studies. The present study overcomes these shortcomings by using subtle violations of agreement structure in a preference classification task. In contrast to the studies conducted so far, we use an implicit learning paradigm, allowing the time needed for both abstraction processes and consolidation to take place. Our results demonstrate robust implicit learning of recursively embedded structures (context-free grammar) and recursive structures with cross-dependencies (context-sensitive grammar) in an artificial grammar learning task spanning 9 days. Keywords: Implicit artificial grammar learning; centre embedded; cross-dependency; implicit learning; context- sensitive grammar; context-free grammar; regular grammar; non-regular grammar Introduction During the past decade, investigations of language acquisition as well as language evolution have been revitalized by the artificial grammar learning (AGL) paradigm which allows animals as well as children and adult humans to implicitly acquire new syntactic structures without explicit teaching, i.e., similar to the conditions for natural language development. In this context, implicit learning is a process whereby a complex, rule-governed knowledge base is acquired largely independent of awareness of both the process and product of acquisition (Reber, Walkenfeld & Hernstadt, 1991). In AGL, one separates the acquisition and the testing phase, and the paradigm consists of at least one acquisition and The cat the rats the dog chases fear is sitting in the yard. The recursive embedding of subordinate phrases in super- ordinate phrases introduces morphological noun-verb agreement dependencies or what we here call nested dependencies. In a recent paper (de Vries, Monaghan, Knecht, & Zwitserlood, 2008), participants were trained on such sequences following the pattern A 1 A 2 A 3 B 3 B 2 B 1 and tested on different kinds of violations, all in one session. Critically, there was no indication of learning in the hierarchical vs. scrambled condition, where non- grammatical sequences were only violating the","Acquisition of Recursive Sequence Structures Authors: Julia Uddén,Susana Araujo Keywords: Implicit artificial grammar learning, centre embedded, cross-dependency, implicit learning, contextsensitive grammar, context-free grammar, regular grammar, non-regular grammar Introduction:
 During the past decade, investigations of language acquisition as well as language evolution have been revitalized by the artificial grammar learning (AGL) paradigm which allows animals as well as children and adult humans to implicitly acquire new syntactic structures without explicit teaching, i.e., similar to the conditions for natural language development. In this context, implicit learning is a process whereby a complex, rule-governed knowledge base is acquired largely independent of awareness of both the process and product of acquisition . I n A G L , one separates the acquisition and the testing phase, and the paradigm consists of at least one acquisition and classification session. In the acquisition phase, participants are typically engaged in a short term memory task using an acquisition sample of sequences generated from a formal grammar. Subsequently, subjects are informed that the symbol sequences were generated according to a complex s y s t e m o f r u l e s a n d a s k e d t o c l a s s i f y n o v e l i t e m s a s grammatical or not, typically with the instruction to base their classification decisions on their immediate intuitive impression (i.e., guessing based on ''gut feeling''). It is a robust finding on regular grammars that subjects perform well above chance and more so after several days of learning . Introduction:
 Taking the perspective that some aspects of the faculty of language are shared with nonhuman animals (faculty of language in a broad sense; FLB) and that other aspects are specific to human language (faculty of language in a narrow sense; FLN), the quest for FLN in AGL has centered around the theoretical construct of the Chomsky hierarchy -a complexity hierarchy for formal grammars, which are divided into regular (finite state; T3), context-free (phrasestructure; T2), context-sensitive (T1), and general phrasestructure grammars (Turing-Tue; T0), and its embodiment in the recursion-only hypothesis for FLN outlined in a seminal paper by . For example, in a sentence such as: Introduction:
 The cat the rats the dog chases fear is sitting in the yard."
"On the pursuit of the brain network for proto-syntactic learning in non-human primates: conceptual issues and neurobiological hypotheses.","https://scispace.com/paper/on-the-pursuit-of-the-brain-network-for-proto-syntactic-2apel4mbjn","2012","Journal Article","Philosophical Transactions of the Royal Society B","Christopher I. Petkov
Benjamin P. Wilson","10.1098/RSTB.2012.0073","https://scispace.com/pdf/on-the-pursuit-of-the-brain-network-for-proto-syntactic-2apel4mbjn.pdf","Songbirds have become impressive neurobiological models for aspects of human verbal communication because they learn to sequence their song elements, analogous, in some ways, to how humans learn to produce spoken sequences with syntactic structure. However, mammals such as non-human primates are considered to be at best limited-vocal learners and not able to sequence their vocalizations, although some of these animals can learn certain ‘artificial grammar’ sequences. Thus, conceptual issues have slowed the progress in exploring potential neurobiological homologues to language-related processes in species that are taxonomically closely related to humans. We consider some of the conceptual issues impeding a pursuit of, as we define them, ‘proto-syntactic’ capabilities and their neuronal substrates in non-human animals. We also discuss ways to better bridge comparative behavioural and neurobiological data between humans and other animals. Finally, we propose guiding neurobiological hypotheses with which we aim to facilitate the future testing of the level of correspondence between the human brain network for syntactic-learning and related neurobiological networks present in other primates. Insights from the study of non-human primates and other mammals are likely to complement those being obtained in birds to further our knowledge of the human language-related network at the cellular level.","different species. In this section, we consider (i) how AGL can be used to study implicit or explicit learning processes and (ii) several approaches in which behavioural and neurobiological data can be similarly obtained across species to facilitate comparative testing. OBTAINING COMPARATIVE DATA ON ARTIFICIAL GRAMMAR LEARNING: IMPLICIT VERSUS EXPLICIT LEARNING:
 The use of AGL paradigms is a promising approach for understanding what aspects of syntactic-related patterns can be learned by animals. Following Chomsky's theoretical formulations of the structure of language , Reber pioneered the use of artificial language paradigms to study how humans learn language structure . AGL paradigms have been used to explore the types of structures that humans (including infants and adults), songbirds, non-human primates and rodents can learn . However, there are differences in how some of these study groups have been tested such that different learning substrates might have been engaged. OBTAINING COMPARATIVE DATA ON ARTIFICIAL GRAMMAR LEARNING: IMPLICIT VERSUS EXPLICIT LEARNING:
 The infant and non-human primate data have tended to be obtained relying on the implicit learning of artificial grammars, which is often studied by measuring preferential looking during habituation/ dishabituation paradigms . Typically, these experiments are conducted by familiarizing the individual for some length of time with exemplary sequences of stimuli that follow the artificial-grammar pattern or rule(s) . Then in the second 'testing phase' of the experiment, the individual is tested with well-formed 'correct' or 'violation' sequences during natural response measurements, such as preferential looking towards the audio speaker that presented the test sequence. In this way, the familiarization and testing need not engage perceptual awareness for learning to have occurred, i.e. implicit learning . However, in the bird and rodent studies, the participants were trained to discriminate correct versus violation sequences, which could engage an explicit rather than implicit learning system . Similarly, in many of the human studies  either during the familiarization phase or during the testing phase, the participants were engaged in learning the sequencing structure of the artificial grammar by being asked to judge whether the sequences were correct or violation sequences. When participants are actively seeking to determine the artificial-grammar pattern, there is a risk that they might fail to learn some of the sequencing relationships after the point at which they feel that they have sufficiently understood the pattern and are performing reasonably well. Such explicit learning could engage different brain circuits  in relation to studies of AGL using implicit learning (such as those in infants and non-human primates)."
