"Paper Title","Paper Link","Publication Year","Publication Type","Publication Title","Author Names","DOI","PDF Link","Abstract","TL;DR"
"Knowledge Representation, Heuristics, and Awareness in Artificial Grammar Learning","https://scispace.com/paper/knowledge-representation-heuristics-and-awareness-in-3uw0rgkvhu","2008","Dissertation","","Tobias Johansson","","https://scispace.com/pdf/knowledge-representation-heuristics-and-awareness-in-3uw0rgkvhu.pdf","People can become sensitive to the general structure of different parts of the environment, often without studying that general structure directly, but through being incidentally exposed to instances that conform to the structure. When such learning proceeds unintentionally and gives rise to knowledge that is difficult to verbalize it is often referred to as implicit learning. One of the most commonly used experimental paradigms in the study of implicit learning is artificial grammar learning, in which participants are exposed to sequences that conform to a set of rules without being informed about the presence of rules. In a subsequent test phase, participants can usually distinguish between sequences that conform to and sequences that violate the rules, without being able to say much about the underlying rules. There are many different theories about the kind of knowledge representations that underlie sensitivity to general structure in artificial grammar learning, and there are also different viewpoints concerning how to measure the conscious status of the knowledge acquired in artificial grammar learning. Investigating these different theories is important, partly because it may provide an understanding of the extent to which complex learning and abstraction of structure proceeds unconsciously. 
Study I of this thesis investigated artificial grammar learning and the use of a fluency heuristic, which involves relying on the surprising ease of processing an item as a basis for making a judgment. Other studies have shown that the fluency heuristic is used in a wide variety of judgments (e.g., recognition and preference). Study I showed that participants rely on a fluency heuristic in artificial grammar learning as well, but mainly under non-analytic pro¬ces¬sing conditions when participants were encouraged to respond rapidly and thereby make global judgments about items without processing details to any large extent. This is consistent with the idea that fluency may provide a cue for indirect sensitivity to general structure.
Study II investigated the effect of non-analytic processing on the conscious status of knowledge as assessed by confidence judgments. It was found that non-analytic processing increased the availability of conscious knowledge, consistent with the idea that part of the knowledge acquired in artificial grammar learning may be, not inherently unconscious, but of a kind that is available through a non-analytic form of introspection. One possibility is that, relative to more analytic forms of introspection, non-analytic introspection may be more sensitive to the non-focal peripheral contents of consciousness, the so called “fringe consciousness”. This could explain why the knowledge acquired in artificial grammar learning often seems intuitive, even though it is not necessarily unconscious. 
Study III investigated whether artificial grammar learning gives rise to knowledge that is independent from the surface features of the exposure material. A number of claims have been offered in the literature for such surface-independent knowledge, particularly as a result of extended exposure to regularities. The results clearly suggested that the knowledge formed under observational learning conditions in artificial grammar learning is not independent from the surface features of the exposure material. The results are consistent with a variety of computational models of artificial grammar learning that rely on surface-dependent perceptual representations. 
Finally, Study IV investigated whether the knowledge acquired in artificial grammar learning is unconscious in the sense that it may be expressed unintentionally. The results showed that, to the extent that knowledge was expressed, it was expressed intentionally. However, the low levels of performance in Study IV limit the generality of the findings. Possible reasons for the low performance are discussed in the context of different models of artificial grammar learning. 
Taken together, the studies in this thesis illuminate issues regarding both knowledge representation and the conscious status of knowledge in artificial grammar learning. In general, the studies are in line with an episodic framework according to which the general abstract structure of a domain is not automatically extracted. Instead, both learning and awareness proceeds as a function of task demands, intentions, expectations, and processing strategies.","This paper showed that non-analytic processing increased the availability of conscious knowledge, consistent with the idea that part of the knowledge acquired in artificial grammar learning may be, not inherently unconscious, but of a kind that is available through a nonanalytic form of introspection."
"Abrupt and spontaneous strategy switches emerge in simple regularised neural networks","https://scispace.com/paper/abrupt-and-spontaneous-strategy-switches-emerge-in-simple-2va5z6s58u4f","2024","Journal Article","PLOS Computational Biology","Anika T. Löwe
Léo Touzo
Paul S. Muhle-Karbe
Andrew Saxe
Christopher Summerfield
Nicolas W. Schuck","10.1371/journal.pcbi.1012505","","Humans sometimes have an insight that leads to a sudden and drastic performance improvement on the task they are working on. Sudden strategy adaptations are often linked to insights, considered to be a unique aspect of human cognition tied to complex processes such as creativity or meta-cognitive reasoning. Here, we take a learning perspective and ask whether insight-like behaviour can occur in simple artificial neural networks, even when the models only learn to form input-output associations through gradual gradient descent. We compared learning dynamics in humans and regularised neural networks in a perceptual decision task that included a hidden regularity to solve the task more efficiently. Our results show that only some humans discover this regularity, whose behaviour was marked by a sudden and abrupt strategy switch that reflects an aha-moment. Notably, we find that simple neural networks with a gradual learning rule and a constant learning rate closely mimicked behavioural characteristics of human insight-like switches, exhibiting delay of insight, suddenness and selective occurrence in only some networks. Analyses of network architectures and learning dynamics revealed that insight-like behaviour crucially depended on a regularised gating mechanism and noise added to gradient updates, which allowed the networks to accumulate “silent knowledge” that is initially suppressed by regularised gating. This suggests that insight-like behaviour can arise from gradual learning in simple neural networks, where it reflects the combined influences of noise, gating and regularisation. These results have potential implications for more complex systems, such as the brain, and guide the way for future insight research. ","Simple neural networks exhibit insight-like behaviour, characterized by sudden strategy switches, when trained with regularisation and noise, mirroring human cognitive processes, and suggesting that insight can arise from gradual learning in complex systems."
"Differences in implicit vs. explicit grammar processing as revealed by drift-diffusion modeling of reaction times","https://scispace.com/paper/differences-in-implicit-vs-explicit-grammar-processing-as-24kdy3cbct","2021","","","David Abugaber
Kara Morgan-Short","","https://scispace.com/pdf/differences-in-implicit-vs-explicit-grammar-processing-as-24kdy3cbct.pdf","Author(s): Abugaber, David; Morgan-Short, Kara | Abstract: Learning new languages is a complex cognitive task involving both implicit and explicit processes. Batterink, Oudiette, Reber, and Paller (2014) report that participants with vs. without conscious awareness of a hidden semi-artificial language regularity showed no significant differences in grammar learning, suggesting that implicit/explicit routes may be functionally equivalent. However, their operationalizing of learning via median reaction times might not capture underlying differences in cognitive processes. In a conceptual replication, we compared rule-aware (n=14) and rule-unaware (n=21) participants via drift-diffusion modeling, which can quantify distinct subcomponents of evidence-accumulation processes (Ratcliff a Rouder, 1998). For both groups, grammar learning was manifested in non-decision parameters, suggesting anticipation of motor responses. For rule-aware participants only, learning also affected bias in evidence accumulation during word reading. These results suggest that implicit grammar learning may be manifested through low-level mechanisms whereas explicit grammar learning may involve more direct engagement with encoded target meanings.","Abugaber et al. as discussed by the authors compared rule-aware and rule-unaware participants via drift-diffusion modeling, which can quantify distinct subcomponents of evidence accumulation processes."
"Dissociating Implicit and Explicit Learning of Syntactic Rules","https://scispace.com/paper/dissociating-implicit-and-explicit-learning-of-syntactic-4gw0plfxyz","2006","","","Patrick Rebuschat
John N. Williams","","https://scispace.com/pdf/dissociating-implicit-and-explicit-learning-of-syntactic-4gw0plfxyz.pdf","Dissociating Implicit and Explicit Learning of Syntactic Rules Patrick Rebuschat (pr277@cam.ac.uk) RCEAL, University of Cambridge, 9 West Road, Cambridge CB3 9DP, UK John N. Williams (jnw12@cam.ac.uk) RCEAL, University of Cambridge, 9 West Road, Cambridge CB3 9DP, UK Keywords: Implicit learning; explicit learning; syntax; Artificial Grammar Learning; language acquisition Introduction It is common to refer to language acquisition as a real-world phenomenon where most learning proceeds implicitly, i.e. independently of the deliberate intention to learn and in the absence of awareness of what was learned. At the same time, however, little effort has been made, in implicit learning research, to employ stimuli that resemble natural languages more closely than the letter or tone sequences commonly found, for example, in Artificial Grammar Learning (AGL) studies. The present experiment seeks to apply AGL methodology and awareness measurement techniques to the learning of natural language syntax. Methods 21 adult native-speakers of English with no background in German (or any other V2-language) were recruited for this experiment. The average age of the participants (8 male, 14 female) was 21.5 years. A semi-artificial language, consisting of English words and German syntax, was used in this experiment. In generating the stimuli, English declarative sentences were rearranged in accordance to German verb placement rules as in (1-2): (1) Over the past year PLAYED Jennifer many important parts in the school productions. (V2 in main clause) (2) Yesterday LEARNED Chloe that the university her application ACCEPTED . (V2 in main clause, V-final in subordinate clause) Training phase. Participants were exposed, under incidental learning conditions, to auditory input consisting of 256 sentences of the semi-artificial language. They were instructed to listen to ‘scrambled sentences’ in a meaning- oriented task. They had to judge, on an item-by-item basis, whether the statements made in the sentences were plausible or not. Only half of the presented sentences were plausible. Testing phase. Participants were told that the scrambling of the previous 256 sentences had not been arbitrary but that a ‘complex system’ had determined the word-order of all items. They were then instructed to listen to 80 new scrambled sentences and to judge, on an item-by-item basis, whether they were generated in accordance to the above- mentioned system or not. In addition, participants were asked to indicate, after each grammaticality-judgment, how confident they were in their decisions on a binary confidence scale (high vs. low confidence). Only half of the 80 novel sentences were grammatical. With the exception of a few function words (determiners and prepositions), no lexical item was repeated from the training set, making the test analogous to the letter-set transfer paradigm in AGL research. Results and Discussion Participants’ confidence ratings were analyzed using the binary confidence technique (Kunimoto et al., 2001; Tunney & Shanks, 2003). The analysis indicated that 13 participants were equally confident in correct and incorrect classifications, suggesting that they were not aware of the knowledge used in the grammaticality-judgment task (GJT). There was no correlation between confidence and accuracy (r 2 = 0.0007). The Zero-Correlation Criterion was thus met (Dienes et al., 1995). Average GJT performance was 51% and hence not significantly different from chance. In the case of the remaining 8 participants, the analysis indicated that they tended to be more confident in correct decisions and less confident in incorrect ones, suggesting they had some awareness of the information they were relying on in the classification task. For this group there was a positive linear relationship between confidence and accuracy (r 2 = 0.59). The more confident participants were, the higher they tended to score on the GJT. Average GJT performance was 63%, which is significantly different from chance (p < 0.01). In sum, the results of this experiment indicate that adults are able to acquire some of the regularities of German word- order after a relatively brief exposure period, while processing sentences for meaning and without having been explicitly instructed to do so. However, whatever learning took place in this experiment was explicit. Our continuing research explores whether there are conditions under which adults can implicitly acquire syntactic rules. References Dienes, Z., Altmann, G. T. M., Kwan, L., & Goode, A. (1995). Unconscious knowledge of artificial grammars is applied strategically. Journal of Experimental Psychology: General, 21, 1322-1338. Kunimoto, C., Miller, J., & Pashler, H. (2001). Confidence and accuracy of near-threshold discrimination responses. Consciousness & Cognition, 10, 294-340. Tunney, R. J., & Shanks, D. R. (2003). Subjective measures of awareness and implicit cognition. Memory & Cognition, 31 (7), 1060-1071.","The present experiment seeks to apply AGL methodology and awareness measurement techniques to the learning of natural language syntax by exposing adult native-speakers of English with no background in German to semi-artificial language stimuli."
"Modality, presentation, domain and training effects in statistical learning","https://scispace.com/paper/modality-presentation-domain-and-training-effects-in-29gv7kil","2022","Journal Article","Dental science reports","Krisztina Sára Lukics
Ágnes Lukács","10.1038/s41598-022-24951-7","https://scispace.com/pdf/modality-presentation-domain-and-training-effects-in-29gv7kil.pdf","While several studies suggest that the nature and properties of the input have significant effects on statistical learning, they have rarely been investigated systematically. In order to understand how input characteristics and their interactions impact statistical learning, we explored the effects of modality (auditory vs. visual), presentation type (serial vs. simultaneous), domain (linguistic vs. non-linguistic), and training type (random, starting small, starting big) on artificial grammar learning in young adults (N = 360). With serial presentation of stimuli, learning was more effective in the auditory than in the visual modality. However, with simultaneous presentation of visual and serial presentation of auditory stimuli, the modality effect was not present. We found a significant domain effect as well: a linguistic advantage over nonlinguistic material, which was driven by the domain effect in the auditory modality. Overall, the auditory linguistic condition had an advantage over other modality-domain types. Training types did not have any overall effect on learning; starting big enhanced performance only in the case of serial visual presentation. These results show that input characteristics such as modality, presentation type, domain and training type influence statistical learning, and suggest that their effects are also dependent on the specific stimuli and structure to be learned. ","This paper explored the effects of modality (auditory vs. visual), presentation type (serial vs. simultaneous), domain and training type (random, starting small, starting big) on artificial grammar learning in young adults."
"Insight Grammar Learning","https://scispace.com/paper/insight-grammar-learning-xzrrg3ftz1","2016","Journal Article","The Journal of Cognitive Science","Emília Garcia Casademont
Luc Steels","10.17791/JCS.2016.17.1.27","","We report on computational experiments in which a learning agent incrementally acquires grammar from a tutoring agent through situated interactions. The learner is able to (i) detect impasses in routine language processing, such as missing a grammatical construction to integrate a word in the rest of the sentence structure, (ii) move to a meta-level to repair these impasses, primarily based on semantics, and (iii) then expand or restructure his grammar using insights gained from repairs. The paper proposes a cognitive architecture able to support this kind of insight learning and tests it with a computational implementation for a grammar learning task.","A cognitive architecture able to support this kind of insight learning is proposed and tested with a computational implementation for a grammar learning task."
"Desirable Difficulties in Language Learning? How Talker Variability Impacts Artificial Grammar Learning","https://scispace.com/paper/desirable-difficulties-in-language-learning-how-talker-1a8wj2awr7","2021","Posted Content","Language Learning","Federica Bulgarelli
Daniel J. Weiss","10.1111/LANG.12464","https://scispace.com/pdf/desirable-difficulties-in-language-learning-how-talker-1a8wj2awr7.pdf","Contending with talker variability has been found to lead to processing costs but also benefits by focusing learners on invariant properties of the signal. These discrepant findings may indicate that talker variability acts as a desirable difficulty. That is, talker variability may lead to initial costs followed by long term benefits for retention and generalization. Adult participants learned an artificial grammar affording learning of multiple components by 1-, 2- or 8- talkers, tested at 3 time points. The 8-talker condition did not impact learning. The 2-talker condition negatively impacted some aspects of learning, but only under more difficult learning conditions. Across both experiments, generalization of the grammatical dependency was difficult. Taken together, we discovered that high and limited talker variability differentially impact artificial grammar learning. However, talker variability does not act as a desirable difficulty in the current paradigm, as the few evidenced costs were not related to long-term benefits.","The authors found that high and limited talker variability differentially impact artificial grammar learning, and that high variability may lead to initial costs followed by long term benefits for retention and generalization."
"Developmental changes in brain activation during novel grammar learning in 8-25-year-olds","https://scispace.com/paper/developmental-changes-in-brain-activation-during-novel-46bsokb9ft","2024","Journal Article","Developmental Cognitive Neuroscience","Willeke M. Menks
Clara Ekerdt
K. Lemhöfer
E. Kidd
G. Fernández
J. M. McQueen
G. Janzen","10.1016/j.dcn.2024.101347","","While it is well established that grammar learning success varies with age, the cause of this developmental change is largely unknown. This study examined functional MRI activation across a broad developmental sample of 165 Dutch-speaking individuals (8-25 years) as they were implicitly learning a new grammatical system. This approach allowed us to assess the direct effects of age on grammar learning ability while exploring its neural correlates. In contrast to the alleged advantage of children language learners over adults, we found that adults outperformed children. Moreover, our behavioral data showed a sharp discontinuity in the relationship between age and grammar learning performance: there was a strong positive linear correlation between 8 and 15.4 years of age, after which age had no further effect. Neurally, our data indicate two important findings: (i) during grammar learning, adults and children activate similar brain regions, suggesting continuity in the neural networks that support initial grammar learning; and (ii) activation level is age-dependent, with children showing less activation than older participants. We suggest that these age-dependent processes may constrain developmental effects in grammar learning. The present study provides new insights into the neural basis of age-related differences in grammar learning in second language acquisition. ","This study of 165 Dutch-speaking individuals (8-25 years) found that adults outperformed children in novel grammar learning, with a sharp discontinuity in age-performance correlation after 15.4 years, and age-dependent neural activation patterns."
"Animation in artificial grammar learning: can animation facilitate learning?","https://scispace.com/paper/animation-in-artificial-grammar-learning-can-animation-gb9xgndt","2022","Dissertation","","","10.31390/gradschool_theses.872","","Domangue, Mathews, Sun, Roussel, and Guidry (2004) trained participants to generate valid exemplars from an artificial grammar using either memory-based or model-based processing. Their results showed that learning by memory-based processing resulted in fast but inaccurate performance, while model-based learning resulted in slow but accurate performance. Attempts to integrate both types of training did not result in fast and accurate string generation. Fast and accurate performance was achieved by Sun and Mathews (2004) using a computer animated display to train participants. The current study used a 2x2x2 factorial design to determine why participants who view an animated display of a diagram of the grammar perform well at test. The results suggest that the diagram informs participants of which letters, or chunks of letters can appear in each position, as well as where they cannot appear. Animating the diagram focuses attention on the relevant portion of the complex display and leads to the best performance. ","This paper used a 2x2x2 factorial design to determine why participants who view an animated display of a diagram of the grammar perform well at test, and the results suggest that the diagram informs participants of which letters, or chunks of letters can appear in each position, as well as where they cannot appear."
"Complexity, Training Paradigm Design, and the Contribution of Memory Subsystems to Grammar Learning.","https://scispace.com/paper/complexity-training-paradigm-design-and-the-contribution-of-280zfcusg9","2016","Journal Article","PLOS ONE","Mark Antoniou
Marc Ettlinger
Patrick C. M. Wong","10.1371/JOURNAL.PONE.0158812","https://scispace.com/pdf/complexity-training-paradigm-design-and-the-contribution-of-280zfcusg9.pdf","Although there is variability in nonnative grammar learning outcomes, the contributions of training paradigm design and memory subsystems are not well understood. To examine this, we presented learners with an artificial grammar that formed words via simple and complex morphophonological rules. Across three experiments, we manipulated training paradigm design and measured subjects' declarative, procedural, and working memory subsystems. Experiment 1 demonstrated that passive, exposure-based training boosted learning of both simple and complex grammatical rules, relative to no training. Additionally, procedural memory correlated with simple rule learning, whereas declarative memory correlated with complex rule learning. Experiment 2 showed that presenting corrective feedback during the test phase did not improve learning. Experiment 3 revealed that structuring the order of training so that subjects are first exposed to the simple rule and then the complex improved learning. The cumulative findings shed light on the contributions of grammatical complexity, training paradigm design, and domain-general memory subsystems in determining grammar learning success.","Three experiments presented learners with an artificial grammar that formed words via simple and complex morphophonological rules and revealed that structuring the order of training so that subjects are first exposed to the simple rule and then the complex improved learning."
