"Paper Title","Paper Link","Publication Year","Publication Type","Publication Title","Author Names","DOI","PDF Link","Abstract","Relevant Excerpt"
"Abrupt learning and retinal size specificity in illusory-contour perception","https://scispace.com/paper/abrupt-learning-and-retinal-size-specificity-in-illusory-2804isk9hx","1997","Journal Article","Current Biology","Nava Rubin
Ken Nakayama
Robert Shapley","10.1016/S0960-9822(06)00217-X","https://www.cns.nyu.edu/~nava/mypapers/Rubin_etal_CurrBio1997.pdf","","or less . Second, the improvement was incremental: often it took place over hundreds or even thousands of trials , and even in cases in which fast learning phases were observed , performance showed a steep, but gradual, improvement over a few tens of trials. Discussion:
 In the study presented here, neither of these two characteristics is present. First, because of the large retinal distances between the inducers (more than 10° visual angle in the 60 cm viewing condition), the relevant information was stored on widely separated neurons in early visual cortical areas. Second, the learning occurred not only fast but abruptly: the subjects underwent a transition between a 'don't know' and a 'know' state, which did not show the intermediate-performance stages observed in other studies. Taken together, the abruptness and the global nature of the task make it unlikely that a model in which learning depends exclusively on quick synaptic modifications of local connectivity in early cortical areas, such as has been suggested previously for other tasks , could account for our results. Discussion:
 Yet the size specificity of the learning in our study suggests an involvement of early visual cortical areas in which retinotopic organization still exists. Thus, it is difficult to conceive of the learning as occurring at a single site, whether it be retinotopic or some higher area. Rather, our findings suggest a more global rerouting of information and knowledge structure . Our preliminary results from other experiments also seem to indicate that there is a 'high-level', general component to the learning, as well as stimulus-specific components. As such, the results suggest that the dichotomy made between insight and gradual, incremental learning may need to be revised. Discussion:
 Rather than postulating two distinct mechanisms for the two forms of learning, our findings may be better understood within a single framework, suggesting a major role for interactions between multiple levels of representation of the stimuli . Discussion:
 This view has already been put forward by Hebb , who suggested that ""insight ... continually affects the learning of the adult animal,"" and that ""it is not wholly separate from rote learning."" Hebb proposed a unitary mechanism, based on the associations of co-occurring internal states, within which to understand all learning phenomena. However, he emphasized that the sequence of internal states is not merely determined by external events, but is rather an active process in which the animal is attempting continually to discover structure and meaning in the incoming information. This is a very different view from the incremental and 'unsupervised' form of learning with which Hebb is usually associated today . Our findings, as well as other recently reported evidence , vindicate Hebb's original ideas and call for a more integrative approach to studying the organization of learning."
"The phase transition in human cognition","https://scispace.com/paper/the-phase-transition-in-human-cognition-3mzor5y2i6","2009","Journal Article","New Mathematics and Natural Computation","Michael J. Spivey
Sarah Anderson
Rick Dale","10.1142/S1793005709001234","https://scispace.com/pdf/the-phase-transition-in-human-cognition-3mzor5y2i6.pdf","This article attempts to build a bridge between cognitive psychology and computational neuroscience, perhaps allowing each group to understand the other's theoretical insights and sympathize with the other's methodological challenges. In briefly discussing a collection of conceptual demonstrations, neural network and dynamical system simulations, and human experimental results, we highlight the importance of the concept of phase transition to understand cognitive function. Our goal is to show that viewing cognition as a self-organizing process (involving phase transitions, criticality, and autocatalysis) affords a more natural explanation of these data over traditional approaches inspired by a sequence of linear filters (involving detection, recognition, and then response selection).","Title: THE PHASE TRANSITION IN HUMAN COGNITION Authors: Spivey,Anderson,Dale,Michael J Spivey,Sarah E Anderson,Rick Dale Keywords: cognition, dynamical systems, emergence, phase transition"
"Mice in a labyrinth: Rapid learning, sudden insight, and efficient exploration","https://scispace.com/paper/mice-in-a-labyrinth-rapid-learning-sudden-insight-and-4nnr7126ox","2021","Posted Content","bioRxiv","Matthew Rosenberg
Tony Zhang
Pietro Perona
Markus Meister","10.1101/2021.01.14.426746","https://scispace.com/pdf/mice-in-a-labyrinth-rapid-learning-sudden-insight-and-4nnr7126ox.pdf","Animals learn certain complex tasks remarkably fast, sometimes after a single experience. What behavioral algorithms support this efficiency? Many contemporary studies based on two-alternative-forced-choice (2AFC) tasks observe only slow or incomplete learning. As an alternative, we study the unconstrained behavior of mice in a complex labyrinth and measure the dynamics of learning and the behaviors that enable it. A mouse in the labyrinth makes ~2000 navigation decisions per hour. The animal quickly discovers the location of a reward in the maze and executes correct 10-bit choices after only 10 reward experiences – a learning rate 1000-fold higher than in 2AFC experiments. Many mice improve discontinuously from one minute to the next, suggesting moments of sudden insight about the structure of the labyrinth. The underlying search algorithm does not require a global memory of places visited and is largely explained by purely local turning rules.","learn these simple tasks. For example, the mouse with the steering wheel requires about 10,000 experiences before performance saturates. It never gets particularly good, with a typical hit rate only 2/3 of the way from random to perfect. Munn:
 All this training takes 3-6 weeks; in the case of monkeys several months. The rate of learning, measured in task complexity per unit time, is surprisingly low: < 1 bit/month compared to ~10 bits/h observed in the labyrinth. The difference is a factor of 6,000. Similarly when measured in complexity learned per reward experience: The 2AFC mouse may need 5,000 rewards to learn a contingency table with 1 bit complexity, the mouse in the maze needs ~10 rewards to learn 10 bits. Given these differences in learning rate spanning many orders of magnitude, it seems likely that whatever neural process underlies ultra-slow 2AFC learning is different from the implementation of fast learning in the labyrinth and other complex environments. Munn:
 Furthermore, the ultra-slow mode of learning may have little relevance for an animal's natural condition. In the month that the 2AFC mouse requires to finally report the location of a light, its relative in the wild has developed from a baby to having its own babies. Along the way, that wild mouse had to make many decisions, often involving high stakes, without the benefit of 10,000 trials of practice. Sudden insight:
 The dynamics of the learning process are often conceived as a continuously growing association between stimuli and actions, with each reinforcing experience making an infinitesimal contribution. The reality can be quite different. When a child first learns to balance on a bicycle, performance goes from abysmal to astounding within a few seconds. The timing of such a discontinuous step in performance seems impossible to predict but easy to recognize after the fact. Sudden insight:
 From the early days of animal learning experiments there have been warnings against the tendency to average learning curves across subjects . The average of many discontinuous curves will certainly look continuous and incremental, but that reassuring shape may miss the essence of the learning process. A recent reanalysis of many Sudden insight:
 Pavlovian conditioning experiments suggested that discontinuous steps in performance are the rule rather than the exception ). Here we found that the same applies to navigation in a complex labyrinth. While the average learning curve presents like a continuous function (Figure ), the individual records of water rewards show that each animal improves rather quickly but at different times (Figure ). Sudden insight:
 Owing to the unstructured nature of the experiment, the mouse may adopt different policies for getting to the water port. In at least half the animals we observed a discontinuous change in that policy, namely when the animal started using efficient direct paths within the maze (Figure , Figure -figure supplement 2). This second switch happened considerably after the animal started collecting rewards, and did not greatly affect the reward rate. Furthermore, the animals never reverted to the less efficient policy, just as a child rarely unlearns to balance a bicycle."
"The Shape of Learning Curves: A Review","https://scispace.com/paper/the-shape-of-learning-curves-a-review-3pw9t2a0","2023","Journal Article","IEEE Transactions on Pattern Analysis and Machine Intelligence","","10.1109/tpami.2022.3220744","https://scispace.com/pdf/the-shape-of-learning-curves-a-review-3pw9t2a0.pdf","Learning curves provide insight into the dependence of a learner's generalization performance on the training set size. This important tool can be used for model selection, to predict the effect of more training data, and to reduce the computational complexity of model training and hyperparameter tuning. This review recounts the origins of the term, provides a formal definition of the learning curve, and briefly covers basics such as its estimation. Our main contribution is a comprehensive overview of the literature regarding the shape of learning curves. We discuss empirical and theoretical evidence that supports well-behaved curves that often have the shape of a power law or an exponential. We consider the learning curves of Gaussian processes, the complex shapes they can display, and the factors influencing them. We draw specific attention to examples of learning curves that are ill-behaved, showing worse learning performance with more training data. To wrap up, we point out various open problems that warrant deeper empirical and theoretical investigation. All in all, our review underscores that learning curves are surprisingly diverse and no universal model can be identified. ","memorization phase, where n ă d) and has random guessing performance, until a point where the perceptron starts to learn (at n ą d, the underparametrized regime) at which a jump occurs to non-trivial performance. Phase Transitions:
 Phase transitions are also found in two-layer networks with binary weights and activations , , . This happens for the so-called parity problem where the aim is to detect the parity of a binary string  for which Opper  found phase transitions in approximations of the learning curve. Learning curve bounds may display phase transitions as well , , though ,  question whether these will also occur in the actual learning curve. Both Sompolinsky  and Opper  note that the sharp phase transitions predicted by theory, will be more gradual in real-world settings. Indeed, when studying this literature, one should be careful in interpreting theoretical results, as the transitions may occur only under particular assumptions or in limiting cases. Phase Transitions:
 For unsupervised learning, phase transitions have been shown to occur as well ,  (see the latter for additional references). Ipsen and Hansen  extend these analyses to PCA with missing data. They also show phase transitions in experiments on real-world data sets.  provides one of the few real application papers where a distinct, intermediate plateau is visible in the learning curve. Phase Transitions:
 For Figure  under (6.1), we constructed a simple phase transition based on a two-class classification problem, y P t`1, ´1u, with the first 99 features standard normal and the 100th feature set to y 100 . PFLD's performance shows a transition at n "" 100 for the error rate. Peaking and Double Descent:
 The term peaking indicates that the learning curve takes on a maximum, typically in the form of a cusp, see Figure  under (6.2). Unlike many other ill behaviors, peaking can occur in the realizable setting. Its cause seems related to instability of the model. This peaking should not be confused with peaking for feature curves as covered in Subsection 2.6, which is related to the curse of dimensionality. Nevertheless, the same instability that causes peaking in learning curves can also lead to a peak in feature curves, see Figure . The latter phenomenon has gained quite some renewed attention under the name double descent . Peaking and Double Descent:
 By now, the term (sample-wise) double descent has become a term for the peak in the learning curve for deep neural networks , . Related terminologies are model-wise double descent, that describe a peak in the plot of performance versus model size, and epoch-wise double descent, that shows a peak in the training curve . Peaking and Double Descent:
 Peaking was first observed for the pseudo-Fisher's linear discriminant (PFLD)  and has been studied already for quite some time . The PFLD is the classifier minimizing the squared loss, using minimum-norm or ridgeless linear regression based on the pseudo-inverse. PFLD often peaks at d « n, both for the squared loss and classification error. A first theoretical model explaining this behavior in the thermodynamical limit is given in . In such works, originating from statistical physics, the usual quantity of interest is α "" d n that controls the relative sizes for d and n going to infinity , , ."
"Meta-learning in head fixed mice navigating in virtual reality: A Behavioral Analysis","https://scispace.com/paper/meta-learning-in-head-fixed-mice-navigating-in-virtual-3t7qzuv5","2023","Posted Content","bioRxiv","Xinyu Zhao
Sarah Lindo
Nelson Spruston","10.1101/2023.05.01.538936","https://scispace.com/pdf/meta-learning-in-head-fixed-mice-navigating-in-virtual-3t7qzuv5.pdf","Animals can learn general task structures and use them to solve new problems with novel sensory specifics. This capacity of ‘learning to learn’, or meta-learning, is difficult to achieve in artificial systems, and the mechanisms by which it is achieved in animals are unknown. As a step toward enabling mechanistic studies, we developed a behavioral paradigm that demonstrates meta-learning in head-fixed mice. We trained mice to perform a two-alternative forced-choice task in virtual reality (VR), and successively changed the visual cues that signaled reward location. Mice showed increased learning speed in both cue generalization and serial reversal tasks. During reversal learning, behavior exhibited sharp transitions, with the transition occurring earlier in each successive reversal. Analysis of motor patterns revealed that animals utilized similar motor programs to execute the same actions in response to different cues but modified the motor programs during reversal learning. Our study demonstrates that mice can perform meta-learning tasks in VR, thus opening up opportunities for future mechanistic studies.","hypotheses is whether representations in the memory circuit (e.g., hippocampus) shift during reversal. A recent study , using a similar behavioral paradigm, reported minimal effects of reversal in CA1 representations, in favor of the contextualized motor hypothesis. Discussion:
 One striking phenomenon revealed in our study is the sharp transition of behavioral states during reversal learning. A recent study showed that freely moving mice can exhibit abruptly acquired 'insight' . Our study demonstrates that sudden insight is not restricted to freely moving paradigms but can also be observed in head-fixed animals. In our reversal learning task, animals transitioned in and out of a biased behavioral state to eventually learn the rule reversals. This observation is consistent with a classic psychological study, which reported that rats, when presented with a reversal learning task, exhibited strongly biased turning followed by exploration behavior (described as ""hypothesis"" testing) prior to discovering the new task rule . Rapid switch of behavioral preference during reversal has also been reported in non-human primates , although the biased phase that we observed in mice was not typically observed. However, this discrepancy is likely explained by the fact that it only took a few laps for monkeys to learn the rule reversal. In fact, an early monkey study indeed reported hints of the biased phase in some slow learners , suggesting that our discovered phase transitions may be generalized to primates. Although it is reasonable to assume that the beginning of the biased phase reflects the animal's frustration in not getting rewards in a presumably well-learned task, the biased phase may not be a continual disengagement period. For example, animals may exhibit some cognitive changes, such as enhanced attention to environmental cues or vicarious trialand-error , that precede the animal's transition out of the biased phase to above-chance task performance. Future physiological recordings will be helpful to identify potential changes in neural activity leading to this behavioral switch . Finally, it should be noted that the sudden shift in the animal's behavior, or the output of the neural network, does not necessarily indicate that the underlying synaptic and cellular changes are abrupt themselves. Incremental weight changes often lead to stepwise reduction in the error, a well-known phenomenon in training artificial neural networks . Both slow and fast  forms of plasticity exist in the brain. However, the plasticity mechanism underlying sharp behavioral transitions remains to be investigated in the future."
"What Is the Shape of Developmental Change","https://scispace.com/paper/what-is-the-shape-of-developmental-change-4h9r4ab5qy","2008","Journal Article","Psychological Review","Karen E. Adolph
Scott R. Robinson
Jesse W. Young
Felix Gill-Alvarez","10.1037/0033-295X.115.3.527","https://scispace.com/pdf/what-is-the-shape-of-developmental-change-4h9r4ab5qy.pdf","Developmental trajectories provide the empirical foundation for theories about change processes during development. However, the ability to distinguish among alternative trajectories depends on how frequently observations are sampled. This study used real behavioral data, with real patterns of variability, to examine the effects of sampling at different intervals on characterization of the underlying trajectory. Data were derived from a set of 32 infant motor skills indexed daily during the first 18 months. Larger sampling intervals (2-31 days) were simulated by systematically removing observations from the daily data and interpolating over the gaps. Infrequent sampling caused decreasing sensitivity to fluctuations in the daily data: Variable trajectories erroneously appeared as step functions, and estimates of onset ages were increasingly off target. Sensitivity to variation decreased as an inverse power function of sampling interval, resulting in severe degradation of the trajectory with intervals longer than 7 days. These findings suggest that sampling rates typically used by developmental researchers may be inadequate to accurately depict patterns of variability and the shape of developmental change. Inadequate sampling regimes therefore may seriously compromise theories of development.","Title: What Is the Shape of Developmental Change? Authors: Karen E Adolph (Corresponding Author),Scott R Robinson,Jesse W Young,Felix Gill-Alvarez Developmental Trajectories:
 Understanding developmental change is a central goal for developmental science. However, despite numerous treatises by prominent developmental theorists in a variety of areas urging researchers to focus on change processes (e.g., , developmental psychologists have made surprisingly little progress toward understanding the process of developmental change. Part of the problem is historical. Much of the work in developmental psychology has concentrated on descriptions of children's behavior at various ages or on the earliest manifestations of particular abilities. Decades of reliance on cross-sectional designs, demonstration proofs, and broad-sweeping longitudinal approaches have left researchers with a gallery of before and after snapshots, studio portraits of newborns, and fossilized milestones, but little understanding of the process of development itself. What we need are accurate, fine-grained depictions of developmental trajectories for cognitive, language, perceptual, motor, and social skills. Developmental Trajectories:
 The staggering variety of developmental trajectories has also contributed to the lack of progress in understanding change processes. The shape of developmental change might assume any number of patterns (Figure ). For instance, a trajectory might show smooth and monotonic improvements with age, proceeding at a steady pace as in children's use of retrieval strategies in addition , or with accelerating or decelerating rates of change, as in infants' acquisition of new words  and improvements in toddlers' walking skill , respectively. The path of change may show discontinuities such as abrupt, stage-like shifts in performance between periods of relative stability, as in children's stage-like success on many Piagetian tasks , their abrupt shift from ignoring to marking the past tense of verbs , and the sudden transition to grasping while reaching . Variability may increase during the period of acquisition, with a series of reversals vacillating between less and more mature expressions of the skill, as in children's conservation of volume . Or a variable acquisition period may entail use of multiple, unsystematic use of strategies between incorrect and correct endpoints, as in  and their acquisition of a theory of mind . Discontinuities can take on other shapes, such as episodic changes, where development advances like climbing a staircase, with sudden improvements in children's conceptual understanding separated by long periods in a single stage  or small fits and starts of physical growth separated by periods of stasis . Discontinuities can involve reversible patterns of change, as in the U-shaped course of children's success on math equivalence problems , infants' alternating stepping movements , and the classic description of over-regularizations in past tense verb forms , or the inverted-U-shaped trajectory of cognition over the life span , and infants' zigzag-shaped error rate in detecting threats to balance as they learn to sit, crawl, cruise, and walk ."
