"Paper Title","Paper Link","Publication Year","Publication Type","Publication Title","Author Names","DOI","PDF Link","Abstract","Relevant Excerpt"
"Brain Networks of Explicit and Implicit Learning","https://scispace.com/paper/brain-networks-of-explicit-and-implicit-learning-1gmvf3zphw","2012","Journal Article","PLOS ONE","Jing Yang
Ping Li","10.1371/JOURNAL.PONE.0042993","https://scispace.com/pdf/brain-networks-of-explicit-and-implicit-learning-1gmvf3zphw.pdf","Are explicit versus implicit learning mechanisms reflected in the brain as distinct neural structures, as previous research indicates, or are they distinguished by brain networks that involve overlapping systems with differential connectivity? In this functional MRI study we examined the neural correlates of explicit and implicit learning of artificial grammar sequences. Using effective connectivity analyses we found that brain networks of different connectivity underlie the two types of learning: while both processes involve activation in a set of cortical and subcortical structures, explicit learners engage a network that uses the insula as a key mediator whereas implicit learners evoke a direct frontal-striatal network. Individual differences in working memory also differentially impact the two types of sequence learning.","relationship between phonological working memory and implicit and explicit learning conditions. Thus, understanding how phonological working memory differently influences the two types of learning, as well as the neural networks for explicit versus implicit learning, were the research goals of the present study. Introduction:
 To answer our research questions, we trained participants with an adapted classic artificial grammar learning (AGL) paradigm  that involves syllable sequences generated through a finitestate grammar (Figure ). Finite-state grammars, although limited in their generative capacities , are complex systems that can derive sequences through nodes and loops, and the generated sequences either conform to prescribed grammatical rules or do not (see Materials and Methods for details). In a typical AGL paradigm, participants are exposed to a subset of letter sequences generated by a finite grammar (the study phase), and then are given a grammaticality judgment test (the test phase) to see whether they can discriminate new grammatical strings from nongrammatical ones. Although participants often show little confidence in their judgments and are unable to consciously report the rules of the grammar, they typically perform above chance on AGL tasks after training. More important for our discussion, learning in the AGL task, although involving artificially generated sequences for training, has been frequently used to infer about natural language acquisition and processing, as have other artificial systems such as Brocanto . Recent neuroimaging data also indicate that structural incongruencies in both artificial grammar learning and natural language learning lead to similar P600 effects, a positive shift in the waveform recorded through event-related potentials (ERP), typically associated with the processing of syntactic or grammatical violations . Introduction:
 In our study, the participants underwent a study-test procedure as in the classic AGL task: during the study phase, they were asked to study and memorize sequences of syllables that were grammatical according to the finite-state grammar; during the test phase (retrieval phase), when their brain images were collected, they were told to discriminate whether or not the presented novel sequence conformed to the learned AGL rules (grammaticality judgment; see Materials and Methods for details). Forty-three university students, who were performancematched for IQ, vocabulary, processing speed, and executive control abilities (Table ), were randomly assigned to the explicit versus the implicit learning group and received identical study-test materials with identical procedures, except that at the beginning of the study phase, the explicit group was told of the existence of complex rules underlying the sequences of syllables that the participants were studying, whereas the implicit group was not. We investigated the similarities and differences between the neural networks underlying explicit and implicit learning conditions during the retrieval phase in the fMRI scanning session, and further examined correlations between the participants' phonological working memory capacity and their neural responses to the two types of learning. Results:
 There were no significant differences at the group level between explicit and implicit learners in terms of their average age, IQ, vocabulary, processing speed, phonological working memory and other cognitive control abilities (Table ). The explicit learners showed better performance at the IQ and vocabulary tests than the implicit learners, whereas the implicit learners outperformed the explicit learners in processing speed, inhibitory control, and working memory capacity measures. However, these differences were not statistically significant, and were due particularly to outlier performance scores from a few older participants in the explicit group (see our attempt in controlling for age for the partial correlation analysis below)."
"Parity effects in an implicit-learning task.","https://scispace.com/paper/parity-effects-in-an-implicit-learning-task-1ezy7igy51","2007","Journal Article","British Journal of Psychology","André Didierjean","10.1348/000712606X161947","https://scispace.com/pdf/parity-effects-in-an-implicit-learning-task-1ezy7igy51.pdf","Is it possible to extract knowledge from complex material and then unknowingly use it? This key question in the field of implicit learning is addressed here in three experiments using the invariant paradigm. The experiments showed that after seeing a series of items consisting of pairs of 2-digit numbers (e.g. [52; 74]) governed by a rule, subjects judged that new items that followed the rule were more familiar than ones that did not. Experiment 1 showed that this effect was observed when all bigrams seen in phase 2 were new. Experiments 2 and 3 controlled for some ‘classic’ biases and showed that the effect depended on what rule was at stake. An effect was observed only if the rule used brought to bear a salient categorical property in memory: parity.","Title: Parity effects in an implicit-learning task Authors: Andre ´didierjean (Corresponding Author) Tasks used:
 Most tasks used in implicit-learning studies are based on the same principle. In the first phase, participants are given material constructed from rules they do not know. In the second phase, they have to perform a task that requires using the knowledge built during the first. The most widely used tasks of this type are ones in which the material complies with the rules of an artificial grammar. The term artificial grammar is used here to mean a set of arbitrary rules governing the order of letters in strings. In such 'classic' studies, the two experimental phases are as follows. In Phase 1, the participants are shown strings of letters that abide by the rules of the grammar. They are not informed of how the strings were constructed and their task is either to memorize the strings  or to simply study them . In Phase 2, run immediately afterwards, the participants are told that the letter strings they just saw followed certain rules, and they are asked to state whether the items in a new series of strings follow the same rules. The typical result of this type of task is that the participants are able to judge the new strings better than by chance, but turn out to be incapable of verbalizing the rules they used to make their judgments . A similar result has also been observed in other tasks, such as serial reaction time tasks (e.g. ) and more complex interactive cognitive tasks (e.g. . Proposed interpretations:
 Three major theoretical interpretations have been proposed to explain the classical results obtained on implicit-learning tasks (for a review, see . Proposed interpretations:
 (1) Participants extract abstract knowledge and then apply it ; in this view, participants are unaware of the rules they extract and use. (2) Participants memorize exemplars during the first phase and then base their judgments on the resemblance between the exemplars memorized and the target exemplars seen during the second phase . (3) Participants do not memorize exemplars in their entirety but fragments of knowledge. In artificial grammars, for example, participants may learn 'chunks' composed of two or three letters ; then during the second phase, items that do not contain any familiar chunks are seen as 'non-grammatical'. In the last two views, the participants do not have to extract rules to succeed in the task. Proposed interpretations:
 In most studies, awareness of the knowledge used is assessed on the basis of verbalizations collected from the participants after the experiment is over. Given that the nature of this knowledge is uncertain, the risk is that the participants will consciously apply knowledge that is different from that expressed in their verbalizations (e.g. ). Proposed interpretations:
 Although at the present time, everyone agrees that participants memorize exemplars in this type of task, there is as much disagreement as ever about implicit-rule extraction. Some authors contend that participants also implicitly extract rules , while others say that no experimental proof has yet been found showing this to be the case ."
"Using immediate memory span to measure implicit learning.","https://scispace.com/paper/using-immediate-memory-span-to-measure-implicit-learning-2xofx3xeja","2004","Journal Article","Memory & Cognition","Jeffrey D. Karpicke
David B. Pisoni","10.3758/BF03196873","https://scispace.com/pdf/using-immediate-memory-span-to-measure-implicit-learning-2xofx3xeja.pdf","To avoid some conceptual and methodological pitfalls found in traditional artificial grammar learning tasks, we developed a new method of measuring implicit learning using immediate memory span. Subjects were presented with sequences generated by an artificial grammar and were asked to reproduce the patterns by pressing buttons on a response box. After exposure to these sequences, subjects showed selective improvement in immediate memory span for novel sequences governed by the same grammar. Individual differences in implicit learning covaried with measures of auditory digit span. Subjects with greater immediate memory processing capacity were better able to learn and subsequently exploit the information available in grammatical sequences. Our results are consistent with a detailed episodic coding framework in which implicit learning occurs as an incidental by-product of explicit task performance. Although subjects encode highly detailed information about specific instances, they use different aspects of this information to accomplish different task-specific demands.","suggests that individuals who have greater auditory immediate memory spans are better able to acquire implicit knowledge about an artificial grammar in an auditory sequence reproduction task and subsequently use their knowledge to improve their memory span for new sequences that follow the same set of grammatical constraints. DISCUSSION:
 Third, a final recognition memory test revealed that subjects in all three presentation modality conditions were more likely to call trained sequences old than nottrained sequences, regardless of whether the trained sequences were actually old or new. This pattern of results suggests that increased fluency of processing the trained sequences may have created a bias toward incorrectly calling new trained sequences old. Taken together with the results of the sequence reproduction task, the present findings demonstrate a situation in which recall is better than recognition (cf. : Implicit learning of an artificial grammar facilitated immediate recall of trained sequences but interfered with recognition of trained sequences. DISCUSSION:
 Fourth, our analyses of the postexperiment questionnaire indicated that subjects were generally not aware of the existence of any rules. Even if some subjects claimed to be aware of the rules, they were unable to state anything that resembled rules governing the sequences and were not confident in their guesses. In general, the verbal reports obtained after the experiment cannot account for the robust learning effects we observed during the sequence reproduction task. DISCUSSION:
 Finally, we performed post hoc multiple regression analyses to investigate the sources of information that subjects used as a basis for responding during the sequence reproduction task and the recognition memory test. In the test phase of the reproduction task, sequence type (trained or not trained) accounted for a unique portion of the variance in reproduction performance. However, chunk strength did not. This finding suggests that knowledge about frequently occurring bigrams and trigrams was not responsible for the observed improvement in immediate memory span during the test phase. Instead, grammatical knowledge functioned as the source of information used to produce the observed learning effect. A different pattern of results was found in the recognition memory test: Both chunk strength and grammatical knowledge accounted for significant unique portions of the variance in recognition performance. Overall, these findings suggest that subjects relied on different sources of information in order to accomplish task-specific demands. Grammatical information was used to produce the implicit learning effects observed in the sequence reproduction task, while both chunk strength and grammatical information contributed to recognition memory performance."
"Eye movements in implicit artificial grammar learning.","https://scispace.com/paper/eye-movements-in-implicit-artificial-grammar-learning-4uv7fxfk86","2017","Journal Article","Journal of Experimental Psychology: Learning, Memory and Cognition","Susana Silva
Filomena Inácio
Vasiliki Folia
Karl Magnus Petersson
Karl Magnus Petersson","10.1037/XLM0000350","https://scispace.com/pdf/eye-movements-in-implicit-artificial-grammar-learning-4uv7fxfk86.pdf","Artificial grammar learning (AGL) has been probed with forced-choice behavioral tests (active tests). Recent attempts to probe the outcomes of learning (implicitly acquired knowledge) with eye-movement responses (passive tests) have shown null results. However, these latter studies have not tested for sensitivity effects, for example, increased eye movements on a printed violation. In this study, we tested for sensitivity effects in AGL tests with (Experiment 1) and without (Experiment 2) concurrent active tests (preference- and grammaticality classification) in an eye-tracking experiment. Eye movements discriminated between sequence types in passive tests and more so in active tests. The eye-movement profile did not differ between preference and grammaticality classification, and it resembled sensitivity effects commonly observed in natural syntax processing. Our findings show that the outcomes of implicit structured sequence learning can be characterized in eye tracking. More specifically, whole trial measures (dwell time, number of fixations) showed robust AGL effects, whereas first-pass measures (first-fixation duration) did not. Furthermore, our findings strengthen the link between artificial and natural syntax processing, and they shed light on the factors that determine performance differences in preference and grammaticality classification tests. (PsycINFO Database Record","Title: Eye Movements in Implicit Artificial Grammar Learning Authors: Susana Silva,Filomena Inácio,Vasiliki Folia,Karl Magnus Petersson Keywords: eye-tracking, implicit learning, artificial grammar learning, syntactic processing, preference classification Learning, Memory, and Cognition"
"Unspoken knowledge: implicit learning of structured human dance movement.","https://scispace.com/paper/unspoken-knowledge-implicit-learning-of-structured-human-3v6t1kyb48","2009","Journal Article","Journal of Experimental Psychology: Learning, Memory and Cognition","Tajana Opacic
Catherine J. Stevens
Barbara Tillmann","10.1037/A0017244","https://scispace.com/pdf/unspoken-knowledge-implicit-learning-of-structured-human-3v6t1kyb48.pdf","The sequencing of dance movements may be thought of as a grammar. We investigate implicit learning of regularities that govern sequences of unfamiliar, discrete dance movements. It was hypothesized that observers without prior experience with contemporary dance would be able to learn regularities that underpin structured human movement. Thirty-one adults were assigned to either an exposure or a control group. Exposure consisted of 22 grammatical 3-, 4-, and 5-movement sequences presented twice in random order; sequence duration ranged from 9 to 19 s. In a test phase, exposure and control groups identified previously unseen sequences as grammatical or ungrammatical, and rated confidence of judgment. The exposure group selected significantly more new grammatical sequences in the test phase than the control group. In addition, for the exposure group, the zero correlation criterion, wherein no relation between confidence and accuracy indicates unconscious knowledge, was satisfied. Through exposure, novice observers can learn a grammar that governs the sequencing of dance movements. This has implications for implicit learning of long sequences, working memory, and the development of expectations through exposure to contemporary dance.","unseen grammatical sequences from ungrammatical sequences. Because the zero correlation criterion was satisfied for the performance of the exposure group (on the basis of confidence ratings and grammaticality judgment accuracy), acquired knowledge may be represented at an implicit level. Discussion:
 The set of constraints used to generate ungrammatical sequences, such as replacing one movement in a sequence with a movement that also belonged to the set of movements and using ungrammatical changes that created bigrams that also occurred in grammatical sequences, enabled us to draw the conclusion that above chance performance indicates structural knowledge of the grammar above the bigram level and includes either position of bigrams and/or knowledge about possible trigrams. For example, equal average frequencies of occurrence of bigrams in grammatical and ungrammatical test sequences suggest that after exposure, participants had knowledge of where in a sequence a bigram can occur grammatically. Above chance performance of the exposure group is also not explicable by the occurrence of particular items in first and last positions or by the detection of new movements used in anchor positions. In contrast, above chance performance might be explained, at least partially, by the detection of new, ungrammatical trigrams. Discussion:
 Demonstration of implicit learning in the context of contemporary dance is significant for three reasons. First, implicit learning occurred in response to relatively long (19 s) stimulus sequences where the elements of the sequence also extended in time. The extended sequence length, although likely pushing the limits of working memory, did not defeat implicit learning.  reported effects of working memory span in intentional but not incidental learning conditions. The present results demonstrate the efficacy of implicit learning for the regular patterning underlying the order of movements in a sequence. Dynamic stimuli may facilitate such learning. Discussion:
 Second, even when momentum across items was disrupted, a demonstration of implicit learning for chained contemporary dance movements was realized. To destroy the flow of motion to which most adults would be attuned, the sequences were deliberately disrupted such that the end point of one movement did not flow into the starting point of the next movement. Effects may be stronger if momentum is maintained (although this would necessarily confound knowledge stored in long-term memory with the learning of new grammatical knowledge). Moreover, expert dancers who are keenly attuned to the laws of motion may return stronger results again where an artificial grammar across sequences of movement items builds on momentum and biological motion. Discussion:
 Third, it is significant for ways in which new audiences for dance might be attracted, retained, and developed that novice observers acquired knowledge of the underlying artificial grammar. This has practical implications for audience development. Repetition leads to the development of expectations. Such exposure builds perceptual fluency that becomes associated with a sense of familiarity and heightened preference for the movement material (R. . Whether within a single work or across a body of dance works by a particular choreographer, familiarity, at least for novice dance observers, breeds content."
