"Paper Title","Paper Link","Publication Year","Publication Type","Publication Title","Author Names","DOI","PDF Link","Abstract","Relevant Excerpt"
"General Piecewise Growth Mixture Model: Word Recognition Development for Different Learners in Different Phases","https://scispace.com/paper/general-piecewise-growth-mixture-model-word-recognition-4wal2o7p6d","2011","Journal Article","Journal of Modern Applied Statistical Methods","Amery D. Wu
Bruno D. Zumbo
Linda S. Siegel","10.22237/JMASM/1304223600","https://scispace.com/pdf/general-piecewise-growth-mixture-model-word-recognition-4wal2o7p6d.pdf","The General Piecewise Growth Mixture Model (GPGMM), without losing generality to other fields of study, can answer six crucial research questions regarding childrens word recognition development. Using child word recognition data as an example, this study demonstrates the flexibility and versatility of the GPGMM in investigating growth trajectories that are potentially phasic and heterogeneous. The strengths and limitations of the GPGMM and lessons learned from this hands-on experience are discussed.","follow multiple pathways, only some of which are captured by the existing conceptualizations. Thus, researchers could benefit from a more integral and comprehensive data analytical framework that is capable of modeling the complex, intricate, and diversified developmental nature of children's reading development. Data:
 The data consists of 1,853 elementary school children from the North Vancouver school district in British Columbia. These children were measured every year in the fall starting from kindergarten to grade six. The dependent variable, word recognition, had a maximum score of 57, which was measured by naming 15 alphabet letters and followed by the reading subtest of the Wide Range Achievement , which has a list of 42 words ordered by difficulty. The measurement of word recognition remained the same across the seven waves of data collection; hence, measurement invariance that warranted temporal score comparability across grades was assumed. For demonstrative purposes, only the data of the 526 children who had all seven waves of data were included. Outliers were retained because this study aimed to model these cases through distinct latent classes so thatwithin each class -the distribution of reading performance was assumed to be normal. Data:
 Table  displays the mean (M), standard deviation (SD) and skewness of the seven waves of the data. Figure  displays the boxplots for the seven waves of word recognition scores. It can be observed that the distributions of the seven word recognition measures are, for the most part, symmetric. The overall performance in word recognition improved across time, with faster growth in the period between kindergarten and grade two, and relatively slower growth in  Figure  shows the individual trajectories. The overall pattern of the trajectories was consistent with those revealed in the boxplots and the literature, which showed a nonlinear trend . Data:
 Given the observed non-linearity, it would seem inappropriate to impose a linear trajectory to the observed data as portrayed by the thick single straight line in Figure . Most previous studies fitted a quadratic curve to model this non-linear pattern as portrayed by the thick curve line in Figure , where the early development is assumed to improve with a faster growth, followed by a relatively slower growth, and then reach a peak with a possibility to decline near the end. Although a quadratic function is fairly accessible and widely used by applied researchers, it may be inappropriate for literacy development of school-age children, because it may portray a decline at the end of the developmental course, whereas reading development, at worst, is expected to plateau rather than decline, if not continue to grow. Also, the meaning of a quadratic parameter is often hard to interpret conceptually for phenomena studied in the social and behavioral sciences, such as word recognition. Data:
 Another possibility for modeling the developmental pattern observed in Figure  is to fit a piecewise linear trajectory  as shown by the two thick segments connected at grade two in Figure . A piecewise trajectory allows different linear growth rates to be fitted to different developmental phases that are empirically observed or theoretically hypothesized."
"Pier Marco Bertinetto*, Eva Maria Freiberger, Alessandro Lenci, Sabrina Noccetti and Maddalena Agonigi The acquisition of tense and aspect in a morphology-sensitive framework: Data from Italian and Austrian-German children","https://scispace.com/paper/pier-marco-bertinetto-eva-maria-freiberger-alessandro-lenci-4a1a6pqhba","2015","","","Eva Maria Freiberger
Alessandro Lenci
Sabrina Noccetti
Maddalena Agonigi","","https://scispace.com/pdf/pier-marco-bertinetto-eva-maria-freiberger-alessandro-lenci-4a1a6pqhba.pdf","This article criticizes the wide-spread view, sometimes referred to as the ""aspect first hypothesis"" (initiated by Antinucci and Miller 1976 and supported by Bloom et al. 1980; Bickerton 1981; Weist et al. 1984; Shirai and Andersen 1995, among others), according to which a universal acquisition path is postulated in the tense-aspect domain, based on the leading role of actionality (or Aktionsart) and aspect. According to this view, children build their competence starting from the pervasive correlations atelic∴imperfective∴present vs. telic∴perfective∴past, before gradually learning to disentangle (i.e., freely combining) the various actional, aspectual, and temporal components. The alternative view advocated here (typologically-oriented and morphologically-sensitive) claims, instead, that children start out with no predefined strategy and extract the relevant informa- tion out of the individual language's morphological structure. The data stem from four longitudinal corpora relating to three Italian children and one Austrian German child, showing that: (i) the strong correlation between actionality, aspect, and tense can only be supported if activity and stative verbs are lumped together within the category of atelic predicates. Once activities are separately examined, their behavior stands out as absolutely incompatible with the tradi- tional view. (ii) In the relevant languages, there can be earlier understanding of the temporality-oriented morphology as contrasted with the aspect-related cate- gories. (iii) The analysis does not support the so-called prototype hypothesis (Shirai and Andersen 1995), since the examined children were strongly affected","maturation precedes the emergence of morphosyntactic competencemust be rejected. Since the available data do not support the choice between hypotheses (B) and (C), the latter will be provisionally retained due to its cautious formulation. Lexical and morphological spurt:
 This section addresses the relative timing of the lexical and morphological spurt. Not all authors endorse the existence of the former event, and indeed things vary from child to child. To the extent that this occurs, the claim often put forthsupported by connectionist simulationsis that grammatical capacities undergo rapid acceleration as soon as the dimension of the lexicon reaches a given threshold.  detected a clear correlation, for a group of English children, between the respective points of non-linear expansion of the verbal lexicon and of Past tense morphology. Similar observations were put forth by  for French and Austrian German children. Lexical and morphological spurt:
 The issue will be considered here in relation to the acquisition of the Past tenses. The measure adopted is the Verb expansion rate (V-Rate), expressedat any observation timeby the formula in (15), where V t i and N t i are, respectively, the number of verb-and noun-types cumulatively produced by the child in the recordings from t 1 to t i , while V t iþ1 − V t i and N t iþ1 − N t i indicate the number of new verb-and noun-types produced by the child in recording t iþ1 : Lexical and morphological spurt:
 This formula, which compares the incremental rate of verbs with respect to nouns throughout the observation period, has the advantage of neutralizing the recording size problem, thus avoiding undesirable distortions. Although the values are constantly lower than 1 -indicating that the child is learning, as a whole, more nouns than verbsone can spot periods of sudden expansion of the verb lexemes, as shown by a rising slope."
"The differentiation of early word meanings from global to specific categories: Towards a verification of the “semantic pluripotency hypothesis”","https://scispace.com/paper/the-differentiation-of-early-word-meanings-from-global-to-1m0m4i77","2022","Journal Article","","Hiromichi Hagihara","10.1080/10489223.2022.2091441","https://scispace.com/pdf/the-differentiation-of-early-word-meanings-from-global-to-1m0m4i77.pdf","","level only for the second time (MED = 0.788, CI [0.647, 0.893]), but not for the first time (MED = 0.632, CI [0.463, 0.781]). Analysis 2: The effect of object-specific actions on object word comprehension:
 As in Study 1, the null model was selected as the best model (see Appendix E, Table .5 for model comparison). The proportion of correct responses remained near chance level (MED = 0.476, CI [0.402, 0.549]), as shown in Figure .8-b (see also Table .4). Analysis 3: Vocabulary growth prediction:
 Vocabulary growth of common nouns and verbs ranged from 0 to 59 (Median = 22.50, M = 28.44, SD = 22.89) and from 0 to 22 (Median = 1.50, M = 5.38, SD = 6.66), respectively. The best prediction models for both common noun and verb vocabulary growth included the fixed effects of the first-time task performance for all four conditions (see Appendix E, Table .6 for model comparison). For common nouns, the parameter estimates of all conditions straddled zero (Figure .9 and Table .5). Relatively, there was a positive relationship between vocabulary growth and the proportion of correct responses in the mismatch (MED = 1.007, CI ), whereas a negative relationship was observed in the different-object condition (MED = -1.076, CI ). The effect size of the task performance in the match condition was the smallest (see the standardized parameter estimates in Table .5). For verbs, the proportion of correct responses in the mismatch condition was positively related to later vocabulary growth ; see Figures 4.9 and 4.10 and Table .5). Other parameter estimates straddled zero, although there was a relatively negative relationship between vocabulary growth and task performance in the different-object (MED = -1.414, CI ) and absent-object conditions (MED = -1.577, CI ). Discussion:
 The results of developmental change in the task performance obtained in Study 1 were roughly replicated in Study 2 using longitudinal data. The higher task performance in Study 2 in the first-time mismatch than in Study 1 and the credible interval for the parameter estimates between the match and the mismatch conditions straddling zero might be because the sample in Study 2 was a mix of 18-and 19-month-olds. This age period was just before and after the semantic differentiation of object words was actually observed in crosssectional data. The results from Analysis 3 revealed that individual differences in semantic differentiation of object words predicted subsequent vocabulary growth of verbs in particular. This finding provided direct evidence supporting the hypothesis that the differentiation of object word meanings encouraged toddlers to develop new labels depicting specific actions. General discussion:
 In addition to examining the robustness of the findings that early noun meanings developed from undifferentiated event categories to specific object categories (Chapter 2), we investigated whether toddlers could properly select object word referents solely by objectspecific actions and how vocabulary grew along with the semantic change of object words in this Chapter."
"Is prosodic development correlated with grammatical and lexical development? Evidence from emerging intonation in Catalan and Spanish.","https://scispace.com/paper/is-prosodic-development-correlated-with-grammatical-and-5g0iev9y56","2012","Journal Article","Journal of Child Language","Pilar Prieto
Ana Estrella
Jill C. Thorson
Maria Vanrell","10.1017/S030500091100002X","https://scispace.com/pdf/is-prosodic-development-correlated-with-grammatical-and-5g0iev9y56.pdf","This investigation focuses on the development of intonation patterns in four Catalan-speaking children and two Spanish-speaking children between 0 ; 11 and 2 ; 4. Pitch contours were prosodically analyzed within the Autosegmental Metrical framework in all meaningful utterances, for a total of 6558 utterances. The pragmatic meaning and communicative function were also assessed. Three main conclusions arise from the results. First, the study shows that the Autosegmental Metrical model can be successfully used to transcribe early intonation contours. Second, results reveal that children's emerging intonation is largely independent of grammatical development, and generally it develops well before the appearance of two-word combinations. As for the relationship between lexical and intonational development, the data show that the emergence of intonational grammar is related to the onset of speech and the presence of a small lexicon. Finally, we discuss the implications of these results for the biological hypothesis of intonational production.","how the MLU results for each child correlate with the acquisition of distinct nuclear configuration types (see ' Quantitative results ' below). If Snow's hypothesis is correct, we would expect to see a close correlation between the two measures across the six children. Lexical development:
 In our data, vocabulary size was computed with the ' freq ' command in CLAN, that is, by listing the number of unique recorded words per session.   , that is, the first month in which the child used 25 or more identifiable adult-based words spontaneously in one half-hour session. The data in Figure  show that, similarly to the MLU data, Pep, Guillem and Irene all reach a vocabulary size of 25 words between 0; 11 (Irene) and 1; 6 (Guillem). On the other hand, Laura and Gisel . la do not reach this lexicon size until they are 1; 8 (Laura) and 2; 0 (Gisel . la). It is important to note that even though the lexical counts fluctuate across sessions (possibly due to the child's behavior in a given session), we assume that if a child uses 25 words in a given session this is an indication that he or she has reached the 25-word point. The data in Figure  show that the children's lexicon size data pattern differently from the MLU data presented in Figure . While Irene reaches a lexicon size of 100 words at 1; 4, Pep does not reach this level until he is 1; 11, and the other children not until months later, at 2; 4. It is interesting to note that while Guillem gets to the two-word stage quite early (five months before Gisel . la), he patterns with them in his lexicon size, which does not get to be 100 words until he is 2; 4. This seems to be a clear indication that the lexicon size and grammatical complexity measures are not strictly correlated in development. Qualitative results:
 This section examines in a qualitative way the intonational development of all children both at the one-word and at the two-word stages. This section can be regarded as an initial overview of the data before the quantitative analysis is performed. The initial focus of the analysis will be on Guillem, Pep and Irene, the three children who produce two-word combinations stably at around 1; 5 (Pep and Irene) and 1 ; 8 (Guillem). For this part of the analysis, Marı ´a could not be analyzed due to lack of data before the onset of the two-word period. 9 In general, the intonational analysis reveals that all children begin to use a handful of intonational contours at the onset of the one-word period. In the case of Guillem, Pep and Irene, they produce these contours between 1 ; 1 and 1; 3."
"Narrative Writing in Native English and ESL Learners: Developmental Trajectories and Predictors","https://scispace.com/paper/narrative-writing-in-native-english-and-esl-learners-3jb5ix8516","2011","Dissertation","","Chanthalone Smith","","https://scispace.com/pdf/narrative-writing-in-native-english-and-esl-learners-3jb5ix8516.pdf","","trajectories. Research Question 2: As previously indicated, monolingual and ESL groups were not examined individually for the second research question. The main purpose of this question was to explore individual differences in developmental progression and not to attempt to explain these differences. Research Question 2:
 However, group differences could be anticipated by examining the individual variation in change from the unconditional models constructed for this question. When no individual variation was detected in growth trajectories, this suggested that all children demonstrate a similar amount of growth over time, thus indicating that the groups were not significantly different in their growth. Cognitive-linguistics development.:
 The Hierarchical Linear Models used to address this research question produced two types of parameter estimates: fixed effects and random effects. Cognitive-linguistics development.:
 The fixed effects represent the average initial status (average scores at grade 4) and the average growth rate (change in average scores in one year) within the population. The random effects (variance components) indicate the amount of variation around the average initial status and the average growth rate. Cognitive-linguistics development.:
 The results of HLM analyses showed that Vocabulary, Rapid Automatized Naming and Verbal Memory improved significantly over time (see Table  for results). Note that the fixed coefficient for Rapid Automatized Naming reflects the number of seconds needed for naming letters; therefore, its negative value indicates improved speed. Only Vocabulary and Rapid Automatized Naming had significant individual variation in growth rates. Variability among individuals for Verbal Memory approached significant levels, at p =.06. The distribution of the variance components was similar for all three measures, with the differences in initial status accounting for 63.24% to 79.87% of the variance in the outcome scores and 2.74% to 4.77% of the variance accounted for by the individual variation in growth trajectories. These results Cognitive-linguistics development.:
 suggested that children performed differently on Vocabulary, Rapid Automatized Naming and Verbal Memory in grade 4; however, they changed similarly in their performances between grades 4 and 6. Word-level development. Unconditional HLM models were fitted for Word Reading, Pseudoword Reading and Spelling to explore their initial status and growth trajectories. All three variable scores improved significantly over time; however, the random effect for the growth rate was significant for only Pseudoword Reading, indicating that variation in growth trajectories exists among individuals. The distribution of the variance components was similar for all three measures, with the differences in initial status accounting for 72.97% to 87.28% of the variance in the outcome scores and individual variation in growth trajectories accounting for 0.38% to 2.47%."
"The Norwegian Communicative Development Inventories: Reliability, main developmental trends and gender differences","https://scispace.com/paper/the-norwegian-communicative-development-inventories-3dgcmjvkpf","2014","Journal Article","Language","Hanne Gram Simonsen
Kristian Emil Kristoffersen
Dorthe Bleses
Sonja Wehberg
Rune Nørgaard Jørgensen","10.1177/0142723713510997","https://scispace.com/pdf/the-norwegian-communicative-development-inventories-3dgcmjvkpf.pdf","This article presents results from a large population-based study of early communicative development in Norwegian children using an adaptation of the MacArthur–Bates Communicative Development Inven...","(1.7-2.3) Present tense: 1 Earliest month where at least 25% of the answers were ""sometimes"" or ""often"". Present tense: 2 Based on logistic regression models with gender and (continuous) age as covariates. Discussion:
 In this paper we have presented findings from a large population-based study of early communicative development in children learning Norwegian, building on CDI data from 6,574 children aged between 0;8 and 3;0 years, collected via the Internet. We started with reliability analyses, and then reported developmental trends for communicative gestures, comprehension and production of vocabulary, grammatical complexity and grammatical skills, and also for gender variation on these measures. Discussion:
 We found high internal consistency and satisfactory test-retest correlations. Discussion:
 Undoubtedly, our reliability sample is rather small and self-elected, implying potentially biased results. Non-biasedness cannot be proven in a post-hoc sample. The only way to ensure non-biasedness would be a (large) randomized study. However, since nobody can be forced to participate in a study, all (reliability) samples are essentially self-elected. The Norwegian findings are in good agreement with both American and Danish results , suggesting that the Norwegian CDI data are not essentially different. Discussion:
 Whether reliability (i.e. that a measurement is stable when repeated) is a meaningful concept at all when applied to a questionnaire which is designed to capture (rapid) development over time, is, of course, a matter of opinion. Discussion:
 As could be expected, in development we found that vocabulary comprehension preceded vocabulary production, and that both use of gestures, comprehension and production of vocabulary, grammatical complexity and grammatical skills increased with age, gestures producing the least consistently reliable results overall. In general, the findings for Norwegian seem to be in accordance with findings from other languages based on the same instrument, both concerning the extensive variation between children, and concerning general developmental trends . Based on visual inspection of Figures , and 7, it seems safe to conclude that Norwegian children go through two developmental spurts, one in productive vocabulary during the second year of life, and one in morphosyntactic development during the third year. The acceleration in vocabulary growth starts on average at around 50 words, but with extensive variation both concerning the number of words at the start of the 'spurt' (the earliest children start at 30-40 words) and as to when it starts (a span of 8 months, from 1;2 to 1;10). Whether all children go through such a spurt is of course a different question that cannot be answered here. Concerning grammatical skills, they seem to take off on average around 1;7 with combination of words, followed by inflections of nouns and verbs over the next 5 months. Again, there is extensive variation between children as to when the development starts and how long it takes for the grammatical skills to be mastered. An evident and interesting next step will be to look more directly at the correlation between vocabulary size and the emergence of grammar in these children, as suggested by ."
