"Paper Title","Paper Link","Publication Year","Publication Type","Publication Title","Author Names","DOI","PDF Link","Abstract","TL;DR"
"Concurrent Learning of Adjacent and Nonadjacent Dependencies in Visuo-Spatial and Visuo-Verbal Sequences.","https://scispace.com/paper/concurrent-learning-of-adjacent-and-nonadjacent-dependencies-2swhhsaj13","2019","Journal Article","Frontiers in Psychology","Joanne Deocampo
Tricia Z. King
Christopher M. Conway","10.3389/FPSYG.2019.01107","https://scispace.com/pdf/concurrent-learning-of-adjacent-and-nonadjacent-dependencies-2swhhsaj13.pdf","Both adjacent and nonadjacent dependencies (AD and NAD) are present in natural language and other domains, yet the learning of nonadjacent sequential dependencies generally only occurs under favorable circumstances. It is currently unknown to what extent adults can learn AD and NAD presented concurrently in spatial and verbal sequences during a single session and whether a second session improves performance. In addition, the relationship between AD and NAD learning and other theoretically related cognitive and language processes has not yet been fully established. In this study, participants reproduced two types of sequences generated from an artificial grammar: visuo-spatial sequences with stimuli presented in four spatial locations, and visuo-verbal sequences with printed syllables. Participants were tested for incidental learning by reproducing novel sequences, half consistent with the grammar and half containing violations of either AD or NAD. The procedure was repeated on a second day. Results showed that both AD and NAD were learned in both visuo-spatial and visuo-verbal tasks, though AD learning was better than NAD and learning of NAD decreased over time. Furthermore, NAD learning for both spatial and verbal tasks was positively correlated with a language measure whereas AD learning for both spatial and verbal tasks was negatively associated with working memory measures in the opposite domain. These results demonstrate that adults can learn both AD and NAD within a single session but NAD learning is more easily disrupted than AD and both types of learning are subserved by partially distinct cognitive processes. These findings increase our understanding of the processes governing the learning of AD and NAD in verbal and spatial domains.","It is demonstrated that adults can learn both AD and NAD within a single session, but NAD learning is more easily disrupted than AD and both types of learning are sub-served by partially distinct cognitive processes."
"Multiple regression analyses in artificial-grammar learning : The importance of control groups","https://scispace.com/paper/multiple-regression-analyses-in-artificial-grammar-learning-25au0ady2e","2009","Journal Article","Quarterly Journal of Experimental Psychology","Anja Lotz
Annette Kinder
Harald Lachnit","10.1080/17470210802103739","","In artificial-grammar learning, it is crucial to ensure that above-chance performance in the test stage is due to learning in the training stage but not due to judgemental biases. Here we argue that multiple regression analysis can be successfully combined with the use of control groups to assess whether participants were able to transfer knowledge acquired during training when making judgements about test stimuli. We compared the regression weights of judgements in a transfer condition (training and test strings were constructed by the same grammar but with different letters) with those in a control condition. Predictors were identical in both conditions—judgements of control participants were treated as if they were based on knowledge gained in a standard training stage. The results of this experiment as well as reanalyses of a former study support the usefulness of our approach.","It is argued that multiple regression analysis can be successfully combined with the use of control groups to assess whether participants were able to transfer knowledge acquired during training when making judgements about test stimuli."
"Developing rich and quickly accessed knowledge of an artificial grammar.","https://scispace.com/paper/developing-rich-and-quickly-accessed-knowledge-of-an-p98046pxcu","2007","Journal Article","Memory & Cognition","Bill Sallas
Robert C. Mathews
Sean M. Lane
Ron Sun","10.3758/BF03192943","https://link.springer.com/content/pdf/10.3758/BF03192943.pdf","In contrast to prior research, our results demonstrate that it is possible to acquire rich, highly accurate, and quickly accessed knowledge of an artificial grammar. Across two experiments, we trained participants by using a string-edit task and highlighting relatively low-level (letters), medium-level (chunks), or high-level (structural; i.e., grammar diagram) information to increase the efficiency of grammar acquisition. In both experiments, participants who had structural information available during training generated more highly accurate strings during a cued generation test than did those in other conditions, with equivalent speed. Experiment 2 revealed that structural information enhanced acquisition only when relevant features were highlighted during the task using animation. We suggest that two critical components for producing enhanced performance from provided model-based knowledge involve (1) using the model to acquire experience-based knowledge, rather than using a representation of the model to generate responses, and (2) receiving that knowledge precisely when it is needed during training.","Two critical components for producing enhanced performance from provided model- based knowledge involve (1) using the model to acquire experience-based knowledge, rather than using a representation of themodel to generate responses, and (2) receiving that knowledge precisely when it is needed during training."
"Syntax Acquisition in Healthy Adults and Post-Stroke Individuals: The Intriguing Role of Grammatical Preference, Statistical Learning, and Education","https://scispace.com/paper/syntax-acquisition-in-healthy-adults-and-post-stroke-7q75d66c","2022","Journal Article","Brain Sciences","Simon Kirsch
C. F. Elser
Elena Barbieri
Dorothee Kümmerer
Cornelius Weiller
Mariacristina Musso","10.3390/brainsci12050616","https://scispace.com/pdf/syntax-acquisition-in-healthy-adults-and-post-stroke-7q75d66c.pdf","Previous work has provided contrasting evidence on syntax acquisition. Syntax-internal factors, i.e., instinctive knowledge of the universals of grammar (UG) for finite-state grammar (FSG) and phrase-structure grammar (PSG) but also syntax-external factors such as language competence, working memory (WM) and demographic factors may affect syntax acquisition. This study employed an artificial grammar paradigm to identify which factors predicted syntax acquisition. Thirty-seven healthy individuals and forty-nine left-hemispheric stroke patients (fourteen with aphasia) read syllable sequences adhering to or violating FSG and PSG. They performed preference classifications followed by grammatical classifications (after training). Results showed the best classification accuracy for sequences adhering to UG, with performance predicted by syntactic competence and spatial WM. Classification of ungrammatical sequences improved after training and was predicted by verbal WM. Although accuracy on FSG was better than on PSG, generalization was fully possible only for PSG. Education was the best predictor of syntax acquisition, while aphasia and lesion volume were not predictors. This study shows a clear preference for UG, which is influenced by spatial and linguistic knowledge, but not by the presence of aphasia. Verbal WM supported the identification of rule violations. Moreover, the acquisition of FSG and PSG was related to partially different mechanisms, but both depended on education.","This article employed an artificial grammar paradigm to identify which factors predicted syntax acquisition, i.e., instinctive knowledge of the universals of grammar (UG) for finite-state grammar (FSG) and phrase-structure grammar (PSG) but also syntax-external factors such as language competence, working memory (WM) and demographic factors may affect syntax acquisition."
"Developmental differences in children's statistical learning abilities","https://scispace.com/paper/developmental-differences-in-children-s-statistical-learning-33yssrcimu","2015","","","Inbal Arnon
Limor Raviv","","https://scispace.com/pdf/developmental-differences-in-children-s-statistical-learning-33yssrcimu.pdf","Infants, children and adults are constantly exposed to repeating patterns in their environment, and manage to learn and generalize from them. This ability – often called statistical learning (SL) is postulated to be one of the important mechanisms in language acquisition [1]. Research over the past twenty years has shown that SL is present already from early infancy and found in a variety of tasks and modalities [2,3]. Though SL is well established for infants and adults, only few studies examine the developmental trajectory of SL abilities across childhood [4]. Even less work has compared auditory and visual learning throughout development. Moreover, studies of SL focus on the group level: learning is demonstrated when participants (as a group) show performance that is significantly above chance (50%). Yet recent work suggests that only a subset of participants show significant learning when looking at individual performance [5]. These findings raise questions about individual differences in SL, and the ability to correlate performance on SL tasks with other linguistic measures. To address these issues, we conducted a large-scale developmental study of both auditory and visual SL across a wide age-range (4-14, N=238), with three questions in mind: (1) Does auditory and visual SL improve with age? (2) Are there differences in SL abilities between modalities? And (3) What is the pattern of individual performance in children?","This paper conducted a large-scale developmental study of both auditory and visual statistical learning across a wide age-range (4-14, N=238), with three questions in mind: (1) Does auditory SL improve with age? (2) Are there differences in SL abilities between modalities? And (3) What is the pattern of individual performance in children?"
"L'apprentissage d'une grammaire artificielle par des enfants de 9 à 11 ans","https://scispace.com/paper/l-apprentissage-d-une-grammaire-artificielle-par-des-enfants-46bfrm0lwz","1997","Journal Article","Annee Psychologique","Jean-Paul Fischer","10.3406/PSY.1997.28950","","In experiment 1, we demonstrate that children can learn an artificial grammar in the standard conditions (see, for example, Reber, 1993). This implicit learning capacity does not develop in the examined age-period (9 to 11). Children's verbal explanations come under the three classical models of artificial grammar learning : abstraction of rules, comparison with training exemplars, and memorization of fragments. However, a complementary analysis shows that children's adherence to some grammatical rules plays a major role.

In experiment 2, we use the same artificial grammar and learning items as in experiment 1 . But, having discovered a system of imperfectly valid rules used by the children, we constructed a new set of test items. This new set is designed for checkmating the rule system of experiment 1 if the (new) children continue to use it. The results conform to the prediction : the 10- and 11 -year-old children judged as grammatical the test items which were not, and conversely judged grammatical items as non-grammatical.
Two other factors are taken into consideration in these experiments : the similarity and association (as measured by associative strength) between the learning items and the test items. The results suggest, if these factors are not confounded with grammaticality, that they have little impact on the judgment of grammaticality. Furthermore, in the present research they appear rather as a by-product of children's adherence to the rules.
In the conclusion, we emphasize the questionable status � which is exacerbated by experiment 2 � of the notion of an «imperfectly valid» rule. We also underline that, in artificial grammar learning, the grammar and the learning items do not alone determine the test performance.","This paper showed that children can learn an artificial grammar in the standard conditions (see, for example, Reber, 1993) but this implicit learning capacity does not develop in the examined age-period (9 to 11)."
"Two mechanisms in implicit artificial grammar learning? Comment on Meulemans and Van der Linden (1997).","https://scispace.com/paper/two-mechanisms-in-implicit-artificial-grammar-learning-4jkzifciiw","1999","Journal Article","Journal of Experimental Psychology: Learning, Memory and Cognition","Theresa Johnstone
David R. Shanks","10.1037/0278-7393.25.2.524","","T. Meulemans and M. Van der Linden (1997) presented evidence for 2 distinct mechanisms involved in artificial grammar learning. They suggested that after training on 32 letter strings (Experiment 2A), participants classify test strings using knowledge of the distributional statistics of letter chunks, whereas after training on 125 letter strings (Experiment 2B) they classify on the basis of knowledge of the rules of the grammar This article offers an alternative unitary account of Meulemans and Van der Linden's findings. The authors show that information about grammatical rules and chunk locations was confounded in the test strings used in Experiment 2B and then present evidence that all of the data can be explained in terms of distributional knowledge, provided this includes knowledge of the positional constraints on chunks. Finally, the authors question the utility of traditional finite-state grammars for investigating abstraction processes, and suggest alternative methods.","This paper showed that information about grammatical rules and chunk locations was confounded in the test strings used in Experiment 2B and then presented evidence that all of the data can be explained in terms of distributional knowledge, provided this includes knowledge of the positional constraints on chunks."
"Reduction of uncertainty in human sequential learning: Evidence from artificial grammar learning","https://scispace.com/paper/reduction-of-uncertainty-in-human-sequential-learning-2nax87maqw","2003","","","R Alterman
D Kirsh","","","Research on statistical teaming in adults and infants has shown that humans are particularly sensitive to statistical properties of the input. Early experiments in artificial grammar teaming, for instance, show a sensitivity for transitional n-gram probabilities. It has been argued, however, that this source of information may not help in detecting nonadjacent dependencies, in the presence of substantial variability of the intervening material, thus suggesting a different focus of attention involving change versus non-change (Gomez, 2002). Following Gomez proposal, we contend that alternative sources of information may be attended to simultaneously by learners, in an attempt to reduce uncertainty. With several potential cues in competition, performance crucially depends on which cue is strong enough to be relied upon. By carefully manipulating the statistical environment it is possible to weigh the contribution of each cue. Several implications for the field of statistical teaming and language development are drawn.","The authors argued that alternative sources of information may be attended to simultaneously by learners, in an attempt to reduce uncertainty, in the presence of substantial variability of the intervening material, thus suggesting a different focus of attention involving change versus non-change."
"Bridging artificial and natural language learning: Comparing processing- and reflection-based measures of learning","https://scispace.com/paper/bridging-artificial-and-natural-language-learning-comparing-4zn03nd8ak","2018","Proceedings Article","Conference Cognitive Science","Erin S. Isbilen
Rebecca Louise Ann Frost
Padraic Monaghan
Morten H. Christiansen","","","A common assumption in the cognitive sciences is that artificial and natural language learning rely on shared mechanisms. However, attempts to bridge the two have yielded ambiguous results. We suggest that an empirical disconnect between the computations employed during learning and the methods employed at test may explain these mixed results. Further, we propose statistically-based chunking as a potential computational link between artificial and natural language learning. We compare the acquisition of non-adjacent dependencies to that of natural language structure using two types of tasks: reflection-based 2AFC measures, and processing-based recall measures, the latter being more computationally analogous to the processes used during language acquisition. Our results demonstrate that task-type significantly influences the correlations observed between artificial and natural language acquisition, with reflection-based and processing-based measures correlating within – but not across – task-type. These findings have fundamental implications for artificial-to-natural language comparisons, both methodologically and theoretically.","This work compares the acquisition of non-adjacent dependencies to that of natural language structure using two types of tasks: reflection-based 2AFC measures, and processing-based recall measures, the latter being more computationally analogous to the processes used during language acquisition."
"Learning on the fly. Computational modelling of an unsupervised online-learning effect","https://scispace.com/paper/learning-on-the-fly-computational-modelling-of-an-4zcgut6r44","2009","","","Martin Rohrmeier","","https://scispace.com/pdf/learning-on-the-fly-computational-modelling-of-an-4zcgut6r44.pdf","Learning on the fly. Computational modelling of an unsupervised online-learning effect Martin Rohrmeier Centre for Music & Science, University of Cambridge Abstract: Humans rapidly learn complex structures in many domains. Some findings of above-chance performance of untrained control groups in artificial grammar learning (AGL) studies raise the question to which extent learning can occur in an untrained, unsupervised testing situation with partially correct and incorrect structures. Computational modelling simulations explore whether an unsupervised online learning effect is theoretically plausible in AGL. Symbolic n-gram models and simple recurrent network models were evaluated using a large free parameter space and applying a novel evaluation framework, which models the human experimental situation through alternating evaluation (in terms of forced binary grammaticality judgments) and subsequent learning of the same stimulus. Results indicate a strong online learning effect for n-gram models and a weaker effect for SRN models. Model performance improves slightly once the window of accessible past responses for the grammaticality decision process is limited. Results suggest that online learning is possible when ungrammatical structures share grammatical chunks to a large extent. Associative chunk strength for grammatical and ungrammatical sequences is found to predict both, chance and above-chance performance for human and computational data.","Results suggest that online learning is possible when ungrammatical structures share grammatical chunks to a large extent and Associative chunk strength for grammatical and un grammatical sequences is found to predict both, chance and above-chance performance for human and computational data."
"Shifts in learning dynamics drive developmental improvements in the acquisition of structured knowledge","https://scispace.com/paper/shifts-in-learning-dynamics-drive-developmental-improvements-p1ozng4d710j","2025","Journal Article","","Kate Nussenbaum
Ari E. Kahn
Alice Zhang
Nathaniel D. Daw
Catherine A. Hartley","10.31234/osf.io/amvth_v1","","Children are adept statistical learners, capable of parsing streams of structured input into meaningful units, but the explicit knowledge of environmental structure that they acquire through experience often differs from that of adults. To date, however, it is unclear how developmental changes in learning mechanisms influence structured knowledge acquisition. To address this question, we tested 110 children, adolescents, and adults, ages 8 - 22 years, on a predictive learning task, in which they experienced sequences of stimuli with a higher-order temporal structure. After an initial learning phase, participants’ explicit knowledge of the relations between stimuli was probed via two additional task measures. We used a recently introduced computational model to characterize participants’ response times during learning, and found that all participants relied on simple, recency-based prediction, anticipating that they would encounter stimuli they recently encountered in the past. With increasing age, however, participants demonstrated greater evidence of additionally relying on a more sophisticated learning mechanism, which captured a predictive representation of the contingent relations between stimuli. The extent to which participants demonstrated evidence of this more complex form of predictive learning related to — and accounted for age-related improvements in — their explicit knowledge of the task’s underlying structure. Our results suggest that age-related changes in the use of different predictive learning mechanisms influences the structured knowledge that people derive from experience, providing an account for why children, adolescents, and adults form different representations of their environments from identical streams of experiences. ","This study examines how developmental changes in learning mechanisms influence structured knowledge acquisition in children, adolescents, and adults, revealing age-related improvements in predictive learning and explicit knowledge of environmental structure."
"Learning trajectories in analogical reasoning : exploring individual differences in children's strategy paths","https://scispace.com/paper/learning-trajectories-in-analogical-reasoning-exploring-xja4rs771x","2014","","","Christine Maria Elizabeth Pronk","","https://scispace.com/pdf/learning-trajectories-in-analogical-reasoning-exploring-xja4rs771x.pdf","Inductive reasoning and more specifically, analogical reasoning, is a basic process involved in a wide range of higher cognitive processes. Therefore, this type of reasoning is often regarded as representing a core component of intelligence. The first few years of primary school represent a particular time period for the rapid development of this ability. Unsurprisingly, children display much variable inter- and intra-individual strategic analogical behavior at this age.
To date, conclusions regarding the nature of changes in the ability to reason by analogy have frequently been drawn on the basis of results obtained from cross-sectional training studies. In contrast, the studies presented in this dissertation were designed to microgenetically investigate young children’s inter- and intra-individual variable analogical learning trajectories over time. By providing children with repeated non-guided practice, dynamic-test-type training and transfer tasks, as well as applying specific methods and analyses, detailed accounts of changing strategic analogical performance were revealed. These accounts were interpreted along five dimensions of cognitive change: the source, rate, path, breadth and variability of change, in accordance with the overlapping waves theory of Siegler (1996)","In this paper, micro-genetically investigated young children's inter-and intra-individual variable analogical learning trajectories over time, by providing repeated non-guided practice, dynamic-test-type training and transfer tasks, as well as applying specific methods and analyses."
"Statistical learning in childhood: dimensions, developmental trajectory, and relation with cognitive control","https://scispace.com/paper/statistical-learning-in-childhood-dimensions-developmental-3b0bq7hn6kil","2025","Journal Article","","Matthew Johnston
J. Daniel Dolan
Dezső Németh
Nicolas Chevalier","10.31234/osf.io/kp68q","","Compared to other developmental processes, such as cognitive control, there is relatively little consensus on the developmental trajectory of statistical learning (the ability to implicitly extract environmental regularities). The literature is further complicated as statistical learning may comprise distinct subtypes, differing in the regularities being tracked. Three statistical learning abilities and cognitive control were assessed in 187 5-12-year-olds (42.8% female, 84.6% White). The ability to extract cue-based and nonadjacent statistics was age-invariant, whereas adjacent dependency extraction yielded a greater benefit in younger than older children. There was only weak evidence of an association with cognitive control, despite research suggesting that immature top-down guidance facilitates statistical learning. Importantly, the different subtypes were uncorrelated, supporting the notion that statistical learning is multifaceted. ","This study examines the developmental trajectory of statistical learning in children aged 5-12, identifying distinct subtypes and age-invariant abilities, with weak association with cognitive control, suggesting a multifaceted nature of statistical learning."
