"Paper Title","Paper Link","Publication Year","Publication Type","Publication Title","Author Names","DOI","PDF Link","Abstract","Relevant Excerpt"
"Continual Learning with Deep Learning Methods in an Application-Oriented
  Context","https://scispace.com/paper/continual-learning-with-deep-learning-methods-in-an-1ec1e6ev","2022","Posted Content","","Hadayet Ullah","10.48550/arxiv.2207.06233","https://scispace.com/pdf/continual-learning-with-deep-learning-methods-in-an-1ec1e6ev.pdf","Abstract knowledge is deeply grounded in many computer-based applications. An important research area of Artificial Intelligence (AI) deals with the automatic derivation of knowledge from data. Machine learning offers the according algorithms. One area of research focuses on the development of biologically inspired learning algorithms. The respective machine learning methods are based on neurological concepts so that they can systematically derive knowledge from data and store it. One type of machine learning algorithms that can be categorized as ""deep learning"" model is referred to as Deep Neural Networks (DNNs). DNNs consist of multiple artificial neurons arranged in layers that are trained by using the backpropagation algorithm. These deep learning methods exhibit amazing capabilities for inferring and storing complex knowledge from high-dimensional data. However, DNNs are affected by a problem that prevents new knowledge from being added to an existing base. The ability to continuously accumulate knowledge is an important factor that contributed to evolution and is therefore a prerequisite for the development of strong AIs. The so-called ""catastrophic forgetting"" (CF) effect causes DNNs to immediately loose already derived knowledge after a few training iterations on a new data distribution. Only an energetically expensive retraining with the joint data distribution of past and new data enables the abstraction of the entire new set of knowledge. In order to counteract the effect, various techniques have been and are still being developed with the goal to mitigate or even solve the CF problem. These published CF avoidance studies usually imply the effectiveness of their approaches for various continual learning tasks. This dissertation is set in the context of continual machine learning with deep learning methods. The first part deals with the development of an ... ","such as the days of the week, the calendar, etc. A common problem that affects the detection of these events is the occurrence of outliers. These outliers can be found in real-world applications and lead to an unwanted detection of concept or context changes. Incremental Learning:
 Incremental learning is often used as a synonym for continual learning (CL) (see related work in chapter 3). In this work, however, these terms are clearly distinguished from each other. When referring to incremental learning, it is important to note the ability of an ML model to be trained in an online manner. Online learning hereby describes the successive provision of individual samples or subsets of training data. Thus, one sample after the other is available for training and cannot/does not have to be stored . Incremental Learning:
 Even though several models and techniques do not support CL, they do allow for incremental learning (as introduced in section 2.3.3). DNNs, for example, are already able to incrementally learn on a stream of data. At the same time, they are subject to the condition of (catastrophic) forgetting. Therefore, the most simple form of DNNs can be referred to as incremental learners. However, they are not automatically continual learners. Incremental Learning:
 Nonetheless, not every type of model can be trained in an incremental manner. These ML models require intensive modification before they can process streaming data. The standard variants of Support Vector Machines (SVMs)  are among them. Usually, adding a single sample requires a complete training of SVMs . Furthermore, the training of large datasets is challenging. This is due to the fact that distances between all data points must be determined in order to separate the support vectors . As a result, the standard version of SVMs becomes unsuitable for incremental learning. Continual Learning:
 The following sections describe the difference between what we as humans perceive as continual learning (CL) and what we, in contrast, expect from machines. Accordingly, the CL paradigm is defined as a basis for this work . Biological Continual Learning:
 Humans have the ability to continuously acquire knowledge without (or at least linear) losing previously learned knowledge . The effort to learn continuously is represented by the survival of the species until today. Adaptability, including the accumulation of experience and knowledge, is the key to success. Even in today's post-knowledge society, CL is applied every single day. In a student's school career, for example, knowledge is accumulated (see figure ). However, this learning process is not a sequence of facts without context. Instead, knowledge, skills and dispositions are interrelated in the context of a task ) and thus enable the construction of new knowledge or ideas. At the same time, only one organ is available for the processing of data and its capacity is limited. In summary, the human being is able to learn continuously by creating and separating connections in the brain. Interestingly, the stability-plasticity dilemma is also recognizable in humans. At a young age, the human brain is very receptive to new knowledge, which is due to its plasticity. At an older age, learning new things is usually much more difficult, indicating stability."
"Fish cognition: a primate's eye view","https://scispace.com/paper/fish-cognition-a-primate-s-eye-view-289k3l4fjm","2002","Journal Article","Animal Cognition","Redouan Bshary
Wolfgang Wickler
Hans Fricke","10.1007/S10071-001-0116-5","https://scispace.com/pdf/fish-cognition-a-primate-s-eye-view-289k3l4fjm.pdf","We provide selected examples from the fish literature of phenomena found in fish that are currently being examined in discussions of cognitive abilities and evolution of neocortex size in primates. In the context of social intelligence, we looked at living in individualised groups and corresponding social strategies, social learning and tradition, and co-operative hunting. Regarding environmental intelligence, we searched for examples concerning special foraging skills, tool use, cognitive maps, memory, anti-predator behaviour, and the manipulation of the environment. Most phenomena of interest for primatologists are found in fish as well. We therefore conclude that more detailed studies on decision rules and mechanisms are necessary to test for differences between the cognitive abilities of primates and other taxa. Cognitive research can benefit from future fish studies in three ways: first, as fish are highly variable in their ecology, they can be used to determine the specific ecological factors that select for the evolution of specific cognitive abilities. Second, for the same reason they can be used to investigate the link between cognitive abilities and the enlargement of specific brain areas. Third, decision rules used by fish could be used as 'null-hypotheses' for primatologists looking at how monkeys might make their decisions. Finally, we propose a variety of fish species that we think are most promising as study objects.","Keywords: Fish, Primates, Cognition, Intelligence, Learning"
"A Place for Patterning in Cognitive Development.","https://scispace.com/paper/a-place-for-patterning-in-cognitive-development-32j05eunfc","2018","","","K. M. Gadzichowski
M. S. Peterson
R. Pasnak
A. M. Bock
S. O. J. M. Fetterer-Robinson
K. L. Schmerold","","https://scispace.com/pdf/a-place-for-patterning-in-cognitive-development-32j05eunfc.pdf","“Patterning” is a cognitive intervention that is unknown to psychologists, but has nevertheless been taught for half a century in nearly all kindergartens and many preschools in English-speaking countries. Patterning is the understanding that a certain rule governs the sequence of items in a series. At the simplest level, if the series has been red, tan, red, tan, red, tan, the next item should be red. More advanced patterns—“growing” geometric patterns and complex patterns of letters, numbers, and objects—have also been studied. Patterning is thought by educators to be a key cognitive ability that promotes academic achievement. However, its relative position in the hierarchy of cognitive developments is unknown. The present study showed that it is closely related to both transitivity and seriation, and that size transitivity problems best expressed the common factor that predicted patterning scores.","Keywords: Seriation, Transitivity, Patterning, Cognitive Development"
"What is comparable in comparative cognition","https://scispace.com/paper/what-is-comparable-in-comparative-cognition-3hdm9olg41","2012","Journal Article","Philosophical Transactions of the Royal Society B","Lars Chittka
Stephen J. Rossiter
Peter Skorupski
Chrisantha Fernando","10.1098/RSTB.2012.0215","https://scispace.com/pdf/what-is-comparable-in-comparative-cognition-3hdm9olg41.pdf","To understand how complex, or ‘advanced’ various forms of cognition are, and to compare them between species for evolutionary studies, we need to understand the diversity of neural–computational mechanisms that may be involved, and to identify the genetic changes that are necessary to mediate changes in cognitive functions. The same overt cognitive capacity might be mediated by entirely different neural circuitries in different species, with a many-to-one mapping between behavioural routines, computations and their neural implementations. Comparative behavioural research needs to be complemented with a bottom-up approach in which neurobiological and molecular-genetic analyses allow pinpointing of underlying neural and genetic bases that constrain cognitive variation. Often, only very minor differences in circuitry might be needed to generate major shifts in cognitive functions and the possibility that cognitive traits arise by convergence or parallel evolution needs to be taken seriously. Hereditary variation in cognitive traits between individuals of a species might be extensive, and selection experiments on cognitive traits might be a useful avenue to explore how rapidly changes in cognitive abilities occur in the face of pertinent selection pressures.","'language' in the animal kingdom? Probably not-and in fact the question of definition-whether or not this symbolic communication warrants the term 'dance' or in fact a 'language'-is perhaps secondary to the fascination with the uniqueness of this communication system. . INTRODUCTION:
 Even if we can agree on the definition of cognitive traits, the question remains whether behavioural performance can be compared in meaningful ways across species without a consideration of underlying mechanisms. For example, an analysis of colour learning speed in 11 animal species found honeybees to be the fastest at reaching a criterion, followed by fishes, then birds, and the slowest were human infants . Curiously, this result, which runs counter to the accepted scala naturae, was then used to argue that learning speed is not a useful measure of intelligence! There may be good reasons not to equate learning speed with intelligence, but the fact that humans do not top the chart should not be one of them. The reason that honeybees perform well on colour learning tasks is that evolution has prepared them to memorize floral cues . This complication-that a given task will often be closer to some species' natural biology than to some other species'-has led to the recommendation that cognition should be explored in tasks that are removed from those typically encountered in the animals' natural setting . But, it appears almost impossible to rule out entirely that some animals will be better prepared to deal with certain laboratory tasks because they might be related, in subtle ways, to naturally relevant challenges. To compensate for such complications, some researchers have suggested that different taxa require adjustments in experimental techniques . However, it is sometimes unclear whether this improves comparability of performance across species or eliminates it altogether. . INTRODUCTION:
 An added complication is that negative results in comparative cognition are sometimes hard to interpret-did the animal fail the test because it really lacked an ability, or because inappropriate methods were employed ? There are many examples where negative results have been initially interpreted to mean that, for example, apes do not display imitation, theory of mind, or understand gravity, where subsequent work showed that, with adjusted procedures, animal subjects pass the grade after all . One possible solution is to gradually increase task complexity until performance breaks down , but just as with our discussion of definitions above, there is some danger that we might adjust procedures or behavioural criteria until we find the desired phenomenon. . INTRODUCTION:
 Finally, a complication in mapping overt behavioural abilities onto phylogenetic trees is that the same (or similar) sensory or cognitive feats might be generated by entirely different mechanisms that have arisen by convergent evolution . On occasion, these are clearly identifiable as instances of convergence when abilities have emerged in highly distinct lineages, such as echolocation in bats and dolphins  or flexible tool use in primates and corvids . Yet, distinguishing homology from convergence is sometimes difficult without knowledge of the underlying mechanisms. Electrolocation in weakly electric fish arose independently in the South American and African lineages, where different areas of the brain mediate the analysis of electro-sensory input . Examples of parallel evolution, where behavioural abilities arise independently from homologous structures or genes are also widespread , and these cases illustrate the difficulty in deducing homology or convergence from mere behavioural abilities even more strongly."
"Transitions, generations andinformal learning in later life","https://scispace.com/paper/transitions-generations-andinformal-learning-in-later-life-5aleaa2wmb","2012","Journal Article","","John Field","10.4312/AS.18.4.29-36","https://scispace.com/pdf/transitions-generations-andinformal-learning-in-later-life-5aleaa2wmb.pdf","The nature of transitions across the lifecourse is changing, as are the ways in which these transitions are understoodand investigated by social scientists. Much earlier debate on older adults’ transitions has tended to be rooted in acco-unts of relatively fixed social roles and age-based social stages. However, while we can detect some tendencies towardsdestandardization and restandardization of the lifecourse in later life, we can also see significant continuities in theinfluences of socio-economic position, gender, and ethnicity, as well as of generational position, that continue to affectpeople’s life chances, as well as the expectations and experiences of transition of older people. The paper examines theinterplay of these complex and contradictory structural positions and cultural locations on transitions, and considersthe ways in which older people use and understand learning, formally and informally, as a way of exercising agencyand recreating meaning. It will draw on recent research into the life histories of adults in Scotland, a relatively smallcountry with a typically European pattern of demographic change. The study was concerned with agency, identity,change and learning across the life course, and this paper will concentrate on the evidence relating to experiences oftransition in later life. It will particularly focus on the idea of ‘educational generations’ as a key concept that helps usunderstand how adults use and interpret learning in later life.","Title: TRANSITIONS, gENERATIONS AND INfORMAL LEARNINg IN LATER LIfE Keywords: transitions, liminality, lifecourse, lifelong learning"
"Exploring Novice Teachers' Cognitive Processes Using Digital Video Technology: A Qualitative Case Study.","https://scispace.com/paper/exploring-novice-teachers-cognitive-processes-using-digital-2zs53hso5j","2012","","","Yuelu Sun-Ongerth","","https://scispace.com/pdf/exploring-novice-teachers-cognitive-processes-using-digital-2zs53hso5j.pdf","EXPLORING NOVICE TEACHERS’COGNITIVE PROCESSES USING DIGITAL VIDEO TECHNOLOGY: A QUALITATIVE CASE STUDY by Yuelu Sun-Ongerth This dissertation describes a qualitative case study that investigated novice teachers’ video-aided reflection on their own teaching. To date, most studies that have investigated novice teachers’ video-aided reflective practice have focused on examining novice teachers’ levels of reflective writing rather than the cognitive processes involved during their reflection. Few studies have probed how novice teachers schematize and theorize their newly acquired and/or existing knowledge during video-aided reflection. The purpose of this study was to explore novice teachers’ cognitive processes, particularly video-aided schematization and theorization (VAST), which is a set of cognitive processes that help novice teachers construct, restructure and reconstruct their professional knowledge and pedagogical thinking while reflecting on videos of their own teaching. The researcher measured novice teachers’ VAST by examining their schema construction and automation in terms of schema accretion, schema tuning, and schema restructuring. The study attempted to answer the following questions: a) What is the focus of novice teachers’ video-aided reflection? and b) How do novice teachers connect the focus of their reflections to their prior knowledge and future actions? The findings indicate that video-aided reflection could help novice teachers (1) notice what was needed to improve in their teaching practice, (2) realize how various elements in teaching were interrelated, and (3) construct, restructure, or reconstruct their professional knowledge – in other words, develop their schemata about teaching and learning through VAST. With a more developed and mature schemata, novice teachers could be able to better understand the various elements involved in teaching and learning, and handle the situations they encounter in their teaching. This may be because people’s schemata can provide the link between concepts and patterns of what they do (Rumelhart, 1980). This research has provided a new way to look at novice teachers’ video-aided reflection: how the cognitive processes they experience during their reflection can help them develop the knowledge about teaching and learning, and how their cognitive development can help them grow toward becoming teaching experts. The research findings could: a) add to the knowledge base on teacher education, b) inform the literature related to novice teachers’ self-reflection and professional development, and c) expand the knowledge base about the use of video technology in the field of teacher education. EXPLORING NOVICE TEACHERS’COGNITIVE PROCESSES USING DIGITAL VIDEO TECHNOLOGY: A QUALITATIVE CASE STUDY by Yuelu Sun-Ongerth","memorize isolated facts when they encounter a new field of knowledge because they have not developed a schema to interpret and integrate the various pieces of information they just encountered. As learning progresses, they begin to group and organize the facts into higher order structures. E.:
 Therefore, learning is a much more complex process than people realize. The learning process involves various phases. At different phases, the nature of the learning process changes in systematic ways and the variables that function also have different effects . Moreover, ""Learning is not merely an additive processqualitative, as well as quantitative, changes occur, and qualitative differences are evident in both the substance of what is being learned and in the learning processes most appropriate for acquiring additional knowledge""  According to , learners go through three phases in their learning about a subject: the initial phase, the intermediate phase, and the terminal phase. During the initial phase of learning, novice learners memorize isolated facts and pieces of information, and use pre-existing schemata to interpret the isolated pieces of data. They make comparisons and contrasts, trying to find analogies that appear to be relevant. The knowledge acquired during this stage is more concrete and context-dependent than abstract and context-free. Although novice learners begin to develop concept learning, they have not acquired sufficient information to reach more complex forms of learning. E.:
 With the help of their prior knowledge, novice learners begin to identify both the similarities and differences of the newly acquired information and make connections among the conceptually isolated pieces of information, thus forming an overview about what the new domain is about. E.:
 During the intermediate phase, as the relationships of the acquired knowledge are better developed, they are organized into higher-order structures and networks. Thus, new schemata are formed, which render the learners more conceptual power. These new structures and schemata, however, are not fully developed to allow the learners to function on an autonomous, or automatic, basis. During this phase, the knowledge is extended as learners apply it to new situations. They learn by doing as well as by reflecting on the feedback generated from the trial of the new knowledge into various situations. During the last or the terminal phase of learning, the knowledge structure and schemata that are formed during the intermediate phase are better integrated into other existing schemata and are functioning more automatically. Learning that occurs at this stage is usually addition of new facts to pre-existing schemata and increase of higher level of interrelationships, where schemata consists of other schemata rather than facts . E.:
 Although many cognitive theorists seem to accept the notion of phases in meaningful learning, there have been few systematic attempts to explore the issue in depth. Most of the empirical evidence on stages of learning deals with simpler forms of learning. Although the evidence of phases in long-term meaningful learning is not as convincing at present as one would like, there is good reason to postulate their presence. ( p. 532)  also argues that learning does not naturally progress from one phase to another. Certain things must be done to ensure the transition from a lower phase to a higher phase. ""Unfortunately, these things often are missing from an educational system that emphasizes the accumulation of more and more factual information-that is, an additive model of learning"" (p. 542). What seems to be more problematic is that ""we currently have a very poor understanding of how these transitions occur and what factors precipitate them"" (p. 542)."
