"Paper Title","Paper Link","Publication Year","Publication Type","Publication Title","Author Names","DOI","PDF Link","Abstract","Relevant Excerpt"
"Technology-based reading intervention programs for elementary grades: An analytical review","https://scispace.com/paper/technology-based-reading-intervention-programs-for-57xc7kq4a8","2019","Journal Article","Computers in Education","Hossein Jamshidifarsani
Samir Garbaya
Theodore Lim
Pierre Blazevic
James Millar Ritchie","10.1016/J.COMPEDU.2018.10.003","https://scispace.com/pdf/technology-based-reading-intervention-programs-for-57xc7kq4a8.pdf","In modern societies, the role of reading is becoming increasingly crucial. Hence, any impairment to the reading ability can seriously limit a person's aspirations. The enormous importance of reading as an essential skill in modern life has encouraged many researchers to try and find more effective intervention approaches. Technology has been used extensively to assist and enhance literacy learning. This analytical review aims at presenting a comprehensive overview of the existing research on technology-based or technology-assisted reading interventions for elementary grades, between 2000 and 2017, along with analyzing various aspects of these studies. After extensive research, 42 articles have met the inclusion criteria, which have evaluated a total of 32 reading programs. The studies are classified into six categories of phonological awareness, phonics, vocabulary, comprehension, fluency, and multi-component. Each reading category begins with a brief introduction. Then, the content and instructional mechanisms of each program in the category is explained, alongside the outcome of its interventions. It is found that vocabulary interventions, as well as using mobile, tablet and other non-computer technologies are massively overlooked. Furthermore, a very limited number of programs focused on fluency, none of them addressed all its components. In addition, despite the required long-term practice for fostering fluency, the reviewed studies have an average intervention time shorter than other intervention categories. This paper provides researchers and solution developers with an extensive and informative review of the current state of the art in reading interventions. Additionally, it identifies the current knowledge gaps and defines future research directions to develop effective reading programs.","holistic view, which addresses different components of fluency at various levels. Moreover, compared to other types of interventions, the gamification of fluency and comprehension programs is not established yet. Additionally, fluency programs were less used in early elementary grades. Conclusion and Future Directions:
 The findings of this study suggest that for languages with opaque orthographies such as English, the speed aspect of reading was neglected. Despite the emphasis on teaching phonics for these languages to address precision, still dyslexia is the problem of both accuracy and speed, these aspects should be addressed together in the future studies. Hence, it is recommended to study the efficacy of reading programs that accentuate both the decoding speed and decoding accuracy. Letter recognition automaticity can be trained at first, then word recognition automaticity can be practiced, and later, fluency approaches on the phrase, paragraph, and longer texts can be worked. In addition, instead of making a simple integral digital copy of the existing pedagogical methods used in schools, it is recommended that designers take benefit from the recent advances of information and communication technologies to design innovative methods not available in normal schooling conditions. Conclusion and Future Directions:
 In order to develop innovative reading approaches, this analytical review showed that more investigations are necessary. Intelligent self-adaptable systems should be developed to assess the student's skills. These systems should provide individualized interaction modalities and adapt the content of the instruction based on the real-time capture of the user performance. In order to enhance the learning process, gamified multisensory interactive modalities such as spoken speech and tactile interfaces could be integrated to address different human sensory channels. Since it is acquired that emotion can drive motivation, which is crucial for developing reading skills, emotional interaction could also be included to enhance the effectiveness of the reading programs. Conclusion and Future Directions:
 Furthermore, speech recognition was not used at its maximum potential for enhancing the reading acquisition. If advanced integration of speech recognition is made with being sensitive to smaller parts of the language so that it detects not only the pronunciation errors but also the prosody attributes and even the emotional states of the speaker, it would be promising for the creation of intelligent assistive reading systems. Moreover, the technologies of virtual and augmented realities can be used to teach vocabulary, the context relative to each word can be built in a meaningful and realistic way to enhance its retention. Finally, mathematical modeling can be used to maximize the value of the pedagogical content. The mathematical modeling approach could open new research directions to learn from existing mathematical models and to improve their efficacy by experimenting with the elements and attributes that have not been considered previously."
"Implicit Statistical Learning Across Modalities and Its Relationship With Reading in Childhood.","https://scispace.com/paper/implicit-statistical-learning-across-modalities-and-its-472c9ycjcq","2019","Journal Article","Frontiers in Psychology","Elpis V. Pavlidou
Louisa Bogaerts","10.3389/FPSYG.2019.01834","https://scispace.com/pdf/implicit-statistical-learning-across-modalities-and-its-472c9ycjcq.pdf","Implicit statistical learning (ISL) describes our ability to tacitly pick up regularities from our environment therefore, shaping our behavior. A broad understanding of ISL incorporates a great range of possible computations, which render it highly relevant to reading. In the light of this hypothesized relationship, ISL performance was explored in young (M = 8.47 years) typical readers (N = 31) across three different modalities (i.e., visual, auditory, and tactile) using the Artificial Grammar Learning (AGL) paradigm. Adopting repeated measures and correlational designs, the obtained data revealed modality constraints: (1) above-chance performance was observed on the visual and tactile tasks but not on the auditory task, (2) there was no significant correlation of ISL performance across modalities, and (3) split-half reliability of visual and auditory tasks was reasonably high, yet for the tactile task it was close to zero. Evaluating the relation between ISL ability and language skills, we observed a positive correlation between visual ISL performance and phonological awareness. We discuss these findings in view of current perspectives on the nature of ISL and its potential involvement in mastering successful (i.e., accurate and fluent) reading.","Title: Implicit Statistical Learning Across Modalities and Its Relationship With Reading in Childhood Authors: Elpis V Pavlidou (Corresponding Author),Louisa Bogaerts Keywords: implicit statistical learning, artificial grammar learning, modality specificity, reading, reading fluency, children"
"Distinguishing DD from SLI. Language profiles of Italian dyslexic children with and without specific language impairment","https://scispace.com/paper/distinguishing-dd-from-sli-language-profiles-of-italian-22r0ahb187","2020","Journal Article","Pragmalingüística","Emanuele Casani","10.25267/PRAGMALINGUISTICA.2020.IEXTRA2.03","https://scispace.com/pdf/distinguishing-dd-from-sli-language-profiles-of-italian-22r0ahb187.pdf","espanolAunque la Dislexia del Desarrollo (DD) y el Trastorno Especifico del Lenguaje (TEL) son dos tras-tornos distintos, los ninos con DD y los ninos con TEL pueden mostrar dificultades similares en las habilidades orales y escritas, lo que puede dificultar un diagnostico definido. Este estudio explora la lectura y sus relaciones con algunas habilidades susceptibles (denominacion rapida, comprension sintactica y produccion sin-tactica) en una muestra de ninos italianos dislexicos con presencia y ausencia del TEL, con el fin de investigar posibles patrones distintivos para los diferentes perfiles de trastorno. Los ninos dislexicos con y sin TEL muestran rendimientos de lectura similares, pero difieren en que los ninos con TEL tienen deficiencias adicionales de denominacion rapida y de produccion de pronombres cliticos. Algunos patrones de error tipicos emergen en la denominacion rapida cuando se trata de ninos con TEL y algunas estrategias de compensacion tipicas emergen en la produccion de pronombres cliticos por parte de los ninos con TEL y tambien en ninos dislexicos mas pequenos. La cantidad y la calidad de las correlaciones entre la lectura y otras habilidades son proporcionales a la severidad de los trastornos. Se sugiere finalmente el uso de una prueba de lectura ad hoc, asi como una posible implementacion de la prueba de comprension sintactica EnglishAlthough Developmental Dyslexia (DD) and Specific LanguageImpairment (SLI) are two distinct disorders, DD and SLI children can show comparable difficulties with written and oral skills which may make a definite diagnosis difficult. This study explores reading and its relations with some sensitive skills (rapid naming, syntactic comprehension,and syntactic production) in a sample of Italian DD children with and without SLI to investigate possible distinctive patterns for different disorder pro-files. DD children with and without SLI show comparable reading performances but differ in that SLI children have additional naming and clitic production deficits. Typical error patterns emerge for rapid naming by SLI children and typical compensation strategies for clitic production by SLI and younger DD children. Quantity and quality of correlations between reading and other skills are proportional to the severity of the impairment. The use of an ad hocreading test,as well as a possible implementation of the syntactic comprehension test,is suggested francaisLa Dyslexie Developpementale (DD) et le Trouble Specifique du Langage (TSL) sont deux troubles distincts, pourtant les enfants DD et TSL peuvent presenter des difficultes comparables au niveau de leurs competences ecrites et orales, ce qui peut rendre difficile la pose de diagnostic. Cette etude explore la lecture et ses relations avec certaines competences a risque (denomination rapide, comprehension et production syntaxiques) chez un echantillon d'enfants DD italiens avec ou sans TSL, afin de rechercher d'eventuels schemas distinctifs pour les differents profils de troubles. Les enfants DD avec et sans TSL affichent des performances en lecture comparables, mais different en ce que les enfants TSL presentent des deficits au niveau de la denomination rapide et de la production de pronoms clitiques. Des patterns d'erreur typiques apparaissent dans la denomination rapide chez les enfants avec TSL et des strategies de compensation typiques pour la production de pronoms clitiques chez les enfants avec TSL et les DD plus jeunes. La nature et le nombre de correlations entre les performances de lecture et les autres competences sont proportionnels a la gravite du deficit. L'utilisation d'un test de lecture ad hoc ainsi qu’une implementation possible du test de comprehension syntaxique sont suggerees","of SLI-children. Furthermore, the main compensation strategy, namely DP production, is distributed along the DDG1 without any significant association to particular subjects. It seems unlikely that every subject of that group presents an undiagnosed SLI . DISCUSSION:
 The number of correlations between reading and other skills confirms to be proportional to the severity of the impairment, as no correlation is present in the SLIG, only one relation is present in the younger DDG, and several relations are present in the CGs (tables 7 and 8). In particular, in the DDG1, syntactic comprehension is significantly related to reading comprehension but this relation disappears in the DDG2. In the CG1, reading comprehension is significantly related to decoding speed but this relation disappears in the CG2. This might be evidence of an evolution in comprehension strategies of elder children: in the first phases of reading acquisition, they would be more tied to the text, whereas in the subsequent phases they might exploit other elements, such as contextual aspects, which would enable them to get ""the gist from a passage"" (Hulme and . In the CG1, decoding accuracy and speed are related to clitic production, whereas in the CG2, naming accuracy is related to decoding speed. In both CGs, decoding speed is related to decoding accuracy. These patterns, which confirm in principle previous results obtained by the analyses of raw scores and Zscores of the global sample, suggest that all these [reading]-related skills that are present only among TD-children might provide a series of clues in support of reading  which would be absent among impaired subjects. Good lexicon-retrieval skills coupled with good (morpho)syntactic skills may support the reader's expectancy grammar , thus making reading more fluent and effective. This hypothesis is consistent with extensive research by Maryanne Wolf, who also developed a method aiming at improving children's written decoding and comprehension through explicit teaching of different phonological, semantic, and (morpho)syntactic representational systems involved in reading . CONCLUSION:
 In this study, a group of dyslexic children with and without SLI was tested in some language skills that are demanding for both DD and SLI to describe possible patterns that might be distinctive of different disorder profiles. CONCLUSION:
 Experimental groups showed comparable reading performances, with some age-related differences. Error analyses based on text reading allowed to detect different error patterns and suggest that an ad hoc reading battery could be used to distinguish different kinds of DD. CONCLUSION:
 Widening the sample could allow exploring more deeply decoding accuracy of younger impaired children and whether a particular kind of ""double deficit"" (naming accuracy + decoding) might be a marker of SLI among DDchildren. CONCLUSION:
 Some syntactic comprehension tests that are commonly used in clinical practice might hide possible difficulties that would rather emerge at a qualitative fine-grained analysis. An implementation of such tests through a focus on sensitive structures is suggested. CONCLUSION:
 The omission of DOcls confirms to be a good clinical marker of SLI even in small samples, provided that a fine-grained response analysis is conducted. Typical strategic patterns are found among experimental samples, with significant qualitative and quantitative differences. This might be evidence of the different nature of clitic production problems of DD children compared to SLI children."
"Cross- and Within-Domain Associations of Early Reading and Mathematical Skills: Changes Across the Preschool Years.","https://scispace.com/paper/cross-and-within-domain-associations-of-early-reading-and-14ibn9fzvy","2021","Journal Article","Frontiers in Psychology","Fu Yu Kwok
Rebecca Bull
David Múñez","10.3389/FPSYG.2021.710470","https://scispace.com/pdf/cross-and-within-domain-associations-of-early-reading-and-14ibn9fzvy.pdf","Existing research has mainly examined the role of cognitive correlates of early reading and mathematics from a stationary perspective that does not consider how these skills unfold and interact over time. This approach constraints the interpretation of cross-domain associations and the specificity of domain-specific covariates. In this study, we disentangle the role of these predictors and investigate cross-domain associations between reading, math, and two related domain-specific predictors (phonological awareness and fluency with number sets) over the kindergarten years (n=512, Mage=54months, SDage=3.5, 52% females). Results reveal that the overlap between reading and math skills changes over development. Reciprocal associations between reading and math abilities are observed at earlier stages; then, reading abilities become the lead force. Findings also show that phonological awareness and fluency with number sets are domain-specific predictors that do not contribute to cross-domain gains in academic skills. Indeed, there is a trend for domain-specific skills to be more strongly related to achievement at the beginning of formal education than at the beginning of kindergarten, which suggests an increasing differentiation of domains over the kindergarten years. Such findings have implications for the timing and nature of interventions that aim to support children's reading and mathematical development.","in an everyday context. It has been noted that reading in real-life situations o en involves several words strung into sentences, which involves the sequential and simultaneous processing of visual and semantic information; these processes are not examined during the reading of solitary words . Limitations:
 ird, while the present study has tried to account for other domain-general predictors, such as non-verbal reasoning, that may be involved in the cross-domain association between early reading and mathematics, it is not comprehensive. Future studies should consider the inclusion of other important predictors, such as working memory, where robust relationships have been found. In terms of math, decades of research have shown that working memory skills are closely related to math achievement and precursors of math, such as counting , as well as early numerical magnitude skills . Similarly, research indicates that both the phonological loop (verbal working memory) and the central executive are pertinent at di erent stages of reading. e phonological loop plays a crucial role in the early stages of reading where children start learning the concept of mapping of grapheme-phoneme and gain mastery of decoding, which facilitates both word and non-word reading . As children's reading development progresses, the central executive is found to play a more important role in facilitating reading comprehension . Limitations:
 Finally, moderation e ects may impact on the relative importance of withinversus cross-domain prediction. For October 2021 | Volume 12 | Article 710470 instance, children in our sample who are higher achieving will be progressing to problems in the TEMA with increased task di culty, e.g., word problem solving, which requires storing of verbal information without external support. Limitations:
 ese tasks may then require children to draw on their language and comprehension skills in solving these problems. is is consistent with previous studies (e.g.,  that have found than domain-speci c skills, such as processing of non-symbolic quantity, were more likely to predict performance of children at the lower end of the distribution who are completing only simple math questions, while performance of children at the upper end of the distribution (who are completing questions that required more translation between di erent representations) was more likely to be predicted by math language. Conclusion:
 is study is one of only a few to investigate the cross-domain associations between reading, mathematics, and their domainspeci c predictors. Collecting data on all tasks across 3 years have allowed us to examine the changing nature of the relationships within and across domains of learning. Path model analyses highlighted that the reciprocal relationship between reading and mathematics changes over time; speci cally, that reading has a stronger in uence on mathematics closer to the formal schooling years."
"Predicting Children's Reading and Mathematics Achievement from Early Quantitative Knowledge and Domain-General Cognitive Abilities.","https://scispace.com/paper/predicting-children-s-reading-and-mathematics-achievement-1eiu75hrmm","2016","Journal Article","Frontiers in Psychology","Felicia W. Chu
Kristy vanMarle
David C. Geary","10.3389/FPSYG.2016.00775","https://scispace.com/pdf/predicting-children-s-reading-and-mathematics-achievement-1eiu75hrmm.pdf","At the beginning of preschool, we assessed a broad range of quantitative abilities for 100 (43 boys) children, as well as their preliteracy knowledge, intelligence, executive functions, and parental educational background. Mathematics achievement was assessed at the end of each of two years of preschool and at the end of kindergarten, and word reading achievement was also assessed at the end of kindergarten. We identified the core quantitative competencies, such as children’s understanding of the cardinal value of number words, that predict later achievement, the domain-general abilities that predicted growth in these competencies across two years of preschool, and the domain-general and domain-specific abilities that predicted mathematics achievement growth across the preschool years. We also identified similarities in the early domain-general abilities and differences in the domain-specific knowledge that predict mathematics and word reading achievement at the end of kindergarten.","the other hand, performance on the task does involve a clear natural language component, understanding the meaning of number words , and this may be the source of the result. The resolution of these alternative explanations for our finding will have to await follow up studies. Limitations and Future Directions:
 There are several limitations that call for caution in interpreting our results. First, although the longitudinal component allows for reasonably strong inferences, the data are still correlational and any definitive conclusions will require experimental follow up studies. Second, our inclusion of multiple quantitative tasks and 3 years of mathematics achievement data relative to one preliteracy task and 1 year of word reading achievement means that the study was better designed (by intention) to identify predictors of mathematics than reading achievement. We attempted to control the most commonly identified domain-general abilities and parental background but this does not mean that we identified all of them. Moreover, we argued that domain-general associative learning mechanisms may contribute to learning in both mathematics and reading, following studies with older children (e.g., ), but we did not measure these mechanisms directly. Despite these limitations, our overall results are consistent with previous studies of both academic domains, and point to a combination of domain-general and domain-specific contributors to preschool children's emerging competencies with mathematics and reading. ACKNOWLEDGMENTS:
 We thank Mary Rook for her help in facilitating our assessments of the Title I preschool children. We are also grateful for the cooperation of Columbia Public Schools and especially the children and parents involved in the study. We thank Tim Adams, Melissa Barton, Sarah Becktell, Sam Belvin, Erica Bizub, Kaitlyn Bumberry, Lex Clarkson, Stephen Cobb, Danielle Cooper, Dillon Falk, Lauren Johnson-Hafenscher, Jared Kester, Morgan Kotva, Brad Lance, Kate Leach, Kayla Legow, Natalie Miller, Lexi Mok, Molly O'Byrne, Rebecca Peick, Kelly Regan, Nicole Reimer, Laura Roider, Sara Schroeder, Claudia Tran, Hannah Weise, Melissa Willoughby, and Grace Woessner for help with data collection and entry, and Mary Hoard and Lara Nugent for help with managing the project."
